word,part_of_speech,meaning,example,example_meaning,definition
polemicist,noun,người tranh cãi,"So why is my story more than just the story of a quirky, long, six-year, difficult lawsuit, an American professor being dragged into a courtroom by a man that the court declared in its judgment was a neo-Nazi polemicist ?","Vậy tại sao câu chuyện của tôi lại hơn cả một câu chuyện về một vụ kiện mưu mô, khó khăn kéo dài những sáu năm giữa một giáo sư ở Mỹ bị kéo vào phòng xử án và một người đàn ông mà tòa đã gọi là nhà luận chiến thuộc tân Phát- xít ?",A person who writes polemics
begotten,adjective,sinh ra,How did Jehovah’s only- begotten Son come to be born as a human?,Làm sao Con một của Đức Giê-hô-va được sinh ra làm người?,Past participle of beget
probity,noun,tính liêm khiết,Probity .,Liêm khiết .,integrity
captious,adjective,tính xoi mói,,,Having a disposition to find fault unreasonably or to raise petty objections.
sang-froid,noun,sự bình tĩnh,,,"Composure, level-headedness, coolness in trying circumstances."
underpin,verb,làm nền,One of the things that underpins it is this idea of resilience.,Một trong những điều làm nền tảng cho nó là ý tưởng về khả năng phục hồi.,(transitive) To support from below with props or masonry.
dyslexia,noun,chứng khó đọc,Dyslexia also runs in families.,Chứng khó đọc cũng phổ biến trong phạm vi gia đình.,"(neurology, pathology) A learning disability in which a person finds it difficult to read and write."
dysgraphia,noun,,Other learning disabilities are dysgraphia (a disorder that affects handwriting) and dyscalculia (difficulty with math skills).,Dạng khác là khiếm khuyết kỹ năng viết (dysgraphia) và kỹ năng làm toán (dyscalculia).,A language disorder that affects a person's ability to write.
remediation,noun,,Is there no remedy ?,Không có biện pháp nào sao?,An action taken to remedy a situation.
affective,adjective,xúc động,"If his target is afraid and affected , then he's won.","Nếu mục tiêu của hắn sợ và xúc động , thì hắn thắng.","Relating to, resulting from, or influenced by the emotions."
phoneme,noun,âm vị,The coastal dialects have additional phonemes that do not exist in Standard Somali.,Các phương ngữ ven biển có thêm các âm vị không tồn tại trong tiếng Somali tiêu chuẩn.,(linguistics) An indivisible unit of sound in a given language. A phoneme is an abstraction of the physical speech sounds (phones) and may encompass several different phones.
recommence,verb,bắt đầu lại,His plan was to recommence the revolt of the angels.,Mưu toan của anh là tái diễn cuộc nổi loạn của các thiên thần.,To begin again.
charisma,noun,uy tín,Sava was predominantly occupied with clerical duties and did not enjoy as much charisma among tribal heads as his predecessor did.,Sava được chủ yếu chiếm đóng với các nhiệm vụ văn thư và không được hưởng nhiều uy tín trong số những người đứng đầu bộ lạc như người tiền nhiệm của ông đã làm.,(Christianity) An extraordinary power granted by the Holy Spirit
aureole,noun,quầng,"Actinolite is commonly found in metamorphic rocks, such as contact aureoles surrounding cooled intrusive igneous rocks.","Actinolit được tìm thấy phổ biến trong các đá biến chất, như vành tiếp xúc xung quan các đá mácma xâm nhập đã nguội.",(astronomy) Corona.
ad hominem,adjective,lập luận công kích cá nhân,"It has always been controversial because it is (in a pejorative sense) considered a subjective term, used as an ad hominem attack against groups with differing doctrines or practices.","Nó đã luôn luôn gây tranh cãi bởi vì nó (theo nghĩa xấu) được coi là một thuật ngữ mang tính chủ quan, được sử dụng như một việc tấn công cá nhân khi tranh luận giữa các nhóm có các học thuyết hoặc cách thờ phượng khác nhau.","(logical fallacy) A fallacious objection to an argument or factual claim by appealing to a characteristic or belief of the person making the argument or claim, rather than by addressing the substance of the argument or producing evidence against the claim; an attempt to argue against an opponent's idea by discrediting the opponent himself."
bon voyage,interjection,chúc thượng lộ bình an,"Well, anchors aweigh, and have a bon voyage .","Được rồi, chuẩn bị lên đường đi, và chúc thượng lộ bình an .",Used to wish someone a good journey.
caveat,verb,hang,But a few caveats remained.,Có một số cây thông cổ còn sót lại .,a qualification or exception
caveat emptor,noun,,,,Used as a warning to anyone buying something that there might be unforeseen problems or faults with what is bought.
cum laude,adjective,,"Graduated a semester early, magna cum laude .",Tốt nghiệp sớm một học kì .,With praise; an honor added to a diploma or degree for work that is above average.
deus ex machina,noun,,"Deus ex machina is a Latin term meaning ""god from the machine.""","Deus ex machina là một thuật ngữ tiếng Latin, có nghĩa là ""Chúa tới từ cỗ máy.""","Any resolution to a story that does not pay due regard to the story's internal logic and that is so unlikely that it challenges suspension of disbelief, and presumably allows the author, director, or developer to end the story in the way that he or she desired"
en masse,adverb,cả đống,Produce it en masse .,Ta muốn có số lượng lớn .,in a single body or group; together
mea culpa,noun,,"Mea culpa , babe.",Lỗi của tôi.,"My fault, due to my error; my bad."
ad nauseam,adverb,,What's ad nauseam ?,""" Điệp khúc "" là gì ạ ?",to a nauseating or sickening degree.
carte blanche,noun,,"You mean "" carte blanche . """,Ý cậu là Carte Blanche .,Unlimited discretionary power to act; unrestricted authority
ergo,adverb,do đó,"Ergo , we should keep kissing.","Do đó , chúng ta nên tiếp tục hôn nhau đi.","Consequently, therefore."
et al,Phrase,,The results by Liben et al . were inconclusive due to the test design.,Các kết quả của Liben et al . đã thuyết phục do những thiết kế thử nghiệm.,Alternative form of [i]et al.[/i]
faux pas,noun,hành động tếu,There have also been high-profile failures and faux pas .,Cũng đã có những thất bại cao cấp và giả vờ.,A blunder (especially used in social contexts).
habeas corpus,verb,,"Right to habeas corpus , suspended.","Quyền được bảo hộ nhân thân , huỷ.","(law) A writ to bring a person before a court or a judge, most frequently used to ensure that a person's imprisonment, detention, or commitment is legal."
hoi polloi,noun,dân thường,"Jimmy McGill, getting fingerprinted with the hoi polloi .",Jimmy McGill... mà cũng bị lấy dấu vân tay như dân đen .,The common people; the masses. (Used with or without the definite article.)
joie de vivre,noun,niềm vui sống,"when I was feeling a little depressed and not a lot of joie de vivre ,","khi tôi đã cảm thấy một chút chán nản và không nhiều niềm vui sống ,","Enjoyment of living; happiness, ebullience, zest for life."
modus operandi,noun,,Modus operandi .,Modus operandi.,(colloquial) A person or thing's normal mode of operation.
nom de plume,noun,bút danh,"My plume de nom , rather than nom de plume .",Bút danh chứ không phải là danh bút .,A pen name or pseudonym
persona non grata,noun,Persona non grata,Why are you persona non grata in France?,Tại sao chị bị trục xuất khỏi Pháp?,"A person who is not welcome, especially a diplomat in a foreign country."
pro forma,adjective,,Here’s how to get a pro forma invoice:,Dưới đây là cách lấy hóa đơn chiếu lệ:,for the sake of form only
savoir-faire,noun,,,,The ability to do or say what is appropriate for the occasion.
tabula rasa,noun,,"From here on out, it's tabula rasa .","Kể từ bây giờ, nó đã biến mất .","(uncountable) The idea that the mind comes into this world as a ""blank slate""."
terra firma,noun,đất liền,We know that our planet—the terra firma and the vast oceans—cannot sing.,Chúng ta biết rằng hành tinh của chúng ta—gồm đất liền và đại dương bao la—không biết hát.,"land, as opposed to water or air."
a cappella,adjective,A cappella,"Hi, any interest in joining our a cappella group?","Xin chào, có muốn tham gia nhóm A Cappella của bọn tớ chứ?","(music) Performed by a soloist or choir with no instrumental accompaniment; literally ""in the style of the (Sistine) Chapel (in Rome)""; such as a musical Mass donea cappella."
