word,part_of_speech,meaning,example,example_meaning,definition
ruefully,adverb,buồn rầu,Mason stood somewhat ruefully to one side until the photographers had secured their close-up pictures.,Mason đứng cạnh đó với vẻ mặt thảm thương cho tới khi các phóng viên nhiếp ảnh chụp xong những cận ảnh.,"In a rueful manner; causing, feeling, or expressing regret or sorrow."
impish,adjective,tinh quái,There's the habilis - impish scavengers.,Loài habilis - chuyên ăn xác chết,mischievous; of or befitting an imp.
aperture,noun,lỗ hổng,"Captain, photic sonar readings indicate the aperture is closing.","Thuyền trưởng, thiết bị sonar ánh sáng cho thấy lỗ hổng đang đóng lại.","An opening; an open space; a gap, cleft, or chasm; a passage perforated; a hole; as, an aperture in a wall."
diatribe,noun,,"She noticed that Rebecca, a coworker, never seemed fazed by Agnes’s diatribes .",Cô nhận thấy đồng nghiệp Rebecca dường như không bao giờ lúng túng với lời lẽ công kích của Agnes .,A speech or writing which bitterly denounces something.
proxy,adjective,do uỷ nhiệm,Youth can participate in proxy baptisms.,Các thiếu niên và thiếu nữ có thể tham gia phép báp têm thay cho người chết.,Used as a proxy or acting as a proxy.
quintessential,adjective,nguyên tố thứ năm,"Considered the quintessential tap dancer,","Được coi như tinh hoa của vũ công thiết hài,",Of the nature of a quintessence (in all senses); ultimate.
indispensable,adjective,không thể thiếu được,And so each citizen plays an indispensable role.,Và như vậy mọi công dân đều có vai trò không thể thiếu được .,A thing that is not dispensable; a necessity. [from 17th c.]
intrinsically,adverb,,And you also need to make it intrinsically interesting.,Và bạn cũng phải làm giáo dục thú vị một cách thực chất .,In an intrinsic manner; internally; essentially.
appealing,adjective,quyến rũ,"It's not necessarily glamorous, but unveiling the glamour has an appeal .","Nó không nhất thiết quyến rũ , nhưng để lộ sức hút như 1 yêu cầu.",Having appeal; attractive.
incidentally,adverb,nhân tiện,"Including, incidentally , New Orleans.","Nhân tiện , có cả New Orleans.",(manner) In an incidental manner; not of central or critical importance.
moralist,noun,người dạy luân lý,moralistic .,... có đạo đức nữa.,"(pejorative) One who drives all their decisions based on perceived morals, especially one who enforces them with censorship."
militate,verb,chiến đấu,His militancy has caused the Alliance a great many problems.,Cách chiến đấu của ông ta gây ra nhiều vấn đề cho Liên minh.,To give force or effect toward; to influence.
quiescent,adjective,im lìm,Only the northern boundary is relatively quiescent .,Chỉ có ranh giới phía bắc là tương đối yên tĩnh .,"Inactive, at rest, quiet."
unfettered,adjective,không bị cùm,"That life, unfettered , moves towards life.","Rằng cuộc sống, không gông cùm , sẽ hướng tới cuộc sống.",Simple past tense and past participle of unfetter.
anomalous,adjective,bất thường,The parietal lobe of Albert Einstein is truly anomalous .,Thùy đỉnh của Albert Einstein thực sự bất thường .,deviating from the normal; aberrant or abnormal
rhetoric,noun,hùng biện,I am trying to move beyond political rhetoric to a place of ethical questioning.,Tôi đang cố vượt lên hùng biện chính trị thành điều tra đạo đức.,"The art of using language, especially public speaking, as a means to persuade."
steward,verb,người quản lý,I have urgent news for the tetrarch's steward .,Tôi có tin khẩn cho người quản lý Tetrarch.,A person who manages the property or affairs for another entity.
pathogen,noun,Mầm bệnh,"Pathogens , viruses.","Mầm bệnh , vi-rút.","(pathology, immunology) Any organism or substance, especially a microorganism, capable of causing disease, such as bacteria, viruses, protozoa or fungi. Microorganisms are not considered to be pathogenic until they have reached a population size that is large enough to cause disease."
coffer,noun,rương,For centuries rich and poor alike have been filling the coffers of religious organizations in the hope of reducing the time they or their loved ones are in purgatory.,"Trải qua nhiều thế kỷ, người giàu cũng như nghèo đã bỏ tiền vào đầy rương của các tổ chức tôn giáo với hy vọng làm giảm bớt thời gian mà họ hoặc những người thân của họ ở trong nơi hành tội.",A strongbox: a strong chest or box used for keeping money or valuables safe.
serendipitous,adjective,ngẫu nhiên,"This is what they call "" serendipitous . """,Cái này người ta gọi là khả năng cầu may .,By serendipity; by unexpected good fortune.
boon,noun,ơn,"And in her gratitude, she will see fit to grant us boons .","Và với lòng biết ơn của mình, bà ấy sẽ cho chúng ta một ân huệ.",A blessing or benefit.
inflexible,adjective,cứng,"Do I seek to lay down arbitrary, inflexible rules or to turn my personal opinions into law?","Tôi có đặt ra luật lệ tùy tiện, cứng nhắc hoặc biến quan điểm riêng của mình thành điều luật không?",Not flexible; not capable of bending or being bent; stiff; rigid; firm; unyielding.
corrugated,adjective,có nếp,So this is a corrugated box and its shadow.,Đây là một hộp có nếp sóng và bóng của nó.,Simple past tense and past participle of corrugate.
fanatic,adjective,cuồng tín,Indeed my husband was simply a fanatical fisherman.,Thực sự thì chồng tôi đơn giản chỉ là một ngư dân cuồng tín .,Fanatical.
scuff,adjective,scruff,Scuff marks back to the edge.,Dấu lê chân ở cuối mép.,"Caused by scraping, usually with one's feet."
convoy,verb,hộ tống,"You're gonna go after those guys that hit my convoy , huh?",Các cậu sẽ đuổi theo bọn đã hạ đoàn hộ tống của tôi chứ hả?,(nautical) One or more merchant ships sailing in company to the same general destination under the protection of naval vessels
esteem,verb,kính mến,Our esteemed professor will explain it.,Giáo sư kính mến đây sẽ giải thích nó.,To regard someone with respect
static,adjective,tĩnh,The codes applicable to European safety footwear are: There is also EN ISO 20346:2004 for protective footwear (must comply to basic safety requirements but toe cap impact resistance requirement is lower - 100 Joules) & EN ISO 20347:2004 for Occupational Footwear (must comply to basic safety requirements with anti static or slip resistant properties.,Các mã áp dụng cho giày dép an toàn Châu Âu là: Ngoài ra còn có EN ISO 20346: 2004 cho giày bảo hộ (phải tuân thủ các yêu cầu an toàn cơ bản nhưng yêu cầu chịu va đập trên đầu ngón chân là thấp hơn - 100 Joules) và EN ISO 20347: 2004 cho Giày dép bảo hộ (phải tuân theo yêu cầu an toàn với tính chất chống tĩnh hoặc chống trượt.,Unable to change.
grandstand,verb,khán đài,"He's coming up to the grandstand , fellow Federationists.","Anh ấy đang đi tới khán đài , anh Federistas.",The seating area at a stadium or arena; the bleachers.
boastful,adjective,thích khoe khoang,Some may be prone to boast about their success in the Christian ministry.,Một số người có thể thích khoe khoang về sự thành công trong thánh chức của tín đồ đấng Christ.,Tending to boast or brag.
vise,noun,mỏ cặp,"Othen / vise , I don't exist.",Những lúc khác thì tôi như không tồn tại vậy.,"(US) An instrument consisting of two jaws, closing by a screw, lever, cam, or the like, for holding work, as in filing."
shrapnel,noun,mảnh đạn,I've got a cluster of shrapnel trying every second to crawl its way into my heart.,"Tôi đã từng bị vô vàn mảnh đạn , cố gắng trườn từng chút một đến tim tôi.","a collective term for shot, fragments, or debris thrown out by an exploding shell or landmine"
rustling,noun,soạt,A rustle at the front door told me Holly had arrived home from school .,Tiếng sột soạt trước cửa cho tôi biết Holly đã đi học về .,Present participle of rustle.
saboteur,noun,kẻ phá hoại,I'm close to finding our saboteur .,Tôi sắp tìm ra kẻ phá hoại rồi.,A person who intentionally causes the destruction of property in order to hinder the efforts of his/her enemy.
hesitant,adjective,do dự,"You hesitate , and that hesitation could kill you.",Em do dự và sự do dự đó sẽ giết em.,"Tending to hesitate, wait, or proceed with caution or reservation."
canteen,noun,căng tin,"Lady, does this look like a canteen to you?","Quý cô, cái này trông giống căng tin của cô lắm à?","a small cafeteria or snack bar, especially one in a military establishment, school, or place of work"
indebted,adjective,mang ơn,Why should we feel indebted to our parents?,Tại sao chúng ta phải cảm thấy mang ơn cha mẹ?,obligated to someone; owing a debt of gratitude to someone
barricade,noun,chướng ngại,"Inside, they barricaded the office and tied the commandant to his chair.","Bên trong trụ sở, họ dựng chướng ngại vật và trói vị chỉ huy trên ghế.","An obstacle, barrier or bulwark."
desolate,adjective,bơ vơ,"He was by turns hurt, confused, angry, and desolate .","Do đó, anh ta bị tổn thương, hoang mang, tức giận, bơ vơ và cô độc.",deserted and devoid of inhabitants
riddle,noun,câu đố,What is the next of the riddle ?,Phần tiếp theo của câu đố là gì?,"A verbal puzzle, mystery, or other problem of an intellectual nature, such as ""It's black, and white, and red all over. What is it?"""
etch,verb,khắc axit,"They were etched by the Mount's founding priest, Isaac Fowler.","Chúng được khắc axit bởi linh mục cha đẻ của nơi này, Isaac Fowler.",To engrave a surface (especially of metal or glass) in order to produce a printing pattern.
bangle,noun,vòng,"Madame, would you like some of those orange bangles","Thưa bà, bà có muốn những vòng đeo tay màu cam","A rigid bracelet or anklet, especially one with no clasp."
sequin,noun,Xêquin,Gold sequins .,Đính kim sa vàng .,(historical) Any of various small gold coins minted in Italy and Turkey.
prosperous,adjective,phồn vinh,"The Wayne name is synonymous with growth, strength and prosperity .","Cái tên Wayne đồng nghĩa với tăng trưởng, lớn mạnh và phồn vinh .",characterized by success
headmaster,noun,hiệu trưởng,"Thank you, headmaster , for those kind words of welcome.","Cám ơn ông, thưa ông hiệu trưởng , vì những lời chào đón tử tế.",(Chiefly British.) A male school principal.
cricket,noun,con dế,They gave away my crickets .,Họ đã lấy đi những con dế của tôi.,A wooden footstool.
composition,noun,thành phần,"This promise pertains regardless of family size, composition , or location.","Lời hứa này áp dụng bất kể kích thước, thành phần hoặc địa điểm của gia đình.",The combining of different parts to make a whole. [from 14th c.]
garland,noun,vòng hoa,"If I were you, I'd take the garland off in a neighborhood like this...","Nếu tôi là anh, ở trong khu phố này tôi sẽ cất cái vòng hoa kia đi.","A wreath, especially one of plaited flowers or leaves, worn on the body or draped as a decoration"
ostracize,verb,tẩy chay,Both were ostracized socially for some time thereafter.,"Một thời gian sau đó, cả hai đứa này đã bị tẩy chay khỏi đám bạn của nó.","To exclude (a person) from society or from a community, by not communicating with them or by refusing to acknowledge their presence; to refuse to talk to or associate with; to shun."
abacus,noun,bàn tính,I'm surprised I don't find an abacus in here.,Tôi ngạc nhiên khi không thấy cái bàn tính ở đây đấy.,"(obsolete) A table or tray strewn with sand, anciently used for drawing, calculating, etc."
inject,verb,tiêm,"You inject that stuff into your body to control the Lickers, right?",Cách anh tiêm nó vào để kiềm Licker à?,"(transitive) To push or pump (something, especially fluids) into a cavity or passage."
gash,verb,vết cắt,Whole hillsides bear deep gashes hundreds of meters wide.,Khắp sườn đồi loang lổ những vết cắt rộng hàng trăm mét.,A deep cut.
kameez,noun,,Many actresses wear the salwar kameez in Bollywood movies.,Nhiều nữ diễn viên mặc kameez salwar trong phim Bollywood.,Alternative spelling of kamees.
vendor,verb,ngưởi bán hàng rong,I need to see your vendor permits.,Tôi cần xem giấy phép của ảnh.,A person or a company that vends or sells.
ripple,verb,gợn sóng lăn tăn,Better than rain or rippling brook,♪ Tốt hơn mưa hay dòng suối gợn sóng ♪,A moving disturbance or undulation in the surface of a liquid.
quiver,verb,run,Miss Stephanie's nose quivered with curiosity.,Mũi cô Stephanie run lên vì tò mò.,"(weaponry) A container for arrows, crossbow bolts or darts, such as those fired from a bow, crossbow or blowgun."
refugee,verb,người lánh nạn,Some refugees from the disaster soon headed toward those buildings.,Chẳng mấy chốc một số người lánh nạn đi về hướng những tòa nhà này.,"A person seeking refuge in a foreign country out of fear of political persecution or the prospect of such persecution in his home country, i.e., a person seeking a political asylum."
kerchief,verb,khăn tay,"And mamma in her kerchief , and I in my cap,","Mẹ trong khăn tay của cô, và Con ở trong mũ của tôi,",(old-fashioned) A piece of cloth used to cover the head.
fragile,adjective,mỏng manh,"As you know from the reading, DNA is a fragile molecule.","Như các em đã đọc sách, ADN là một phân tử mỏng manh .","easily broken or destroyed, and thus often of subtle or intricate structure"
harsh,adjective,khắc nghiệt,But it seems so harsh .,Nhưng có vẻ hơi khắc nghiệt với cô ấy.,Unpleasantly rough to the touch or other senses.
tapestry,verb,tấm thảm,We have exquisite tapestries dating all the way back to...,Chúng tôi trải những tấm thảm tuyệt mĩ dọc con đường quay lại...,(by extension) anything with variegated or complex details
sari,noun,xari,I am shaking in my sari .,Tôi đang run rẩy trong sari của tôi.,"The traditional dress of women in the Indian Subcontinent; an outer garment consisting of a single length of cotton or silk, most often with one end wrapped around the waist to form a skirt, the other draped over the shoulder or head."
jumpy,adjective,hay giật mình,"Certain everyday things, They make him jumpy or startled?","một số vật gì đó, làm cho anh ấy hoảng hốt hay giật mình ?",Nervous and excited.
squat,verb,ngồi xổm,Someone has been slackin with the squat and cough.,Có ai đó chểnh mảng trong lúc bắt phạm nhân ngồi xổm và ho.,A position assumed by bending deeply at the knees while resting on one's feet.
rumple,verb,làm nhàu,"This weapon, what does Rumple say of its power?",Rumple nói gì về sức mạnh của nó?,"To make wrinkled, particularly of fabric."
mutter,verb,càu nhàu,"“Not,” he muttered , “if one didn’t want to make any enemies.”",“Không” Anh càu nhàu . “nếu người đó không muốn tạo ra kẻ thù nào.”,A repressed or obscure utterance; an instance of muttering.
grave,noun,mồ,"What kind of man crawled into his own grave in search of hope, hm?",Loại người nào bò vào chính nấm mồ của mình để tìm kiếm hy vọng?,"A written accent used in French, Italian, and other languages. è is an e with a grave accent."
grime,verb,bụi bẩn,"In the process, they remove layers of built-up grime and reverse previous crude restoration attempts.","Trong tiến trình thực hiện, họ tẩy đi những lớp bụi bẩn đóng lâu ngày và chỉnh lại những chỗ sửa không khéo trước kia.","Dirt, grease, soot, etc. that is ingrained and difficult to remove."
defect,noun,khuyết điểm,"Yet, there is no doubt that this defect is unusually common today.",Nhưng chắc chắn là khuyết điểm này ngày nay phổ thông một cách bất thường.,A fault or malfunction.
nestle,verb,náu mình,"In 1839 (June–August), Shamil and his followers, numbering about 4000 men, women and children, found themselves under siege in their mountain stronghold of Akhoulgo, nestled in the bend of the Andi Koysu, about ten miles east of Gimry.","Năm 1839 (tháng 6-tháng 8), Shamil và những người lính của mình, 4000 người, phụ nữ và trẻ em, bị bao vây trong pháo đài trên núi Akhoulgo, náu mình trong khúc quanh của Sông Andee Koisou, khoảng mười dặm phía đông Gimry.",To settle oneself comfortably and snugly.
stutter,verb,nói lắp,There are some interesting angles to having a stutter .,Có vài điều thú vị khi mắc phải tật nói lắp .,(intransitive) To speak with a spasmodic repetition of vocal sounds.
upright,adjective,thẳng đứng,This word helps to show that stau·rosʹ was an upright stake without a crossbeam.,Chữ này giúp cho thấy stau.ros’ là một cây cọc thẳng đứng không có đà ngang.,Vertical; erect.
braised,adjective,,Today's stew is braised meatballs with vegetables.,Món hầm hôm nay là thịt viên om với rau. Anh sẽ trổ tài nấu nướng.,Simple past tense and past participle of braise.
gazette,verb,báo hằng ngày,The Sunday Gazette,Báo Gazette Chủ Nhật,"A newspaper; a printed sheet published periodically; esp., the official journal published by the British government, and containing legal and state notices."
presumption,noun,sự cho là đúng,Presumption Receiving Stolen Property 410.,Tội bắt cóc nhằm chiếm đoạt tài sản Điều 170.,(dated) arrogant behaviour
systemic,adjective,toàn thân,Or systemic scleroderma.,Hoặc là xơ cứng bì toàn thân .,"Embedded within and spread throughout and affecting a group, system, body, economy, market, or society as a whole."
consulate,noun,tòa lãnh sự,The consulate .,Không Tòa lãnh sự .,"In practice, an office of a government in a foreign city that oversees the distribution of visas and provides assistance to nationals."
persevere,verb,kiên trì,Why do we persevere in making repeated visits to people in their homes?,Tại sao chúng ta kiên trì trở lại thăm người ta nhiều lần tại nhà của họ?,"To persist steadfastly in pursuit of an undertaking, task, journey or mission in spite of distraction, difficulty, obstacles or discouragement."
establishment,noun,tổ chức,Institutions have always been the ones to establish the rules and propose changes.,Các qui chế luôn luôn đã được thiết lập và đề xuất thay đổi bởi những tổ chức .,The act of establishing; a ratifying or ordaining; settlement; confirmation.
authentic,adjective,đích thực,"They say, we Dutch, we like real, natural, authentic experiences.","Họ nói, người Hà Lan chúng tôi thích các trải nghiệm thật, tự nhiên, đích thực .",Of the same origin as claimed; genuine.
enrapture,verb,làm mê mẩn,"Animals appear and dance, enraptured , to his music.","Các con thú xuất hiện và nhảy múa, mê mẩn trong tiếng sáo của anh ta.",To fill with great delight or joy; to fascinate.
ail,adjective,làm phiền não,She's ailing .,Cổ bị bệnh .,An ailment; trouble; illness.
decline,verb,từ chối,He declined to share that information with me.,Anh ta từ chối chia sẻ thông tin đó với tôi.,"(intransitive) To move downwards, to fall, to drop."
theorem,noun,định lý,"It will then become a theorem , a truth, forever and ever.","Thì nó sẽ trở thành định lý , một sự thật, vĩnh viễn.",(mathematics) A mathematical statement of some importance that has been proven to be true. Minor theorems are often calledpropositions. Theorems which are not very interesting in themselves but are an essential part of a bigger theorem's proof are calledlemmas
weather,noun,thời tiết,"According to the weather forecast, it'll snow tomorrow.","Theo dự báo thời tiết , mai sẽ có tuyết.","To expose to the weather, or show the effects of such exposure, or to withstand such effects."
exclusive,adjective,độc quyền,She promised him the exclusive rights to her story of revenge.,Cô ấy hứa ông ta sẽ được độc quyền câu chuyện báo thù của mình.,(literally) Excluding items or members that do not meet certain conditions.
nostalgia,noun,hoài cổ,"It's one of those nostalgia places, but not done very well.",Nó là một trong những nơi hoài cổ nhưng không làm ăn tốt lắm.,A longing for home or familiar surroundings; homesickness.
compassion,verb,trắc ẩn,"You also can show compassion , hard work, and optimism.","Các em cũng có thể bày tỏ lòng trắc ẩn , sự chăm chỉ, và tính lạc quan.","Deep awareness of the suffering of another, coupled with the wish to relieve it"
ethics,noun,luân lý,"For a long time, religion has generally dictated the ethical standards by which people live.","Từ lâu, tiêu chuẩn luân lý thường là do tôn giáo quy định.",(philosophy) The study of principles relating to right and wrong conduct.
impulse,verb,sự thúc đẩy,"Because everything Beth does comes from within, from some dark impulse .","Bởi mọi việc Beth làm đều từ bên trong, từ 1 sự thúc đẩy đen tối nào đó.",A thrust; a push; a sudden force that impels.
cascade,noun,tầng,"And then on top of that, that's created a kind of cascading effect.","Sau cùng, điều này đã tạo ra một dạng ảnh hưởng phân tầng .",(intransitive) To fall as a waterfall or series of small waterfalls.
decompose,verb,phân huỷ,"It can take bottle one an agonizing 1,000 years to decompose .","Và có thể mất tới 1,000 năm đằng đẵng để chiếc chai thứ nhất này phân huỷ .",(transitive) to separate or break down something into its components; to disintegrate or fragment
irritated,adjective,bị chọc tức,and it seems to keep getting irritated .,và dường như cứ bị chọc tức .,Simple past tense and past participle of irritate.
collaborate,verb,cộng tác,"Instead, the band held out for Vig, with whom they felt comfortable collaborating .","Cuối cùng, họ đã cộng tác với Vig, người mà họ cảm thấy thoải mái nhất.",To work together with others to achieve a common goal.
stunning,adjective,cừ khôi,"McCarthy believed American Beauty a "" stunning card of introduction"" for film débutantes Mendes and Ball.","McCarthy tin Vẻ đẹp Mỹ là một ""nước cờ mở đầu cừ khôi "" cho những người mới bước vào ngành điện ảnh như Mendes và Ball.",Having an effect that stuns.
slump,verb,hạ nhanh,Her shoulders slumped as she replaced the lid and shuffled into the house .,Vai của con bé hạ nhanh xuống khi con bé lấy cái nắp ra rồi lê bước vào nhà .,(intransitive) To collapse heavily or helplessly.
mode,noun,cách thức,Chapters 4–5 detail the exact mode of administering the sacrament.,Các chương 4–5 chỉ dẫn tường tận cách thức chính xác làm lễ Tiệc Thánh.,"(music) One of several ancient scales, one of which corresponds to the modern major scale and one to the natural minor scale"
dander,verb,sự giận dữ,"Their coats do not shed, which reduces dander .","Bộ lông của chúng không rụng, làm giảm dander .",Dandruff—scaly white dead skin flakes from the human scalp.
theoretical,adjective,suông,Jesus’s teachings were not meant to be theoretical .,Những lời giảng dạy của Chúa Giê Su không có nghĩa là lý thuyết .,Of or relating to theory; abstract; not empirical.
demonstrate,Verb,giải thích,Mother comes to the rescue and demonstrates what must be done.,Mẹ nó đến giải cứu và giải thích phải làm gì.,To display the method of using an object.
simulation,noun,mô phỏng,You couldn't really create this or simulate it in any other way.,Bạn không thể nào tạo ra hoặc mô phỏng nó bằng bất cứ cách nào.,Something which simulates a system or environment in order to predict actual behaviour.
anterior,adjective,phía trước,The most common cause of anterior nosebleeds is dry air .,Nguyên nhân chảy máu cam phía trước thường gặp nhất là do không khí khô .,Before in place.
mucus,noun,nước nhầy,"Because newborns tend to breathe through their noses and their nasal passages are narrow , small amounts of nasal fluid or mucus can cause them to breathe noisily or sound congested even when they do n't have a cold or other problem .","Vì trẻ sơ sinh thường có khuynh hướng thở bằng mũi và lỗ mũi của bé rất hẹp , nên một lượng nhỏ dịch mũi hoặc nước nhầy có thể làm cho bé thở khò khè hoặc nghe như bị nghẹt mũi thậm chí khi bé không bị cảm lạnh hoặc bị một bệnh nào khác .",(physiology) A slippery secretion from the lining of the mucous membranes.
