word,part_of_speech,meaning,example,example_meaning,definition
logic,noun,luận lý,"Through logic and learning, knowledge is increased and understanding enhanced.","Qua luận lý học và kiến thức, sự hiểu biết được gia tăng.","(uncountable) A method of human thought that involves thinking in a linear, step-by-step manner about how a problem can be solved. Logic is the basis of many principles including the scientific method."
humane,adjective,nhân đức,No human has ever entered this castle.,Không con người nào trong lâu đài này được.,Having regard for the health and well-being of another; compassionate.
cassette,noun,cassette,"And listen, I made you a cassette recording.","Và nghe này, bố đã ghi cho con một băng cassette .","A small flat case containing magnetic tape on two reels, used to record and play back audio and video material."
ban,verb,cấm,President Jefferson did not want the trade ban to last long.,Tổng thống Jefferson không muốn cấm vận thương mại kéo dài.,To forbid or block from participation.
abide by,verb,tuân thủ,I know it'll be hard for you to abide by my rules.,Tao mày sẽ khó khi tuân thủ các quy tắc của tao.,"(transitive) To accept a decision or law and act in accordance with it; to conform to; to acquiesce; as,to abide by an award."
reluctant,adjective,bất đắc dĩ,Helen is one of the more reluctant members of tonight's audience.,Helen là 1 khán giả bất đắc dĩ của buổi diễn tối nay.,(now rare) Opposing; offering resistance (to).
pudgy,adjective,mập lùn,It's got these two pudgy cherubs holding it.,Có hai thiên xứ lùn lùn giữ chiếc đồng hồ.,"Fat, overweight (pertaining particularly to children), plump; chubby"
resolve,verb,giải quyết,"If you two could resolve this tension, you could really help each other.",Nếu có thể giải quyết vấn đề căng thẳng này hai người có thể giúp được nhau đó.,(transitive) To find a solution to (a problem).
spite,verb,mối hận thù,I love you in spite of that.,Anh yêu em mặc dù em như thế.,"Ill will or hatred toward another, accompanied with the disposition to irritate, annoy, or thwart; a desire to vex or injure; petty malice; grudge; rancor."
nonfiction,noun,,Nonfiction,Truyện có thật,"Written works intended to give facts, or true accounts of real things and events. Often used attributively."
odious,adjective,ghê tởm,That is one odious aroma.,Đó là một hương thơm ghê tởm .,"Arousing or meriting strong dislike, aversion, or intense displeasure."
corrupt,adjective,tham nhũng,"Now, I don't want to be an apologist for corruption .","Bây giờ, tôi không muốn là người biện hộ cho tham nhũng .",In a depraved state; debased; perverted; morally degenerate; weak in morals.
juvenile,adjective,vị thành niên,Given that my client is a juvenile the people have agreed to probation.,"Vì thân chủ của tôi vẫn là vị thành niên , nên được phép hưởng án treo.",an actor playing a child's role
sly,adjective,ranh mãnh,Sly wit.,Ranh mãnh .,"Done with, and marked by, artful and dexterous secrecy; subtle; as, a sly trick."
obsess,verb,ám ảnh,And this obsession of yours with Raiden will cease immediately.,Và nỗi ám ảnh của ngươi với Raiden phải dừng lại ở đây.,"(passive, construed withwith) To be preoccupied with a single topic or emotion."
misdemeanor,noun,,Got him out on a misdemeanor .,Lôi anh ta ra khỏi một vụ khinh tội .,(law) A crime usually punishable upon conviction by a small fine or by a short term of imprisonment. Crimes which are punishable by large fines or by longer imprisonment are usually called felonies.
heft,verb,sức nặng,Has some heft .,Có vẻ nặng đấy nhỉ .,(uncountable) Weight
psychic,adjective,tâm thần,"No, it's a metaphorical construct representing a psychic attack within a shared dreamscape.",đó là hình ảnh ẩn dụ được tạo dựng đại diện cho cuộc tấn công tâm thần trong giấc mơ được chia sẻ này.,"A person who possesses, or appears to possess, extra-sensory abilities such as precognition, clairvoyance and telepathy, or who appears to be susceptible to paranormal or supernatural influence."
trove,noun,,Flint's trove ?,Của cải của thuyền trưởng Flint à?,A treasure trove; a collection of treasure.
prosper,verb,thịnh vượng,"And in order to build prosperity , we need security in place.","Và để xây dựng sự thịnh vượng , ta cần có an ninh.",To favor; to render successful.
dilemma,noun,song đề,I'm going to talk briefly about two of them: the prisoner's dilemma and the tragedy of the commons.,Tôi sẽ nói qua về 2 trong số đó: song đề tù nhân và bi kịch của mảnh đất công.,A circumstance in which a choice must be made between two or more alternatives that seem equally undesirable.
perilous,adjective,nguy hiểm,This is very perilous stuff you're messing with.,Cậu đang đùa với việc vô cùng nguy hiểm đấy.,"Dangerous, full of peril."
chronicle,verb,ghi chép,"But I found the clues that will safely take us through, in the Chronicles of St. Anselm.",Nhưng ta đã tìm ra đầu mối giúp chúng ta an toàn Trong ghi chép về thánh Anselm,"A written account of events and when they happened, ordered by time."
unanimous,adjective,nhất trí,I think our unanimous vote is all the commentary you need.,Tôi nghĩ việc nhất trí của chúng tôi là tất cả những bình luận các anh cần.,"Based on unanimity, complete assent or agreement."
portray,verb,miêu tả sinh động,"In the Alexiad, Anna Komnene portrays gender and gender stereotypes in a unique way.","Trong Alexiad, Anna Komnene miêu tả sinh động các định kiến về giới tính theo một cách duy nhất.",To paint or draw the likeness of.
lewd,adjective,dâm dục,Replace lewd thoughts with hopeful images and joyful memories.,Thay thế những ý nghĩ dâm dục bằng hình ảnh đầy hy vọng và những kỷ niệm vui vẻ.,"Lascivious, sexually promiscuous, rude."
gavel,verb,,"""Hillary takes Senate gavel –for an hour"".",Danh sách Chủ tịch Thượng viện tạm quyền Hoa Kỳ ^ a ă “Hillary takes Senate gavel– for an hour”. cnn.com.,(historical) Rent.
joist,verb,rầm,"Day after day, your memory sagged a little more, collapsing like the floor joists in the abandoned house.","Ngày qua ngày, trí nhớ của bà dần giảm sút như những mối ghép sàn ở căn nhà hoang nọ.","A piece of timber laid horizontally, or nearly so, to which the planks of the floor, or the laths or furring strips of a ceiling, are nailed; -- called, according to its position or use, binding joist, bridging joist, ceiling joist, trimming joist, etc."
quirk,verb,lời châm biếm,"You want to tame Florence, but I prefer it wild, for all its quirks and criminals.","Ngươi muốn thuần hóa Florence, nhưng ta muốn nó hoang dã, với tất cả lời châm biếm và tội phạm.","an idiosyncrasy; a slight glitch, mannerism; something unusual about the manner or style of something or someone"
embellish,verb,thêm thắt,( Chuckles ) Figured your stories could use a little embellishment .,Tôi thấy câu chuyện ông tạo ra cần thêm tí chút thêm thắt .,To make more beautiful and attractive; to decorate.
incognito,adjective,giấu tên,What does incognito mean?,Ẩn danh có nghĩa là gì?,"Without being known; in disguise; in an assumed character, or under an assumed title."
fanciful,adjective,huyền ảo,"Oh, fancy policeman.","Oh, tôi đoán anh là cảnh sát.",imaginative or fantastic; unreal or imagined
oust,verb,đuổi,Exposing the board for wanting to oust us because we wanted to stop poisoning people?,Cho hội đồng đã đuổi chúng ta Vì ta muốn ngưng việc đầu độc mọi người?,To expel; to remove.
bifurcation,noun,chỗ rẽ,You're at the carotid bifurcation .,Cậu đang ở chỗ rẽ nhánh động mạch cảnh rồi đấy.,(biology) A division into two branches.
altercation,noun,cuộc cãi lộn,Daddy calls it an altercation .,Cha em gọi đó là cãi lộn .,Warm contention in words; dispute carried on with heat or anger; controversy; wrangle; wordy contest.
hanker,verb,ao ước,I've a hankering to see it.,Chú rất muốn được nhìn thấy nó.,"To crave, want or desire."
gimmick,verb,đồ không cần thiết,What gimmick ?,Mẹo cả đấy .,A trick or device used to reach some end.
introspection,noun,sự tự xem xét nội tâm,Transformation followed introspection .,Sự biến đổi theo sau sự tự xem xét nội tâm .,"A looking inward; specifically, the act or process of self-examination, or inspection of one's own thoughts and feelings; the cognition which the mind has of its own acts and states; self-consciousness; reflection."
parlance,noun,cách nói,"The term ""boutique"" entered common English parlance in the late 1960s.","Thuật ngữ ""cửa hàng thời trang"" đã đi vào cách nói tiếng Anh phổ biến vào cuối những năm 1960.","A certain way of speaking, of using words, especially when it comes to those with a particular job or interest."
consequential,adjective,"có ảnh hưởng, có kết quả",insurance against consequential loss,,someone who is self-important
patronizing,adjective,ra vẻ kẻ cả,"You're so patronizing , Mr Campion.","Ông rất ra vẻ kẻ cả , ông Campion.",offensive condescending
emblazon,verb,trang trí phù hiệu,"He gathered a group of people on the Hill of Love and unfurled a blue and white flag emblazoned with the words Ness Ziona (""Banner to Zion"") written in gold.","Ông tập hợp một nhóm người trên Hill of Love và giương một lá cờ màu xanh và màu trắng trang trí phù hiệu với các từ Ness Ziona (""Banner Zion"") được viết bằng vàng.",(transitive) To adorn with prominent markings.
tome,noun,quyển,A ponderous Tome .,Đó là một quyền sách khá nặng.,One in a series of volumes.
deviation,noun,sự lệch,We have a midcourse deviation .,Chúng ta có sự lệch hướng ở chính giữa.,"The act of deviating; a wandering from the way; variation from the common way, from an established rule, etc.; departure, as from the right course or the path of duty."
medley,verb,bản nhạc hỗn hợp,He once again swam both individual medley events.,Thế nên chúng tôi buộc phải chơi lại cả medley.,"(now rare, archaic) Combat, fighting; a battle. [from 14th c.]"
enigma,noun,điều bí ẩn,Death does not need to be an enigma .,Sự chết không còn là điều bí ẩn .,"Something or someone puzzling, mysterious or inexplicable."
susceptibility,noun,tính nhạy cảm,Individuals with low perceived susceptibility may deny that they are at risk for contracting a particular illness.,Những người có tính nhạy cảm nhận thấp có thể phủ nhận rằng họ có nguy cơ bị mắc một căn bệnh đặc biệt.,the condition of being susceptible; vulnerability
distress,noun,nỗi đau buồn,Does that prevent Jehovah from knowing our distress ?,Điều đó có ngăn cản Đức Giê-hô-va hiểu được nỗi đau buồn của chúng ta không?,(Cause of) discomfort.
obligatory,adjective,bắt buộc,It is an obligatory question in this evaluation.,Chỉ là 1 câu hỏi bắt buộc dùng để đánh giá thôi.,"Imposing obligation, morally or legally; binding: an obligatory promise."
unresponsive,adjective,khó động lòng,Woe to an Unresponsive Generation,Khốn cho thế hệ không chịu hưởng ứng,Not responsive; unreactive.
denial,noun,sự phủ nhận,So the first consistent component of regret is basically denial .,Yếu tố kiên định đầu tiên của sự hối hận đơn giản là sự phủ nhận .,The negation in logic
tenant,verb,thuê,Most of this building's tenants are artists.,Những người thuê nhà trong tòa nhà này hầu hết là nghệ sỹ.,"One who pays a fee (rent) in return for the use of land, buildings, or other property owned by others."
fatigue,verb,mệt nhọc,"You seem to be well balanced, even if you are suffering momentarily from fatigue .","Cô trông rất quân bình, cho dù ngay cả khi cô đang mệt nhọc nhất thời.",A weariness caused by exertion; exhaustion.
ornithology,noun,Điểu học,maybe getting a Ph.D. from Cornell in ornithology .,có thể tôi sẽ lấy bằng Tiến sĩ ngành Điểu học ở Cornell.,The branch of zoology that deals with the scientific study of birds.
insomnia,noun,mất ngủ,The problem causing the insomnia differs from person to person .,Nguyên nhân gây mất ngủ không phải ai cũng giống ai .,a sleeping disorder that is known for its symptoms of unrest and the inability to sleep
soothing,adjective,dễ chịu,For some reason it soothes me.,khiến tôi thấy dễ chịu .,Tending to soothe.
pun,verb,sự chơi chữ,( this is a pun ),( đây là một sự chơi chữ ),"A joke or type of wordplay in which similar senses or sounds of two words or phrases, or different senses of the same word, are deliberately confused."
condolence,noun,lời chia buồn,That people are gonna post condolences on a website?,Mọi người sẽ post những lời chia buồn lên website này sao?,"(uncountable) comfort, support or sympathy"
distracted,adjective,mất trí,"Well, I got a little distracted , didn't I?",Chắc bố hơi bị mất trí rồi nhỉ?,Simple past tense and past participle of distract.
distorted,adjective,bị bóp méo,And it is not subject to the distortions that often mark oral retelling.,Và nó không bị bóp méo như thường thấy trong sự truyền miệng.,Simple past tense and past participle of distort.
potential,adjective,tiềm tàng,"Therefore, it might be said that the potential human race within his loins died with him.",Thế nên có thể nói là dòng giống loài người tiềm tàng trong ngài cũng chết theo ngài.,Currently unrealized ability.
flirt,adjective,ve vãn,All that flirting with everything in pants that crossed our threshold.,Cô đã ve vãn bất cứ tên đực rựa nào đi ngang qua nhà.,"A sudden jerk; a quick throw or cast; a darting motion; hence, a jeer."
teeter,verb,đu,"Teetering teapots, so dainty.",Bàn tay búp măng xinh chưa này!,To tilt back and forth on an edge.
sonnet,verb,bài thơ xonê,Sonnet Spell Client,Khách chính tả KSpellComment,a fixed verse form of Italian origin consisting of fourteen lines that are typically five-foot iambics rhyming according to a prescribed scheme
idolize,verb,tôn sùng,In this world it is common to idolize oneself and one’s own will.,Trong thế gian ngày nay người ta thường tôn sùng chính mình và ý muốn riêng của mình.,"To make an idol of, or to worship as an idol."
clammy,adjective,lạnh và ẩm ướt,Many have fruiting bodies that reach upwards to catch any feeble current there might be in the clammy air.,Nhiều phần trái vươn lên trên bắt lấy nhiều luồng gió yếu ớt trong không khí lạnh và ẩm ướt .,"Cold and damp, usually referring to hands or palms."
accusation,noun,sự buộc tội,He was prepared to face her accusations .,Anh đã chuẩn bị để đương đầu với sự buộc tội của vợ.,The act of accusing or charging with a crime or with a lighter offense.
omen,noun,điềm,He writes: “The overthrow of this world-power [Egypt] is an omen and prelude of the overthrow of every ungodly world-power on the day of the last judgment.”,Ông viết: “Sự sụp đổ của cường quốc thế giới này [Ê-díp-tô] là một điềm và dấu hiệu báo trước sự sụp đổ của mọi cường quốc thế giới chống tôn giáo trong ngày phán xét sau cùng”.,Something which portends or is perceived to portend a good or evil event or circumstance in the future; an augury or foreboding.
horde,verb,đám,Meaning “ Hordes .”,Nghĩa là “ đám dân”.,"A wandering troop or gang; especially, a clan or tribe of a nomadic people (originally Tatars) migrating from place to place for the sake of pasturage, plunder, etc.; a predatory multitude."
harmony,noun,hoà âm,Rhythms set a foundation for melodies and harmonies to play on top of.,Nhịp điệu tạo ra một nền tảng cho giai điệu và hoà âm để trình diễn.,"a pleasing combination of elements, or arrangement of sounds"
concoct,verb,chế,I've concocted you.,Tôi đã bịa ra anh.,"to prepare something by mixing various ingredients, especially to prepare food for cooking"
iconic,adjective,chân dung,They're just icons ; you click on them.,"Chúng chỉ là những biểu tượng , và bạn click vào chúng.","Relating to, or having the characteristics of, an icon."
endearing,adjective,khả ái,• What qualities endeared Jesus to people?,• Người ta quý những đức tính nào của Chúa Giê-su?,"Inspiring love or affection, in a childlike way."
superstar,noun,siêu sao,Ich was going to be the biggest Austrian superstar since Hitler.,Tôi sẽ trở thành siêu sao người Áo sáng giá nhất kể từ sau Hitler.,Someone who has accumulated a vast amount of fame and wealth.
sprint,verb,chạy nước rút,I did some sprints on the beach today.,Hôm nay tôi chạy nước rút trên bãi biển.,A short race at top speed
mythological,adjective,hoang đường,As in the mythological city under the ocean?,Thành phố thần thoại đã bị chìm xuống đáy đại dương đây sao?,"(colloquial) imaginary, fabulous"
statistic,adjective,Thông số,"And if I go back in time, I've added some historical statistics —","Nếu tôi có thể quay ngược thời gian, tôi sẽ bổ sung vài thông số lịch sử —",Alternative spelling of statistical.
home run,noun,,Home run !,Ngon lành!,"(baseball) A four-base hit, a homer"
personify,verb,nhân cách hóa,"There wisdom is personified , as though able to speak and act.","Ở đó, sự khôn ngoan được nhân cách hóa , như thể nói và hành động được.",(intransitive) To be an example of; to have all the attributes of.
charismatic,adjective,lôi cuốn,"We'd know a whole lot about charismatic megafauna,","Chúng ta biết rất nhiều loài động vật to lớn có sức lôi cuốn ,","of, related to, or being a member of a form of Christianity that emphasises the role of the Holy Spirit"
cherish,Verb,giữ trong lòng,"I mean, we shared a very special afternoon together, and that's something I will always cherish .",Ý tôi là chúng ta đã chia sẽ một chiều đặc biệt với nhau và đó là điều mà tôi sẽ luôn giữ trong lòng .,To treat with tenderness and affection; to nurture with care; to protect and aid.
unrivaled,adjective,vô song,"His appearance is like Lebʹa·non, as unrivaled as the cedars.","Tướng mạo chàng như Li-băng, đẹp vô song như cây tuyết tùng.","Beyond compare, far surpassing any other, unparalleled, without rival."
impersonate,verb,đóng vai,"Here, we must be impersonal .","Ở đây, chúng ta không được xen tình cảm cá nhân vào.","(transitive) To manifest in corporeal form, or in one's own person or body."
admire,verb,khâm phục,You see things to admire where there's nothing.,Cậu thấy khâm phục những việc đâu đâu.,"(obsolete, transitive) To be amazed at."
cardinal,adjective,chủ yếu,"Numbers are mainly formed by adding cardinal numbers to the number 5 and by multiplying the numbers 10, 20 and 100.","Số đếm chủ yếu được tạo ra bằng cách thêm số vào 5 và nhân những số 10, 20 và 100.","Of fundamental importance; crucial, pivotal."
preach,verb,thuyết giáo,"What's the matter, Preacher, don't you like being preached at?","Sao vậy, Linh mục, anh không thích nghe thuyết giáo hả?",Give a sermon.
actor,noun,diễn viên,Tom lacks the talent to be an actor .,Tom thiếu tài năng để trở thành một diễn viên .,a person who performs in a theatrical play or film
role,noun,vai trò,And so each citizen plays an indispensable role .,Và như vậy mọi công dân đều có vai trò không thể thiếu được.,A character or part played by a performer or actor.
caliber,noun,cỡ,"Inspired by but not licensed by America's Next Top Model, the objective of this program was to raise the caliber of young models in the country and enhancing the international perception of Ghanaian models.","Lấy cảm hứng từ America's Next Top Model, mục tiêu của chương trình này là nâng cao tầm cỡ của các thí sinh trẻ trong nước và nâng cao nhận thức quốc tế về người mẫu.",US spelling of calibre.
versatile,adjective,đa năng,Mbabazi is a versatile player with the ability to play on either wing or as a forward.,Mbabazi là 1 cầu thủ đa năng với khả năng để chơi ở hai cánh hoặc là tiền đạo.,(biology) Capable of moving freely in all directions.
fuddy-duddy,noun,người vô tích sự,"Yeats, you old fuddy - duddy .","Là Yeats, ông già hủ lậu ạ .","(US, informal) An old-fashioned, persnickety or ineffective person."
aspire,verb,khao khát,No. Designers aspire to be really great designers.,Không. Những nhà thiết kế khao khát trở thành những nhà thiết kế vĩ đại.,To hope or dream; especially to hope or work towards a profession or occupation (followed by to as a preposition or infinitive particle).
neophyte,noun,người mới nhập đạo,Here come the Neophytes .,Đây là Neophytes .,A beginner.
sitcom,noun,phim hài,They can watch sitcoms with her.,Họ có thể xem phim hài với con bé.,A situation comedy: an episodic comedy television program with a plot or storyline based around a particular humorous situation.
comedian,noun,diễn viên kịch vui,She's a comedian .,Cô nhóc là diễn viên hài đấy.,"An entertainer who performs in a humorous manner, especially by telling jokes."
character,noun,nhân vật,"The following is a list of characters from the anime and manga series, Gakuen Alice.",Dưới đây là danh sách các nhân vật trong manga và anime Gakuen Alice.,A being involved in the action of a story.
induct,verb,induce,"Induction motor, sir.","Động cơ cảm ứng , thưa thầy.","to introduce into (particularly if certain knowledge or experience is required, such as ritual adulthood or cults)."
humor,verb,hài hước,He seems to be bankrupt of humor .,Hình như anh ấy chẳng có tí khiếu hài hước nào.,"(uncountable) The quality of being amusing, comical, funny. [from the early 18th c.]"
basso profundo,noun,,,,Alternative spelling of basso profondo.
override,verb,cho ngựa giày xéo,Override .,Thông qua !,To ride across or beyond something.
redeem,verb,chuộc,But into that agonizing breach came three redeeming forces.,Nhưng có ba sức mạnh cứu chuộc đã xảy đến trong thời gian đau khổ đó.,(transitive) To recover ownership of something by paying a sum.
determine,verb,quyết định,And the choices we make about this will determine our future.,Và quyết định của chúng ta sẽ quyết định tương lai của chính chúng ta.,To set the limits of.
nausea,noun,buồn nôn,Taking ginger or doxylamine is most likely to effectively curb nausea and vomiting .,Củ gừng hoặc thuốc doxylamine có thể trị được buồn nôn và ói hiệu quả nhất .,"A feeling of physical unwellness, usually with the desire to vomit."
hull,noun,vỏ,"The modifications to her hull increased her armor weight from 6,502 to 10,313 long tons, directly violating the terms of the Washington Naval Treaty.","Việc cải tiến thân tàu đã làm tăng trọng lượng của vỏ giáp bảo vệ từ 6.502 lên 10.313 tấn, trực tiếp vi phạm các điều khoản của Hiệp ước Washington.",The outer covering of a fruit or seed
absolutely,adverb,hoàn toàn,Absolutely marvelous.,Hoàn toàn tuyệt diệu.,"In an absolute, independent, or unconditional manner."
vocation,noun,nghề,"Make a plan for your life, including education or vocational training.","Hãy lập một kế hoạch cho cuộc sống của các em, kể cả học vấn lẫn học nghề .","an occupation for which a person is suited, trained or qualified"
confidence,noun,sự tự tin,"As they started out, I was impressed with their confidence .","Khi họ bắt đầu đi, tôi cảm kích trước sự tự tin của họ.",Self-assurance.
virtue,noun,đức,Many people do not fully understand the meaning of virtue .,Nhiều người không hiểu trọn vẹn ý nghĩa của đức tính.,"(obsolete) The inherent power of a god, or other supernatural being. [13th-19th c.]"
honorable,adjective,chính,"It doesn't pass the balancing test, your honor .","Nó không vượt qua các phân tích chính đáng, thưa quan tòa.",Worthy of respect; respectable.
self-pity,noun,sự tự thương mình,Is he self - pitying ?,Ông có than thân trách phận không?,a feeling of pity for oneself
mansion,noun,lâu đài,"Finally, he came to a wonderful mansion , which was his destination.","Cuối cùng, ông đến một lâu đài tráng lệ chính là điểm đến của ông.","A large house or building, usually built for the wealthy."
defeatist,adjective,thất bại chủ nghĩa,To criticize the plan is defeatist !,Phê phán kế hoạch này là chủ bại !,"of, or relating to defeatism"
