word,part_of_speech,meaning,example,example_meaning,definition
generosity,noun,hành động khoan hồng,A Time of Generosity,Thời Gian để Có Lòng Quảng Đại,(uncountable) the trait of being willing to donate money and/or time
insight,noun,sự sáng suốt,"I was mindful, of course, that such insights were relative.",Dĩ nhiên tôi để ý rằng sự sáng suốt chỉ là tương đối.,A sight or view of the interior of anything; a deep inspection or view; introspection; frequently used with into.
pitiful,adjective,không đáng kể,I pity them.,Ta thương xót họ.,(now rare) Feeling pity; merciful.
primary,adjective,chủ yếu,We have four primary hand gestures that we use.,Chúng tôi chủ yếu có 4 cử chỉ tay.,The first in a group or series.
sincere,adjective,chân thành,"It takes continual, sincere effort.","Phải cần có nỗ lực liên tục, chân thành .",earnest; meaning what one says or does; truthful.
cringe,verb,khúm núm,Foreigners will come cringing before me.,Dân ngoại sẽ khúm núm mà đến trước mặt con.,A posture or gesture of shrinking or recoiling.
evidence,noun,bằng chứng,"She went in to get evidence , and she came out with evidence .",Cổ vô đó để tìm bằng chứng và cổ đã lấy được bằng chứng ra. Như là gì?,Facts or observations presented in support of an assertion.
express,adjective,tốc hành,The ones you tied to the express train?,Những người bạn mà anh cột vào tàu tốc hành đó?,"Moving or operating quickly, as a train not making local stops."
hoist,verb,sự nhấc bổng lên,From March to October the flag should be hoisted from 08.00.,"Từ tháng 3 đến tháng 10, cờ phải được treo từ 08:00.","(transitive) To raise; to lift; to elevate; especially, to raise or lift to a desired elevation, by means of tackle or pulley, as a sail, a flag, a heavy package or weight."
practical,adjective,thiết thực,"Finally, help your children see the practical benefits of study.",Bạn hãy giúp con thấy rõ lợi ích thiết thực của việc học.,(UK) that part of an exam or series of exams in which the candidate has to demonstrate their practical ability
puny,adjective,yếu đuối,Puny god.,Vị thần bé nhỏ .,"Of inferior size, strength or significance."
wistful,adjective,có vẻ khao khát,"With heavy step and wistful eye,","Với bước đi nặng nề và đôi mắt buồn rầu ,",full of yearning or longing
analyze,Verb,phân tích,Do you need me to analyze the data?,Anh có muốn tôi phân tích dữ liệu?,(chiefly US and Canada) Alternative spelling of analyse.
devour,verb,ngấu,"But, instead of devouring the people in the shop,","Nhưng thay vì ăn ngấu nghiến con người trong cửa hàng đó,","To eat quickly, greedily, or hungrily; to eat by swallowing large bits of food with little or no chewing."
envious,adjective,ghen tị,"Either way, I've spent a lifetime often envious of him.","Dù thế nào, ta luôn luôn ghen tị với nó.",Feeling or exhibiting envy; desire of excellence or good fortune of another; maliciously grudging
influence,noun,ảnh hưởng,"To influence somebody, we need to know what already influences them.","Khi chúng ta muốn gây ảnh hưởng lên ai đó, ta phải biết cái gì ảnh hưởng họ.","The power to affect, control or manipulate something or someone; the ability to change the development of fluctuating things such as conduct, thoughts or decisions."
prohibit,verb,cấm,"The policy is changing to clarify that content that misleads viewers by appearing to be appropriate for a general audience, but contains sexual themes or obscene content, is prohibited .","Chính sách này sẽ thay đổi để làm rõ việc nghiêm cấm nội dung gây hiểu lầm cho người xem bằng cách hiển thị nội dung có vẻ như phù hợp cho đối tượng chung, nhưng lại chứa các chủ đề tình dục hoặc nội dung khiêu dâm.","(transitive) To forbid, disallow, or proscribe; to make illegal or illicit."
regret,verb,tiếc,"I don't want gamers to regret the time they spent playing, time that I encouraged them to spend.","Tôi không muốn những game thủ phải hối tiếc về khoảng thời gian họ đã bỏ ra để chơi, khoảng thời gian mà tôi khuyến khích họ bỏ ra.","To feel sorry about (a thing that has happened), afterthink: to wish that a thing had not happened, that something else had happened instead."
wring,verb,vắt,They've taken their T-shirts and they wring the sweat out.,Họ vắt áo thun cho mồ hôi chảy ra.,To squeeze or twist tightly so that liquid is forced out.
glimpse,verb,cái nhìn thoáng qua,"When you receive your blessing, you get a glimpse of eternity.","Khi nhận phước lành của mình, các em có được cái nhìn thoáng qua về sự vĩnh cửu.","A brief look, glance, or peek."
glisten,verb,lấp lánh,There's only one kind of rock that glistens like that!,Chỉ có một loại đá lấp lánh như vầy.,"(intransitive) to reflect light with a glittering luster; to sparkle, coruscate, glint or flash"
isolate,verb,cách ly,"It's isolated in the containment lab, sir.","Nó đã bị cách ly trong phòng thí nghiệm, thưa ngài.",(transitive) To set apart or cut off from others.
option,verb,sự chọn lựa,What options do I have left?,Tôi còn có sự chọn lựa nào khác nữa?,One of the choices which can be made.
passage,noun,đoạn,* Why do you think the writer included these events or passages ?,* Các anh chị em nghĩ tại sao tác giả gồm vào những sự kiện hay những đoạn này?,A paragraph or section of text or music with particular meaning.
vast,adjective,rộng,"As you can see, the system is very complex and vast .","Như bạn có thể thấy, toàn bộ hệ thống vô cùng phức tạp và rộng lớn.",Very large or wide (literally or figuratively).
visual,adjective,thị giác,The body needs vitamin A for the visual and immune systems to work properly .,Cơ thể cần vitamin A giúp hệ miễn dịch và thị giác hoạt động tốt .,related to or affecting the vision
sire,verb,bệ hạ,"There will be no argument and no politics, sire .","Thưa bệ hạ , sẽ không có tranh cãi và cũng chẳng có chính trị.","A lord, master, or other person in authority, most commonly used vocatively."
denizen,verb,cư dân,This saloon is for denizens of Daisy Town.,Quán rượu này chỉ dành cho cư dân trong thị trấn.,"(transitive, UK) To grant rights of citizenship to; to naturalize."
wayfarer,noun,người đi đường,I'm quite aware of Wayfarer 515.,"Vâng, tôi cũng nắm khá rõ vụ 515.","A traveller, especially one on foot."
rife,adjective,lan tràn,Bribery is rife at Camelot.,Nạn tham nhũng lan tràn ở Camelot.,"Widespread, common (especially of unpleasant or harmful things)."
suppliant,adjective,khẩn khoản,"In fact, David’s words in Psalm 51 express many a suppliant’s sentiments.","Thật thế, những lời của Đa-vít trong bài Thi-thiên 51 số 51 biểu lộ nhiều cảm nghĩ của một người van xin .",One who pleads or requests earnestly.
bastion,noun,pháo đài,Get together by the west bastion .,Hãy cùng nhau đến pháo đài phía tây.,a projecting part of a rampart or other fortification
fain,adjective,vui lòng,And that is what you would fain destroy?,"Và chính cái đó, các anh định phá hủy sao?",(archaic) Well-pleased; glad; apt; wont; fond; inclined.
tarry,adjective,trễ,"“While the bridegroom tarried , they all slumbered and slept.","Vì chàng rể đến trễ , nên các nàng thảy đều buồn ngủ và ngủ gục.",(intransitive) To delay; to be late or tardy in beginning or doing anything.
consummation,noun,sự hoàn hảo,'Tis a consummation devoutly to be wished.,nó là một sự hoàn hảo sốt sắng để được mong muốn.,"The act of consummating, or the state of being consummated; the state of being completed; completion."
thrall,verb,bắt làm nô lệ,The Duke has the Dark One in thrall .,Kỵ Sĩ Bóng Tối là nô lệ của Công Tước,One who is enslaved or mind-controlled.
profane,adjective,coi thường,But you... you profaned our sacred rites.,Nhưng các người... các người đã coi thường lễ nghi của Chúa.,"Unclean; ritually impure; unholy, desecrating a holy place or thing."
envoy,noun,phái viên,Did you know they sent an envoy to the Citadel after that?,Cậu có biết là họ đã gửi một phái viên đến Citadel ngay sau đó không?,diplomat
filial,adjective,đạo làm con,What a filial son!,Thật là một người con trai hiếu thuận !,(not comparable) Pertaining to or befitting a son or daughter.
bane,verb,nguyên nhân suy sụp,Bane took her.,Bane bắt cô ta đi rồi,A cause of misery or death; an affliction or curse
atonement,noun,sự chuộc lỗi,The sermons were about atonement for sin.,Những bài thuyết giáo là về sự chuộc lỗi cho những tội lỗi.,A repair done for the sake of a damaged relationship.
deign,verb,hạ cố,"You will not deign to drink with us, yet you would taste our steel.","Ông không chịu hạ cố uống rượu với tôi, mà chỉ muốn nếm mùi kiếm thép của tôi.",(intransitive) To condescend; to accept as appropriate to one's dignity.
impious,adjective,bất hiếu,"Depart then, impious one...","Hãy đi đi,",not pious
succor,noun,giúp đỡ,The word succor means to help in time of need or distress.,Từ giúp đỡ có nghĩa là giúp đỡ trong lúc hoạn nạn hoặc đau khổ.,"Aid, assistance or relief given to one in distress; ministration."
glen,noun,thung lũng hẹp,"The next glen , many fires.","Thung lũng hẹp , nhiều ngọn lửa",A secluded and narrow valley; a dale; a depression between hills.
presage,verb,báo trước,"It could presage an enemy sortie, or locate an enemy over the horizon.","Truy cập ngày 31 tháng 1 năm 2009. ^ It could presage an enemy sortie, or locate an enemy over the horizon.",A warning of a future event; an omen.
perforce,verb,tất yếu,but it is perforce typical of virtually all Hungarians.,Nhưng đó là điều tất yếu đối với hầu hết người Hungary.,(archaic) By force.
choleric,adjective,hay cáu,"SAMPSON I mean, an we be in choler we'll draw.","Sampson tôi có nghĩa là, chúng tôi được trong choler chúng ta sẽ vẽ.",Easily becoming angry.
exorcise,verb,trừ tà cho,We can exorcise him.,Chúng ta có thể trục xuất hắn.,"To rid a person, place or thing of an evil spirit"
importunate,adjective,nài nỉ,"14 When Potiphar’s wife importuned Joseph to “lie down with [her],” his loyalty to Jehovah was put to the test.","14 Khi vợ của Phô-ti-pha nài nỉ Giô-sép “nằm cùng [y thị]”, sự trung thành của Giô-sép đối với Đức Giê-hô-va gặp thử thách.","Of a demand: persistent or pressing, often annoyingly so."
knell,verb,hồi chuông báo tử,That sounded the death knell for Haman.,Đó là hồi chuông báo tử cho Ha-man.,"(intransitive) to ring a bell slowly, especially for a funeral; to toll."
sedition,noun,sự dấy loạn,Seditive will help with the discomfort.,Thuốc an thần sẽ giải quyết sự khó chịu.,The organized incitement of rebellion or civil disorder against authority or the state.
procure,verb,làm ma cô,‘The Woman Who Procures Praise’,‘Người nữ được khen-ngợi’,"(transitive) To acquire or obtain an item or service, sometimes rare, usually by extra effort."
invoice,noun,hóa đơn,"That's not like invoices or reports, or numbers.","Nó không giống như cùi hóa đơn hay tờ báo cuộn, hay đồ chơi.","a bill; a commercial document issued by a seller to a buyer indicating the products, quantities and agreed prices for products or services that the seller has already provided the buyer with. An invoice indicates that, unless paid in advance, payment is due by the buyer to the seller, according to the agreed terms."
chime in,verb,a dua,Good chime - in .,Nói hay lắm.,(idiomatic) to talk; to join in conversation or discussion
transaction,noun,giao dịch,"It turned transactions into interactions, and generosity into a currency.","Cửa hàng này biến các giao dịch thành các tương tác, và sự hào phóng thành tiền.","The act of conducting or carrying out (business, negotiations, plans)."
cubicle,noun,phòng ngủ nhỏ,We don't paint work cubicles .,Ta không sơn phòng ngủ nhỏ nơi làm việc.,A small separate part or one of the compartments of a room.
slack,adjective,chùng,That one looks a little slack .,Hắn có hơi chùng xuống kìa.,(followed by “off”) to procrastinate; to be lazy
portfolio,noun,chức vị bộ trưởng,This Regis Air fiasco's crushing my portfolio .,Thất bại của Regis Air đã nghiền nát các danh mục đầu tư của tôi.,"A case for carrying papers, drawings, photographs, maps and other flat documents."
circulation,noun,lưu thông,There's still 13 trillion dollars circulating in the US economy.,Vẫn có 13 nghìn tỷ đô lưu thông trong nền kinh tế Mỹ.,"The act of moving in a circle, or in a course which brings the moving body to the place where its motion began."
bulge,verb,chỗ phồng,"There's an ink smudge on your wrist, a bulge in your jacket pocket.","Có 1 vết mực trên cổ tay của cô, 1 chỗ phồng lên ( máy ghi âm ) trong túi áo khoác bên trái.",Something sticking out from a surface.
torment,verb,giày vò,On some cellular level that still torments me.,Vẫn còn giày vò từng tế bào của tôi.,(obsolete) A catapult or other kind of war-engine.
occupational,noun,nghề nghiệp,Occupation ?,Nghề nghiệp ?,"Of, relating to, or caused by an occupation"
lisp,verb,nói ngọng,He stays in the room next to mine and has a lisp .,Anh ta ở cạnh phòng tôi. Anh ấy nói ngọng .,To pronounce the sibilant letter ‘s’ imperfectly; to give ‘s’ and ‘z’ the sounds of ‘th’ (IPA: /θ / ð/) — a defect common amongst children.
replica,noun,bản sao,Here's a replica of one such seal.,Dưới đây là bản sao của một con dấu như vậy.,An exact copy.
syndrome,noun,hội chứng,Chronic fatigue syndrome makes simple activities difficult.,Hội chứng mệt mỏi kinh niên khiến những hoạt động đơn giản trở nên khó khăn.,(pathology) A recognizable pattern of symptoms or behaviours.
pulsate,verb,rung,"As the object ascended, it was expanding and pulsating , but a decrease in brightness was not noted.","Khi vật thể vọt lên, nó như đang nở ra và rung lắc, nhưng sự giảm độ sáng đã không được ghi nhận.",To expand and contract rhythmically; to throb or to beat.
irk,verb,làm khó chịu,You're beginning to irk me.,Ông đang bắt đầu làm tôi khó chịu đấy.,(transitive) to irritate; annoy; bother
brute,adjective,kẻ vũ phu,Vester is a brute with no conscience.,"Vester là một kẻ vũ phu , không có lương tâm.",An animal destitute of human reason; any animal not human; especially a quadruped; a beast.
severe,adjective,gay go,20 The disciple Stephen displayed tranquillity when enduring a severe test of his faith.,20 Môn đồ Ê-tiên biểu lộ sự bình tĩnh khi chịu thử thách gay go vì đức tin.,Very bad or intense.
intimidate,verb,dọa,Who's intimidating to a guy who won the Nobel Prize?,Ai có thể đe dọa 1 người đã giành giải khôngbel?,"(transitive) To make timid or fearful; to inspire or affect with fear; to deter, as by threats; to dishearten; to abash."
transpire,verb,diễn ra,Other key events transpired on that date in later years.,Những sự kiện quan trọng nhiều năm sau cũng diễn ra vào thời điểm đó.,"To give off (vapour, waste matter etc.); to exhale (an odour etc.). [from 16th c.]"
interject,verb,xen vào,Can I just interject something here?,Tôi có thể xen vào không?,(transitive) To insert something between other things
plaintiff,noun,nguyên cáo,Unselfish Attitude of the Plaintiffs,Thái độ vị tha của nguyên cáo,(law) A party bringing a suit in civil law against a defendant; accusers.
conveyor belt,noun,băng tải,All the boxes are still on the conveyor belt .,Tất cả các hộp đều đang trên băng tải .,"A continuous flexible band moved by a series of rollers to transport objects or material from one place to another, especially within a factory or mine."
eventually,adverb,cuối cùng,"And once you start off like that, you eventually end up being able to dream in Vietnamese.","Một khi bạn bắt đầu như thế, bạn cuối cùng có thể mơ thành người Việt.",In the end.
personnel,noun,biên chế,"The Italian Navy in 2008 had 35,200 active personnel with 85 commissioned ships and 123 aircraft.",Hải quân Ý vào năm 2008 có 35.200 quân nhân tại ngũ cùng với 85 tàu được biên chế và 123 máy bay.,employees; office staff
motivational,adjective,,Be Motivated to Serve God,Được thúc đẩy để phụng sự Đức Chúa Trời,Tending or intended to motivate.
descent,noun,dòng dõi,"The word “generation” may refer to one’s descent , or background.",Từ ngữ “ dòng dõi ” có thể ám chỉ nguồn gốc hay gốc gác của một người.,An instance of descending
knoll,noun,gò,I remember this knoll over here.,Tôi nhớ có cái gò trên kia.,A small mound or rounded hill.
hail,verb,gọi,"We're hailing them on every frequency and mode in the book, sir.","Chúng tôi đã gọi họ trên mọi tần số và chế độ theo quy định, thưa ngài.","Balls or pieces of ice falling as precipitation, often in connection with a thunderstorm."
beaming,adjective,,Switch to full- beam !,Bật hết cỡ đi!,Smilingly happy; showing happy emotion.
impressive,adjective,gây ấn tượng,How am I going to impress Tom?,Tôi sẽ gây ấn tượng với Tom bằng cách nào đây?,"Making, or tending to make, an impression; having power to impress; adapted to excite attention and feeling, to touch the sensibilities, or affect the conscience; as, an impressive discourse; an impressive scene."
disperse,verb,giải tán,I'm certain it will disperse once his feet have stopped twitching.,TÔi chắc là họ sẽ giải tán ngay khi cái chân của hắn ngừng co giật.,"(transitive, intransitive) To scatter in different directions"
lopsided,adjective,không cân,Her face is all lopsided .,Gương mặt không cân xứng.,Not even or balanced; not the same on one side as on the other.
impose,verb,áp đặt,"But I vowed to master the chaos, to impose order.","Nhưng tôi thề phải làm chủ sự hỗn loạn, áp đặt lệnh.",(transitive) to establish or apply by authority
advisable,adjective,thích hợp,It advises us on the proper use of wealth.,Sách khuyên bảo chúng ta về cách sử dụng của cải một cách thích hợp .,(of a course of action) Worthy of being recommended; desirable.
humanitarian,adjective,nhân đạo,Attacks on humanitarian aid workers are war crimes in international law.,Tấn công nhân viên cứu trợ nhân đạo là tội ác chiến tranh theo luật quốc tế.,"Concerned with people's welfare, and the alleviation of suffering; humane or compassionate."
carefree,adjective,vô tư lự,"Monika grew up as a carefree , vibrant person with a cheerful disposition.","Monika lớn lên là người vô tư lự , sôi nổi đầy nghị lực và có tính tình vui vẻ.",Without cares; free of concern or worries; easy; casual; without difficulty.
eclectic,adjective,trung hòa,to pursue ever more ambitious and eclectic objectives.,để theo đuổi hoài bão tương lai và chủ nghĩa trung hòa .,"Selecting a mixture of what appear to be best of various doctrines, methods or styles."
sentimental,adjective,đa cảm,I wouldn't have thought Vesper the sentimental type.,Tôi không nghĩ Vesper lại là loại người đa cảm đấy.,"Characterized by sentiment, sentimentality or excess emotion."
insular,noun,hòn đảo,"One instance that enraged the Insulares was the Franciscan takeover of Antipolo, the richest parish in the islands, which had been under the control of Philippine-born priests.","Một ví dụ mà tức giận các Insulares là Phanxicô tiến của giáo xứ giàu nhất trong các hòn đảo đã được đặt dưới sự Philippines-sinh linh mục, đó là Antipolo.","Of, pertaining to, being, or resembling an island or islands."
precipitate,adjective,chất kết tủa,Most precipitation areas occur near frontal zones.,Hầu hết các vùng mưa xảy ra gần các vùng frông.,(transitive) To make something happen suddenly and quickly; hasten.
voluble,adjective,lém,"And when my ritual began, this very voluble patient began to quiet down.","Và khi nghi lễ của tôi bắt đầu, bệnh nhân nói nhiều này bắt đầu im tiếng dần.",(botany) twisting and turning like a vine
unexceptionable,adjective,không thể bác được,"You give logical, unexceptionable answers, but the tone - indeed the monotone which is a bit boring - with which you answer perplexes me a bit.","Những câu trả lời của em bình thường, hợp lý, nhưng cái giọng, đúng ra là cái giọng đều đều nghe hơi chán khiến cho tôi hơi khó hiểu.",Beyond reproach; unimpeachable
remonstrance,noun,sự can gián,"After that act, they were called Remonstrants .","Sau hành động ấy, họ bị gọi là Những Người Phản Đối .","A remonstration; disapproval; a formal, usually written, protest or objection."
auspicious,adjective,thuận lợi,"But still, not a particularly auspicious start for either of your kids at Lakeside.",Nhưng đây vẫn không phải là khởi đầu thuận lợi cho cả hai con bà ở Lakeside này.,Of good omen; indicating future success.
engender,verb,sinh ra,"The sin is the pride, the arrogance, the confidence in self that gaining wealth can engender .","Nhưng tội ở chỗ tự cao, kiêu ngạo, cậy mình, là những tật mà bởi sự làm giàu sinh ra .","(obsolete, transitive) To beget (of a man); to bear or conceive (of a woman). [14th-19th c.]"
maxim,noun,cách ngôn,The way of the Lord is best defined by a different maxim : “Believing is seeing.”,Cách thức của Chúa được định nghĩa rõ nhất bởi một câu cách ngôn khác: “Tin rồi sẽ thấy”.,(now rare) A self-evident axiom or premise; a pithy expression of a general principle or rule.
affectation,noun,sự giả bô,Satan understands that how we think affects the way we act.,Sa-tan hiểu rõ rằng tư tưởng chi phối hành động của chúng ta.,An attempt to assume or exhibit what is not natural or real; false display; artificial show.
gentry,noun,ghuộm hạng người,I understand you’re of the local gentry .”,Tôi biết cô thuộc tầng lớp quý tộc nhỏ ở địa phương.”,Birth; condition; rank by birth.
limpid,adjective,trong suốt,Caroline turned limpid eyes to her husband.,Caroline đưa đôi mắt trong sáng về phía chồng cô.,"Clear, transparent or bright."
aquiline,adjective,chim ưng,"He was a remarkably handsome man, dark, aquiline , and moustached -- evidently the man of whom I had heard.","Ông là một người đàn ông đáng kể đẹp trai, tối, chim ưng , và moustached - rõ ràng người đàn ông mà tôi đã nghe.","of, pertaining to, or characteristic of eagles."
enervate,adjective,yếu ớt,"‘She is stuck in her enervating slumbers, from the hesternal dissipation or debauch,’ Daffy said.","“Nó đang bị mắc kẹt trong mấy giấc ngủ mỏi mệt, vì vẫn còn vương vấn chuyện của ngày hôm qua đấy,” Daffy nói.",(transitive) To reduce strength or energy; debilitate.
apoplectic,adjective,ngập máu,On 23 January 1904 he suffered an apoplectic stroke and died the next day at Ballenstedt castle.,"Vào ngày 23 tháng 1 năm 1904, Quận công bị ngập máu và ngày hôm sau ông từ trần tại lâu đài Ballenstedt.","Of, or relating to apoplexy."
circumspect,adjective,thận trọng,One should approach it with extreme circumspection .,Mọi người khi đến gần nó đều phải thận trọng tối đa.,Carefully aware of all circumstances; considerate of all that is pertinent.
recreant,adjective,hèn nhát,"Demetrius sent him in 161 BCE to Judea with a large army, in order to invest the recreant Alcimus with the office of high priest (I Macc. vii.",Demetrius phái ông đến Judea vào năm 161 TCN với một đội quân lớn để khôi phục cho tên phản bội Alcimos với cùng với chức giáo sĩ tối cao(I Macc vii..,"disloyal, unfaithful, surrendering allegiance."
dearth,noun,sự khan hiếm,"First of all, there's a real dearth of data in the debate.","Trước hết, đó là một sự khan hiếm thực tế về dữ liệu trong các cuộc tranh luận.",(Can we clean up(+)this sense?) A period or condition when food is rare and hence expensive; famine.
beset,verb,bao vây,"Beset means to surround or press in on all sides, to trouble, or to harass.","Quấy nhiễu có nghĩa là bao vây hoặc thúc ép mọi phía, gây phiền hà, hay quấy rầy.",(transitive) To surround or hem in
wayward,adjective,ương ngạnh,From what may parents of wayward children draw comfort?,Cha mẹ của những người con ương ngạnh có thể tìm được sự an ủi từ đâu?,"given to wilful, perverse deviation from the expected norm; tending to stray"
