word,part_of_speech,meaning,example,example_meaning,definition
intensify,verb,tăng cường,"Thus, he has intensified his attacks on God’s people.","Vì vậy, hắn tăng cường tấn công dân của Đức Chúa Trời.","(transitive) To render more intense; as, to intensify heat or cold; to intensify colors; to intensify a photographic negative; to intensify animosity."
deprive,verb,cách chức,She was deprived of the company of her son for many years as he studied in Cuba and the Soviet Union.,Bà bị cách chức khỏi công ty của con trai bà khi con trai bà học tại Cuba và Liên Xô.,To take something away (and keep it away); deny someone of something.
deflect,verb,lệch,"And that was that the gravitational field, due to mass, will deflect not only the trajectory of particles, but will deflect light itself.","Và đó chính là trường hấp dẫn, do khối thiên hà sinh ra, sẽ làm lệch hướng không chỉ qũy đạo của các hạt, mà còn làm lệch cả bản thân ánh sáng nữa.",(transitive) To make (something) deviate from original path.
fluctuation,noun,sự dao động,"Should there be excessive fluctuations in exchange markets , then we need to take resolute actions .","Nếu có sự dao động quá mức trên thị trường ngoại hối , thì chúng tôi cần phải hành động kiên quyết .",A motion like that of waves; a moving in this and that direction.
canvass,Verb,vận động bầu cử,"Yeah, I'll canvass .",Tôi sẽ đi vận động .,a solicitation of voters or opinions
mingle,Verb,lẫn vào,"His remains are long lost, mingled with the dust of nearly 60 centuries.","Hài cốt của ông đã tiêu tan, hòa lẫn vào cát bụi gần 60 thế kỷ.","To mix; intermix; to combine or join, as an individual or part, with other parts, but commonly so as to be distinguishable in the product; to confuse; to confound."
glacial,adjective,băng giá,"Few countries range from glacial to tropical within a small area, but Uganda does.","Không mấy xứ giống như Uganda, có phong cảnh thay đổi từ băng giá đến nhiệt đới trong một vùng nhỏ.",having the appearance of ice
alternative,adjective,chọn một,Choose an alternate name for the new folder,Hãy chọn một tên xen kẽ cho thư mục mới,A situation which allows a mutually exclusive choice between two or more possibilities.
bombard,verb,bắn phá,They're under heavy bombardment .,Họ đang bị bắn phá dữ dội.,"a medieval primitive cannon, used chiefly in sieges for throwing heavy stone balls."
irascible,adjective,bẳn tính,Nature is really irascible .,Thiên nhiên là thực sự irascible.,Easily provoked to outbursts of anger; irritable.
lure,verb,nhử,This fleece used to lure satyrs every day.,Bộ Lông này đã dùng để nhử bọn thần dê hằng ngày.,"Something that tempts or attracts, especially one with a promise of reward or pleasure."
garish,adjective,sặc sỡ,Why on earth do you travel in such a garish litter?,Sao ngài lại ngồi trong cái kiệu sặc sỡ thế này?,Overly ostentatious; so colourful as to be in bad taste.
pinion,noun,cánh,"“With his pinions he will block approach to you, and under his wings you will take refuge,” wrote the psalmist. —Psalm 91:4.","Người viết Thi-thiên nói: “Ngài sẽ lấy lông Ngài mà che-chở ngươi, và dưới cánh Ngài, ngươi sẽ được nương-náu mình”.—Thi-thiên 91:4.",A wing.
sycophantic,adjective,bợ đỡ,,,given to obsequious flattery.
jubilation,noun,sự hân hoan,"Be jubilant , my feet!",Xứng đáng là chân tướng quân!,A triumphant shouting; rejoicing; exultation.
sinuous,adjective,khúc khuỷu,"Turkish Angora cats have long, silky coats and elegant, sinuous bodies.","Mèo Angora Thổ Nhĩ Kỳ có bộ lông dài, mượt sang trọng và thân hình khá gồ ghề .",moving gracefully and supplely
sphere,noun,mặt cầu,(The number is so high because several spheres are needed for each planet.),(Số lượng nhiều bởi mỗi hành tinh cần nhiều mặt cầu trong suốt).,(mathematics) A regular three-dimensional object in which every cross-section is a circle; the figure described by the revolution of a circle about its diameter [from 14th c.].
besmirch,verb,bôi nhọ,Or besmirching the good name of the Spinners.,Hoặc bôi nhọ tên tuổi của Spinners.,(transitive) To make dirty; to soil.
prophecy,verb,lời tiên tri,What does this prophecy teach us about God’s Kingdom?,Lời tiên tri này cho chúng ta biết gì về Nước Đức Chúa Trời?,"A prediction, especially one made by a prophet or under divine inspiration."
appalled,adjective,kinh hoàng,You're appalled .,Anh ghê sợ ?,Simple past tense and past participle of appall.
dissolve,verb,hoà tan,It is the sodium salt of benzoic acid and exists in this form when dissolved in water.,Nó là muối natri của axit benzoic và tồn tại ở dạng này khi hoà tan trong nước.,(cinematography) A film punctuation in which there is a gradual transition from one scene to the next.
righteous,adjective,chính,It’s important for us to realize that there is no one way that a righteous family looks.,Điều quan trọng cho chúng ta là nhận thức rằng không thể diễn tả một gia đình ngay chính bằng một cách thức nhất định.,(slang US) awesome
pathetic,adjective,thống thiết,"And what is time travel but your pathetic attempt to control the world around you,",Thế cái gì là du hành vượt thời gian khi sự thống thiết của ngươi đang cố gắng kiểm soát thế giới xung quanh ngươi.,"Arousing pity, sympathy, or compassion."
accomplish,verb,hoàn thành,"No matter what the cost, I will accomplish that.",Bằng mọi giá tôi sẽ hoàn thành nó.,To finish successfully.
combination,noun,tổ hợp,"Yes, because atoms could not combine to form molecules.","Thưa có, bởi vì các nguyên tử không thể tổ hợp thành phân tử.","The act of combining, the state of being combined or the result of combining."
crucial,adjective,chủ yếu,"Clearly , financial management encompasses a number of crucial areas of your business .",Rõ ràng việc quản lý tài chính chứa đựng một số mặt chủ yếu của doanh nghiệp .,Being essential or decisive for determining the outcome or future of something; extremely important.
duplicate,adjective,gấp đôi,that he or she can duplicate the original figure,chính mình có thể gấp đôi hình ban đầu,"being the same as another; identical. This may exclude the first identical item in a series, but usage is inconsistent."
independent,adjective,không phụ thuộc,I'm economically independent of my parents.,Tôi không phụ thuộc chuyện tiền bạc vào bố mẹ tôi,(politics) not affiliated with any political party
overcome,verb,khắc phục,And we need to overcome as they overcame.,Và chúng ta cần phải khắc phục như họ đã khắc phục .,"(transitive) To surmount (a physical or abstract obstacle); to prevail over, to get the better of."
peculiar,adjective,riêng,"So the stuff I'm talking about is the peculiar problem of modern, affluent, Western societies.","Vậy, cái tôi đang nói về là vấn đề riêng của xã hội hiên đại giàu có phương Tây.",Out of the ordinary; odd; curious; unusual.
perplex,adjective,khó hiểu,3 Israel’s lack of appreciation is indeed perplexing .,3 Sự vô ơn của dân Y-sơ-ra-ên quả là khó hiểu .,(transitive) To cause to feel baffled; to puzzle.
beckon,verb,vẫy tay ra hiệu,My day job beckons .,Công việc đang vẫy gọi .,To wave and/or to nod to somebody with the intention to make the person come closer.
challenge,verb,thách thức,It should be a challenge of creating wealth.,Mà nên là thách thức trong việc tạo ra sự giàu có.,An instigation or antagonization intended to convince a person to perform an action they otherwise would not.
decrease,verb,giảm,"Three, decrease per capita expenditure across a continuum.","Ba, giảm chi phí bình quân đầu người cho việc theo bệnh.","(intransitive) Of a quantity, to become smaller."
essential,adjective,chủ yếu,Or is Suzie right —that life is essentially what each of us makes of it?,Hay Suzie đã nói đúng—đời sống chủ yếu là do mỗi người chúng ta quyết định?,A fundamental ingredient.
gigantic,adjective,khổng lồ,Gigantic Whales of the Sea,Cá voi khổng lồ,Very large.
modest,adjective,khiêm tốn,From that modest beginning something truly remarkable has happened.,"Từ sự khởi đầu khiêm tốn đó, một điều thật phi thường đã xảy ra.","Not bragging or boasting about oneself or one's achievements, unpretentious, humble."
resemble,verb,giống với,"You said it resembled my apartment, didn't you?","Anh đã nói nó giống với căn hộ của em, phải không?",(transitive) To be like or similar to (something); to represent as similar.
accurate,adjective,chính xác,Everything I've told you may not be accurate .,Mọi thứ tôi kể với bạn có thể không chính xác .,"In exact or careful conformity to truth, or to some standard of requirement, the result of care or pains; free from failure, error, or defect; exact; as, an accurate calculator; an accurate measure; accurate expression, knowledge, etc."
culture,verb,cấy,"I've seen nurses give my son throat cultures , and what is it?","Tôi từng thấy y tá cấy vi khuẩn ở họng cho con tôi, là sao ấy nhỉ?","The arts, customs, and habits that characterize a particular society or nation."
frequent,adjective,thường xuyên,"She often looks down on Kon as inferior, which causes frequent arguments between the two.",Cô thường coi Kon thấp kém dẫn đến những cuộc tranh cãi thường xuyên giữa hai người.,Done or occurring often.
hesitate,verb,do dự,"You hesitate , and that hesitation could kill you.",Em do dự và sự do dự đó sẽ giết em.,(intransitive) To stop or pause respecting decision or action; to be in suspense or uncertainty as to a determination.
infuriate,adjective,làm tức điên lên,He may infuriate .,Hắn có thể tức lên .,to make furious or mad with anger; to enrage
population,noun,dân số,The number of people on Facebook is greater than the population of the United States.,Số lượng người dùng trên Facebook lớn hơn cả dân số của nước Mỹ.,(collective) The people living within a political or geographical boundary
realistic,adjective,hiện thực,"But you need to have realistic expectations, son.",Nhưng nếu cậu cần dự định hiện thực,Expressed or represented as being accurate.
resource,verb,Nguồn lực,Eternal Resources in a Mortal Journey,Các Nguồn Lực Vĩnh Cửu trong một Cuộc Sống Trần Thế,"Something that one uses to achieve an objective, e.g. raw materials or personnel."
comprehend,verb,hiểu,"People typically do not comprehend all the relevant options, or at least not very clearly.","Nói chung, người ta thường không hiểu tất cả các giải pháp liên quan, hoặc hiểu không rõ ràng lắm.","to cover, include, or contain"
establish,verb,lập,"After running through the battlefield towards a group of soldiers surrounded by the Japanese, firing on enemy combatants with a machine gun, she attempted to establish a defensive position to wait for reinforcements so she could evacuate the wounded, but was heavily outnumbered and was captured by the Japanese after she lost consciousness.","Sau khi chạy qua chiến trường hướng tới một nhóm binh sĩ được bao quanh bởi quân Nhật, bắn vào các chiến binh địch bằng súng máy, bà đã cố gắng thiết lập một vị trí phòng thủ để chờ quân tiếp viện để bà có thể di tản những người bị thương, nhưng bà đã bị quân Nhật bắt giữ sau khi bà bất tỉnh.",(transitive) To make stable or firm; to confirm.
exaggerate,verb,phóng đại,Many of us tend to exaggerate the negative when we experience disappointment.,"Khi thất vọng, nhiều người trong chúng ta thường có khuynh hướng phóng đại những điều tiêu cực.","To overstate, to describe more than is fact."
ordeal,noun,ải,When The Ghastly Ordeal of Timothy Cavendish is turned into a film... I'm thinking for the role of the hero one part Sir Laurence Olivier... with a dash of Michael Caine.,"Khi lần vượt ải kinh hoàng của Timothy Cavendish có lên phim, tôi nghĩ vai nam chính phải có nét của huyển thoại Laurence Olivier và một chút Michael Caine nữa.","a trial in which the accused was subjected to a dangerous test (such as ducking in water), divine authority deciding the guilt of the accused"
strategy,noun,Chiến lược,Such mitigation strategies have already been implemented at some sites.,Các chiến lược giảm nhẹ như vậy đã được thực hiện tại một số địa điểm.,The science and art of military command as applied to the overall planning and conduct of warfare
achievement,noun,thành tựu,"Miss Abbott, how would you sum up, in words, this achievement ?","Bà Abbott, bà có cảm tưởng gì về thành tựu này?","The act of achieving or performing; an obtaining by exertion; successful performance; accomplishment; as, the achievement of his/her object."
compose,verb,soạn,He was the son of the French mathematician Élie Cartan and the brother of composer Jean Cartan.,Ông là con trai của nhà toán học người Pháp Élie Cartan và là anh trai của nhà soạn nhạc Jean Cartan.,(transitive) To make something by merging parts. [ from later 15th c.]
extraordinary,adjective,lạ thường,What is that extraordinary smell coming from the kitchen?,Cái mùi lạ thường từ nhà bếp bay ra là gì vậy?,Not ordinary; exceptional; unusual;
gleeful,adjective,vui sướng,"If you answered “deflate me” and “ gleeful ,” you may be nurturing envy.",Nếu trả lời “mình buồn” cho câu hỏi đầu và “mình vui ” cho câu hỏi sau thì có thể bạn có tính ghen tị (Sáng-thế Ký 26:12-14).,Exuberantly or triumphantly joyful.
identify,verb,nhận biết,"What are some of the fruits, or identifying features, of true religion?","Vậy, tôn giáo thật được nhận biết qua một số đặc điểm nào?",(transitive) To establish the identity of someone or something.
blurt,verb,thốt ra,"Because at first, I'd be so excited I would blurt out,","Vì ban đầu, tôi quá phấn khởi nên thốt ra ,",To utter suddenly and unadvisedly; to speak quickly or without thought; to divulge inconsiderately — commonly with out.
criticize,verb,chỉ trích,Most writers are sensitive to criticism .,Hầu hết các nhà văn đều dễ bị tổn thương bởi các lời chỉ trích .,(archaic) to find fault (with something)
fortunate,adjective,may mắn,"Fortunately , the weather was good.","May mắn thay, thời tiết rất tốt.",Coming by good luck or favorable chance.
ridicule,verb,chế nhạo,She is compelled to suffer long hours of servitude and ridicule .,Cô bé ấy bị bắt buộc phải phục dịch và bị chế nhạo rất lâu.,(transitive) to criticize or disapprove of someone or something through scornful jocularity; to make fun of
trait,noun,đặc điểm,"Civilian broadcasters have a certain, you know, personality trait .",Phát thanh viên thường dân thường có những đặc điểm cá nhân.,"(computing, programming) In object-oriented programming, an uninstantiable collection of methods that provides functionality to a class by using the class’s own interface."
utter,adjective,hoàn toàn,"For me, the worst was the feeling of utter powerlessness.","Với tôi, cảm xúc đáng sợ nhất là cảm thấy bất lực hoàn toàn .","(now poetic, literary) Outer; furthest out, most remote. [from 10th c.]"
adjust,verb,điều chỉnh,"If you change the grasp, it can adjust to that.","Nếu bạn thay đổi cách cầm, nó có thể tự điều chỉnh cho phù hợp.",(transitive) To modify.
approve,verb,tán thành,"President Lula , 65 , is leaving office with approval ratings of over 80 %","Tổng thống Lula , 65 tuổi , sẽ rời chức vụ với mức tán thành hơn 80%",(transitive) To sanction officially; to ratify; to confirm.
conduct,verb,dẫn,And that's evident here with the slower conduction .,Bằng chứng là có sự suy giảm tính dẫn điện.,The act or method of controlling or directing
conflict,verb,xung đột,Philosophies which are deeply held often conflict with each other.,Những triết lý mà được nhiều người rất tin tưởng thường xung đột với nhau.,"(intransitive, with ‘with’) To be at odds (with); to disagree or be incompatible"
equivalent,adjective,tương đương,So what is the transformational equivalent like that in medicine?,Vậy sự thay đổi tương đương trong y học thì như thế nào?,"similar or identical in value, meaning or effect; virtually equal"
likely,adjective,có khả năng,It is unlikely we'd be seen and even less likely we'd be caught.,Khó có khả năng mình bị nhìn thấy và càng khó có khả năng mình bị bắt.,probable; Possessing or displaying the qualities or characteristics that make something probable
neglect,verb,bỏ bê,"Parents neglected her, so she was always creating drama.","Bố mẹ nó bỏ bê nó, nên nó sống ảo lắm.",(transitive) To disregard or pay little attention to something
significant,adjective,quan trọng,What significant events occurred when a particular Bible book was written?,Có những sự kiện quan trọng nào xảy ra khi sách Kinh Thánh này được viết?,Signifying something; carrying meaning.
context,noun,ngữ cảnh,Many of our words change depending on the context .,Rất nhiều từ bị thay đổi tùy thuộc vào ngữ cảnh .,(linguistics) the text in which a word or passage appears and which helps ascertain its meaning
graphic,adjective,sinh động,"Wow, this is graphic .","Ooaa, thật sinh động .",grotesque or otherwise repulsively gory
investigate,verb,điều tra,The mayor thought that he should investigate the decline in tax revenues.,Thị trưởng nghĩ rằng ông ta nên điều tra về việc sụt giảm nguồn thu từ thuế.,(transitive) To inquire into or study in order to ascertain facts or information.
irregular,adjective,không chính quy,"On 2 April 1453, Sultan Mehmed's army of 80,000 men and large numbers of irregulars laid siege to the city.","Ngày 2 tháng 4 năm 1453, Sultan Mehmed đem 80.000 quân và hàng trăm ngàn quân không chính quy bao vây thành phố.",Nonstandard; not conforming to rules or expectations.
wage,verb,tiến hành,You do not have to wage this fight on your own.,Bạn không phải tiến hành cuộc tranh chiến này dựa vào sức riêng bạn.,"an amount of money paid to a worker for a specified quantity of work, usually expressed on an hourly basis."
affect,verb,dùng,"- receiving medications that affect the immune system , such as steroids or chemotherapy","- phải dùng thuốc ảnh hưởng đến hệ miễn dịch , như là xtê-rô-it hoặc hoá trị liệu",(transitive) To influence or alter.
detect,adjective,phát hiện,I learned how to effectively communicate across borders without being detected .,Tôi học cách liên lạc hiệu quả xuyên biên giới mà không bị phát hiện .,Detected.
external,adjective,ngoài,List internal and external pages that link to the site.,Liệt kê các trang nội bộ và trang bên ngoài liên kết tới trang web.,Outside of something; on the exterior.
gleam,Verb,tia,"There was a gleam of light when the brother of Bicky's pawnbroker offered ten dollars, money down, for an introduction to old Chiswick, but the deal fell through, owing to its turning out that the chap was an anarchist and intended to kick the old boy instead of shaking hands with him.","Có một tia ánh sáng khi anh trai của chủ tiệm cầm đồ Bicky được cung cấp mười đô la, tiền xuống, đối với một giới thiệu về tuổi Chiswick, nhưng thỏa thuận này đã giảm, do của nó quay ra rằng các chap là một vô chính phủ và có ý định đá cậu bé tuổi thay vì bắt tay với anh ta.",a small or indistinct shaft or stream of light.
internal,adjective,nội bộ,"This guy, Leland, take a look at his internal security designation.","Gã này, Leland, hãy xem thiết lập an ninh nội bộ của ông ta.","concerned with the domestic affairs of a nation, state or other political community."
restrict,adjective,hạn chế,Others want the authorities to restrict the sale of firearms.,Người khác thì muốn các nhà cầm quyền hạn chế việc buôn bán súng đạn.,"To restrain within bounds; to limit; to confine; as, to restrict worlds to a particular meaning; to restrict a patient to a certain diet."
secure,adjective,an toàn,"When I hear the van is away and the money is secure , my men will leave.","Khi tôi được báo là xe đã đi và tiền an toàn , người của tôi sẽ rời đi.",Free from attack or danger; protected.
enhance,verb,nâng cao,Her moral strength thus enhanced her physical beauty.,"Do đó, phẩm hạnh đã nâng cao vẻ đẹp bề ngoài của nàng.","(obsolete) To lift, raise up."
exhibit,verb,triển lãm,He was recommended as a councilor in many exhibitions .,Bà đã từng là thành viên ban giám khảo trong nhiều triển lãm in.,An instance of exhibiting.
familiar,adjective,quen thuộc,This song is familiar to us.,Bài hát này quen thuộc đối với chúng tôi.,Known to one.
ferocious,adjective,dữ tợn,The world is full of ferocious animals.,Thế giời này đầy những động vật dữ tợn .,Marked by extreme and violent energy.
murky,adjective,tối tăm,She' il never take me back to her murky womb,Bà không bao giờ mang ta vào lại cái bụng tối tăm đó đâu,"Hard to see through, as a fog or mist."
outcome,noun,hậu quả,What was the outcome for Adam and Eve when they sinned?,"Khi A-đam và Ê-va phạm tội, hậu quả là gì?","Information, event, object or state of being produced as a result or consequence of a plan, process, accident, effort or other similar action or occurrence."
restrain,verb,nén,"You look sad, but you restrain it, okay?","Trông cô buồn, nhưng cô phải kìm nén nó.",(transitive) To control or keep in check.
sorrowful,adjective,buồn rầu,Why were the Nephites sorrowing ?,Tại sao dân Nê Phi buồn rầu ?,"Of a person, full of sorrow; exhibiting sorrow; sad; dejected; distressed."
sympathy,noun,sự đồng tình,If word gets out... it could generate sympathy for the rebellion in the senate.,Nếu việc này lộ ra ngoài... nó sẽ tạo ra sự đồng tình về cuộc nổi loạn trong Thượng nghị viện.,A feeling of pity or sorrow for the suffering or distress of another; compassion.
appropriate,adjective,thích đáng,Why is this appropriate ?,Tại sao phải làm thế ?,(obsolete) Set apart for a particular use or person; reserved.
approximate,adjective,xấp xỉ,Kepler-10 has a measured age of approximately 10.6 billion years.,"Kepler-10 có tuổi xấp xỉ 10,6 tỷ năm.",Approaching; proximate; nearly resembling.
conclude,verb,kết luận,What do we conclude from these four resurrection accounts?,Chúng ta kết luận gì qua bốn lời tường thuật về sự sống lại này?,"(transitive or intransitive) To end, to come to an end."
erupt,verb,phun,"Pyroclastic ash flow from the eruption formed the Valley of Ten Thousand Smokes, named by botanist Robert F. Griggs, who explored the volcano's aftermath for the National Geographic Society in 1916.","Bài chi tiết: Thung lũng của Thousand Smokes Pyroclastic ash chảy từ vụ phun trào này tạo thành Thung lũng của Mười nghìn khói, được đặt tên bởi nhà thực vật Robert F. Griggs, người đã khám phá ra hậu quả của núi lửa cho Hiệp hội Địa lý Quốc gia năm 1916.",(figuratively) to spontaneously release pressure or tension
imitate,verb,nhái,"He advanced the theory of ""autoforgery"" during the trial and accused Dreyfus of imitating his own handwriting, explaining the differences in writing by using extracts of writing from his brother Matthieu and his wife Lucie.","Ông này mới đề xuất một lý thuyết về sự tự nhái chữ(autoforgerie) vào thời điểm đó và đã cáo buộc Dreyfus bắt chước chữ của chính mình, giải thích những khác biệt bằng cách dùng những trích đoạn của chữ viết tay của anh trai ông Mathieu và vợ ông Lucie.","To follow as a model or a pattern; to make a copy, counterpart or semblance of."
insist,verb,nhấn mạnh,Mersenne insisted that the goal of the natural philosopher should be precision.,Mersenne đã nhấn mạnh rằng mục tiêu của nhà triết học tự nhiên phải là sự chính xác.,(with on or upon) to hold up a claim emphatically.
tuft,verb,búi,Its ear tufts are white.,Các thùy tai có màu trắng.,"(transitive) To secure and strengthen (a mattress, quilt, etc.) with tufts."
aggressive,adjective,xâm lược,With the fascist aggression the world is in trouble.,Nhưng sự xâm lược của chủ nghĩa phát xít có qui mô toàn cầu...,Tending or disposed to aggress; characterized by aggression; making assaults; unjustly attacking.
