word,part_of_speech,meaning,example,example_meaning,definition
solemnity,noun,sự long trọng,"I so testify in all solemnity and leave my love and my blessing with you, my beloved brethren and sisters of this grateful Church.","Tôi xin làm chứng như vậy với tất cả sự long trọng và để lại tình yêu thương và phước lành của tôi với các anh chị em, các anh chị em yêu dấu của Giáo Hội đầy lòng biết ơn này.",The quality of being deeply serious and sober or solemn.
winnow,verb,đập,"That evening, Ruth made her way to the threshing floor —a flat, hard-packed area where a number of farmers would take their grain for threshing and winnowing .","Chiều hôm ấy, Ru-tơ đi đến sân đạp lúa, khoảng sân có nền đất cứng, một số nông dân đập và sàng lúa tại đây.","(transitive) To subject (granular material, especially food grain) to a current of air separating heavier and lighter components, as grain from chaff."
touchstone,noun,đá thử vàng,"It was a thin strip of vellum on which was written the secret of the "" Touchstone "" !","Đó là một dải giấy da mỏng trên đó có viết về bí mật của "" Hòn đá thử vàng "" !",A stone used to test the quality of gold alloys.
disaffected,adjective,bất bình,Disaffection in the other republics was met by promises of greater decentralization.,Sự bất bình của những nước cộng hoà khác được thoả mãn bằng các hứa hẹn phi tập trung lớn hơn.,Simple past tense and past participle of disaffect.
encrypt,verb,mã hóa,"By this stage, sending a PGP encrypted message is becoming quite complicated.","Tới giai đoạn này, việc gửi một bức thư mã hóa bằng PGP vẫn còn khá phức tạp.",To conceal information by means of a code or cipher.
peripatetic,adjective,lưu động đi rong,"Strabo mentions a contemporary of his, Athenaeus of Seleucia, a Peripatetic philosopher.","Strabo có nhắc đến người sống cùng thời của mình, Athenaeus thành Seleucia, là một triết gia phái Peripatetic.",tending to walk about
rapprochement,noun,和解,“Malcolm and I have come to a rapprochement of sorts.”,“Malcolm và cháu đã lập một mối quan hệ hữu nghị.”,"The reestablishment of cordial relations, particularly between two countries; a reconciliation."
tranche,noun,phân đoạn,We want to do $ 15 million in swaps on the AA tranche .,Tôi muốn mua 15 triệu hợp đồng hoán đổi cho ngạch AA.,"A slice, section or portion."
convulse,verb,làm chấn động,Gasping and convulsing ...,Thở hổn hển và co giật ...,(transitive) To violently shake or agitate.
delineation,noun,sự mô tả,"Increasingly, the digital economy is intertwined with the traditional economy, making a clear delineation harder.",Kinh tế kỹ thuật số được đan xen với nền kinh tế truyền thống tạo ra một miêu tả rõ ràng hơn.,(art) An image of the outline of an object
eviscerate,verb,moi ruột,He eviscerates Underwood on ICO.,Ông ấy sẽ moi ruột Underwood trong vụ Tổ chức Lãnh thổ Hồi giáo.,"(transitive) To disembowel, to remove the viscera."
idiosyncratic,adjective,do khí chất,Too idiosyncratic .,Quá cá tính .,Peculiar to a specific individual; eccentric.
sanguine,adjective,lạc quan,"How can you, out of all people, be so sanguine after what happened last week?",Sao cô có thể quá lạc quan thế sau chuyện xảy ra tuần trước chứ?,Having the colour of blood; red.
schematic,adjective,lược đồ,You have got to upload that schematic in the next three minutes.,Anh phải tải lược đồ đó lên trong ba phút tới.,A drawing or sketch showing how a system works at an abstract level.
sommelier,noun,,Is the sommelier in?,Có ngài Sommelier trong đó không?,A wine steward. The person at an expensive restaurant who keeps the wine cellar and advises guests on a choice of wines.
unorthodox,adjective,không chính thống,"It's a bit unorthodox , but it's tested.","Hơi không chính thống , nhưng được thử nghiệm rồi.","unusual, unconventional, or idiosyncratic"
effigy,noun,hình nộm,Why is there a clay effigy of me on your coffee table?,Sao lại có hình nộm của tôi trên bàn cà phê vậy?,"a dummy or other crude representation of a person, group or object that is hated."
pillory,verb,bêu riếu,"Oh, trespass, theft, pilfering, littering, pillorying , walking about, playing.","Đột nhập, ăn trộm, móc túi, phá hoại đồ công, hỗn xược , lêu lổng, chọc ghẹo.","A framework on a post, with holes for the hands and head, used as a means of punishment and humiliation."
reciprocity,noun,sự nhân nhượng,"Well, that probably has to do with reciprocity .",Điều này có thể làm được với nguyên tắc tương hỗ.,"the characteristic of being reciprocal, e.g. of a relationship between people"
redoubt,verb,đòn nhỏ,My father isn't using any of the League's ordinary redoubts in the city.,Cha tôi không sử dụng bất kỳ nơi ẩn náu nào của Liên Minh trong thành phố.,"A small, temporary, military fortification."
upbraid,verb,mắng nhiếc,"Clovis upbraided her; but when Chlodomer was born, she insisted on baptising him also.","Clovis đã trách mắng bà; nhưng tới khi Chlodomer chào đời, bà khăng khăng đòi rửa tội cho cậu bé.",(obsolete) The act of reproaching; contumely.
veracity,noun,tính chân thực,The veracity of the responses does not seem to be in doubt .,Tính chân thực của hồi đáp không có vẻ gì là đáng ngờ .,(countable) Something that is true
virulent,adjective,độc,"So, you've got a higher level of virulence .",Bạn đã có mức độ độc tính cao hơn.,"(chiefly medicine)Of a disease or disease-causing agent,highly infectious, malignant, or deadly."
differentiate,verb,phân biệt,We can continue this differential in five minutes.,Chúng ta có thể chẩn đoán phân biệt trong năm phút nữa.,"(transitive) To show, or be the distinction between two things."
gravitate,verb,bị hút,because unconsciously we gravitate toward things,"bởi vì 1 cách vô thức, chúng ta bị hút về những thứ",(intransitive) To move under the force of gravity.
outre,adjective,,"As for television, the public service broadcaster France Télévision operates a local channel, Réseau Outre -Mer 1re, along with France 2, France 3, France 4, France 5, France Ô, France 24 and Arte.","Hãng truyền thông công cộng France Télévision vận hành một kênh truyền hình địa phương mang tên Réseau Outre -Mer 1re, cùng với truyền phát các kênh France 2, France 3, France 4, France 5, France Ô, France 24 và Arte.",Very unconventional.
sanction,verb,hình phạt,Surely your mortal souls are not above Church- sanctioned repentance.,Chắc là linh hồn chết chóc của các ông không phải hối hận trên hình phạt của nhà thờ.,"An approval, by an authority, generally one that makes something valid."
synergistic,adjective,,Its synergistic mixture with thiabendazol was described in US patent 4092422 (1978).,Hỗn hợp của nó với thiabendazol được đăng ký sáng chế số 4092422 (1978).,"Of or pertaining to synergy or synergism; co-operative, working together, interacting, mutually stimulating."
terrain,noun,địa thế,"Fanning out on a wide front, they stealthily glide through the rough terrain .","Phân tán thành một tuyến rộng, chúng kín đáo lẻn qua địa thế gồ ghề.","(geology) A single, distinctive rock formation; an area having a preponderance of a particular rock or group of rocks."
rumination,noun,sự ngẫm nghĩ,"While I play, I ruminate .","Khi tôi chơi, tôi nghiền ngẫm .",The act of ruminating; i.e. chewing cud and other ruminants.
