word,part_of_speech,meaning,example,example_meaning,definition
curator,noun,người phụ trách,"I need to have confidence in my curators , Beth...","Tôi cần phải có lòng tin đối với người phụ trách chương trình, Beth à...","A person who manages, administers or organizes a collection, either independently or employed by a museum, library, archive or zoo."
tribunal,noun,tòa án,I testified against her as a professional witness in a Rwanda war crimes tribunal .,Tôi đã kiểm tra danh sách nhân chứng ở tòa án tội ác chiến tranh ở Rwanda.,an assembly including one or more judges to conduct judicial business; a court of law
concomitant,adjective,trùng nhau,"According to Hindu belief, suffering and evil are concomitants to creation.","Theo tín ngưỡng Ấn Độ giáo, mọi tạo vật đều phải chịu sự đau khổ và sự ác.","Happening at the same time as something else, especially because one thing is related to or causes the other, i.e. concurrent."
pontificate,verb,pontify,"Inaugural Mass of the Pontificate (Vatican video of Pope Francis' papal inauguration on YouTube ""MEISNER, Joachim"".","Truy cập ngày 22 tháng 3 năm 2013. ^ a ă Inaugural Mass of the Pontificate (Vatican video of Pope Francis' papal inauguration trên YouTube ^ Jaffe, Matthew (ngày 19 tháng 3 năm 2013).",The state or term of office of a pontiff or pontifex.
recursive,adjective,tái diễn,recursive function not allowed,Không chấp nhận hàm tự gọi chính mình,"drawing upon itself, referring back."
coruscate,verb,chói lọi,I'm taking these people to Coruscant .,Ta đang đưa những người này đến Coruscant .,To exhibit brilliant technique or style.
savagely,adverb,gay gắt,Partisan groups turned on one another with savage hatred.,"Các phe phái hận thù gay gắt , đấu đá nhau thật man rợ.","In a wild, uncontrolled, or savage manner."
fury,noun,cơn thịnh nộ,I will pour out my fury on them like water.,Ta sẽ đổ cơn thịnh nộ trên bọn chúng như đổ nước.,Extreme anger.
extinguish,verb,dập tắt,"They will be extinguished , snuffed out like a burning wick.”","Chúng sẽ tắt ngấm, bị dập tắt như tim đèn”.","(transitive) to put out, as in fire; to end burning; to quench"
corporeal,adjective,cụ thể,Mabuchi Motor engages in certain specific corporate citizenship activities.,Mabuchi Motor tham gia vào một số hoạt động xã hội cụ thể .,That which is material; tangible; physical.
connotation,noun,nghĩa rộng,"You don't hear them now, because they borrowed from an era that was too steeped in its own connotation .","Các bạn không nghe chúng bây giờ, bởi vì chúng được vay mượn từ một thời đại quá khắt khe theo đúng nghĩa rộng của nó.","A meaning of a word or phrase that is suggested or implied, as opposed to a denotation, or literal meaning. A characteristic of words or phrases, or of the contexts that words and phrases are used in."
swivet,noun,xoắn,,,"(Also swivvet) A state of condition of haste, flutter; extreme discomposure or distress; irritation exasperation annoyance."
corrosive,adjective,gặm mòn,Sin is spiritually corrosive .,Tội lỗi gặm mòn phần thuộc linh.,"Eating away; having the power of gradually wearing, hanging, or destroying the texture or substance of a body; as the corrosive action of an acid."
fallible,adjective,có thể sai lầm,"Because we can never have perfect information, our predictions are inherently fallible .","Bởi vì chúng ta không bao giờ có được thông tin hoàn hảo, nên các dự đoán của chúng ta vốn dĩ luôn có thể sai lầm .",Capable of making mistakes or being wrong.
celibacy,noun,sống độc thân,No Vow of Perpetual Celibacy,Không thề nguyện sống độc thân suốt đời,Abstaining from marriage; the state of being unmarried.
whimsy,verb,whim,So whimsy matters.,Một vấn đề thật kì lạ.,A quaint and fanciful idea. A whim. Playfully odd behaviour.
vet,verb,hiệu đính,"And yet, next week, we launch globally verified, vetted and certified standards for salmon aquaculture.","Chưa hết, tuần sau, chúng tôi đạt được tiêu chuẩn được chứng nhận toàn cầu, hiệu đính và xác nhận cho nuôi trồng cá hồi.",(colloquial) A veterinarian or veterinary surgeon.
artifice,noun,ngón gian xảo,Artifice !,Gian trá .,a crafty but underhanded deception
searing,noun,đốt cháy,I just had Mr Sears on the line.,Tôi vừa có ông Sears gọi đến.,very hot; blistering or boiling
dedicate,adjective,hiến dâng,"Eventually, she dedicated her life to Jehovah and was baptized.","Cuối cùng, cô hiến dâng đời sống cho Đức Giê-hô-va và làm báp têm.",(transitive) To set apart for a deity or for religious purposes; consecrate.
complexity,noun,điều phức tạp,And slightly more complex things appear.,Và những điều phức tạp hơn một chút xúât xuất hiện,(uncountable) The state of being complex; intricacy; entanglement.
diverge,verb,rẽ ra,"Two roads diverged in a wood, and I—","Có hai con đường rẽ ra trong một khu rừng, và tôi—","(intransitive, literally, of lines or paths) To run apart; to separate; to tend into different directions."
solitude,noun,nơi tĩnh mịch,"Hell's brimstone his food, consumed from birth, in solitude .","Địa ngục thiêu hủy thức ăn, thiêu rụi sự sống ở nơi tĩnh mịch .","Aloneness; state of being alone or solitary, by oneself."
deteriorate,verb,xấu đi,Vietnam’s human rights situation deteriorated significantly in 2017.,Tình hình nhân quyền Việt Nam xấu đi đáng kể trong năm 2017.,(transitive) To make worse; to make inferior in quality or value; to impair.
emit,verb,phát hành,"About 86% of the gas released from these structures is methane, with much less carbon dioxide and nitrogen emitted .","Khoảng 86% khí phát hành từ các cấu trúc này là methane, carbon dioxide ít hơn nhiều và nitơ phát ra.",(transitive) To send out or give off.
excel,verb,trội hơn,(Romans 12:6) Different brothers excel in different areas.,"(Rô-ma 12:6) Trong nhiều khía cạnh, có những anh trội hơn người khác.",(transitive) To surpass someone or something; to be better or do better than someone or something.
sabotage,verb,phá hoại,If we're gonna sabotage Division that's one of the veins I'm gonna need you to tap.,Muốn phá hoại được Division phòng đó là một trong những mạch chính em cần xâm nhập.,"A deliberate action aimed at weakening an enemy through subversion, obstruction, disruption, and/or destruction."
apparent,adjective,biểu kiến,"It has an apparent magnitude of +2.05, making it readily visible to the naked eye.","Nó có cấp sao biểu kiến +2.05, và dễ dàng thấy được bằng mắt thường.","Capable of being seen, or easily seen; open to view; visible to the eye; within sight or view."
flammable,adjective,dễ cháy,It's flammable .,Dễ cháy lắm.,"Capable of burning, especially a liquid."
exempt,verb,miễn,"This was not only due to the country's backwards economy, but also because the nobility were tax- exempt and free from the expense of waging wars, not only the great ones, but the smaller campaigns in the Caucasus.","Điều này không chỉ do nền kinh tế lạc hậu của đất nước, mà còn bởi vì tầng lớp quý tộc được miễn thuế và không phải chịu chi phí cho chiến tranh, không chỉ các cuộc chiến tranh vĩ đại, mà còn là các chiến dịch nhỏ hơn ở Caucasus.",One who has been released from something.
priority,noun,quyền ưu tiên,This job gets top priority at all times.,Công việc này có quyền ưu tiên tối cao.,"Prior or antecedent in time, or preceding something else; as, priority application."
recurring,adjective,có định kỳ,"She also had recurring roles on Sister, Sister, Party of Five, and Boy Meets World.","Cô cũng có các vai diễn có định kỳ trong Sister, Sister; Party of Five; và Boy Meets World.",Present participle of recur.
stable,adjective,ổn định,The current stable release is openSUSE Leap 15.0.,Bản phát hành ổn định hiện tại là openSUSE Leap 15.0.,"A building, wing or dependency set apart and adapted for lodging and feeding (and training) animals with hoofs, especially horses"
viewpoint,noun,quan điểm,The woman summoned all her courage and explained her Bible-based viewpoint to her partner.,Bà thu hết can đảm giải thích cho ông ấy quan điểm của bà dựa trên Kinh Thánh.,"The position from which something is observed or considered; an angle, outlook or point of view"
ascendant,adjective,có uy thế,"Over the span of several centuries, however, various factors gradually led to the ascendancy of the codex.","Tuy nhiên, trong nhiều thế kỷ, một số yếu tố đã khiến sách chép tay dần dần có uy thế hơn.","Rising, moving upward."
gerrymander,verb,gerrymander,"As The Independent newspaper put it, sleaze covers “everything from love affairs and local government gerrymandering to kickbacks on big export orders.”",Tờ báo The Independent nói rằng sự nhơ nhuốc ảnh hưởng đến “mọi phương diện từ việc ái tình vụng trộm và việc chính quyền địa phương gian lận đến việc ăn hối lộ trong những chuyến hàng xuất cảng lớn”.,"(transitive, pejorative) To divide a geographic area into voting districts in such a way as to give an unfair advantage to one party in an election."
appendage,noun,phần phụ,"Typically, each body segment carries one pair of appendages .","Thông thường, mỗi khúc cơ thể đều mang một cặp phần phụ .",an external body part that projects from the body
affiliation,noun,liên kết,The Soka Gakkai International comprises a global network of affiliated organizations.,Soka Gakkai International bao gồm một mạng lưới các tổ chức liên kết toàn cầu.,The relationship resulting from affiliating one thing with another.
skewed,adjective,nghiêng,All to gather skewed data from a house full of sexual invalids.,Tất cả vì mớ dữ liệu khập khiễng từ một ngôi nhà đầy ắp bệnh qua đường tình dục.,Twisted at an angle.
scathing,adjective,nghiêm khắc,Franklin wrote a scathing attack against the racial prejudice of the Paxton Boys.,Franklin đã nghiêm khắc lên án thành kiến chủng tộc của nhóm Paxton Boys.,harmful or painful; acerbic
sobering,adjective,tỉnh táo,Stay sober .,Ráng tỉnh táo nghe .,Describing something that causes more sober thought or concern.
deficit,noun,Thâm hụt ngân sách,A budget deficit will occur because of a revenue shortfall.,Thâm hụt ngân sách sẽ xảy ra do sự sụ giảm doanh thu.,Deficiency in amount or quality; a falling short; lack.
voucher,verb,biên lai,"For companies that do not operate a cafeteria, it is mandatory for white-collar workers to be given lunch vouchers as part of their employee benefits.","Với công ty mà không có căng tin, công nhân cổ cồn trắng bắt buộc phải được cung cấp biên lai bữa trưa như là một phần lợi ích của họ.",(transitive) To establish the authenticity of; to vouch for.
paralegal,noun,trợ lý pháp lý,The paralegal ?,Cô trợ lý hả?,"(law) One who assists a lawyer in their routine work but who is without the qualified status of a solicitor or barrister (England and Wales), attorney (U.S.), or advocate; known more commonly in the U.S. as a legal assistant."
hallmark,verb,dấu hiệu nhận biết,"Tanner, the hallmark of a sociopath is a lack of empathy.","Tanner, dấu hiệu nhận biết một kẻ điên là sự thiếu đồng cảm.",To provide or stamp with a hallmark
parity,noun,tính chẵn lẻ,The concept of parity is used for making groups of two objects.,Khái niệm tính chẵn lẻ được dùng để tạo các nhóm chứa hai đồ vật.,(uncountable) Equality; comparability of strength or intensity.
curious,adjective,tò mò,Really want to curious is dead.,Thực sự muốn tò mò là chết.,"(obsolete) Fastidious, particular; demanding a high standard of excellence, difficult to satisfy."
endodontist,noun,bác sĩ nội nha,,,"One who specializes in endodontics, a specialty of dentistry."
permanent,adjective,vĩnh cửu,On God’s part this covenant is permanent .,"Về phần Đức Chúa Trời, giao ước này là vĩnh cửu .","Without end, eternal."
temporary,adjective,tạm thời,It affords us a temporary channel of communication with the outside world.,Nó cho chúng ta một kênh tạm thời để giao tiếp với thế giới bên ngoài.,"For a limited time, ephemeral, not constant; transient"
cosmetic,adjective,trang điểm,And do n't use cosmetics if you have an eye infection like pinkeye .,Và cũng chớ nên trang điểm nếu bị nhiễm trùng mắt như bị bệnh đau mắt đỏ chẳng hạn .,External or superficial; pertaining only to the surface or appearance of something.
reality,noun,thực tế,Don't talk down to me about realities .,Đừng lên giọng với tôi về thực tế .,The state of being actual or real.
gauze,verb,gạc,"Immediately after circumcision , the tip of the penis is usually covered with gauze coated with petroleum jelly to keep the wound from sticking to the diaper .","Ngay sau khi cắt bao quy đầu , đầu dương vật thường được quấn bằng một miếng gạc có bôi một chút mỡ trơn để vết thương không dính vào tã lót .",To apply a dressing of gauze
embarrassing,adjective,làm lúng túng,This embarrassing but fairly mild treatment silenced him.,Điều này làm lúng túng nhưng khá nhẹ điều trị im lặng anh ta.,Present participle of embarrass.
puberty,noun,tuổi dậy thì,Body hair really gets going during puberty .,Ở tuổi dậy thì thì lông trên cơ thể thực sự bắt đầu mọc nhiều hơn .,the age at which a person is first capable of sexual reproduction
accordingly,adverb,do đó,"Accordingly , the Bible admonishes Christians: “Do not severely criticize an older man.”","Do đó , Kinh Thánh khuyên tín đồ Đấng Christ: “Chớ quở nặng người già-cả”.",(manner) Agreeably; correspondingly; suitably; in a manner conformable.
disgust,verb,ghê tởm,"Disgusting , isn't it?","Ghê tởm quá, phải không?",To cause an intense dislike for something.
periodontist,noun,nha sĩ nha khoa,,,A dentist whose speciality is periodontics
acute angle,noun,góc nhọn,"You start by teaching angles -- an acute angle , a right angle, an obtuse angle, a straight angle.","Bạn bắt đầu bằng việc dạy các góc -- góc nhọn , góc vuông, góc tù, góc bẹt.",An angle measuring less than ninety degrees.
angle,noun,góc,"In highly branched alkanes, the bond angle may differ significantly from the optimal value (109.5°) in order to allow the different groups sufficient space.","Trong các ankan mạch nhánh lớn thì các góc liên kết có thể khác đáng kể so với giá trị tối ưu (109,5°) để đảm bảo cho các nhóm khác có đủ không gian cần thiết.","(snooker) To leave the cue ball in the jaws of a pocket such that the surround of the pocket (the ""angle"") blocks the path from cue ball to object ball."
area,noun,khu vực,"It originated from the area surrounding the Mediterranean Sea, but gradually moved north.","It originated từ khu vực xung quanh Địa Trung Hải, but gradually moved north.","(mathematics) A measure of the extent of a planar region, or of the surface of a solid; it is measured in square units"
circle,noun,đường tròn,So a trigonometric milliradian is just under 1/6283 of a circle .,Vì vậy 1 milliradian lượng giác xấp xỉ 1⁄6283 đường tròn .,"(geometry): A two-dimensional geometric figure, a line, consisting of the set of all those points in a plane that are equally distant from another point."
clockwise,adjective,theo chiều kim đồng hồ,& Rotate Image Clockwise,& Quay ảnh theo chiều kim đồng hồ,"(of movement) In a circular fashion so as to be moving to the right at the top of the circle and to the left at the bottom, in the way that the hands of an analogue/analog clock move."
complementary angles,noun,góc bổ sung,So we can also say that angle DBA and angles ABC are complementary .,Chúng ta cũng có thể nói là góc DBA và góc ABC phụ nhau,(geometry) A pair of angles that sum to a right angle.
cone,noun,hình nón,"Like its neighbouring island, Tidore, Ternate is a visually dramatic cone -shape.","Cũng giống như hòn đảo Tidore lân cận, Ternate là một đảo có hình nón .",(geometry) A surface of revolution formed by rotating a segment of a line around another line that intersects the first line.
congruent,adjective,đồng dư,"If p is a Sophie Germain prime greater than 3, then p must be congruent to 2 mod 3.",Nếu p là một số nguyên tố Sophie Germain lớn hơn 3 thì p phải đồng dư với 2 (mod 3).,Corresponding in character.
degree,noun,độ,"It goes down to 15 degrees centigrade from 35, and comes out of this perfectly fine.","Giảm xuống từ 35 độ C còn 15 độ C, và thoát khỏi nó hoàn toàn ổn.",(obsolete except heraldry) A step on a set of stairs; the rung of a ladder. [from 13th c.]
diameter,noun,đường kính,The average fiber diameter is 22.99 in ewes and 23.51 in ram.,"Đường kính sợi trung bình là 22,99 ở cừu cái và 23,51 ở cừu đực.",(geometry) Any straight line between two points on the circumference of a circle that passes through the centre/center of the circle.
dimension,verb,cỡ,"Naturally, with a story of these dimensions .","Tự nhiên thôi, với một câu chuyện tầm cỡ như vậy.",A single aspect of a given thing.
equilateral triangle,noun,tam giác đều,This is an equilateral triangle .,Đây là một tam giác đều .,(geometry) A triangle having all three sides equal.
exterior angle,noun,góc bên ngoài,"It’s helpful to take advantage of natural light, try shots from different angles before uploading the best options, and zoom out enough to capture the entirety of a subject, like a horizontal photo that shows the full exterior of a building, or a restaurant dish shot from above.","Có thể hữu ích khi tận dụng ánh sáng tự nhiên, thử chụp từ các góc độ khác nhau trước khi tải lên lựa chọn tốt nhất và phóng đủ to để nắm bắt toàn bộ chủ đề, như ảnh ngang hiển thị toàn bộ bề ngoài của một tòa nhà hoặc một món ăn nhà hàng được chụp từ phía trên.",(geometry) An angle formed between one side of a polygon and an extension of an adjacent side.
face,verb,đương đầu,Let them explain the obstacles they face in their Christian ministry.,Hãy để họ giải thích những trở ngại họ phải đương đầu trong thánh chức đạo Đấng Christ.,"(anatomy) The front part of the head, featuring the eyes, nose, and mouth and the surrounding area."
formula,noun,công thức,The divine formula called for a fourfold aromatic mixture.,Đức Chúa Trời dặn phải dùng bốn loại hương trong công thức hòa hương.,(mathematics) Any mathematical rule expressed symbolically.
height,noun,chiều cao,Height is dependent on the device’s current orientation.,Chiều cao phụ thuộc vào hướng hiện tại của thiết bị.,The distance from the base of something to the top.
hexagon,noun,hình lục giác,"Instead of expanding circles, they're expanding hexagons .","Thay vì mở ra theo hình tròn, chúng sẽ tạo thành hình lục giác .",A polygon with six sides and six angles.
hypotenuse,noun,cạnh huyền,(Video) Salman Khan: So the hypotenuse is now going to be five.,(Video) Salman Khan: Vậy cạnh huyền là năm.,(geometry) The side of a right triangle opposite the right angle.
interior angle,noun,góc bên trong,"Interiors were created in 3D modeling software, which had the benefit of capturing angles impossible with cameras.","Phần nội tâm được tạo bằng phần mềm mô hình 3D, nó có lợi trong việc chụp được những góc quay khó mà máy ảnh không thể thu lại được.",(geometry) The inner angle between two sides of a polygon.
intersect,verb,cắt ngang nhau,At no point on this graph can I draw a vertical line and it intersects it twice.,Ngay không điểm trên cái biểu đồ Tôi có thể vẽ một đường thẳng đứng và nó cắt ngang nhau hai lần.,to cross; to cut
isosceles,adjective,đồng cánh,"This becomes an isosceles triangle -- again, very shaky.","Cái này trở thành tam giác cân -- một lần nữa, rất linh động.","(geometry) Having two sides of equal length, used especially of an isosceles triangle."
parallelogram,noun,hình bình hành,"You give it a push, this becomes a parallelogram .",Hay đẩy nó vào tạo thành một hình bình hành .,(geometry) A convex quadrilateral in which each pair of opposite edges are parallel and of equal length.
perpendicular,adjective,thẳng góc,be perpendicular,Đứng thẳng !,(geometry) At or forming a right angle (to).
pi,adjective,pi,"Lord Pi , a renegade monk, learned whoever controlled the Golden Nectar could gain immortality.","Chúa tể Pi , một tu sĩ cải đạo, biết rằng... bất cứ ai kiểm soát được Kim Tửu có thể bất tử.",The name of the sixteenth letter of the Classical and Modern Greek alphabets and the seventeenth in Old Greek.
plane section,noun,phần mặt phẳng,The first section of the task group launched planes to land on Okinawa on 7 April 1945.,Đợt thứ nhất của đội đặc nhiệm cho phóng máy bay lên để hạ cánh xuống Okinawa vào ngày 7 tháng 4.,(geometry) the area created by a plane cutting through a solid
point,verb,trỏ,"The default behavior in KDE is to select and activate icons with a single click of the left button on your pointing device. This behavior is consistent with what you would expect when you click links in most web browsers. If you would prefer to select with a single click, and activate with a double click, check this option","Cư xử mặc định của KDE là chọn và kích hoạt biểu tượng bằng một cú nhắp nút bên trái trên thiết bị trỏ . Cư xử này khớp điều khi bạn nhắp vào liên kết trong bộ duyệt Mạng. Nếu bạn muốn chon bằng nhắp đơn, và kích hoạt bằng nhắp đôi, hãy bật tùy chọn này",(intransitive) To extend the index finger in the direction of something in order to show where it is or to draw attention to it.
polygon,noun,đa giác,Setup Polygon Screen Saver,Cài đặt Ảnh bảo vệ Màn hình Đa giác,(geometry) A plane figure bounded by straight edges.
prism,noun,lăng kính,I am a prism .,Tôi là một lăng kính .,"(geometry) A polyhedron with parallel ends of the same size and shape, the other faces being parallelogram-shaped sides."
protractor,noun,thước đo góc,,,A circular or semicircular tool for drawing or measuring angles.
pyramid,noun,kim tự tháp,This pyramid is designed to provide an ambience for meditation to happen.,Kim tự tháp này được thiết kế để cung cấp môi trường cho thiền xảy ra.,"An ancient massive construction with a square or rectangular base and four triangular sides meeting in an apex, such as those built as tombs in Egypt or as bases for temples in Mesoamerica."
quadrant,noun,cung phần tư,"Well, then, send Necrocraft to every corner of the quadrant .",Vậy thì cho tàu Necrocraft đi khắp mọi ngóc ngách của cung phần tư này.,One of the four sections made by dividing an area with two perpendicular lines.
quadrilateral,adjective,tứ giác,"When p = 1 + i and q = (1 + i)/2, then the quadrilateral is square.","Nếu p = 1 + i và q = (1 + i)/2, thì tứ giác đó là hình vuông.",a polygon having four sides.
radius,noun,bán kính,So it must be beyond that radius .,Chắc phải xa hơn bán kính này.,"(anatomy) The long bone in the forearm, on the side of the thumb."
ray,noun,tia,"He, Emilio G. Segrè (1905–1989) who discovered the elements technetium and astatine, and the antiproton), Bruno Rossi (1905–1993) a pioneer in Cosmic Rays and X- ray astronomy) and a number of Italian physicists were forced to leave Italy in the 1930s by Fascist laws against Jews,.","Ông cùng với Emilio G. Segrè (1905–89, khám phá các nguyên tố tecneti và astatin, và phản proton), Bruno Rossi (1905–93, tiên phong trong bức xạ vũ trụ và thiên văn học tia X) và một số nhà vật lý học Ý bị buộc phải rời khỏi Ý trong thập niên 1930 do các đạo luật phát xít chống người Do Thái.",A beam of light or radiation.
right angle,noun,góc vuông,"Let ABC represent a right triangle, with the right angle located at C, as shown on the figure.","Gọi ABC là một tam giác vuông , với góc vuông nằm tại đỉnh C, như ở hình bên.",(geometry) An angle of 90 degrees; the bisect of the angle formed by a single straight line.
origin,noun,nguồn gốc,Kalinin was one of comparatively few members of Stalin's inner circle springing from peasant origins .,Kalinin là một trong số ít thành viên thuộc phe Stalin xuất thân từ nguồn gốc nông dân.,The beginning of something.
