word,part_of_speech,meaning,example,example_meaning,definition
beatification,noun,sự ban phúc lành,"""Rani Maria's beatification on November 4?"".",Truy cập ngày 5 tháng 7 năm 2017 . ^ “Rani Maria's beatification on November 4?”.,"The act of beatifying, or the state of being beatified; esp., in the Roman Catholic Church, the act or process of ascertaining and declaring that a deceased person is one of ""the blessed,"" or has attained the second degree of sanctity, — usually a stage in the process of canonization."
epistemology,noun,nhận thức luận,Russell's epistemology went through many phases.,Nhận thức luận của Russell trải qua nhiều giai đoạn.,"(uncountable) The branch of philosophy dealing with the study of knowledge; theory of knowledge, asking such questions as ""What is knowledge?"", ""How is knowledge acquired?"", ""What do people know?"", ""How do we know what we know?""."
ethnocentric,adjective,vị chủng,Cultural relativism was in part a response to Western ethnocentrism .,Thuyết văn hóa tương đối là một phần trong một phản ứng với chủ nghĩa vị chủng phương Tây.,Of or pertaining to ethnocentrism.
etiology,noun,khoa nguyên nhân bệnh,"No tumors, no cysts, no clear etiology .","Không khối u, không u nang hay nguyên nhân gì rõ ràng cả.",Alternative spelling of aetiology.
impermeable,adjective,không thấm nước,"The seeds are small, with a hard, water- impermeable coating, weighing around 1 mg.","Các hạt nhỏ, với lớp vỏ cứng không thấm nước , nặng khoảng 1 mg.",impossible to permeate
ineluctable,adjective,không thể tránh khỏi,To expand the boundaries of our ineluctable power!,Để mở rộng hơn nữa sức mạnh không thể tránh khỏi của chúng ta,"Impossible to avoid or escape; inescapable, irresistible."
insularity,noun,đảo,"To the south is Phang Nga Bay, with the insular district Ko Yao.","Về phía nam là vịnh Phang Nga, và huyện đảo Ko Yao.",The quality or property of being insular.
comeuppance,noun,sự mắng mỏ,A plenty of people think he's got a comeuppance coming.,Có rất nhiều người ở đây nghĩ là ổng sẽ lãnh hậu quả.,An outcome which is justly deserved (and invariably unpleasant).
forthright,adjective,thẳng thắn,"A real man is honest and forthright , and trustworthy.","Một người đàn ông thực sự thì thẳng thắn , thật thà, và đáng tin cậy.",straightforward; not evasive; characterized by candor and directness
tacit,adjective,ngầm,"In 1919, the two founders split and Nakajima bought out Nihon Aircraft's factory with tacit help from the Imperial Japanese Army.","Năm 1919, hai nhà sáng lập tách ra và Nakajima mua lại nhà máy của Nihon Hikoki với sự giúp đỡ ngầm của Lục quân Đế quốc Nhật.","Done or made in silence; implied, but not expressed; silent; as, tacit consent is consent by silence, or by not interposing an objection."
gentility,noun,dòng dõi trâm anh,The Gentiles .,Dân Ngoại .,"(uncountable) The state of being elegant, genteel, having good breeding, or being socially superior."
imprimatur,noun,giấy phép cho in,"And it was really her strength, I believe, that became the kind of mudra and imprimatur that has been a guiding light in my life.","Và thực sự chính là sức mạnh của cô, tôi tin như vậy, đã phát triển thành một thứ lực hấp dẫn soi sáng chỉ đường cho cuộc đời tôi.","An official license to publish or print something, especially when censorship applies."
rationalization,noun,sự hợp lý hoá,Just K rations .,Chỉ là lương khô .,"The process, or result of rationalizing."
cronyism,noun,tình bạn,Critics of President Déby have accused him of cronyism and tribalism.,Những người chỉ trích Tổng thống Déby cáo buộc ông nhậm dụng thân tín và bộ lạc chủ nghĩa.,"favoritism to friends without regard for their qualifications, especially by appointing them to political positions."
tort,adjective,việc làm có hại,Among the cakes with the longest tradition is the Linzer torte .,Trong số những bánh ngọt loại có truyền thống lâu đời nhất là Linzer torte .,"Tart, sharp."
mitigation,noun,giảm nhẹ,Such mitigation strategies have already been implemented at some sites.,Các chiến lược giảm nhẹ như vậy đã được thực hiện tại một số địa điểm.,relief; alleviation
extricate,verb,giải thoát,I'm offering you a chance to extricate yourself.,Tôi cho ông một cơ hội để giải thoát mình.,"(transitive) To free, disengage, loosen, or untangle."
claustrophobic,adjective,sợ khoá,Claustrophobic ?,Có sợ lắm không?,(psychology) Suffering from claustrophobia; being scared of being enclosed in a confined space.
domineering,adjective,hống hách,"What do you think, bossy and domineering ?","Cô nghĩ sao, đồ hống hách và bạo ngược?",Present participle of domineer.
torrid,adjective,bức,"The diversity in altitude, climate, and soil allows for a wide variety of trees, shrubs, and other plants—including some that thrive in the cold alpine regions, others that grow in the torrid desert, and still others that flourish on the alluvial plain or the rocky plateau.","Nhờ có độ cao, khí hậu, và đất đai khác nhau nên vùng đất này thích hợp cho rất nhiều loại cây, bụi rậm và các thực vật khác—kể cả những cây mọc tươi tốt trên các vùng núi lạnh, một số khác mọc trong sa mạc nóng bức , và các loại khác nữa cũng mọc um tùm trong đồng bằng phù sa hay trên cao nguyên đá sỏi.",Very hot and dry.
fleece,noun,tuyết,"Voice: Mary had a little lamb whose fleece was white as snow, and everywhere that Mary went, that lamb was sure to go.","Tiếng nói: Mary đã có một chú cừu nhỏ có lông trắng như tuyết , và bất kì đâu Mary tới, chú cừu chắc chắn sẽ theo sau.",(uncountable) Hair or wool of a sheep or similar animal
reflective,adjective,phản xạ,Reflection .,Phản xạ .,"Something which reflects, or redirects back to the source."
nib,noun,ngòi bút,"The Greeks used reeds for cannulas, we use my pen nibs .",chúng ta dùng ngòi bút .,The tip of a pen or tool that touches the surface.
zeppelin,noun,khí cầu zeppelin,"May 2 – Eight German Zeppelins raid the east coast of England, causing 39 casualties.","2 tháng 5 - 8 khí cầu Zeppelin của Đức tấn công bờ biển phía đông của Anh, gây ra 39 thương vong.",A type of large German dirigible airship of the early 20th century; designed to carry passengers or bombs
extremism,noun,chủ nghĩa cực đoan,Third of all: extremism .,Thứ ba: Chủ nghĩa cực đoan .,extreme ideas or actions
busk,verb,Busk,"Douglas Busk , a British mountaineer, climbed Alam-Kuh via the east ridge in 1933 and again in 1934 from over the west ridge.","Douglas Busk , một người leo núi người Anh, leo lên Alam-Kuh qua sườn núi phía đông năm 1933 và một lần nữa vào năm 1934 từ phía sườn phía tây .","A strip of metal, whalebone, wood, or other material, worn in the front of a corset to stiffen it."
brawny,adjective,rắn chắc,"They were nearly all whalemen; chief mates, and second mates, and third mates, and sea carpenters, and sea coopers, and sea blacksmiths, and harpooneers, and ship keepers; a brown and brawny company, with bosky beards; an unshorn, shaggy set, all wearing monkey jackets for morning gowns.","Họ gần như tất cả các whalemen, bạn tình trưởng, và bạn tình thứ hai, và bạn tình thứ ba, và biển thợ mộc, và Coopers biển, và các thợ rèn biển, và harpooneers, và tàu thủ, một công ty nâu và rắn chắc , với nhiều cây râu, một thiết lập, không có hớt lông xù xì, tất cả các áo khoác khỉ mặc áo sáng.",Characterized by brawn; muscular; strong.
accomplice,noun,kẻ tòng phạm,"And as far as the authorities are concerned, you're an accomplice .","Và theo như nhà chức trách nghĩ, mày là kẻ tòng phạm .",(rare) A cooperator.
anteroom,noun,phòng chờ,I'll be right outside in the anteroom should you need me.,Thần ở ngay bên ngoài trong phòng chờ nếu ngài có cần chi.,"A room before, or forming an entrance to, another; a waiting room."
budge,verb,chuyển,We're not gonna be able to budge it.,Ta không thể lay chuyển nó được.,(intransitive) To move.
religious,adjective,sùng đạo,He's about as religious as a hog.,Hắn sùng đạo như một con heo.,Concerning religion.
roommate,noun,bạn cùng phòng,And there I lived in a collapsing apartment building in Harlem with roommates .,Và tôi sống ở đó trong một căn hộ sắp sập ở Harlem với vài bạn cùng phòng .,"A person with whom one shares a room, as at university etc."
sacrificial,adjective,dùng để cúng tế,It was a truly sacrificial love.,Đó thật là một tình yêu thương đầy hy sinh .,Relating to sacrifice
vitamin,noun,vitamin,"But if you give people vitamin D supplements, you don't change that high rate of heart disease.","Nhưng nếu bạn cung cấp cho mọi người nguồn bổ sung vitamin D, bạn không thay đổi tỷ lệ bệnh tim cao đó.","Any of a specific group of organic compounds essential in small quantities for healthy human growth, metabolism, development, and body function; found in minute amounts in plant and animal foods or sometimes produced synthetically; deficiencies of specific vitamins produce specific disorders."
appliance,noun,thiết bị,Cisco-General appliance,Cisco- Thiết bị chung chungStencils,The act of applying; application.
criticism,noun,sự phê bình,This thinking is a product of higher criticism .,Lối suy nghĩ đó là hậu quả của sự phê bình Kinh-thánh.,The act of criticising; a critical judgment passed or expressed; a critical observation or detailed examination and review; a critique; animadversion; censure.
formation,noun,sự hình thành,"The thermodynamic principles of formation , however, are the same.","Tuy nhiên, các nguyên lý nhiệt động lực học của sự hình thành là giống như nhau.",Something possessing structure or form.
necessity,noun,sự cần thiết,Golda abhorred the necessity that was imposed on us to carry out the operations.,"""Golda ghê tởm sự cần thiết khiến chúng tôi phải tiến hành những chiến dịch đó.","The quality or state of being necessary, unavoidable, or absolutely requisite; inevitableness; indispensableness."
obesity,noun,béo phì,What has obesity as a symptom?,Bệnh gì có triệu chứng là béo phì ?,the state of being obese due to an excess of body fat
burglary,noun,ăn trộm bẻ khoá,During our own burglary ?,Trong lúc đột nhập ?,"The crime of breaking into a vehicle, house, store, or other enclosure with the intent to steal."
colonel,noun,đại tá,"Yes, well, we've heard about their ability as soldiers from Colonel Breed.","Phải, chúng tôi đã nghe Đại tá Breed nói về khả năng của họ.","A commissioned officer in the army, air force, or marine corps. In U.S. military, it ranks above a lieutenant colonel and below a brigadier general."
cylinder,noun,hình trụ,"The volume is 4/3πr3 for the sphere, and 2πr3 for the cylinder .","Thể tích là 4⁄3πr3 với hình cầu, và 2πr3 với hình trụ .",(geometry) A surface created by projecting a closed two-dimensional curve along an axis intersecting the plane of the curve.
brilliance,noun,sự rực rỡ,"Now, the American health care system has more than its fair share of dysfunction -- to match its brilliance , to be sure.","Hiện nay, hệ thống y tế của Mỹ có quá nhiều lỗ hỏng để tương xứng với sự rực rỡ của nó, chắc chắn.",The quality of being exceptionally effulgent (giving off light).
dialogue,noun,đối thoại,I look forward to a very productive dialogue .,Hi vọng chúng ta sẽ có một buổi đối thoại hiệu quả.,A conversation or other form of discourse between two or more individuals.
escalator,noun,thang cuốn,The building has 57 elevators and 8 escalators .,Tòa nhà có 57 thang máy và 8 thang cuốn .,An upward or progressive course.
negligence,noun,cẩu thả,How many more must die because of your negligence ?,Còn bao nhiêu người nữa phải chết vì sự cẩu thả của anh?,The state of being negligent
rehearsal,noun,sự diễn tập,"I think I've heard this, in my kind of pop psychological understanding of play, that somehow, the way animals and humans deal with play, is that it's some sort of rehearsal for adult activity.","Tôi nghĩ tôi biết điều này, trong kiến thức tâm lý bình dân về trò chơi, nói cách khác, cách mà động vật và con người trao đổi trong các trò chơi, là giống như một sự diễn tập cho các hoạt động trưởng thành.","the practicing of something which is to be performed before an audience, usually to test or improve the interaction between several participating people, or to allow technical adjustments with respect to staging to be done"
acoustics,noun,âm học,"We studied the acoustics with laser stuff, and they bounce them off this and see where it all works.","Chúng tôi nghiên cứu âm học với tia lase, và chúng bật khỏi cái này và xem nó sẽ có tác dụng tối ưu ở đâu.",The physical quality of a space for performing music.
dominance,noun,chiếm ưu thế,Coniferous forests only dominate in the Borjomi Gorge and in the extreme western areas.,Những cánh rừng tùng bách chỉ chiếm ưu thế tại Borjomi Gorge và các vùng cực tây.,The state of being dominant; of prime importance; supremacy.
excessive,adjective,quá mức,Is excessive exploitation of resources threatening the lives of every species?,Liệu sự khai thác quá mức có đang đe doạ cuộc sống các loài?,Exceeding the usual bounds of something; extravagant; immoderate.
bachelor,noun,cử nhân,"She attended University of Cape Town in 1975, receiving a bachelor's degree.","Bà theo học Đại học Cape Town năm 1975, nhận bằng Cử nhân .",The first or lowest academical degree conferred by universities and colleges; a bachelor's degree.
correlation,noun,sự tương quan,And what we found was that indeed there was a correlation .,Và điều chúng tôi phát hiện ra là trong đó tồn tại một sự tương quan,"A reciprocal, parallel or complementary relationship between two or more comparable objects"
inconvenience,verb,sự bất tiện,A Marriage of Inconvenience : Persecution of Ruth and Seretse Khama.,"""Một cuộc Hôn nhân của sự bất Tiện , Sự bắt bớ của Ruth và Seretse Khama"".",The quality of being inconvenient.
procrastinate,verb,trì hoãn,Most of us do not procrastinate consciously.,"Hầu hết chúng ta không trì hoãn , lần lữa một cách có ý thức.",(intransitive) To put off; to delay taking action; to wait until later.
psychiatrist,noun,bác sĩ tâm thần,"Uh, psychiatrist , yeah.","Phải, bác sĩ tâm thần học.",(medicine) A medical doctor specializing in psychiatry.
acquittal,noun,sự tha bổng,The acquittal of Esterhazy therefore brought about a change of strategy for the Dreyfusards.,Sự tha bổng Esterházy do đó dẫn đến một sư thay đổi trong chiến lược bảo vệ Dreyfus.,The act of acquitting; discharge from debt or obligation; acquittance.
antidote,verb,thuốc giải độc,"Now, there's an antidote to commoditization, and that is customization.","Nào, có một loại thuốc giải độc cho hàng hóa chính là tùy biến.","A remedy to counteract the effects of poison (often followed by ""against,"" ""for,"" or ""to"")."
embargo,verb,cấm vận,This declaration is the equivalent of a trade embargo .,Tuyên bố này tương đương với một lệnh cấm vận thương mại.,An order by the government prohibiting ships from leaving port.
hazardous,adjective,mạo hiểm,"Risky, yes, but it's a hazard of a profession.","Mạo hiểm , vâng, nhưng nó là rủi ro nghề nghiệp.",exposing to loss or evil
longevity,noun,sống lâu,"We overestimate our longevity , our career prospects.","Chúng ta đánh giá quá cao việc sống lâu , hay viễn cảnh sự nghiệp trong tương lai.","The quality of being long-lasting, especially of life"
melodious,adjective,du dương,Thanksgiving and melodious song.,Lời tạ ơn và bài hát du dương .,Having a pleasant melody or sound; tuneful.
scandalize,verb adverb,lại,"LOS ANGELES – Michael Jackson , the "" King of Pop "" who once moonwalked above the music world , died Thursday as he prepared for a comeback bid to vanquish nightmare years of sexual scandal and financial calamity .","Los Angeles - Michael Jackson , "" Vua nhạc Pop "" từng trình diễn nhảy bước lùi trong thế giới âm nhạc , chết thứ Năm như anh ấy được chuẩn bị cho nỗ lực trở lại để vượt qua những năm tháng ác mộng bị xì-căng-đan tình dục và khó khăn lớn về tài chính .",To shock someone.
chandelier,noun,đèn chùm,"Oh, the supports for the big Murano chandelier .","À, các kết cấu của đèn chùm Murano.","A branched, often ornate, lighting fixture suspended from the ceiling"
luncheon,verb,tiệc trưa,He said he was at a luncheon meeting.,Cậu ta nói cậu ta đã ở một buổi tiệc trưa .,A formal meal served in the middle of the day.
qualitative,noun,định tính,Qualitative Analysis : What Makes A Company Great ?,Phân tích định tính : Điều gì làm cho một công ty trở nên có uy thế ?,of descriptions or distinctions based on some quality rather than on some quantity
undernourished,adjective,thiếu dinh dưỡng,▪ More than 200 million children are undernourished .,▪ Hơn 200 triệu trẻ em đang thiếu ăn .,Provided with insufficient nourishment to sustain proper health and growth.
disbursement,noun,sự chi tiêu,TARP funds were never disbursed for this subprogram.,Tuy nhiên nguồn vốn không bao giờ được phân bổ cho dự án này.,"The act, instance, or process of disbursing, which is the present participle of disburse."
fungible,adjective,có thể thay thế,Most investors prefer their money to be in cash than in less fungible investments.,Hầu hết các nhà đầu tư thích tiền của họ ở dạng tiền mặt hơn là nằm trong các đầu tư ít khả năng thay thế hơn.,(finance and commerce) Able to be substituted for something of equal value or utility; interchangeable.
parliament,noun,nghị viện,All ordinary statutes enacted by Parliament must be consistent with the Constitution.,Mọi điều luật thông thường được Nghị viện ban hành phải tương thích với Hiến pháp.,An institution whose elected or appointed members meet to debate the major political issues of the day and usually to exercise legislative powers and sometimes judicial powers.
unconscious,adjective,bất tỉnh,This guy was found unconscious at the first scene.,Và anh chàng này đã được tìm thấy bất tỉnh tại hiện trường đầu tiên.,(sports) engaged in skilled performance without conscious control.
unenforceable,adjective,không thể thực thi,"However, these anti-discrimination laws remain largely unenforced .","Tuy nhiên, các luật chống phân biệt đối xử này phần lớn vẫn chưa được ban hành .",Resistant to enforcement.
emancipate,verb,giải phóng,The emancipation of the serfs took place in Courland in 1817 and in Vidzeme in 1819.,Giai cấp nông nô chính thức được giải phóng tại Courland vào năm 1818 và Vidzeme vào năm 1819.,To set free from the power of another; to liberate; as:
legerdemain,noun,mưu lừa gạt,But the clients do so enjoy the legerdemain .,Nhưng khách hàng của tôi thích những điều bí ẩn hơn.,"Sleight of hand; ""magic"" trickery"
proficiency,noun,sự thành thạo,"Apart from being agile and magically proficient , Asghan is also able to use a wealth of different weapons.",Ngoài tính nhanh nhẹn và sự thành thạo về phép thuật thì Asghan còn có thể sử dụng đủ loại vũ khí khác nhau.,"Ability, skill, competence."
appellation,noun,tên,"Whereas it was originally called waw or wau, its most common appellation in classical Greek is digamma; as a numeral, it was called episēmon during the Byzantine era and is now known as stigma after the Byzantine ligature combining σ-τ as ϛ.","Trong khi đó ban đầu nó được gọi là waw hoặc wau, tên gọi phổ biến nhất của nó trong tiếng Hy Lạp cổ điển là digamma; như một chữ số, nó được gọi là episēmon trong thời kỳ Byzantine và hiện được gọi là sự kỳ thị sau khi dây chằng Byzantine kết hợp - là. chữ này thường được sử dụng vào thời tiền cổ bổ sung cho bảng 24 chữ cái nhưng bây giờ nó đã dược bổ sung vào bảng số","A name, title, or designation."
lacerate,verb,xé,"Victim shows signs of lacerations and subcutaneous hematoma, indicating blunt force trauma to the head and neck.",Nạn nhân có dấu hiệu bị xé rách và xuất huyết dưới da cho thấy bị thương do đánh mạnh vào đầu và cổ.,"To tear, rip or wound."
contumely,noun,thái độ hỗn xược,"“As long as my brethren stand by me and encourage me, I can combat the prejudices of the world, and can bear the contumely [harsh treatment] and abuse with joy; but when my brethren stand aloof, when they begin to faint, and endeavor to retard my progress and enterprise, then I feel to mourn, but am no less determined to prosecute my task, being confident that although my earthly friends may fail, and even turn against me, yet my heavenly Father will bear me off triumphant.","“Chừng nào mà các anh em của tôi còn hỗ trợ tôi và khuyến khích tôi, thì tôi còn có thể chiến đấu chống lại những thành kiến của thế gian, và có thể vui vẻ chịu đựng những cách đối xử và khắc nghiệt đầy si nhục và lạm dụng; nhưng khi các anh em của tôi đứng ở xa, khi họ bắt đầu trở nên nản chí, và cố gắng cản trở sự tiến bô và nỗ lực của tôi, thì tôi cảm thấy buồn phiền, nhưng tôi vấn quyết tâm tiếp tục nhiệm vụ của mình, vì tôi tin tưởng rằng mặc dù những người bạn trần thế của tôi có thể thất bại, và ngay cả quay lại chống tôi, nhưng Cha Thiên Thượng của tôi sẽ mang tôi đến chiến thắng.","Rude language or behaviour; scorn, insult."
effectual,adjective,có hiệu lực,"In effect, a PA system created and considered effectual in one country may not be an appropriate assessment in another cultural region.","Trên thực tế, một hệ thống PA được tạo ra và được coi là có hiệu lực ở một quốc gia có thể không phải là một đánh giá thích hợp ở một khu vực văn hóa khác.",Producing the intended result; entirely adequate.
inviolable,adjective,bất khả xâm phạm,Inviolably ?,Bất khả xâm phạm ?,"Not violable; not susceptible of violence, or of being profaned or corrupted; incapable of being injured; not to be infringed or dishonoured."
franchise,verb,quyền bầu cử,Dutton Peabody exercising his franchise .,Dutton Peabody thực hành quyền bầu cử .,"A right or privilege officially granted to a person, a group of people, or a company by a government."
preordain,verb,an bài,Everything is preordained .,Mọi thứ đã được sắp đặt từ trước .,To determine the fate of something in advance
stratified,adjective,được phân tầng,"Much like the regular labor market, self-employment in the United States is stratified across racial lines.","Giống như thị trường lao động thông thường, việc làm nghề tự do ở Hoa Kỳ được phân tầng theo chủng tộc.",arranged in a sequence of layers or strata
accede,verb,gia nhập,"When Hungary acceded to NATO in April 1999, it became a formal ally of the United States.","Na Uy đã gia nhập NATO năm 1949, và trở thành một đồng minh thân cận của Hoa Kỳ.",(intransitive) (obsolete) To approach; to arrive; to come forward.
idyll,noun,cảnh điền viên,Imagine an idyllic river of bacteria.,Tưởng tượng ra một dòng sông hiền hòa cho lũ vi khuẩn xem.,"Any poem or short written piece composed in the style of Theocritus's short pastoral poems, the Idylls."
emulsify,verb,chuyển thành thể sữa,Acetylation prevents gel-formation but increases the stabilising and emulsifying effects of pectin.,Acetyl hóa ngăn ngừa sự hình thành gel nhưng làm tăng tác dụng ổn định và nhũ hóa của pectin.,To make into an emulsion.
adversarial,adjective,đối nghịch,I am not your adversary .,Tôi không phải kẻ thù của chị.,"Characteristic of, or in the manner of, an adversary; combative, hostile, opposed"
ergonomics,noun,công thái học,"To ergonomics specialists, the chance to help simplify the working environment.","Với các chuyên gia công thái học , cơ hội để giúp đơn giản hóa môi trường làm việc.","The science of the design of equipment, especially so as to reduce operator fatigue, discomfort and injury."
