word,part_of_speech,meaning,example,example_meaning,definition
merger,noun,sự hợp,It was created after 1945 by the merger of Braunsdorf and Bedra.,"Đô thị này được thiết lập sau năm 1945, nhờ sự hợp nhất của Braunsdorf và Bedra.",The act or process of merging two or more parts into a single unit.
refund,verb,trả lại,"You break the rules, you're out, no refunds .",không được trả lại tiền.,(transitive) To return (money) to (someone).
cactus,noun,cây xương rồng,Try that cactus .,Bắn thử cây xương rồng đi.,"(botany) Any member of the familyCactaceae, a family of flowering New World succulent plants suited to a hot, semi-desert climate."
conservationist,noun,bảo tồn thiên nhiên,She was first mentored by the renowned conservationist Richard Leakey.,Bà được giáo dục đầu tiên bởi nhà bảo tồn nổi tiếng Richard Leakey.,A person who maintains natural areas or protects threatened species.
divination,noun,sự bói toán,"Divination embraces the entire scope of gaining knowledge, especially concerning future events, through occult powers.","Sự bói toán bao gồm mọi sự tìm hiểu, đặc biệt liên quan đến việc tương lai, qua năng lực huyền bí.",(uncountable) The act of divining; a foreseeing or foretelling of future events.
eclipse,verb,làm lu mờ,"A titan, his victory eclipsing all others!",chiến thắng của hắn làm lu mờ tất cả!,"An astronomical alignment in which a planetary object (for example, the Moon) comes between the sun and another planetary object (for example, the Earth), resulting in a shadow being cast by the middle object onto the other object."
equation,noun,phương trình,Many know of his equation E=mc2.,Nhiều người biết phương trình E=mc2 của ông.,"(mathematics) An assertion that two expressions are equal, expressed by writing the two expressions separated by an equal sign; from which one is to determine a particular quantity."
gymnastics,noun,thể dục,Two of the first gymnastics clubs were Turnvereins and Sokols.,Hai trong số các câu lạc bộ thể dục nghệ đầu tiên là Turnvereins và Sokols.,"A sport involving the performance of sequences of movements requiring physical strength, flexibility, and kinesthetic awareness."
humbug,verb,bịp,"When I looked in your hand, it was just Gypsy humbug .","Khi tôi coi tay cho anh, đó chỉ là trò bịp của người Gypsy.","A hoax, prank or jest"
conveyance,verb,sự chuyên chở,I put the shoe on the conveyer belt.,Con để cái giày vô băng chuyền đó.,An act or instance of conveying.
interrogative,noun,nghi vấn,Interrogative cough.,Nghi vấn ho.,"Asking or denoting a question; pertaining to inquiry; questioning: as, an interrogative phrase, pronoun, or point; an interrogative look or tone of voice."
remittance,noun,kiều hối,It also has reduced remittances from people working abroad .,Nó cũng làm giảm lượng kiều hối của những người đang công tác ở nước ngoài .,A payment to a remote recipient.
vociferous,adjective,om sòm,"There was a conference, and the incredible evidence of a vociferous eye- witness.",Có một cuộc thảo luận và bằng chứng đáng kinh ngạc của một nhân chứng om sòm mắt.,Making or characterized by a noisy outcry; clamorous.
akimbo,adjective,chống nạnh,"The suit of clothes, now all unbuttoned and hanging loosely upon its unseen supports, stood up, arms akimbo .","Phù hợp với quần áo, bây giờ tất cả các mở nút khuy áo và treo một cách lỏng lẻo khi hỗ trợ vô hình của nó, đứng lên, cánh tay chống nạnh .","Into, in, or of the position where the arms are akimbo."
intonation,noun,ngữ điệu,The Vicar's voice answered with a curious jerking intonation :,Tiếng nói của vị Đại Diện đã trả lời với một ngữ điệu jerking tò mò:,The act of sounding the tones of the musical scale.
obliquely,adverb,chéo,"The subclass is followed by a one-to-three-digit ""group"" number, an oblique stroke and a number of at least two digits representing a ""main group"" or ""subgroup"".","Sau đó là từ 1 đến 3 chữ số thể hiện ""hạng mục phụ"", rồi tiếp đến dấu gạch chéo và một số ít nhất là hai chữ số đại diện cho một ""nhóm chính"" hay ""nhóm phụ"".",in an oblique manner; sideways
indecorous,adjective,bất lịch s,"Sorry to be indecorous , but you were both solidly unconscious when I pulled you from the wedding mayhem.","Thông cảm vì hơi đường đột, cơ mà hai người bất tỉnh nhân sự khi tôi mang hai người ra khỏi cái lễ cưới thảm hại đó.","improper, immodest or indecent"
ligature,verb,dây buộc,"The earliest published report of candiru attacking a human host comes from German biologist C. F. P. von Martius in 1829, who never actually observed it, but rather was told about it by the native people of the area, including that men would tie a ligature around their penis while going into the river to prevent this from happening.","Báo cáo công bố sớm nhất về candiru tấn công vật chủ là người đến từ nhà sinh vật học Đức C. F. P. von Martius năm 1829, người chưa bao giờ thực sự quan sát nó, mà thay vì thế là được các thổ dân của khu vực kể cho biết, bao gồm cả những người đàn ông có dải dây buộc xung quanh dương vật trong khi đi xuống sông để ngăn ngừa xảy ra các cuộc tấn công.",(uncountable) The act of tying or binding something.
yokel,noun,người nông thôn,Endure these country yokels a bit longer.,Đành chịu đựng bọn nữ tỳ quê mùa vậy.,(pejorative) An unsophisticated person.
refract,verb,khúc xạ,In this work d'Alembert theoretically explained refraction .,"Trong tác phẩm, d'Alembert giải thích về mặt lý thuyết hiện tượng khúc xạ .","(intransitive, of light) To change direction as a result of entering a different medium"
sentimentality,noun,tính đa cảm,Neither should warmth and feeling be confused with sentimentality and emotionalism.,Cũng đừng nhầm lẫn sự nhiệt thành và tình cảm với tính đa cảm hay sự cảm động thái quá.,An act of being sentimental.
forego,verb,đi trước,"In order to lower and raise the shields quickly, we'll forego the tractor beam.","Để hạ và nâng khiên chắn lên một cách nhanh nhất có thể, ta phải đi trước chùm tia dẫn đường và điều khiển tầu bằng tay.","To precede, to go before."
lout,verb,người thô lỗ,Who's this lout ?,Thằng láo này là ai ?,"Troublemaker, often violent."
ken,verb,biết,But I ken now ye're telling the truth.,Nhưng giờ tôi biết là cô đã nói sự thật.,Knowledge or perception.
relic,noun,di tích,"Carbon-dating has indicated these relics to be about 28,000 years old.",Xác định niên đại bằng cacbon đã chỉ ra những di tích này khoảng 28.000 năm tuổi.,That which remains; that which is left after loss or decay; a remaining portion.
concerted,adjective,có phối hợp,However... through the concerted efforts... of our brightest scientists... we have confirmed its validity.,"Tuy nhiên... qua những cố gắng có phối hợp của các nhà khoa học lỗi lạc nhất của chúng tôi, chúng tôi đã xác nhận được chuyện đó.",Simple past tense and past participle of concert.
ingot,verb,thỏi,Credit balances on the account do not entitle the creditor to specific bars of gold or silver or plates or ingots of platinum or palladium but are backed by the general stock of the precious metal dealer with whom the account is held.,Số dư Có trên tài khoản không cho chủ nợ quyền định đoạt đối với một lượng cụ thể các thoi vàng hay bạc hoặc các thanh hay thỏi platin hay paladi mà được hỗ trợ bởi lượng hàng kim loại quý tồn kho chung của nhà môi giới mà tài khoản này được nắm giữ.,"A solid block of more or less pure metal, often but not necessarily bricklike in shape and trapezoidal in cross-section, the result of pouring out and cooling molten metal, often immediately after smelting from raw ore or alloying from constituents."
maritime,adjective,gần biển,"The only noteworthy area of Maritime Climate at or near sea-level within Africa is in South Africa from Mossel Bay on the Western Cape coast to Plettenberg Bay, with additional pockets of this climate inland of the Eastern Cape and KwaZulu-Natal coast.","Những khu vực có kiểu khí hậu đại dương ở gần biển của châu Phi bao gồm một phần của Nam Phi từ Vịnh Mossel ở bờ biển Tây Cape tới Vịnh Plettenberg, cộng một vài vùng có kiểu khí hậu này ở Đông Cape và bờ biển KwaZulu-Natal.",Related to the sea or sailing
khan,noun,hãn,"We gladly gave tribute, Lord Khan .","Chúng thần sẵn lòng cống nạp, thưa Khả Hãn .","after Genghis Khan, a ruler over various Turkish, Tatar and Mongol peoples in the Middle Ages"
silt,noun,bùn,"This silt accumulated in the harbor until it became useless, and Rome was forced to rebuild Carthage.","Lượng bùn này đã tích lũy ở trong bến cảng cho đến khi nó làm cho bến cảng dần trở nên vô dụng, và Roma đã buộc phải xây dựng lại Carthago.",Mud or fine earth deposited from running or standing water.
potentate,adjective,kẻ thống trị,The moon is one of the most potent symbols of magic.,Mặt Trăng là một trong những biểu tượng mạnh nhất của ma thuật.,A powerful leader; a monarch; a ruler
admiral,noun,đô đốc,He was bring groomed for admiral .,Hoàn tất chu đáo việc trở thành đô đốc .,A naval officer of the highest rank; the commander of a country's naval forces.
painstakingly,adverb,một cách cẩn thận,Some of the color slides and films were painstakingly hand painted.,Một số phim và hình đèn chiếu có màu được vẽ bằng tay tốn nhiều công phu.,In a painstaking manner; very slowly and carefully.
blandishment,noun,lời nịnh hót,,,Flattering speech or actions designed to persuade or influence.
coagulate,adjective,đông lại,"It comes from petroleum, and it is readily found in Mesopotamia, where it wells up out of the earth and coagulates .",Chất này được chưng cất từ dầu mỏ; nó cũng trào lên khỏi mặt đất và đông lại ở nhiều nơi trong vùng Lưỡng Hà.,(intransitive) To become congealed; to convert from a liquid to a semisolid mass.
metamorphose,verb,biến hình,"In Metamorphoses , Ovid follows Hesiod's concept of the four ages.","Trong tập Biến hình (Metamorphoses), Ovidius tiếp nối quan niệm của Hēsíodos về bốn thời đại.",(of a moth or insect) to undergo metamorphosis
necromancy,noun,gọi hồn,This is used in necromancy .,Thường dùng trong thuật gọi hồn .,Divination involving the dead or death.
pusillanimous,adjective,hèn nhát,"Yet, why the hell be so pusillanimous !",Sao còn núp lén làm gì ?,"Showing ignoble cowardice, or contemptible timidity"
delineated,adjective,được định hình,"Increasingly, the digital economy is intertwined with the traditional economy, making a clear delineation harder.",Kinh tế kỹ thuật số được đan xen với nền kinh tế truyền thống tạo ra một miêu tả rõ ràng hơn.,Simple past tense and past participle of delineate.
egotistical,adjective,tự cao tự đại,"You're a self-serving, egotistical fuckwad.","Cậu là đồ tự tung tự tác, thằng khốn tự cao tự đại .",Tending to talk excessively about oneself.
elysian,adjective,elysian,Since before Elysian Fields.,Trước cả lúc ở Elysian Fields .,"being of such surpassing excellence as to suggest inspiration by the gods; ""her pies were simply divine""; ""the divine Shakespeare""; ""an elysian meal""; ""an inspired performance"""
fractious,adjective,bướng,The collision between the fractious political world of the Greeks and the enormous empire of the Persians began when Cyrus the Great conquered the Greek-inhabited region of Ionia in 547 BC.,Sự đụng độ giữa thế giới chính trị ngang bướng của người Hy Lạp và đế quốc to lớn của người Ba Tư đã bắt đầu khi Cyrus Đại đế chinh phục vùng người Hy Lạp sinh sống Ionia trong 547 TCN.,irritable; argumentative; quarrelsome
inveigle,verb,dụ dỗ,"Eventually, Englishman Henry Phillips cunningly inveigled himself into Tyndale’s confidences.","Cuối cùng, một người Anh tên là Henry Phillips xảo quyệt giả vờ để được Tyndale tín cẩn.","(transitive) to convert, convince or win over with flattery or wiles"
abstemious,adjective,có điều độ,"There are two words in the English language that have all five vowels in order : "" abstemious "" and "" facetious .","Có hai từ trong tiếng Anh có cả năm nguyên âm theo thứ tự : "" điều độ "" và "" khôi hài "" .",(Original Latin sense) Abstaining from wine.
fracas,noun,fracas,"Probably overkill, but you did cause one hell of a fracas last night.",Chắc là hơi quá trớn... nhưng cô đã tạo ra một vụ khá hỗn loạn tối qua đấy.,"A noisy disorderly quarrel, fight, brawl, disturbance or scrap."
fulsome,adjective,ngấy tởm,Ben Fulsom's funeral is later today.,Tang lễ của Ben Fulsom sẽ diễn ra vào hôm nay.,"Offensive to good taste, tactless, overzealous, excessive."
accrued,adjective,tích lũy,Your ads continue to run and accrue costs.,Quảng cáo của bạn tiếp tục chạy và tích lũy chi phí.,Simple past tense and past participle of accrue.
antediluvian,adjective,cũ kỹ,What went wrong with that antediluvian society?,Xã hội trước đại hồng thủy đã có những vấn đề gì?,ancient or antiquated; old; prehistoric.
igneous,adjective,có lửa,"Speaking of volcanoes, man, are they a violent igneous rock formation!","Nói về núi lửa mới nhớ, trời ơi, sự phun trào của những ngọn lửa mãnh liệt! Hả?","Pertaining to, having the nature of fire; containing fire; resembling fire; as, an igneous appearance"
apposite,adjective,thích hợp,It is a noun in apposition .,Đây là một noun in apposition .,"appropriate, relevant, well-suited; fit"
cosmology,noun,vũ trụ học,Cosmology portal Physics portal Timeline of cosmology Theory of everything Seymour Feldman (1967).,Biểu đồ thời gian của vũ trụ học Lý thuyết vạn vật ^ Seymour Feldman (1967).,"The study of the physical universe, its structure, dynamics, origin and evolution, and fate"
detraction,noun,sự chê bai,Does it detract from the Kingdom message we bear?,Nó có làm giảm giá trị của thông điệp chúng ta không?,"the act of detracting something, or something detracted"
doctrinaire,adjective,giáo điều,"Hans Hillerbrand writes that Luther had no intention of confronting the church, but saw his disputation as a scholarly objection to church practices, and the tone of the writing is accordingly ""searching, rather than doctrinaire .""","Hans Hillerbrand viết rằng Luther không có ý định đối đầu với giáo hội, nhưng xem cuộc tranh luận là một sự phản biện về học thuật đối với các tập tục của giáo hội, văn phong của ông thể hiện chủ tâm ""tra cứu hơn là lập thuyết.""",A person who stubbornly holds to his or her philosophy or opinion regardless of its feasibility.
abscission,noun,sự cắt bỏ,ABA was originally believed to be involved in abscission .,AAB ban đầu được cho là có liên quan đến việc rụng các cơ quan ( abscission ).,The act or process of cutting off.
atavism,noun,lại giống,There's what we call atavism activation.,Ta gọi đó là sự lai tạo giống .,The reappearance of an ancestral characteristic in an organism after several generations of absence.
chicanery,noun,sự cãi nhau,"In the economy of God, there is no room for chicanery and greed.","Trong hệ thống kinh tế của Thượng Đế, không có chỗ cho sự lừa đảo và tính tham lam.","Deception by use of trickery, quibbling, or subterfuge."
demotic,adjective,bình dân,"Around the first century AD, the Coptic alphabet started to be used alongside the Demotic script.","Khoảng thế kỷ thứ nhất, bảng chữ cái Copt đã bắt đầu được sử dụng cùng với chữ viết bình dân .",Of or for the common people.
factotum,noun,người quản gia,,,(dated) A person having many diverse activities or responsibilities.
impecunious,adjective,túng thiếu,""" I fancy it would be a simple matter, sir, to find some impecunious author who would be glad to do the actual composition of the volume for a small fee.",""" Tôi thích nó sẽ là một vấn đề đơn giản, thưa ông, để tìm thấy một số tác giả không có tiền người sẽ được vui để làm thành phần thực tế của khối lượng cho một khoản phí nhỏ.",Lacking money.
stygian,adjective,sông mê,He has a sword made of Stygian iron.,Cậu có một thanh kiếm bằng sắt Stygian .,Dark and gloomy.
bacchanalian,adjective,chè chén say sưa,,,alternative capitalization of Bacchanalian
bedizen,verb,bedizen,,,"To ornament something in showy, tasteless, or gaudy finery."
carping,adjective,đánh cá,Holy carp .,Thánh cá ơi .,Present participle of carp.
interregnum,noun,lúc tạm ngừng,In the subsequent interregnum Joannes was nominated Emperor.,"Trong khoảng thời gian đứt quãng tiếp theo, Joannes được đề cử làm Hoàng đế.",The period of time between the end of a sovereign's reign and the accession of another sovereign.
peregrination,noun,cuộc du lịch,Peregrine falcon,Chim cắt lớn,"A travel or journey, especially by foot, notably by a pilgrim."
refulgent,adjective,chói lọi,,,"Resplendent, or shining brightly and radiantly."
simian,noun,khỉ,"Emergency rooms are being overwhelmed with patients showing signs... of what's being dubbed "" The Simian Flu. ""","Các phòng cấp cứu đầy nghẹt những bệnh nhân có các triệu chứng... của loại bệnh mà giờ đây được gọi là "" Cúm Khỉ "".",Of or pertaining to apes.
explication,noun,giải thích,"Rarely, changes are made in the explication of doctrine.",Những thay đổi để làm sáng tỏ giáo lý hiếm khi xảy ra.,"The act of opening, unfolding, or explaining; explanation; exposition; interpretation."
extrinsic,adjective,không cố hữu,Now what I'm also interested in is: Is it possible to separate intrinsic and extrinsic beauty?,Điều mà tôi cũng thấy hứng thú nữa là: Liệu có thể tách rời vẻ đẹp bản chất và vẻ đẹp bề ngoài ?,"external, separable from the thing itself, inessential"
iconoclastic,adjective,chống đối thần tượng,The Iconoclasts,Người bài trừ hình tượng,Characterized by attack on established beliefs or institutions; of or pertaining to iconoclasm.
kudos,noun,danh tiếng,"Within the scientific community, journal impact factors continue to play a large but controversial role in determining the kudos attached to a scientist's published research record.","Trong cộng đồng khoa học, Impact Factor đóng một vai trò lớn trong việc xác định danh tiếng gắn liền với nghiên cứu được công bố của một nhà khoa học.",Praise; accolades.
mendacious,adjective,điêu,Mendacious deceit.,hơi giả dối.,"(of a person) lying, untruthful or dishonest"
permeable,adjective,thấm qua được,It's not only transparent to light but it's permeable to oxygen.,Nó không những trong suốt với ánh sáng mà còn khí oxy còn có thể thấm qua được .,"Of or relating to substance, substrate, membrane or material that absorbs or allows the passage of water."
sidereal,adjective,thiên văn,A sidereal trip that takes me to infinity,Và chuyến du hành qua chác chòm sao đã đẩy tôi lên đến đỉnh điểm,Of or relating to the stars.
apogee,noun,điểm viễn địa,Chichen Itza was a major economic power in the northern Maya lowlands during its apogee .,Chichen Itza là một trung tâm kinh tế lớn của các vùng đất thấp phía bắc Maya ở thời cực thịnh của nó.,(astronomy) The point in an orbit around the Earth that is most distant from the Earth.
axiomatic,adjective,hiển nhiên,It's axiomatic . Why not us?,Đó là điều hiển nhiên .,Evident without proof or argument.
contumacious,adjective,không tuân lệnh toà,"In the words of the Victorian author George Trevelyan, the King was determined ""never to acknowledge the independence of the Americans, and to punish their contumacy by the indefinite prolongation of a war which promised to be eternal.""","Theo như tác gia thời Victoria, George Trevelyan, Nhà vua tuyên bố ""Không bao giờ thừa nhận sự độc lập của người Mỹ, và để trừng phạt cho sự vô lễ của chúng, Quả nhân sẽ kéo dài vô thời hạn một cuộc chiến tranh mà có thể sẽ là vĩnh viễn.",Contemptuous of authority; willfully disobedient; rebellious.
euthanasia,noun,an tử,It is the only country that does not have age restrictions on euthanasia .,Đây là quốc gia duy nhất không có giới hạn tuổi về an tử .,"The practice of killing a human being or animal for humane reasons, especially one suffering greatly or experiencing poor quality of life."
hirsute,adjective,rậm lông,Hirsutism affects between 5–15% of all women across all ethnic backgrounds.,Chứng rậm lông ảnh hưởng đến 5–15% của tất cả phụ nữ trên tất cả các nền dân tộc.,Covered in hair or bristles; hairy.
insouciance,noun,tính không lo nghĩ,He maintained a calm insouciance .,Anh ấy giữ được thái độ ôn hòa.,"carelessness, heedlessness, indifference, or casual unconcern"
misanthropic,adjective,ghét người,"Nice try, but you're a misanthrope , not a misogynist.","Có cố gắng đấy, nhưng anh hay ghét người ta chứ đâu có ghét việc kết hôn.",Hating or disliking mankind.
monolithic,adjective,nguyên khối,U.S. is a monolith .,Hoa Kỳ là một khối thống nhất .,Of or resembling a monolith.
nugatory,adjective,không có hiệu lực,,,"Trivial, trifling or of little importance."
apothegm,noun,cách ngôn,"Jullien gave us the famous apothegm defining naturalism in his The Living Theatre (1892): ""A play is a slice of life put onstage with art.""","Jullien đã cho chúng ta một apothegm nổi tiếng xác định chủ nghĩa tự nhiên trong Nhà hát Cuộc sống (1892): ""Một vở kịch là một lát cắt của cuộc sống được đưa lên sân khấu với nghệ thuật.""","A short, witty, instructive saying; an aphorism or maxim."
argot,noun,tiếng lóng,"Abandoned children formed gangs, created their own argot , and engaged in petty theft and prostitution.","Những đứa trẻ bị bỏ rơi đã lập ra các băng đảng, tạo ra tiếng lóng riêng của bọn chúng, và tham gia vào việc ăn cắp và mại dâm.","A secret language or conventional slang peculiar to thieves, tramps, and vagabonds."
desuetude,noun,tình trạng lỗi thời,,,"disuse, obsolescence (for example, the state of a custom that is no longer observed nor practised)"
distrait,adjective,lãng trí,,,"absent-minded, troubled, distracted"
megalomania,noun,chứng hoang tưởng tự đại,"Heinrich Himmler wrote, ""I suppose that it is Goebbels's megalomania ...and stupidity which is responsible for starting this operation now, in a particularly difficult diplomatic situation.""","Heinrich Himmler viết: ""Tôi tin rằng đó là chứng hoang tưởng tự đại và ngu xuẩn của Goebbels... nó chịu trách nhiệm cho sự khởi đầu của chiến dịch này bây giờ, trong một tình cảnh ngoại giao đặc biệt khó khăn.""","A psychopathological condition characterized by delusional fantasies of wealth, power, or omnipotence."
occlude,verb,bít,"So many of them are occluded by faces, and so on.","Có rất nhiều loại được bít kín bởi các mặt, và nhiều hơn nữa.","To obstruct, cover, or otherwise block an opening."
plasticity,noun,tính dẻo,"Phthalates are additives used in everyday plastic products to increase their flexibility, durability and transparency.","Phthalate là phụ gia dùng trong sản xuất nhựa hàng ngày để tăng tính dẻo , tính bền và độ trong.",The quality or state of being plastic.
riposte,verb,câi lại,Riposte .,Phản công .,(fencing) a thrust given in return after parrying an attack.
salacious,adjective,dâm ô,I have no interest in salaciousness .,Tôi không có thói dâm ô đâu.,Promoting sexual desire or lust.
thespian,adjective,thespian,More likely offering your backside to the Thespians .,"Anh tiến nhanh à, có lẽ anh đi lùi chăng .","of, or relating to drama and acting; dramatic, theatrical"
avuncular,adjective,như bác,"Reagan's "" avuncular style, optimism, and plain-folks demeanor"" also helped him turn ""government-bashing into an art form.""","""Phong cách cha chú , chủ nghĩa lạc quan, và cách cư xử bình dân"" của Reagan cũng giúp ông biến ""công khích chính phủ thành một hình thức nghệ thuật"".","In the manner of an uncle, pertaining to an uncle."
