word,part_of_speech,meaning,example,example_meaning,definition
shrill,adjective,the thé,"Suddenly you hear in the distance a shrill , startling sound.","Thình lình, bạn nghe một tiếng the thé từ đằng xa làm bạn giật mình.",High-pitched and piercing.
frigid,adjective,băng giá,"He breathed his last on the frigid steppe of eastern Siberia, vilified and disgraced.","Thân bại, danh liệt, ông trút hơi thở cuối cùng tại vùng thảo nguyên băng giá ở miền đông Siberia.",Very cold; lacking warmth; icy.
reproachful,adjective,nhục nhã,19 You know my reproach and my disgrace and my humiliation.,"19 Ngài biết nỗi sỉ nhục con, cùng nỗi nhuốc nhơ và sự nhục nhã .",Expressing or containing reproach; upbraiding; opprobrious; abusive.
vandalism,noun,phá hoại,It's just vandalism .,Chúng chỉ phá hoại thôi.,Willful damage or destruction of any property with no other purpose than damage or destruction of said property.
musket,noun,súng hỏa mai,I've seen'em fire muskets before.,"Trước đây, tôi đã thấy chúng bắn súng hỏa mai .","A species of firearm formerly carried by the infantry of an army. It was originally fired by means of a match, or matchlock, for which several mechanical appliances (including the flintlock, and finally the percussion lock) were successively substituted. This arm has been superseded by the rifle."
militia,noun,dân quân,It's not uncommon for militia members to have military experience.,Nó khá phổ biến cho thành viên lực lượng dân quân có kinh nghiệm quân sự.,"An army of trained civilians, which may be an official reserve army, called upon in time of need; the national police force of a country (e.g. Russia, Ukraine, etc.); the entire able-bodied population of a state; or a private force, not under government control."
heir,noun,thừa kế,I must remind you that the princess is the direct heir to the throne.,Tôi phải nhắc anh rằng Công chúa là người trực tiếp thừa kế ngai vàng.,"Someone who inherits, or is designated to inherit, the property of another."
impassable,adjective,không thể qua được,Diotimus told of the bridge being impassable this late in season.,Diotimus từng nói cầu này không thể qua được trong mùa này.,"(of a route, terrain, etc.) Incapable of being passed over, crossed, or negotiated."
intelligence,noun,trí thông minh,"As artificial intelligence evolves, so does his intelligence .","Và trí thông minh nhân tạo phát triển, trí thông minh của nó cũng vậy.","(uncountable) Capacity of mind, especially to understand principles, truths, facts or meanings, acquire knowledge, and apply it to practice; the ability to learn and comprehend."
plentiful,adjective,dồi dào,"Although these particles may be difficult to study, they are plentiful .","Mặc dù nghiên cứu các hạt này rất khó, chúng tồn tại với số lượng dồi dào .",Existing in large number or ample amount.
banish,verb,trục xuất,A similar edict banished the Muslims ten years later.,"Mười năm sau, một sắc lệnh tương tự cũng được ban ra để trục xuất người Hồi giáo.",To send someone away and forbid that person from returning.
restraint,noun,sự kiềm chế,"Even within these boundaries, restraint and respect are expected.","Ngay cả trong những khuôn khổ này, cần phải có sự kiềm chế và kính trọng.","(countable) something that restrains, ties, fastens or secures"
tote,verb,khuân,“ Tote the Load.”,“Hãy mang lấy gánh nặng”.,"A bag, specifically a tote bag."
fleet,noun,hạm đội,"Further troops and ships joined the fleet from Cam Ranh Bay, Indochina.","Thêm nhiều binh lính và tàu thuyền tham gia hạm đội từ vịnh Cam Ranh, Đông Dương.",A group of vessels or vehicles.
convey,verb,truyền,I wouldn't have been able to convey so little information.,Tôi sẽ không chỉ truyền tải một chút thông tin như vậy được.,To transport; to carry; to take from one place to another.
siege,verb,bao vây,"We will lay siege to the capital, surrounding the city on all sides.","Chúng ta sẽ bao vây kinh đô, bao vây mọi mặt.",seat
espionage,noun,gián điệp,"Apparently, they're very paranoid about industrial espionage here.",Rõ ràng là họ rất hoang tưởng về gián điệp công nghiệp ở đây.,The act or process of learning secret information through clandestine means.
forgery,noun,chữ ký giả mạo,Forgery is your superpower.,Siêu năng lực của cậu kia mà.,The act of forging metal into shape.
amateur,adjective,không chuyên,"You see, gentlemen... greed is for amateurs",Quý ngài thấy đấy... sự tham lam chỉ dành cho kẻ không chuyên,(now rare) A lover of something.
treason,noun,sự,Only a madman hears the truth as treason !,Chỉ có một thằng điên mới nghe sự thật ra thành phản nghịch!,The crime of betraying one’s government.
martial,adjective,hùng dũng,This means a court- martial .,Vậy có nghĩa là tòa án binh .,"Of, relating to, or suggestive of war; warlike."
liberate,verb,giải phóng,"And in so many ways, I think this is a terrific liberation .","Và trong rất nhiều cách, tôi nghĩ đây là một sự giải phóng tuyệt vời.",(transitive) to free; to release from restraint or bondage; to set at liberty; to manumit; to disengage
promptly,adverb,nhanh chóng,"Then, make sure to repay what you have borrowed, and do so promptly .","Vậy, hãy hoàn trả những gì đã vay cách nhanh chóng .",In prompt manner; both soon and quickly.
counterfeit,adjective,giả mạo,Or maybe it's that it feels like all our heroes are counterfeit .,Hoặc có thể đó là cảm giác tất cả anh hùng của chúng ta đều là giả mạo .,"False, especially of money; intended to deceive or carry appearance of being genuine."
treachery,noun,sự phản bội,And then you will die for your treachery .,Và rồi bà sẽ chết vì sự phản bội của mình.,"Deliberate, often calculated, disregard for trust or faith."
assign,verb,định,He and his wife did wonderfully well in that assignment .,Vợ chồng anh đã phục vụ rất tuyệt vời trong chỉ định đó.,(transitive) To designate or set apart something for some purpose.
cipher,noun,mật mã,"Next day, I came to work and the cipher was waiting.","Ngày hôm sau, tôi đến làm việc và mật mã đang đợi tôi.",A method of transforming a text in order to conceal its meaning.
detection,noun,phát hiện,"Once it 's under control , it 's usually impossible to detect .",Khi đã kiểm soát được gàu thì thường người ta không dễ phát hiện ra nó .,The act of detecting or sensing something; discovering something that was hidden or disguised.
denture,noun,hàm răng,"You can't understand me without the dentures , can you?",Anh không hiểu tôi nếu không có hàm răng giả à?,"a set of teeth, the teeth viewed as a unit"
whereabouts,noun,chỗ ở,The focus of your investigation isn't going to be about Younger's whereabouts .,Trọng tâm điều tra của các bạn không phải là chỗ ở của hắn.,"In, at or near what location"
merely,adverb,đơn thuần,You're not guilty of anything merely by working at Auschwitz.,Các bạn không hề có tội gì vì chỉ đơn thuần làm việc ở trại Auschwitz.,"(focus) only, just, and nothing more"
dabble,verb,học đòi,Curiosity and peer pressure are selfish reasons to dabble with addictive substances.,Sự tò mò và áp lực của bạn bè là những lý do ích kỷ để học đòi các chất gây nghiện ngập.,(transitive) To partially wet (something) by splashing or dipping; connotes playfulness.
almanac,noun,niên giám,We need your navigational maps and celestial almanacs .,Chúng tôi cần bản đồ hàng hải và niên giám của ông.,"(astronomy, navigation) A book or table listing nautical, astronomical, astrological or other events for the year; sometimes, but not essentially, containing historical and statistical information."
quill,noun,lông cánh,The wren with little quill,♪ Chim hồng tước với những chiếc lông cánh nhỏ ♪,"The lower shaft of a feather, specifically the region lacking barbs."
emetic,adjective,gây nôn,"Realistically, it may just mean that we've got the anti- emetics tuned right.","Thực tế mà nói, có thể nó chỉ chứng tỏ rằng ta dùng đúng loại thuốc chống nôn .",causing nausea and vomiting
doom,verb,diệt vong,"Each race is bound to this fate, this one doom .","Mọi tộc đều chung số phận này, sự diệt vong này.","(countable, historical) A law."
morale,noun,chí khí,Whose morale are you worried about?,Chí khí của ai mà mày phải lo?,"The capacity of people to maintain belief in an institution or a goal, or even in oneself and others."
privileged,adjective,có đặc quyền,Percy's got him under a privileged noc file.,Percy có một file về đặc vụ chìm có đặc quyền .,Simple past tense and past participle ofprivilege.
eavesdrop,verb,nghe trộm,Sort of eavesdrop on the activity of nerve cells in the brain.,Kiểu như là nghe trộm hoạt động của tế bào thần kinh trong não vậy.,To hear a conversation one is not intended to hear; to listen in.
manifesto,verb,tuyên ngôn,* See also Manifesto ; Official Declaration 1,"* Xem thêm Tuyên Ngôn , Bản; Tuyên Ngôn Chính Thức—1",(intransitive) To issue a manifesto
displacement,noun,[sự,That's displacement of space.,Đó là sự thay thế về không gian.,"The act of displacing, or the state of being displaced; a putting out of place."
incarceration,noun,sự bỏ tù,"Phelps, who was close to the Prophet Joseph, betrayed him in 1838, which led to Joseph’s incarceration in Missouri.","Phelps, là một người gần gũi với Tiên Tri Joseph, đã phản bội Vị Tiên Tri vào năm 1838, mà đưa đến sự bỏ tù ông ở Missouri.","The act of confining, or the state of being confined; imprisonment."
foster,adjective,khuyến khích,Five ways to foster experiences that lead to conversion.,Năm cách để khuyến khích những kinh nghiệm đưa đến sự cải đạo.,Providing parental care to unrelated children.
arbitrarily,adverb,chuyên quyền,Often they acted unfairly and arbitrarily .,Thường thường họ hành động một cách thiên vị và độc đoán .,In an arbitrary manner.
credo,noun,cương lĩnh,The credo says make sure the client is committed to their objective.,Các cương lĩnh nói rằng đảm bảo khách hàng... cam kết mục tiêu của họ tại mỗi bước.,A belief system.
immunize,verb,gây miễn dịch,Niki's immunization records.,Tài liệu về Niki .,(transitive) To make someone or something immune to something.
typhoid,noun,bệnh thương hàn,Father contracted typhoid fever while serving on the Russian front.,Cha tôi mắc phải bệnh thương hàn khi đang chiến đấu tại mặt trận Nga.,(pathology) typhoid fever
fluent,adjective,trôi chảy,"Fluent , Conversational Delivery with Proper Pronunciation","Nói trôi chảy , giọng nói chuyện và phát âm đúng","(linguistics) Able to speak a language accurately, rapidly, and confidently – in aflowingway."
stooge,noun,bù nhìn,A Nazi stooge like you?,1 Nazi bù nhìn như ông?,One who knowingly allows himself or herself to be used for another's profit; a dupe.
lackey,noun,tay sai,The Divine Might's lackeys deserve to die.,Tay sai cho Thiên Tôn càng đáng chết.,"A footman, liveried male servant."
prejudice,verb,định kiến,It's always heartwarming to see a prejudice defeated by a deeper prejudice .,Thật ấm lòng khi thấy một định kiến bị đánh bại bởi một định kiến nặng hơn.,An adverse judgement or opinion formed beforehand or without knowledge of the facts.
republican,adjective,đảng cộng hoà,Every Republican is against the Russians being involved.,Mọi thành viên đảng Cộng hoà chống đối Nga đều có liên quan.,Someone who favors a republic; an anti-monarchist.
claustrophobia,noun,nỗi lo sợ mình bị giam giữ,I have claustrophobia .,Tôi mắc chứng sợ không gian hẹp .,"The fear of closed, tight places."
sentry,noun,lính gác,How many hours the sentries stay on and when they go.,Mỗi lính gác ở đó bao nhiêu tiếng và khi nào thì chúng đi.,"A guard, particularly on duty at the entrance to a military base."
barrack,noun,trại,"That reminds him of the word baroque, barrack , bark, poodle,","Và điều đó gợi lại cho anh những từ "" kỳ dị, trại lính, tiếng sủa, vũng nước,","(military) A building for soldiers, especially when in garrison. Commonly in the plural, originally meaning temporary huts, but now usually applied to a permanent structure or set of buildings."
constitutional,adjective,hợp hiến,"Rutskoy's interim presidency, although constitutional , was never acknowledged outside Russia.","Chức tổng thống tạm quyền của Rutskoy, tuy rằng hợp hiến , nhưng lại không được công nhận bên ngoài nước Nga.",Conforming to the constitution.
beneficiary,adjective,người hưởng hoa lợi,The main beneficiaries of his will were his eight surviving children by Mrs. Jordan.,Những người hưởng hoa lợi từ bản chúc thư của ông là tám người con còn sống với Quý bà Mrs. Jordan.,One who benefits or receives an advantage.
evacuee,noun,người sơ tán,FEMA is assisting thousands of evacuees returning to their homes.,FEMA đang hỗ trợ hàng nghìn người sơ tán trở về nhà.,"A person who has been evacuated, especially a civilian evacuated from a dangerous place in time of war"
feasible,adjective,nghe xuôi tai,Sounds eminently feasible .,Nghe khả thi lắm.,"Doable, possible, achievable, workable."
unqualified,adjective,hoàn toàn,You're utterly unqualified to work in my office.,Cô hoàn toàn không đủ chuẩn để làm việc trong văn phòng của tôi.,"not qualified, ineligible, unfit for a position or task"
forswear,verb,thề bỏ,"Forswear it, sight!",Đó là dấu hiệu!,"(transitive) To renounce or deny something, especially under oath."
renounce,verb,từ bỏ,We don’t just renounce our weakness the way we renounce sin.,Chúng ta không từ bỏ sự yếu kém của mình theo cách chúng ta từ bỏ tội lỗi.,(card games) An act of renouncing.
rift,verb,bỏ ra,How long until we reach the Rift ?,Còn bao lâu ta tới được eo Rift ?,A chasm or fissure.
resistance,noun,chống cự,"13 When he is determined, who can resist him?","13 Khi ngài đã quyết, ai chống cự nổi?","The act of resisting, or the capacity to resist."
penitence,noun,sự hối lỗi,The penitent man is humble before God.,Người biết sám hối là phải hạ mình trước Chúa,Condition of being penitent.
incriminate,verb,buộc tội cho,You're likely to incriminate yourself.,Mẹ rất có khả năng buộc tội chính mình.,(transitive) To accuse or bring criminal charges against.
ecclesiastic,adjective,thầy tu,With what does one replace an ecclesiastical collar?,Cái thằng thầy tu ấy sẽ làm cái gì nhỉ?,Of or pertaining to the church; ecclesiastical.
oratory,noun,nghệ thuật diễn thuyết,"So it's not "" oratory , "" it's "" laboratory. ""","Cho nên không phải là "" oratory "" Nó là laboratory ( Phòng thí nghiệm )","(not countable) The art of public speaking, especially in a formal, expressive, or forceful manner."
myriad,adjective,vô số,and myriad other important functions in our bodies.,và vô số những chức năng khác trong cơ thể chúng ta.,"(now historical) Ten thousand; 10,000. [from mid-16th c.]"
indolent,adjective,không đau,"Although most infections follow an indolent course, the disease can progress rapidly.","Mặc dù hầu hết nhiễm trùng theo một cách không đau , bệnh có thể tiến triển nhanh chóng.","Habitually lazy, procrastinating, or resistant to physical labor/labour."
cataclysm,noun,biến động lớn,"The first half of the 20th century was an absolute disaster in human affairs, a cataclysm .","Trong nửa đầu thế kỉ 20 là một thời kì thảm họa của nhân loại, một biến động lớn .","A sudden, violent event."
fanaticism,noun,sự cuồng tín,"It's fanaticism , and we have to stop confusing the two.","Nó là sự cuồng tín , chúng ta nên rõ ràng giữa hai điều này",The characteristic or practice of being a fanatic.
ascribe,verb,gán cho,"Those words have been ascribed to Benito Mussolini, one-time dictator of Italy.","Đó là những lời mà người ta đã gán cho Benito Mussolini, một thời là nhà độc tài Ý.",(transitive) To attribute a cause or characteristic to someone or something.
fetid,adjective,hôi hám,"You breathe this fetid air of Rome, but you are not Roman.","Chú thở thứ không khí hôi hám của La Mã, nhưng chú không phải dân La Mã.",Foul-smelling.
luminous,adjective,sáng,of regions of different colors and luminances .,từ những vùng màu và độ sáng khác nhau.,emitting light; glowing brightly
apparition,noun,sự xuất hiện,Narrator: Flow is the mental state of apparition,Người dẫn chương trình: Chủ đề là sự xuất hiện của tình trạng trí tuệ,An act of becoming visible; appearance; visibility.
exalt,verb,khen ngợi,"On the other side of the sea, the large crowd of people praised God with a song: “Sing to Jehovah, for he has become highly exalted .","Trên bờ biển bên kia, đoàn dân đông hát bài ca này để khen ngợi Đức Chúa Trời: “Hãy hát cho Đức Giê-hô-va, vì ngài đã toàn thắng vinh quang.",(transitive) To honor; to hold in high esteem.
profoundly,adverb,sâu sắc,So we obviously profoundly agreed with him.,Vậy nên tất nhiên chúng tôi đồng ý với ông ấy một cách sâu sắc .,"(manner) With depth, meaningfully."
provocation,noun,sự khiêu khích,Louis responded to John XXII with fresh provocations .,Ludwig đã đáp lại John XXII với sự khiêu khích đầy vẻ tự phụ.,"The act of provoking, inciting or annoying someone into doing something"
rejuvenate,verb,làm trẻ lại,"and asked, can we again rejuvenate these old mice?",rồi chờ đợi: chúng ta có thể làm trẻ lại những con chuột già không?,To render young again.
irremediable,adjective,không thể chữa được,Irremediable !,Không thể cứu chữa được rồi.,"unable to be remedied, cured, corrected or repaired; irreparable, incurable"
veneration,noun,sự tôn kính,This is a 16th century image to show you how widespread his veneration actually was.,Đây là bức ảnh từ thế kỷ XVI cho ta thấy sự tôn kính đối với ông lan rộng như thế nào.,The act of venerating or the state of being venerated.
irrefutable,adjective,không thể bác được,Should you conclude that simply quoting a relevant scripture provides an irrefutable argument?,Bạn có nên kết luận rằng chỉ trích dẫn một câu Kinh Thánh thích hợp là đủ để có một lý lẽ không thể bác được không ?,undeniable; unable to be disproved or refuted
beneficent,adjective,có lợi,Beneficence .,Sự nhân đạo.,"Given to acts that are kind, charitable, philanthropic or beneficial."
euphoric,adjective,phấn chấn,I wanted you to feel euphoric .,Em muốn anh thấy sảng khoái .,Feeling of great well-being or elation or intense feeling of happiness; characterized by euphoria.
ingenuous,adjective,chân thật,"Because we also need your intellectual capital: your ideas, your skills, your ingenuity .","Bởi chúng ta cũng cần nguồn tri thức của họ: những ý tưởng, kĩ năng và sự chân thật .",naïve and trusting
harangue,verb,diễn thuyết,"We are harangued , lectured to,","Chúng ta hô hào, diễn thuyết ,",(transitive) To give a forceful and lengthy lecture or criticism to someone.
somnolent,adjective,làm buồn ngủ,Somnolence is often viewed as a symptom rather than a disorder by itself.,Buồn ngủ thường được xem như một triệu chứng chứ không phải là một rối loạn.,Drowsy or sleepy.
solicitous,adjective,lo lắng,"Priors, solicitation , possession.","Tiền sự bán dâm , tàng trữ đồ ăn cắp.","Disposed to solicit; eager to obtain something desirable, or to avoid anything evil; concerned; anxious; careful."
enterprise,noun,công ty,How does the record of business enterprises cast doubt on the future?,Quá trình của các công ty kinh doanh làm người ta nghi ngờ tương lai như thế nào?,"a company, business, organization, or other purposeful endeavor"
disheveled,adjective,lôi thôi,"So when the conventioners arrive in the area where the convention is to be held, their appearance is often somewhat disheveled .","Vì thế khi tới địa điểm đại hội, ngoại diện của họ thường lôi thôi .",untidy or unkempt; messy
endow,verb,phú,Birds that catch flying insects are similarly endowed .,Những loài chim ăn các loài côn trùng biết bay cũng được phú cho khả năng tương tự.,"To furnish with money or its equivalent, as a permanent fund for support; to make pecuniary provision for; to settle an income upon; especially, to furnish with dower; as, to endow a wife; to endow a public institution."
innocuous,adjective,vô hại,You put your knife with a fork and a spoon and it looks innocuous .,Anh để con dao chung với muỗng nĩa để trông như có vẻ vô hại .,Harmless; producing no ill effect.
constitution,noun,hiến pháp,I'm very interested in the new constitution that's being given to the islands.,Tôi rất quan tâm tới hiến pháp mới sắp được ban cho quần đảo.,"The act, or process of setting something up, or establishing something; the composition or structure of such a thing; its makeup."
macabre,adjective,rùng rợn,I never would've taken you as an enthusiast of the macabre .,Tôi không bao giờ xếp anh vào hàng những người đam mê sự rùng rợn .,Representing or personifying death.
irreconcilable,adjective,,Differences seem irreconcilable .,Những khác biệt dường như không thể hòa giải .,Unable to be reconciled; opposed; uncompromising.
colossal,adjective,khổng lồ,"It demands colossal patience, all this growing small:",Nó đòi hỏi sự kiên nhẫn khổng lồ Tất cả những thứ này ngày càng nhỏ:,Extremely large or on a great scale.
sinecure,verb,,Galileo looked elsewhere for an academic sinecure where he could pursue his new astronomical interest.,Galileo đã đi tìm những sự tài trợ ở nơi khác để theo đuổi công việc nghiên cứu thiên văn của mình.,A position that requires no work but still gives an ample payment; a cushy job.
emaciated,adjective,gầy mòn,They were alive but emaciated and traumatized.,Các em vẫn sống nhưng gầy mòn và bị khủng hoảng tinh thần.,"Thin or haggard, especially from hunger or disease."
cache,verb,trữ,about a cache of dodo bones that was found,về nơi trữ xương chim Dodo được tìm thấy,"A store of things that may be required in the future, which can be retrieved rapidly, protected or hidden in some way."
fortitude,noun,nghị lực,It speaks of fortitude in the face of threat.,Nó thể hiện nghị lực trong việc đối mặt với nguy hiểm.,the mental strength that enables courage in the face of adversity
intransigent,adjective,không khoan nhượng,I'm afraid my brother can be very intransigent .,Tôi e là em trai tôi có thể rất không khoan nhượng .,Unwilling to compromise or moderate a position; unreasonable; irreconcilable; stubborn.
expropriate,verb,chiếm đoạt,"Just when you feel some people get too wealthy, you just expropriate them.","Khi bạn thấy một số người trở nên quá giàu, bạn chỉ chiếm đoạt từ họ.",To deprive a person of their property. To confiscate. Usually in reference to taking property for public use.
inflammatory,adjective,do viêm,"With the new anti- inflammatories healing takes days, not weeks.","Với những loại thuốc kháng viêm mới, vết mổ sê lành trong vài ngày, chứ không mất đến mấy tuần đâu.",Tending to inflame or provoke somebody.
persecute,Verb,hành hạ,The demons persecuted me so much that my nerves were affected.,Các quỉ hành hạ tôi đến nỗi thần kinh tôi bị ảnh hưởng.,"To pursue in a manner to injure, grieve, or afflict; to beset with cruelty or malignity; to harass; especially, to afflict, harass, punish, or put to death for one's race, sexual identity, adherence to a particular religious creed, or mode of worship."
aspersion,noun,lời nói xấu,But to cast aspersions on his character is proof of desperation.,Nhưng vu khống nhân cách của anh ấy là bằng chứng của sự tuyệt vọng.,"An attack on somebody's reputation or good name, often in the phrase to cast aspersions upon...."
perquisite,noun,bổng lộc,A perquisition among my papers ... Mine?,Ông nói lục soát các giấy tờ của ta... Với ta ư?,(mostly plural) Any monetary or other incidental benefit beyond salary.
