word,part_of_speech,meaning,example,example_meaning,definition
promotion,noun,sự khuyến khích,The promotion for such loans is designed to tempt us to borrow more in order to have more.,Sự khuyến khích cho những món nợ vay mượn như thế là nhằm dụ dỗ chúng ta mượn thêm để có thêm.,An advancement in rank or position.
rate,noun,tốc độ,He is taking eternal prisoners at an alarming rate .,Nó bắt những tù nhân vĩnh cửu theo một tốc độ cực kỳ nhanh chóng.,(transitive) To assign or be assigned a particular rank or level.
recruit,verb,tuyển mộ,I'm supposed to recruit a few guys for this new outfit.,Anh phải tuyển mộ vài người nữa cho đội công tác mới này.,A supply of anything wasted or exhausted; a reinforcement.
applicant,noun,người xin việc,"We even used to ask job applicants , ""Do you have access to a telephone?""","Thậm chí chúng tôi thường hỏi người xin việc : ""Bạn có dùng điện thoại không?""",One who applies for something; one who makes request; a petitioner.
associate,adjective,phó,"Professor Jeremy Pearson , associate medical director at the British Heart Foundation , said the study showed promise , but warned it was still uncertain whether the therapy would produce lasting benefit .","Giáo sư Jeremy Pearson , phó giám đốc y tế tại Quỹ tim mạch Anh cho biết nghiên cứu này có nhiều hứa hẹn nhưng ông cũng cảnh báo thêm rằng vẫn không có gì đảm bảo chắc chắn liệu pháp này sẽ đem lại lợi ích lâu dài .",One that habitually accompanies or is associated with another; an attendant circumstance.
candidate,noun,ứng cử viên,"Well, candidate one is, is pretty far away, candidate two is a little bit closer.","Ứng cử viên số 1 nằm khá xa, ứng cử viên số hai có gần hơn một chút.",A person who is running in an election or who is applying to a position for a job.
colleague,verb,bạn đồng sự,I miss my colleague James E.,Tôi thấy nhớ người bạn đồng sự James E.,"A fellow member of a profession, staff, academic faculty or other organization; an associate"
eager beaver,noun,,Your Sergeant Diggle was an eager beaver .,Trung sĩ Diggle của ông là một người chăm chỉ.,"(idiomatic, colloquial) One (especially a child) who is very excited or enthusiastic to begin a task."
employee,noun,nhân viên,Tom is the best employee we've ever had.,Tom là nhân viên tốt nhất mà chúng ta chưa từng có.,An individual who provides labor to a company or another person.
employer,noun,chủ,You will be more honest with your employers .,Các anh em sẽ lương thiện hơn với những người chủ thuê mình làm.,"A person, firm or other entity which pays for or hires the services of another person."
sponsor,verb,bảo trợ,"In addition, more than 31,000 Church- sponsored volunteers gave more than 600,000 hours of service.","Ngoài ra, hơn 31.000 tình nguyện viên do Giáo Hội bảo trợ đã đóng góp hơn 600.000 giờ phục vụ.",(transitive) To be a sponsor for.
staff,noun,nhân viên,He is an indispensable member for the staff .,Ông ta là một thành viên không thể thiếu của nhân viên .,(uncountable) A mixture of plaster and fibre used as a temporary exterior wall covering (see w:Staff (building material))
supervisor,noun,người giám sát,We're going out the back door before a supervisor comes.,Chúng ta sẽ ra lối cửa sau trước khi người giám sát đến đây.,(management) A person with the official task of overseeing the work of a person or group.
workforce,noun,lực lượng lao động,We'll have to massively re-train our workforce .,Ta cần đào tạo lại lực lượng lao động trên quy mô lớn.,"All the workers employed by a specific organization or nation, or on a specific project"
bridal,noun,đám cưới,So my friends are being really lame and nobody's offered to throw me a bridal shower.,Bạn của em đứa nào cũng lười không đứa nào giúp em tổ chức bữa tiệc trước đám cưới .,"Of or pertaining to a bride, or to wedding; nuptial; as, bridal ornaments; a bridal outfit; a bridal chamber."
vein,noun,tĩnh mạch,The kid's liver's failing because of a massive clot that's blocking his hepatic vein .,Suy gan vì tụ máu nặng gây tắc tĩnh mạch gan.,(anatomy) A blood vessel that transports blood from the capillaries back to the heart
vane,noun,cánh,"Vane , this is Val","Vane , đây là Val",(countable) A weather vane.
aristocratic,adjective,dòng dõi quý tộc,There's a reason why aristocrats developed weak chins.,Không phải ngẫu nhiên mà dòng dõi quý tộc suy kiệt.,"Of or pertaining to an aristocracy; consisting in, or favoring, a government of nobles, or principal men."
rambunctious,adjective,bướng bỉnh,They got rambunctious .,Bọn chúng rất bướng bỉnh !,Energetic and difficult to control.
scud,adjective,Scud,"I'm Josh, you can call me Scud , though.","Tên tôi là Josh, nhưng cứ gọi tôi là Scud .","(slang, Scottish) Naked."
sonata,noun,sonata,"Ideally, I would like to record the complete collection of sonatas .",Em đang có ý định thu một bộ sưu tập đầy đủ các bản sonata .,"(music) A musical composition for one or a few instruments, one of which is frequently a piano, in three or four movements that vary in key and tempo"
rampart,noun,lũy,And we'll go back and dig our graves behind those ramparts .,Ta sẽ quay lại và đào mồ của ta đằng sau những thành lũy .,"A defensive mound of earth or a wall with a broad top and usually a stone parapet; a wall-like ridge of earth, stones or debris; an embankment for defensive purpose."
protracted,adjective,kéo dài,"When we meet new people, protract your S's. It's more dramatic.","Khi chúng ta gặp người mới, kéo dài chữ "" s "" để gây ấn tượng hơn.",Simple past tense and past participle of protract.
opulence,noun,phong phú,But their opulence was no protection.,Nhưng sự sang trọng của họ không che chở họ được.,wealth
provincial,noun,tỉnh,The Indonesian provincial capital Jayapura is situated on the bay.,Thủ phủ Jayapura của tỉnh Papua thuộc Indonesia nằm trên vịnh này.,"Of or pertaining to province; constituting a province; as, a provincial government; a provincial dialect."
clergy,noun,tăng lữ,"It instructed the clergy on how to locate, torture and kill all freethinking women.","Nó huấn thị cho giới tăng lữ cách tim kiếm, tra tấn và giết những phụ nữ suy nghĩ độc lập.","Body of persons, such as ministers, priests and rabbis, who are trained and ordained for religious service."
lilting,adjective,,The lilt .,Sự nhịp nhàng .,"Having a lilt; with energy, spirit and sprightliness; lively and cheerful."
academia,noun,giới học viện,"""My Hero Academia Anime Gets 2nd Season"".",Truy cập ngày 10 tháng 12 năm 2017 . ^ “My Hero Academia Anime Gets 2nd Season”.,"The scientific and cultural community engaged in higher education and research, taken as a whole."
commerce,noun,thương mại,What if there was a stock market for commerce ?,Nếu như có một thị trường chứng khoán cho thương mại thì sao?,"(business) The exchange or buying and selling of commodities; especially the exchange of merchandise, on a large scale, between different places or communities; extended trade or traffic."
blatant,adjective,rành rành,"True, it may irritate you when you see what seems to be blatant favoritism.",Có lẽ bạn bực bội khi thấy sự thiên vị rành rành của thầy cô.,"Bellowing, as a calf; bawling; brawling; clamoring; disagreeably clamorous; sounding loudly and harshly."
cleric,noun,giáo sĩ,"The exiled cleric , Ayatollah Khomeini, returned to rule Iran.",giáo sĩ lưu vong Ayatollah Khomeini trở về để nắm quyền.,A clergy member
morality,noun,đạo đức,She is a tender girl of questionable morals .,Cô ta là một đứa con gái tinh tế với đạo đức đáng ngờ.,(uncountable) Recognition of the distinction between good and evil or between right and wrong; respect for and obedience to the rules of right conduct; the mental disposition or characteristic of behaving in a manner intended to produce morally good results.
canon,noun,giáo sĩ,'Commentary on the Anatomy of a Canon ...','Bài luận về giải phẫu của một giáo sĩ ...',Alternative spelling of canyon.
officiate,verb,làm nhiệm vụ,I am here on official business.,Tôi đang ở đây làm nhiệm vụ chính thức.,"(intransitive, transitive) To perform the functions of some office."
indoctrinate,verb,truyền bá,"From there, we create simulants to spread our ideologies through peaceful indoctrination .",Từ đó chúng tôi có thể tạo ra dạng truyền bá tư tưởng chúng tôi bằng con đường hòa bình.,to brainwash.
lavish,adjective,hoang toàng,What may move some people to want lavish weddings?,Điều gì có thể thúc đẩy một số người muốn có đám cưới lớn một cách linh-đình?,"Expending or bestowing profusely; profuse; prodigal; as, lavish of money; lavish of praise."
rigorous,adjective,khắc nghiệt,The nature of Galileo’s “ rigorous examination” remains a mystery.,Sự thật về việc Galileo bị “thẩm vấn khắc nghiệt ” vẫn còn bí ẩn.,"Manifesting, exercising, or favoring rigor; allowing no abatement or mitigation; scrupulously accurate; exact; strict; severe; relentless; as, a rigorous officer of justice; a rigorous execution of law; a rigorous definition or demonstration."
activist,noun,nhà hoạt động,I think of myself as a national health activist .,Tôi cho mình là nhà hoạt động về sức khỏe quốc gia.,"one who is politically active in the role of a citizen; especially, one who campaigns for change"
formative,adjective,hình thành,Crystals are frequently formed and found...... in volcanic tubes,Đá quý thường được hình thành và tìm thấy...... ở đường ống núi lửa,Of or pertaining to the formation and subsequent growth of something.
statute,noun,đạo luật,Isn't there a statute of limitations on this kind of thing?,Không phải có đạo luật hết hạn nào cho việc này à?,"Written law, as laid down by the legislature."
repugnant,adjective,gớm,You are repugnant .,Cậu là kẻ khó chịu .,(law) opposed or in conflict
unnerve,verb,,People find it unnerving .,Người ta thấy nơi này quá đáng sợ .,"To deprive of nerve, force, or strength; to weaken; to enfeeble."
pacifist,noun,,I'm a pacifist .,Tôi theo chủ nghĩa hòa bình .,"One who loves, supports, or favours peace; one who is pro-peace."
inconspicuous,adjective,kín đáo,"Well, this isn't exactly the inconspicuous relationship I wanted.",Đây không phải mối quan hệ kín đáo mà tôi mong muốn.,Not prominent nor easily noticeable
ostensibly,adverb,bề ngoài,"Ostensibly , turning Mars into a giant gas station.",Có vẻ như sẽ biến Sao Hỏa thành trạm cung ứng nhiên liệu khổng lồ.,"(modal) seemingly, apparently, on the surface"
pestilent,adjective,độc hại,"Nationalism is well described by the psalmist’s expression, “the pestilence causing adversities.”",Chủ nghĩa quốc gia được người viết Thi-thiên diễn tả một cách thích hợp là “dịch-lệ độc - hại ”.,highly injurious or destructive to life: deadly.
dispirited,adjective,chán nản,"Although the Northern public became quite dispirited by the seeming lack of progress at Petersburg, the dramatic success of Sherman at Atlanta helped ensure the reelection of Abraham Lincoln, which guaranteed that the war would be fought to a conclusion.","Mặc dù lúc này nhân dân miền Bắc tỏ ra khá chán nản do tiến độ có vẻ ỳ ạch tại Petersburg, thắng lợi đầy kịch tính của Sherman tại Atlanta đã giúp khẳng định chiến thắng chắc chắn trong lần tái cử của Abraham Lincoln, bảo đảm rằng chiến tranh sẽ diễn ra đến thắng lợi cuối cùng.",Simple past tense and past participle of dispirit.
intercede,verb,nói giùm,And Moses interceded on behalf of the people.,"Vậy, Môi-se nói giùm dân chúng.",(intransitive) To plea on someone else's behalf.
forge,verb,rèn,An army like this would need a huge forge .,Một quân đội như thế này cần một xưởng rèn khổng lồ.,furnace or hearth where metals are heated prior to hammering them into shape
impasse,noun,bế tắc,So I think we're at a kind of impasse here.,Tôi nghĩ chúng ta đang bế tắc tại điểm này.,a road with no exit; a cul-de-sac
munition,verb,đạn dược,I need to know where the munitions are kept.,Tôi cần biết nơi cất giữ đạn dược .,"(usually plural) Armament, weaponry."
law,noun,pháp luật,"I mean, if your passion is law enforcement, you can have a career in law enforcement.","Nếu con đam mê việc thi hành pháp luật , con có thể có công việc như thế.","(uncountable) The body of rules and standards issued by a government, or to be applied by courts and similar authorities."
state,noun,nhà nước,"The Uffizi brought together under one roof the administrative offices and the Archivio di Stato, the state archive.","Uffizi bao gồm các văn phòng hành chính và Archivio di Stato, kho lưu trữ của nhà nước .",Any sovereign polity. A government.
government,noun,chính phủ,The policy of the government was criticized by the opposition party.,Chính sách của chính phủ bị phê phán bởi đảng đối lập.,"The body with the power to make and/or enforce laws to control a country, land area, people or organization."
serve,verb,dọn ăn,"As the founder of our feast, shouldn’t He be the guest of honor, the first to be served ?","Không phải Ngài là vị thượng khách, vị đầu tiên để chúng ta dọn ăn sao?",(sports) the act of putting the ball or shuttlecock in play in various games
decide,verb,quyết định,"Since they had no children of their own, they decided to adopt a little girl.",Vì không sinh con nên họ quyết định nhận nuôi một bé gái.,"(intransitive) To make a judgment, especially after deliberation."
judge,verb,xét xử,Judge Theresa Howard was the judge at his trial.,Thẩm phán Theresa Howard đã xét xử phiên tòa của hắn.,(transitive) To sit in judgment on; to pass sentence on.
manage,verb,quản lý,She manages a shoe store.,Cô ấy quản lý một cửa hàng giày dép.,(transitive) to direct or be in charge of.
duty,noun,nhiệm vụ,You may return to your breakfasts or your other duties .,Quý vị có thể quay về ăn sáng và làm nhiệm vụ của mình.,That which one is morally or legally obligated to do.
term,noun,thuật ngữ,"Around the world, the term has different senses.","Trên thế giới, thuật ngữ này có nhiều ý nghĩa khác nhau.","A limitation, restriction or regulation."
trade,noun,thương mại,President Jefferson did not want the trade ban to last long.,Tổng thống Jefferson không muốn cấm vận thương mại kéo dài.,relating to or used in or intended for trade or commerce;
leader,noun,lãnh đạo,Why is it that our leaders still persist in looking inwards?,Tại sao các nhà lãnh đạo của chúng ta vẫn khăng khăng chỉ nhìn vào bên trong?,Any person or thing that leads or conducts.
district,noun,quận,"Every year from 1992 to 2000, the Republican leadership of the U.S. Congress added a rider to the District of Columbia appropriations bill that prohibited the use of federal or local funds to implement the Health Care Benefits Expansion Act.","Hàng năm từ năm 1992 đến 2002, lãnh đạo Đảng Cộng hòa của Quốc hội Hoa Kỳ đã thêm người lái vào Quận Columbia dự luật chiếm đoạt cấm sử dụng quỹ liên bang hoặc địa phương để thực hiện Đạo luật mở rộng lợi ích chăm sóc sức khỏe.",An administrative division of an area.
program,noun,chương trình,Let us now consider the program itself.,Giờ đây chúng ta hãy xem xét chính chương trình hội nghị.,A set of structured activities.
chamber,noun,phòng,Get out of my chambers .,Ra khỏi văn phòng tôi ngay.,"A room, especially one used primarily for sleeping; bedroom, sleeping room."
mayor,noun,thị trưởng,The mayor thought that he should investigate the decline in tax revenues.,Thị trưởng nghĩ rằng ông ta nên điều tra về việc sụt giảm nguồn thu từ thuế.,"The leader of a city, or a municipality, sometimes just a figurehead and sometimes a powerful position. In some countries, the mayor is elected by the citizens or by the city council."
jury,adjective,ban giám khảo,I fear a jury will see it the same way.,Anh sợ rằng ban giám khảo sẽ nhận ra chuyên này theo cùng một cách.,(law) A group of individuals chosen from the general population to hear and decide a case in a court of law.
urban,adjective,ở thành phố,The chicken is an urban myth.,Con gà đó là chuyện hoang đường ở thành phố .,related to the (or any) city
overturn,verb,lật đổ,"Pouring out the coins of the money changers, he overturns their tables.","Vãi tiền người đổi bạc, ngài lật đổ bàn của họ.","To turn over, capsize or upset (something)"
veto,verb,phủ quyết,We don't want to undermine the veto of permanent members.,Chúng tôi không muốn ngầm phá hoại quyền phủ quyết của thành viên thường trực.,"A political right to disapprove of (and thereby stop) the process of a decision, a law etc."
borough,noun,thành phố,"If you think of medieval cities, medieval cities the boroughs","Nếu nghĩ đến các thành phố trung cổ, thì mỗi thành phố , đường phố",(obsolete) A fortified town; a town or city.
senate,noun,thượng nghị viện,So he decided to run for senate .,Vậy nên anh đã quyết định tranh cử vào thượng nghị viện .,"In some bicameral legislative systems, the upper house or chamber."
general election,noun,cuộc tổng tuyển cử,"And then when he won the general election ,","Và rồi khi ông thắng cuộc tổng tuyển cử ,","An election, usually held at regular intervals, in which candidates are elected in all or most constituencies or electoral districts of a nation."
unicameral,adjective,,The 1935 Constitution established a unicameral National Assembly.,Hiến pháp 1935 thành lập một Quốc hội đơn viện.,"Of, or having a single legislative chamber."
bicameral,adjective,Lưỡng viện,He based it on a theory of consciousness called the Bicameral Mind.,Ông ấy căn cứ theo một học thuyết về ý thức gọi là Bicameral Mind .,"(politics) Having, or pertaining to, two separate legislative chambers or houses."
branch,noun,nhánh,I had the blessing of growing up in a small branch .,Tôi được phước vì lớn lên trong một chi nhánh nhỏ.,The woody part of a tree arising from the trunk and usually dividing
secretary,noun,thư ký,My sister works in a bank as a secretary .,Chị của tôi làm thư ký ở ngân hàng.,(obsolete) Someone entrusted with a secret.
defense,noun,bảo vệ,The second article will examine how to fortify the spiritual defenses of a marriage.,Bài thứ hai sẽ xem xét làm thế nào chúng ta có thể bảo vệ hôn nhân.,"The action of defending or protecting from attack, danger, or injury."
agriculture,noun,nông nghiệp,Although it's called agriculture in the world of food.,"Mặc dù trong thế giới thực phẩm, nó được gọi là nông nghiệp .","The art or science of cultivating the ground, including the harvesting of crops, and the rearing and management of livestock; tillage; husbandry; farming."
education,noun,giáo dục,What do you think about Japan's educational system?,Bạn nghĩ gì về hệ thống giáo dục của Nhật Bản?,"(uncountable) The process or art of imparting knowledge, skill and judgment"
justice,noun,công lý,"16 Then justice will reside in the wilderness,","16 Bấy giờ, công lý sẽ ngự giữa hoang mạc,",The state or characteristic of being just or fair.
energy,noun,năng lượng,The former minister of energy was elected president on Sunday.,Cựu bộ trưởng bộ năng lượng được bầu làm tổng thống hôm chủ nhật.,The impetus behind all motion and all activity.
transportation,noun,giao thông,"If you're a transportation planner, this might be pretty interesting to know.","Nếu bạn là một nhà hoạch định giao thông , điều này có thể rất thú vị.","The act of transporting, or the state of being transported; conveyance, often of people, goods etc."
attorney general,noun,,Madam Attorney General ?,Bà Tổng chưởng lý ?,"A major government officer throughout the English-speaking world, generally responsible for interpreting the law for the head of government and executive department and functioning as chief prosecutor, with the ability to bring civil and criminal actions directly."
election,noun,bầu cử,"Come election day, sure enough, it was a landslide.","Ngày bầu cử tới, và đó là chiến thắng áp đảo.","A process of choosing a leader, members of parliament, councillors, or other representatives by popular vote."
requirement,noun,yêu cầu,The Philippines ' government required both sides to put an end to the attacks .,Chính phủ Philippines đã lên tiếng yêu cầu hai bên chấm dứt các cuộc tấn công .,A necessity or prerequisite; something required or obligatory.
inauguration,noun,lễ khánh thành,What can you tell us about how much I do not know inauguration of the amphitheater?,Ngài thấy lễ khánh thành đấu trường mới thế nào?,"The act of inaugurating, or inducting into office with solemnity; investiture by appropriate ceremonies."
politician,noun,chính khách,News of the scandal caused the politician to lose face.,Tin về vụ bê bối làm mất mặt vị chính khách .,"One engaged in politics, especially an elected or appointed government official."
ratify,verb,phê chuẩn,All of these nations have ratified Kyoto.,Tất cả những quốc gia này đã phê chuẩn nghị định thư Kyoto.,(transitive) To give formal consent to; make officially valid.
unconstitutional,adjective,bất hợp hiến,"""Yemen's Hadi says Houthis decisions unconstitutional "".",Truy cập ngày 21 tháng 2 năm 2015. ^ “Yemen's Hadi says Houthis decisions unconstitutional”.,Contrary to or violative of the constitution of a government or other institution.
decision,verb,sự giải quyết,"It's their decision , not yours.",đó là sự giải quyết của họ không phải của các anh.,A choice or judgement.
document,noun,tài liệu,We have to get that document back before Tom shows it to anyone.,Chúng ta phải lấy lại tài liệu đó trước khi Tom đưa nó cho bất cứ ai.,"An original or official paper relied upon as the basis, proof, or support of anything else, including any writing, book, or other instrument conveying information pertinent to such proof or support. Any material substance on which the thoughts of men are represented by any species of conventional mark or symbol."
preamble,noun,lời mở đầu,"but before that, a little preamble .","nhưng trước hết, 1 vài lời mở đầu .","A short preliminary statement or remark, especially an explanatory introduction to a formal document or statute."
union,noun,liên bang,"The state of the union is bright, and getting brighter.","Thông điệp Liên bang thật sự sáng sủa, và ngày càng sáng sủa hơn.","The act of uniting or joining two or more things into one, or the state of being united or joined; junction; coalition; combination."
tranquility,noun,,They immediately ride to Tranquility Teahouse.,Lúc này họ chạy về Giang Lăng với Tiêu Dịch.,Alternative spelling of tranquillity.
liberty,noun,tự do,The words liberty and jail do not fit together very well.,Những từ tự do và ngục thất thì không tương xứng với nhau lắm.,The condition of being free from control or restrictions.
posterity,noun,con cháu,You are the pioneers for both your progenitors and your posterity .,Các em là những người tiền phong cho cả tổ tiên và con cháu của mình.,"All the future generations, especially the descendants of a specific person."
ordain,verb,ban hành,"And they've thought, "" Oh, what a horrible religion that is which ordains something like that. ""","Họ đã nghĩ rằng đó thật là một tôn giáo tồi tệ đã ban hành , quy định những điều như vậy.",to decree
framer,noun,,He's a framer for one of my latest commissions.,Cậu ấy là nông dân cho một trong những ủy ban của ta.,A person who makes frames for paintings
centralized,adjective,,"Well, I know that you've been rebuilding Central City at night.",Chú biết là cháu đang xây dựng lại Central City vào ban đêm.,Having things physically towards the center; consolidated or concentrated
nominate,verb,đề cử,Tell me how you knew she'd be nominated before she did?,Cho tôi biết tại sao cô biết cô ấy sẽ được đề cử trước cả cô ấy?,"To name someone as a candidate for a particular role or position, including that of an office."
