word,part_of_speech,meaning,example,example_meaning,definition
supernova,noun,siêu tân tinh,"It is estimated to explode as a supernova in approximately 2,000 years.",Người ta ước tính sẽ phát nổ như một siêu tân tinh trong khoảng 2.000 năm.,"(astronomy) A star which explodes, increasing its brightness to typically a billion times that of our sun, though attenuated by the great distance from our sun. Some leave only debris (Type I); others fade to invisibility as neutron stars (Type II)."
vaporize,verb,bốc hơi,"Then more water vapor goes into the air, forming yet another potent greenhouse gas.","Sau đó nước bốc hơi vào không khí, lại hình thành nên một tầng khí nhà kính.",Turn into vapour.
extraterrestrial,adjective,ngoài trái đất,Is there perhaps an extraterrestrial plan for the human species?,Có thể có một kế hoạch ngoài trái đất cho loài người?,"Originating from outside of the Earth's atmosphere, from space, or from another planet; alien to Earth or its environment."
molecule,noun,phân tử,"Now molecules are really, really tiny.","Những phân tử này thực sự, thực sự nhỏ xíu.",(chemistry) The smallest particle of a specific element or compound that retains the chemical properties of that element or compound; a group of atoms held together by chemical bonds.
enzyme,noun,enzym,"In carbonic anhydrases, a histidine proton shuttle is utilized to rapidly shuttle protons away from a zinc-bound water molecule to quickly regenerate the active form of the enzyme .","Trong enzym carbonic anhydrase, một kênh vận chuyển proton histidin được dùng để vẩn chuyển nhanh proton ra khỏi một phân tử nước được gắn với kẽm để nhanh chóng kích hoạt dạng hoạt động của enzym .",(biochemistry) A globular protein that catalyses a biological chemical reaction.
regime,noun,chế độ,"But today, the international drug control regime is starting to crumble.","Nhưng hôm nay, chế độ quản lý ma túy thế giới đang bắt đầu đổ vỡ.","A form of government, or the government in power (as in a socialist regime)"
symbiotic,adjective,cộng sinh,The symbiotic Nephroselmis is different from the free-living form.,Vật cộng sinh Nephroselmis khác biệt so với khi sống tự do.,"(biology) Of, or relating to symbiosis; living together."
nonsectarian,adjective,không tôn giáo,"Golden Gate University is a private, nonsectarian , coeducational university formed in 1901 and located in the Financial District.",Đại học Golden Gate là một đại học tư đồng giáo dục không giáo phái được thành lập nằm 1901 và nằm trong khu tài chính San Francisco.,Of or pertaining to nonsectarianism.
arcane,adjective,huyền bí,An arcane medical procedure performed by savages upon those possessed of evil spirits.,1 thủ thuật y khoa huyền bí thực hiện bởi những kẻ man rợ vì họ bị ám ảnh bởi linh hồn quỷ dữ.,Understood by only a few; obscure; requiring secret or mysterious knowledge.
trajectory,noun,quỹ đạo,"Now, angle the trajectory facing the Turks.","Giờ, canh góc quỹ đạo giáp mặt với người Thổ.",The path of a body as it travels through space.
radioactive,adjective,phóng xạ,The birch had taken up the radioactive gas.,Cái cây bạch dương đã hấp thu khí phóng xạ .,Exhibiting radioactivity.
constellation,noun,chòm sao,I count the sparkle of constellations to foretell the future of my love.,Tôi đếm tia sáng những chòm sao như một lời tiên đoán cho tình yêu của mình.,An arbitrary formation of stars perceived as a figure or pattern.
centrifugal,noun,ly tâm,This entire facility's a centrifuge .,Cả cơ sở này là một máy ly tâm .,"Tending, or causing, to recede from the center."
tectonic,adjective,kiến tạo,And the same thing about tectonic plates.,Đĩa kiến tạo thì cũng vậy thôi.,of or relating to construction or to architecture
immolate,verb,cúng tế,"Necrocraft pilots, enact immolation initiative.","Các phi công Necrocraft, tiến hành thảm sát đi.",to kill as a sacrifice
binary,adjective,nhị nguyên,is because we think of love as a binary thing.,là vì chúng ta coi tình yêu như một thứ nhị nguyên .,"Being in a state of one of two mutually exclusive conditions such as on or off, true or false, presence or absence of a signal."
destined,adjective,đã đựơc định sẵn,The main regular destination is Irkutsk.,Trung tâm hành chính là Irkutsk.,Confined to a predetermined fate or destiny; certain.
recapitulation,noun,bản tóm tắt lại,Her work was recapitulated in 2009 with Jason Cryan.,Tác phẩm của cô đã được tóm tắt lại vào năm 2009 với Jason Cryan.,"A subsequent brief recitement or enumeration of the major points in a narrative, article, or book."
isotope,verb,chất đồng vị,"But in this case, we measured the different isotopes of oxygen.","Nhưng trong trường hợp này, chúng ta đo lường chất đồng vị khác nhau của ôxy","(physics) Any of two or more forms of an element where the atoms have the same number of protons, but a different number of neutrons within their nuclei. As a consequence, atoms for the same isotope will have the same atomic number but a different mass number (atomic weight)."
nascent,adjective,mới sinh,The growing polypeptide is often termed the nascent chain.,Chuỗi polypeptide đang hình thành thường được gọi là chuỗi mới sinh (nascent chain).,Emerging; just coming into existence.
intergalactic,adjective,,That's my intergalactic spaceship.,Đó là tàu vũ trụ liên sao của tôi,Occurring between galaxies.
accretion,noun,phần bồi thêm,Newtonian accretion ?,Định luật Newton ?,The act of increasing by natural growth; especially the increase of organic bodies by the internal accession of parts; organic growth.
presumptive,adjective,cho là đúng,Presumption Receiving Stolen Property 410.,Tội bắt cóc nhằm chiếm đoạt tài sản Điều 170.,"Based on presumption, probability, conjecture, hypothesis or belief"
quasar,noun,chuẩn tinh,"with a few others, make them quasars .","với một vài đặc điểm khác nữa, biến lỗ đen thành chuẩn tinh .","(astronomy) An extragalactic object, starlike in appearance, that is among the most luminous and thought to be the most distant objects in the universe."
temporize,Verb,chờ thời,"You can't, it would create a temporal paradox.",Anh ko thể đâu nó sẽ tạo ra 1 nghịch lý thời gian .,"To deliberately act evasively or prolong a discussion in order to gain time or postpone a decision, sometimes in order to reach a compromise or simply to make a conversation more temperate."
turbid,adjective,đục,P. papuensis is found in turbid rivers and swampy lagoons and backwaters.,"P. papuensis được tìm thấy ở các con sông nước đục , các phá đầm lầy và nước tù đọng.",Having the lees or sediment disturbed; roiled; muddy; thick; not clear; -- used of liquids of any kind
causality,noun,nguyên nhân,"And indeed, people know the causal links quite well","Và thật ra, mọi người đã biết khá rõ nguyên nhân","The agency of a cause; the action or power of a cause, in producing its effect."
vertex,noun,đỉnh,Max. vertex blend matrix palette size,Cỡ bảng chọn ma trận hoà trộn đỉnh tối đa,The highest point of something.
evocative,adjective,dễ gợi liên tưởng,It's very evocative .,Rất dễ gợi sự liên tưởng .,"that evokes (brings to mind) a memory, mood, feeling or image; redolent or reminiscent"
sentient,adjective,có cảm giác,"The word “soul” (Hebrew, neʹphesh), as it appears here in the Bible account of creation, refers to a breathing, sentient creature, whether fish, bird, animal or man.","Chữ “linh hồn” (tiếng Hê-bơ-rơ neʹphesh) nói về một sinh vật có hơi thở, có cảm giác , dù là cá, chim, thú vật hay người, theo như chữ ấy được dùng trong sự tường thuật của Kinh-thánh về sự sáng tạo.",Conscious or aware.
complicated,adjective,phức tạp,"In reality, the explanation is a bit more complicated than this, but you get the gist.","Trong thực tế, giải thích là một chút phức tạp hơn điều này, nhưng bạn nắm được ý chính.",(Biology) Folded longitudinally (as in the wings of certain insects)
cerebral,adjective,âm quặt lưỡi,Cerebral malaria.,Sốt rét thể não .,"(anatomy, medicine) Of, or relating to the brain or cerebral cortex of the brain."
cuneiform,adjective,chữ hình nêm,"As the need for record-keeping increased, cuneiform writing was developed.","Khi nhu cầu lưu trữ tài liệu gia tăng, chữ hình nêm đã được phát triển.",Having the form of a wedge; wedge-shaped.
happenstance,noun,,Nothing is happenstance .,Không có gì là ngẫu nhiên cả.,(countable) A chance or random event or circumstance.
prohibition,noun,luật cấm,"“For example,” Buddhika went on, “the laws of many lands include prohibitions against murder, stealing, and adultery.","Anh Kha nêu ví dụ: “Nhiều nước có luật cấm giết người, trộm cắp và ngoại tình.","An act of prohibiting, forbidding, disallowing, or proscribing something."
obituary,noun,cáo phó,"Do you know, I used to look in the papers every day for your obituary .",Anh có biết là em đã có xem tờ báo ghi phần cáo phó của anh không?,"A brief notice of a person’s death, as published in a newspaper."
citified,adjective,,,,Simple past tense and past participle of citify.
reprobate,adjective,bài xích,Reprobate .,Tội lỗi quá .,(rare) Rejected; cast off as worthless.
cauldron,noun,vạc,Again all the court watched the father place the cauldron on the table .,Lại một lần nữa cả triều đình nhìn vua cha đặt cái vạc trên bàn .,A large bowl-shaped pot used for boiling over an open flame.
penitentiary,adjective,nhà tù,"Expert in the penitentiary system, are you, boy?",Anh là chuyên gia trong hệ thống nhà tù à?,(US) A state or federal prison for convicted felons.
grudge,noun,mối hận thù,"Man, you really hold a grudge .","Anh bạn, thực sự anh đang giữ mối hận thù đấy.",(countable) Deep-seated animosity or ill-feeling about something or someone.
pauper,noun,người nghèo túng,I will die a pauper .,Tôi sẽ chết như một người nghèo túng,One who is extremely poor.
mirage,noun,ảo ảnh,Do you want to die chasing a mirage ?,Ông muốn chết vì săn đuổi một ảo ảnh ?,"An optical phenomenon in which light is refracted through a layer of hot air close to the ground, giving the appearance of there being refuge in the distance."
suspect,verb,nghi,"Do you suspect Mr. Bickersteth would suspect anything, Jeeves, if I made it up to five hundred? "" "" I fancy not, sir.","Bạn có nghi ngờ ông Bickersteth sẽ nghi ngờ bất cứ điều gì, Jeeves, nếu tôi làm cho nó 500? "" Tôi thích không, thưa ông.",(transitive) To imagine or suppose (something) to be true without evidence.
contraption,noun,máy kỳ cục,The crew here has tried to teach me how to use this contraption here.,Mấy nhân viên ở đây đã cố dạy tôi cách dùng cái máy kỳ cục này.,"A mechanical device of any sort, especially one that is complicated."
valise,noun,túi du lịch,You know that valise of mine?,Cậu biết cái rương của tôi?,A piece of hand luggage such as a suitcase or travelling bag.
rumor,noun,lời đồn,"Yeah, well, then it's more than a rumor , Bob.","Vậy thì nó còn hơn cả lời đồn , mấy giờ rồi?","(countable) A statement or claim of questionable accuracy, from no known reliable source, usually spread by word of mouth."
corpse,noun,xác chết,"A lion and a crow in strange alliance, fighting across a sea of corpses .","Con sư tử và con quạ trong một liên minh kì lạ, chiến đấu trên biển xác chết .",a dead body
cadaver,noun,xác chết,"Believed cadavers would rise, reclaim hearts from golden jars.",Tin rằng các xác chết sẽ sống lại lấy lại trái tim từ những chiếc lọ vàng.,A dead body; especially the corpse of a human to be dissected.
anvil,noun,đe,"But as a result, instead of a figurative hammer (Shields) striking at Jackson on an anvil (Frémont), all Lincoln could hope for would be a pincer movement catching Jackson at Strasburg, which would require intricate timing to succeed.","Nhưng hậu quả của sự thay đổi này là thay vì tạo thành một ""cái búa"" Shields đánh dồn Jackson vào ""cái đe "" Frémont, thì toàn bộ những gì Lincoln có thể mong chờ là một gọng kìm chặn bắt Jackson tại Strasburg, điều này đòi hỏi việc sắp đặt thời gian phức tạp hơn nhiều để giành thắng lợi.",A heavy iron block used in the blacksmithing trade as a surface upon which metal can be struck and shaped.
shimmer,verb,chiếu sáng lờ mờ,You're shimmering .,Lung linh quá.,"(intransitive) To shine with a veiled, tremulous, or intermittent light; to gleam faintly; to glisten; to glimmer."
client,noun,khách hàng,You wanna go call some clients or something?,Em muốn đi gọi cho vài khách hàng không?,"A customer, a buyer or receiver of goods or services."
consumer,noun,người tiêu dùng,"Banks, consumers , we're moving money around in circles.","Ngân hàng, người tiêu dùng , chúng ta cho tiền chạy vòng quanh.","One who, or that which, consumes."
customer,noun,khách hàng,We do this for our customers who handle special clients.,Chúng tôi làm việc này cho những khách hàng mà có khách hàng đặc biệt.,"a patron; one who purchases or receives a product or service from a business or merchant, or plans to"
entrepreneur,noun,doanh nhân,"However, there is a secret to work with entrepreneurs .","Tuy nhiên, có một bí mật để làm việc với các doanh nhân .",A person who organizes and operates a business venture and assumes much of the associated risk.
inventor,noun,người sáng chế,The inventor is an old schoolmate of mine.,Người sáng chế ra nó là bạn học cũ của tôi.,"One who invents, either as a hobby or as an occupation."
investor,noun,đầu tư,And my investor agreed that we should make a move before the price went up.,Và nhà đầu tư của tôi đồng ý rằng chúng tôi nên ra tay trước khi giá lên.,A person who invests money in order to make a profit.
brand,noun,hiệu,"You know, you think about, brands are starting to fill the gaps.","Bạn biết đấy, bạn nghĩ về, thương hiệu đang bắt đầu lấp vào các khoảng trống.","(archaic or poetic) A piece of wood red-hot, or still burning, from the fire."
company,verb,Công ty,What's the name of the company you work for?,Công ty chỗ cậu làm tên gì?,"(archaic) To accompany, keep company with."
conglomerate,adjective,Conglomerate,Those living outside the Kasnian Conglomerate are dressed in rags.,Những người sống bên ngoài Kasnian Conglomerate đang mặc giẻ rách đấy.,A cluster of heterogeneous things.
design,verb,thiết kế,"Out of the two designs , I prefer the former to the latter.","Trong hai thiết kế , tôi thích cái trước hơn cái sau.","A plan (with more or less detail) for the structure and functions of an artifact, building or system."
industry,noun,công nghiệp,Detroit is famous for its car industry .,Detroit nổi tiếng về ngành công nghiệp xe hơi.,(uncountable) The tendency to work persistently.
capital,adjective,Vốn,Capital flows to where it is treated the best .,Vốn luôn chảy đến nơi nó được đối xử tốt nhất .,"(uncountable) (economics) Already-produced durable goods available for use as a factor of production, such as steam shovels (equipment) and office buildings (structures)."
discount,noun,bớt giá,"After years of business, do I have a discount ?","Sau nhiều năm kinh doanh, tôi có được bớt giá không?","To deduct from an account, debt, charge, and the like; to make an abatement of; as, merchants sometimes discount five or six per cent for prompt payment of bills."
economic,adjective,kinh tế,Small cars are very economical because of their low fuel consumption.,Xe hơi nhỏ rất kinh tế bởi vì nó tiêu thụ ít xăng.,frugal; cheap (in the sense of representing good value); economical.
financial,adjective,tài chính,He relies on his wife financially .,Anh ấy phụ thuộc vợ về mặt tài chính .,having dues and fees paid up to date for a club or society (a financial member)
funding,verb,quỹ,And they need to borrow from my trust fund .,Họ cần mượn quỹ ủy thác của em.,Present participle of fund.
marketing,noun,marketing,We met at a marketing convention in Vegas.,Chúng ta gặp nhau tại một hội nghị marketing ở Vegas.,Present participle of market.
percentage,noun,tỷ lệ phần trăm,"All, from the poorest to the richest, pay the same percentage .","Mọi người, từ người nghèo nhất đến người giàu nhất, đều đóng tỷ lệ phần trăm như nhau.",A share of the profits.
prediction,noun,sự dự đoán,I'm skeptical of predicting any future... which includes me.,Tôi hoài nghi về sự dự đoán bất cứ tương lai nào kể cả tôi.,A statement of what will happen in the future.
acquisition,noun,cái giành được,Confirm acquisition .,Xác nhận mẫu vật .,The act or process of acquiring.
advertisement,noun,quảng cáo,"My wife's a chef, and I'm in advertising .","Vợ tôi là một đầu bếp, và tôi làm trong ngành quảng cáo .","(marketing) A commercial solicitation designed to sell some commodity, service or similar."
allocate,verb,phân phối,We've allocated every Extra man we have.,Chúng tôi đã phân phối thêm người chúng tôi có.,To set aside for a purpose
budget,noun,ngân sách,"Crave mainly focused on budget titles, and imported games such as Kaido Battle.",Hãng chỉ tập trung vào các khoản ngân sách và các tựa game nhập khẩu như Kaido Battle.,"(obsolete) A wallet, purse or bag."
campaign,noun,chiến dịch,Mr. Wilson just made a sizeable contribution to my campaign .,Anh Wilson vừa đóng góp rất lớn cho chiến dịch tranh cử của mẹ.,"A series of operations undertaken to achieve a set goal; as, an election campaign, a military campaign, an advertising campaign."
collaboration,noun,sự cộng tác,They invest in professional development and collaboration and many other things.,Họ đầu tư để nâng cao chuyên môn và sự cộng tác và nhiều việc khác nữa.,The act of collaborating.
competition,noun,cuộc thi,"And I'm always looking around, like, where is my competition ?","Và tôi luôn luôn nhìn xung quanh, như thế, cuộc thi của tôi đâu?",(uncountable) The action of competing.
endorsement,noun,sự tán thành,"Good,'cause I got a bidding war starting for Marco's endorsement .","Tốt, bởi vì tôi đã phải đấu tranh để đấu thầu dành được sự tán thành cho Marco.",The act or quality of endorsing
generate,verb,phát ra,I was using them to generate something called plasma.,Tớ dùng để phát ra thứ gọi là tia plasma.,(transitive) To bring into being; give rise to.
guarantee,verb,bảo đảm,"Third, discipleship does not guarantee freedom from the storms of life.","Thứ ba, vai trò môn đồ không bảo đảm sự thoát khỏi những cơn bão tố trong đời.",Anything that assures a certain outcome.
incorporate,adjective,hợp nhất,1948 Yonaguni-chō is incorporated as a town.,1948 Yonaguni-chō được hợp nhất thành một thị trấn.,(transitive) To include (something) as a part.
invest,verb,đầu tư,The government doesn't invest much in education.,Chính phủ không đầu tư nhiều vào giáo dục.,(dated) To clothe or wrap (with garments).
merge,verb,hợp nhất,We have to merge the inner and outer event horizons.,Chúng ta phải hợp nhất miền trong và miền ngoài của nó.,(transitive) To combine into a whole.
pitch,verb,ném,Great pitching and now good batting?,"Ném bóng tốt, giờ lại còn đập bóng cũng khá nữa?","A sticky, gummy substance secreted by trees; sap."
profitable,adjective,có lợi,They're three of the most profitable casinos in Las Vegas.,Đó là ba trong số những sòng bạc có lợi nhuận cao nhất ở Las Vegas.,producing a profit
promote,verb,xúc tiến,Then they promote the uptake of nutrients.,Vậy thì chúng giúp xúc tiến khả năng hấp thụ dinh dưỡng.,"(transitive) To raise (someone) to a more important, responsible, or remunerative job or rank."
revolutionary,adjective,nhà cách mạng,"In your experience, how do bankers usually fare with revolutionaries ?","Theo kinh nghiệm của ngài, ngân hàng gặp khó khăn như nào với các nhà cách mạng ?","Of or pertaining to a revolution in government; tending to, or promoting, revolution; as, revolutionary war; revolutionary measures; revolutionary agitators."
apply,verb,áp dụng,Learn and apply divine principles for acquiring spiritual knowledge.,Học hỏi và áp dụng các nguyên tắc thiêng liêng để đạt được sự hiểu biết thuộc linh.,"(transitive) To lay or place; to put or adjust (one thing to another);—with to; as, to apply the hand to the breast; to apply medicaments to a diseased part of the body."
career,noun,nghề nghiệp,"No, it was sort of a career shift.","Không, đó là sự chuyển hướng nghề nghiệp .",One's calling in life; a person's occupation; one's profession.
deadline,verb,hạn cuối,"If you'll excuse me, my dear, I have something of a deadline to meet.","Nếu như được phép, cô em, tôi có chút chuyện để làm cho hạn cuối của tôi.",A date on or before which something must be completed.
employment,noun,việc làm,"You seemed to have your pick of employment , including right here.","Cô có vẻ như có rất nhiều cơ hội việc làm , kể cả ở ngay đây.","A use, purpose"
experience,verb,kinh nghiệm,Do you have professional experience ?,Anh có kinh nghiệm chuyên môn không?,Event(s) of which one is cognizant.
job,noun,công việc,It's part my job .,Đây là một phần của công việc .,A task.
labor,verb,bàn bạc chi tiết,He was also described as imposing heavy tax and labor burdens on the people.,Ông cũng được mô tả là đã áp thuế và phu dịch nặng nề đối với người dân.,"(uncountable) Workers in general; the working class, the workforce;sometimes specificallythe labor movement, organised labor."
management,noun,ban quản lý,"After a while, the camp management found out about the meetings we were holding.","Một thời gian sau, ban quản lý trại biết được các buổi họp của chúng tôi.","(uncountable, management) administration; the process or practice of managing."
occupation,noun,nghề nghiệp,Occupation ?,Nghề nghiệp ?,"An activity or task with which one occupies oneself; usually specifically the productive activity, service, trade, or craft for which one is regularly paid."
office,noun,văn phòng,He is not always in the office in the morning.,Không phải lúc nào anh ấy cũng ở văn phòng vào buổi sáng.,A building or room where clerical or professional duties are performed.
opportunity,noun,cơ hội,Every calling provides an opportunity to serve and to grow.,Mỗi sự kêu gọi cung ứng một cơ hội để phục vụ và tăng trưởng.,"a chance for advancement, progress or profit."
benefit,verb,lợi dụng,"So, for the time being, I'm gonna make this slavery malarkey work to my benefit .","Thế nên hiện tại, tôi sẽ lợi dụng cái vụ nô lệ bịp bợp này vậy.","An advantage, help or aid from something."
compensate,verb,bù,Because the death of a child is compensated by one more child.,Bởi vì một đứa trẻ mất đi được bù đắp bởi một đứa trẻ nữa.,To pay someone in exchange for work done or some other consideration.
counterproductive,adjective,,That can be counterproductive .,Việc này có thể phản tác dụng .,More of a hindrance than a help.
demand,Verb,Cầu,You must not give way to those demands .,Bạn không nên đưa ra những yêu cầu đó.,The desire to purchase goods and services.
earn,verb,kiếm được,"In full retirement at age 63, Rockefeller earned over $58 million in investments in 1902.","Khi nghỉ hưu đầy đủ ở tuổi 63, Rockefeller kiếm được hơn 58 triệu đô la đầu tư vào năm 1902.","(transitive) To gain (success, reward, recognition) through applied effort or work."
freelance,adjective noun,tự do,"It's just freelance right now, but you wanna expand when Kim goes off to college.",Hiện đang làm tự do nhưng em muốn mở rộng khi Kim vào đại học.,(intransitive) To work as a freelance
incentive,adjective,sự khuyến khích,The second tool we reach for is incentives .,Công cụ thứ hai ta dùng là sự khuyến khích .,"Something that motivates, rouses, or encourages."
income,noun,thu nhập,His income is now double what it was ten years ago.,Thu nhập của anh ấy đã tăng gấp đôi so với 10 năm trước.,(obsolete) A coming in; arrival; entrance; introduction.
monotonous,adjective,đơn điệu,I am tired of my monotonous life.,Tớ chán cuộc sống đơn điệu rồi.,having an unvarying tone or pitch
