Title,Subtitle,Description,Thumbnail Link,Book Purchase Link,Author,Category,Link
A Light in the Darkness,"Janusz Korczak, His Orphans, and the Holocaust","This biography details the life of Janusz Korczak, a Polish doctor who refused to abandon the orphaned children in his care during the Holocaust.",https://cdn.vocabulary.com/units/6ojqilks/cover.jpeg?width=220&v=17b83d1553a,https://www.amazon.com/dp/1524701238?tag=vocabulary01-20,Albert Marrin,"Grade 6,Grade 7,Grade 8,Grade 9,Grade 10,Grade 11,Grade 12,Literature,Non-Fiction",/lists/6ojqilks/light-in-the-darkness
Masterminds,,"In this first book of the Masterminds trilogy, a shocking secret about the safe and happy life in Serenity, New Mexico is revealed through the perspectives of five middle school students.",https://cdn.vocabulary.com/units/6ol73mc7/cover.png?width=220&v=187b8dc2953,https://www.amazon.com/dp/0062299999?tag=vocabulary01-20,Gordon Korman,Grade 5,/lists/6ol73mc7/masterminds
I Wish You All the Best,,"After being thrown out of their parents' house, nonbinary teen Ben De Backer moves in with their sister and attempts to navigate their anxiety disorder and an intense new friendship.",https://cdn.vocabulary.com/units/6ovf3nx3/cover.jpeg?width=220&v=18f2b12f0a6,https://www.amazon.com/dp/133830612X?tag=vocabulary01-20,Mason Deaver,Literature,/lists/6ovf3nx3/i-wish-you-all-the-best
"Guns, Germs, and Steel",The Fates of Human Societies,"In this Pulitzer Prize-winning book, Jared Diamond explores how geographical, biological, and environmental factors shaped the development of human societies.",https://cdn.vocabulary.com/units/6pe2bvrz/cover.jpeg?width=220&v=16c44ccdeee,https://www.amazon.com/dp/0393354326?tag=vocabulary01-20,Jared Diamond,"Grade 6,Grade 7,Grade 8,Grade 9,Grade 10,Grade 11,Grade 12,Non-Fiction,Just for Fun",/lists/6pe2bvrz/guns-germs-and-steel
September Sampler,"Vocabulary for This Month's Holidays, Occasions, and Events","Ahoy there! Talk Like a Pirate Day is just one of the fun happenings on this month's calendar. Celebrate September the wordy way with this varied collection of vocabulary, which includes lists for Constitution Day, Punctuation Day, and more.",https://cdn.vocabulary.com/units/6q5gre74/feature.png?width=500&v=191a36e537b,,,Just for Fun,/lists/6q5gre74/september-sampler
Ripped from the Headlines: December 2021,Our Weekly Roundups of Current Events Vocabulary,"Each week, we peruse the news to give you a word’s-eye view of what’s happening in the world. Here are some of our favorite examples from current events and culture stories. Whether you’re a news nerd, a word nerd, or you just like learning, these lists are a fun way to wrap up your week.",https://cdn.vocabulary.com/units/6qrwsaza/feature.png?width=500&v=18502006b13,,,Events,/lists/6qrwsaza/ripped-from-the-headlines-december-2021
Lincoln's Grave Robbers,,This nonfiction account details how members of a counterfeiting ring plotted to hold Abraham Lincoln's body for ransom.,https://cdn.vocabulary.com/units/6r3vyt7r/cover.jpeg?width=220&v=17570f273b1,https://www.amazon.com/dp/1338290134?tag=vocabulary01-20,Steve Sheinkin,"Grade 6,Grade 7,Grade 8,Grade 9,Grade 10,Grade 11,Grade 12,Non-Fiction",/lists/6r3vyt7r/lincolns-grave-robbers
Friday Night Lights,"A Town, a Team, and a Dream","In this nonfiction account, the journalist focuses on the Permian Panthers in Odessa, Texas to explore how high school football shapes the lives and dreams of small towns in America.",https://cdn.vocabulary.com/units/6s44ozil/cover.jpeg?width=220&v=18a29179cdf,https://www.amazon.com/dp/0306824205?tag=vocabulary01-20,H.G. Bissinger,"Grade 10,Non-Fiction,Just for Fun",/lists/6s44ozil/friday-night-lights
A Long Way Home,,"In this memoir, Brierley, who was adopted by an Australian couple, describes his search for his family of origin in India.",https://cdn.vocabulary.com/units/6skrnd6t/cover.jpeg?width=220&v=1727fceea84,https://www.amazon.com/dp/0425276198?tag=vocabulary01-20,Saroo Brierley,"Grade 7,Grade 8,Grade 9,Grade 10,Grade 11,Grade 12,Literature,Non-Fiction",/lists/6skrnd6t/long-way-home
This is My America,,"Tracy, a seventeen-year-old living in Texas, tries to prove that her father and brother are innocent of the crimes of which they've been accused.",https://cdn.vocabulary.com/units/6thmllyy/cover.jpeg?width=220&v=176f2def443,https://www.amazon.com/dp/0593118766?tag=vocabulary01-20,Kim Johnson,Literature,/lists/6thmllyy/this-is-my-america
The 57 Bus,,This award-winning book explores the true story of two teens whose lives were forever changed after a violent encounter on a city bus.,https://cdn.vocabulary.com/units/6tl6dyz2/cover.jpeg?width=220&v=16aeaaa6958,https://www.amazon.com/dp/0374303231?tag=vocabulary01-20,Dashka Slater,Non-Fiction,/lists/6tl6dyz2/57-bus
The Mighty Heart of Sunny St. James,,"After a heart transplant, Sunny St. James resolves to reinvent herself — but she must navigate complicated relationships with her new best friend and with the mother who abandoned her.",https://cdn.vocabulary.com/units/6trnd4kr/cover.jpeg?width=220&v=1720548ca2e,https://www.amazon.com/dp/031651554X?tag=vocabulary01-20,Ashley Herring Blake,Literature,/lists/6trnd4kr/mighty-heart-of-sunny-st-james
Fresh Ink,An Anthology,"This collection of diverse short stories, edited by Lamar Giles, brings together new work by established and up-and-coming young adult authors.",https://cdn.vocabulary.com/units/6v5axsxb/cover.jpeg?width=220&v=17628a1b146,https://www.amazon.com/dp/1524766313?tag=vocabulary01-20,Lamar Giles,"Grade 6,Grade 7,Grade 8,Grade 9,Grade 10,Grade 11,Grade 12,Literature",/lists/6v5axsxb/fresh-ink
All My Sons,,"In the aftermath of World War II, two families come to terms with their involvement in the manufacture of faulty airplane parts that caused the deaths of many soldiers.",https://cdn.vocabulary.com/units/6vcuikpd/cover.jpeg?width=220&v=16fe8ac2ab7,https://www.amazon.com/dp/0141185465?tag=vocabulary01-20,Arthur Miller,"Grade 6,Grade 7,Grade 8,Grade 9,Grade 10,Grade 11,Grade 12,Literature",/lists/6vcuikpd/all-my-sons
A Bend in the River,,"An Indian merchant experiences uncertainty, love, and hardship when he relocates to a town in central Africa.",https://cdn.vocabulary.com/units/6vqkxi7q/cover.jpeg?width=220&v=177459abac6,https://www.amazon.com/dp/0679722025?tag=vocabulary01-20,V.S. Naipaul,"Grade 6,Grade 7,Grade 8,Grade 9,Grade 10,Grade 11,Grade 12,Literature",/lists/6vqkxi7q/bend-in-the-river
The Black Kids,,"As protests and unrest rock Los Angeles, teenager Ashley Bennett deals with family turmoil and prejudice in her community.",https://cdn.vocabulary.com/units/6vwtnfst/cover.jpeg?width=220&v=17749922b20,https://www.amazon.com/dp/1534462724?tag=vocabulary01-20,Christina Hammonds Reed,"Grade 9,Grade 10,Grade 11,Grade 12,Literature",/lists/6vwtnfst/black-kids
Turtle in Paradise,,"During the Great Depression, an eleven-year-old girl tackles challenges and finds adventure when she moves in with relatives in Key West, Florida.",https://cdn.vocabulary.com/units/6woosd5j/cover.jpg?width=220&v=17c0458cf1c,https://www.amazon.com/dp/0375836909?tag=vocabulary01-20,Jennifer L. Holm,"Grade 5,Literature",/lists/6woosd5j/turtle-in-paradise
Habibi,,"When her Arab-American family moves to Jerusalem, Liyana is unprepared for the prejudice they face — or for the close bond she forms with a Jewish boy named Omer.",https://cdn.vocabulary.com/units/6wsff2xa/cover.jpeg?width=220&v=16c256d394e,https://www.amazon.com/dp/0689825234?tag=vocabulary01-20,Naomi Shihab Nye,Literature,/lists/6wsff2xa/habibi
Vincent and Theo,,This award-winning book explores the relationship between artist Vincent van Gogh and his brother Theo.,https://cdn.vocabulary.com/units/6wtffwqe/cover.jpeg?width=220&v=16c2500ca4b,https://www.amazon.com/dp/0805093397?tag=vocabulary01-20,Deborah Heiligman,"Grade 6,Grade 7,Grade 8,Grade 9,Grade 10,Grade 11,Grade 12,Non-Fiction",/lists/6wtffwqe/vincent-and-theo
The Graveyard Book,,"This spooky novel tells the story of Bod, a young boy who is raised in a cemetery by ghosts after his parents are murdered.",https://cdn.vocabulary.com/units/6ygwqzol/cover.jpeg?width=220&v=16c2fee89de,https://www.amazon.com/dp/0060530944?tag=vocabulary01-20,Neil Gaiman,"Grade 6,Literature",/lists/6ygwqzol/graveyard-book
Tolkien Reading Day,,"Tolkien Reading Day has been celebrated on March 25th every year since 2003. March 25th was chosen as the day to commemorate the life and works of J.R.R. Tolkien because that was the date of the downfall of Sauron in Tolkien's The Lord of the Rings. Whether you're a diehard fan of the renowned author or just starting to read his works, celebrate Tolkien Reading Day with this collection of vocabulary that comes from some of his most popular works.",https://cdn.vocabulary.com/units/6yr66jyo/feature.png?width=500&v=195b8db392d,,,Just for Fun,/lists/6yr66jyo/tolkien-reading-day
Children of Blood and Bone,,"In the first novel in Adeyemi's fantasy series, Zélie attempts to overthrow a repressive king and bring magic back to her land.",https://cdn.vocabulary.com/units/6zn2zcmu/cover.jpeg?width=220&v=16c777ab3d0,https://www.amazon.com/dp/1250170974?tag=vocabulary01-20,Tomi Adeyemi,"Grade 8,Literature,Non-Fiction",/lists/6zn2zcmu/children-of-blood-and-bone
Esperanza Rising,,"When tragedy strikes, Esperanza's family has to leave their ranch in Mexico and move to a farmworkers' camp during the Great Depression.",https://cdn.vocabulary.com/units/6zody5y3/cover.jpeg?width=220&v=16d5036acf2,https://www.amazon.com/dp/043912042X?tag=vocabulary01-20,Pam Muñoz Ryan,"Grade 5,Literature,Non-Fiction",/lists/6zody5y3/esperanza-rising
A Bounty of November Resources,Feast on This Cornucopia of Lists,"Gobble up this autumnal assortment of lists for November’s holidays and special events, including Native American Heritage Month, National Aviation Month, Thanksgiving, Election Day, Veterans Day, and even National Pickle Day.",https://cdn.vocabulary.com/units/6zs5wd3x/feature.png?width=500&v=16e436b04e4,,,Just for Fun,/lists/6zs5wd3x/bounty-of-november-resources
Kristy's Great Idea,,"In this first book of The Baby-Sitters Club series, twelve-year-old Kristin Amanda Thomas comes up with the idea to team up with other baby-sitters to advertise and make appointments for individual services in their small Connecticut town.",https://cdn.vocabulary.com/units/724lsct7/cover.png?width=220&v=18974cf6b2e,https://www.amazon.com/dp/1338642200?tag=vocabulary01-20,Ann M. Martin,"Literature,Just for Fun",/lists/724lsct7/kristys-great-idea
Frankenstein,,"In this groundbreaking novel, Dr. Victor Frankenstein works feverishly to bring an inanimate creature to life — but when he finally succeeds, he is horrified by what he has unleashed. Read the full text here.",https://cdn.vocabulary.com/units/72ofxrtn/cover.jpeg?width=220&v=181495bab8e,https://www.amazon.com/dp/0393927938?tag=vocabulary01-20,Mary Shelley,"Grade 10,Grade 12,Literature",/lists/72ofxrtn/frankenstein
Education and Academics,,"Studying words related to education and academics not only enhances your language proficiency but also proves invaluable in preparing for the IELTS exam. This collection of vocabulary can help you effectively respond to various academic topics, enabling you to excel in the reading and listening sections of the test. Moreover, utilizing precise academic language in the writing and speaking sections demonstrates your command over formal expressions, further boosting your overall IELTS performance.",https://cdn.vocabulary.com/units/735x54ei/feature.png?width=500&v=189ada9c2b0,,,Test-Prep,/lists/735x54ei/ielts-exam-education-and-academics
Fahrenheit 451,,"In Fahrenheit 451, Ray Bradbury imagines a dystopian future in which firemen burn banned books and people are constantly bombarded with mindless entertainment. This classic novel is as powerful and relevant today as it was when it was first published in 1953.",https://cdn.vocabulary.com/units/73tsfezr/cover.jpeg?width=220&v=1813973343c,https://www.amazon.com/dp/1451673310?tag=vocabulary01-20,Ray Bradbury,"Grade 9,Grade 10,Grade 11,Grade 12,Literature",/lists/73tsfezr/fahrenheit-451
The Sky at Our Feet,,"Believing that his mother has been deported to Afghanistan, twelve-year-old Jason runs away to New York City, where he meets Max, a mischievous girl with epilepsy.",https://cdn.vocabulary.com/units/76sspyjg/cover.jpeg?width=220&v=16c300c8b6f,https://www.amazon.com/dp/006242193X?tag=vocabulary01-20,Nadia Hashimi,Literature,/lists/76sspyjg/sky-at-our-feet
Same Sun Here,,"Meena and River, twelve-year-olds from very different backgrounds, become pen pals.",https://cdn.vocabulary.com/units/76x2ix6n/cover.jpeg?width=220&v=17ac40ff404,https://www.amazon.com/dp/0763664510?tag=vocabulary01-20,Silas House,Literature,/lists/76x2ix6n/same-sun-here
My Side of the Mountain,,"Crowded by his parents and eight siblings in a New York City apartment, twelve-year-old Sam Gribley runs away to live by himself on his great-grandfather's abandoned farm in the Catskill Mountains.",https://cdn.vocabulary.com/units/77bkzovc/cover.jpeg?width=220&v=18926588a9e,https://www.amazon.com/dp/0142401110?tag=vocabulary01-20,Jean Craighead George,"Grade 6,Grade 7,Grade 8,Grade 11,Just for Fun",/lists/77bkzovc/my-side-of-the-mountain
What If It's Us,,"Arthur and Ben couldn't be more different. Arthur, a Jewish teenager from Georgia, is in New York City for a summer internship that he hopes will help him get into an Ivy League college. Ben, a native New Yorker of Puerto Rican descent, is attending summer school so that he can avoid repeating 11th grade. Find out what happens when a series of coincidences brings these two together.",https://cdn.vocabulary.com/units/77luls7n/cover.jpeg?width=220&v=16c256949b1,https://www.amazon.com/dp/0062795252?tag=vocabulary01-20,Becky Albertalli,Literature,/lists/77luls7n/what-if-its-us
Circumference,Eratosthenes and the Ancient Quest to Measure the Globe,This nonfiction book recounts the story of how a 245 BCE sea journey from Athens to Alexandria inspired Eratosthenes of Cyrene to contemplate the stars and measure the distance around the earth.,https://cdn.vocabulary.com/units/77omg6g5/cover.png?width=220&v=18631cbc660,https://www.amazon.com/dp/0312372477?tag=vocabulary01-20,Nicholas Nicastro,"Grade 9,Grade 10,Non-Fiction",/lists/77omg6g5/circumference
For Black Girls Like Me,,"A cross-country move, questions about her adoption and origins, and an incident of racism at school all have Makeda wondering where she belongs.",https://cdn.vocabulary.com/units/7billuae/cover.jpeg?width=220&v=16d26e168ae,https://www.amazon.com/dp/0374308047?tag=vocabulary01-20,Mariama J. Lockington,"Literature,Non-Fiction",/lists/7billuae/for-black-girls-like-me
Gone to the Woods,Surviving a Lost Childhood,"In this memoir, Gary Paulsen explores his difficult childhood and details the experiences that led him to write the acclaimed novel Hatchet and its sequels.",https://cdn.vocabulary.com/units/7bm4sfxs/cover.jpeg?width=220&v=17a153c3442,https://www.amazon.com/dp/0374314152?tag=vocabulary01-20,Gary Paulsen,Non-Fiction,/lists/7bm4sfxs/gone-to-the-woods
Crispin: The Cross of Lead,,"After being accused of theft, orphan Crispin is on the run in medieval England. As he crosses the country and evades his enemies, he discovers a startling secret about his true identity.",https://cdn.vocabulary.com/units/7bnkp5uc/cover.jpeg?width=220&v=16e473a14a3,https://www.amazon.com/dp/0786808284?tag=vocabulary01-20,Avi,"Grade 5,Grade 6,Grade 7,Grade 8,Literature",/lists/7bnkp5uc/crispin-the-cross-of-lead
Breakout,,"Seventeen-year-old Audelia Thigpen decides to drive away from her Los Angeles foster home, but gets stuck in a traffic jam, which gives her time to reflect on her own and others' lives.",https://cdn.vocabulary.com/units/7cnesl7r/cover.png?width=220&v=1899da448ee,https://www.amazon.com/dp/0689871899?tag=vocabulary01-20,Paul Fleischman,Literature,/lists/7cnesl7r/breakout
By the Great Horn Spoon!,,"During the Gold Rush, twelve-year-old Jack journeys to California in hopes of striking it rich.",https://cdn.vocabulary.com/units/7d34ll2z/cover.jpg?width=220&v=177074511bc,https://www.amazon.com/dp/0316286125?tag=vocabulary01-20,Sid Fleischman,Grade 5,/lists/7d34ll2z/by-the-great-horn-spoon
"Carry On, Mr. Bowditch",,"This novel is a fictionalized biography of Nathaniel Bowditch, a mathematical genius who begins work as an indentured servant on a ship before becoming a captain and celebrated navigator.",https://cdn.vocabulary.com/units/7e6dhalb/cover.jpeg?width=220&v=1803ceb8d8e,https://www.amazon.com/dp/0618250743?tag=vocabulary01-20,Jean Lee Latham,"Grade 6,Grade 7,Grade 8,Literature",/lists/7e6dhalb/carry-on-mr-bowditch
Americanah,,"This novel tells the story of Ifemelu and Obinze, Nigerians who immigrate to the United States and London, respectively, and eventually reunite in their homeland.",https://cdn.vocabulary.com/units/7el2obqu/cover.jpeg?width=220&v=16aeaaa6958,https://www.amazon.com/dp/0307455920?tag=vocabulary01-20,Chimamanda Ngozi Adichie,"Grade 6,Grade 7,Grade 8,Grade 9,Grade 10,Grade 11,Grade 12,Literature",/lists/7el2obqu/americanah
You're Not Supposed to Die Tonight,,"At an upstate New York terror-simulation experience based on events from the slasher film The Curse of Camp Mirror Lake, seventeen-year-old Charity is supposed to be the final girl who survives.",https://cdn.vocabulary.com/units/7f6ppzco/cover.png?width=220&v=18d8982b0da,https://www.amazon.com/dp/1547611545?tag=vocabulary01-20,Kalynn Bayron,Literature,/lists/7f6ppzco/youre-not-supposed-to-die-tonight
Words to Describe Art and Literature,,"Looking for the perfect word to describe a blockbuster movie, a favorite novel, or a museum's latest exhibit? This collection of artsy adjectives will help you paint pictures with words!",https://cdn.vocabulary.com/units/7fsl7oc6/feature.png?width=500&v=17b7e386e7e,,,Just for Fun,/lists/7fsl7oc6/words-to-describe-art-and-literature
Rules,,"To help her younger brother make sense of life in Maine (and avoid embarrassment), twelve-year-old Catherine writes down a list of rules.",https://cdn.vocabulary.com/units/7huzzjxv/cover.jpeg?width=220&v=188defa7620,https://www.amazon.com/dp/0439443830?tag=vocabulary01-20,Cynthia Lord,"Grade 5,Literature",/lists/7huzzjxv/rules
Beowulf,,Nobel Prize-winning poet Seamus Heaney translates the Old English epic poem about a warrior's battles with a series of monsters.,https://cdn.vocabulary.com/units/7imftoaa/cover.jpeg?width=220&v=16e651841da,https://www.amazon.com/dp/0393320979?tag=vocabulary01-20,Seamus Heaney,"Grade 12,Literature",/lists/7imftoaa/beowulf
Dress Coded,,"Eighth-grader Molly is fed up with her school's unfair dress code policy, so she starts a podcast to protest it, sparking a rebellion.",https://cdn.vocabulary.com/units/7imqvuqd/cover.jpeg?width=220&v=183a4037a5a,https://www.amazon.com/dp/1984816438?tag=vocabulary01-20,Carrie Firestone,Literature,/lists/7imqvuqd/dress-coded
One Half from the East,,"The youngest of four daughters, ten-year-old Obayda must pretend to be a boy to help her family in Afghanistan.",https://cdn.vocabulary.com/units/7ipf2nej/cover.png?width=220&v=1890d587f6c,https://www.amazon.com/dp/0062421913?tag=vocabulary01-20,Nadia Hashimi,"Grade 6,Grade 7,Grade 8,Grade 9,Grade 10,Grade 11,Grade 12,Literature",/lists/7ipf2nej/one-half-from-the-east
Candide,,"In this satirical French novella, a wide-eyed optimist gradually becomes disillusioned. Learn these words from the Modern Library translation. Read the full text here.",https://cdn.vocabulary.com/units/7isccfd2/cover.jpeg?width=220&v=16e85a01a3d,https://www.amazon.com/dp/0812972015?tag=vocabulary01-20,Voltaire,"Grade 9,Grade 10",/lists/7isccfd2/candide
Purple Hibiscus,,"Kambili and Jaja's life among the elite in Nigeria isn't so easy under the thumb of their oppressive father. When the country becomes mired in political turmoil, they are sent to stay with their aunt, where they learn a different way of life.",https://cdn.vocabulary.com/units/7iw4n4kz/cover.jpeg?width=220&v=16aeaaa6958,https://www.amazon.com/dp/B00B78AIV0?tag=vocabulary01-20,Chimamanda Ngozi Adichie,"Grade 6,Grade 7,Grade 8,Grade 9,Grade 10,Grade 11,Grade 12,Literature",/lists/7iw4n4kz/purple-hibiscus
The Chosen,,"In the 1940s, two Jewish teenagers from different backgrounds develop a deep friendship as they pursue their ambitions.",https://cdn.vocabulary.com/units/7kazeps7/cover.jpeg?width=220&v=16c2ff786db,https://www.amazon.com/dp/0449213447?tag=vocabulary01-20,Chaim Potok,Literature,/lists/7kazeps7/chosen
Sugar,,"Ten-year-old Sugar endures grueling work on a sugar plantation, but her friendships with the plantation owner's son and new Chinese laborers offer her hope and community.",https://cdn.vocabulary.com/units/7lmoh4cx/cover.jpeg?width=220&v=17010da05d8,https://www.amazon.com/dp/0316043060?tag=vocabulary01-20,Jewell Parker Rhodes,"Grade 5,Grade 6,Grade 7,Grade 8,Literature",/lists/7lmoh4cx/sugar
Founding Brothers,The Revolutionary Generation,"This nonfiction account explores the lives and ideas of six ""Founding Fathers"" of the United States: George Washington, Alexander Hamilton, Thomas Jefferson, Benjamin Franklin, John Adams, and James Madison.",https://cdn.vocabulary.com/units/7ma5mfw6/cover.jpeg?width=220&v=1761f1fac97,https://www.amazon.com/dp/0375705244?tag=vocabulary01-20,Joseph J. Ellis,"Grade 6,Grade 7,Grade 8,Grade 9,Grade 10,Grade 11,Grade 12,Non-Fiction",/lists/7ma5mfw6/founding-brothers
Dicey's Song,"The Tillerman Cycle, Book 2",Dicey and her siblings adjust to life on their grandmother's farm.,https://cdn.vocabulary.com/units/7mabkkue/cover.jpeg?width=220&v=17abf36ef99,https://www.amazon.com/dp/1442428791?tag=vocabulary01-20,Cynthia Voigt,Literature,/lists/7mabkkue/diceys-song
Foreign Words and Phrases Used in English,,"You've got carte blanche to learn these foreign words and phrases that commonly appear in English speech and writing. Whether you want to add gravitas to your writing or simply to avoid making a faux pas, mastering these words will help you become a bona fide vocabulary star!",https://cdn.vocabulary.com/units/7mdntuqn/feature.png?width=500&v=179d7a7d371,,,"Grade 5,Grade 6,Grade 7,Grade 8,Grade 9,Grade 10,Grade 11,Grade 12,Roots & Affixes",/lists/7mdntuqn/foreign-words-and-phrases-commonly-used-by-english-speakers
Watched,,"After a minor run-in with the police, eighteen-year-old Naeem is offered a terrible choice: go to court or spy on members of his community.",https://cdn.vocabulary.com/units/7mwkrof4/cover.jpeg?width=220&v=16d1d0543e6,https://www.amazon.com/dp/0553534211?tag=vocabulary01-20,Marina Budhos,Literature,/lists/7mwkrof4/watched
Fallen Angels,,"After finishing high school, aspiring writer Richard Perry does not have the money for college, so he decides to enlist in the army and ends up fighting for his life in Vietnam.",https://cdn.vocabulary.com/units/7nyspiyy/cover.jpeg?width=220&v=189d69205ab,https://www.amazon.com/dp/0545055768?tag=vocabulary01-20,Walter Dean Myers,"Grade 9,Grade 10,Grade 11,Grade 12,Literature",/lists/7nyspiyy/fallen-angels
The Remains of the Day,,This novel by Nobel laureate Kazuo Ishiguro explores the interior life of a traditional English butler.,https://cdn.vocabulary.com/units/7o2tflqb/cover.jpeg?width=220&v=16aeaaa6958,https://www.amazon.com/dp/0679731725?tag=vocabulary01-20,Kazuo Ishiguro,"Grade 6,Grade 7,Grade 8,Grade 9,Grade 10,Grade 11,Grade 12,Literature",/lists/7o2tflqb/remains-of-the-day
A Place to Belong,,"Like many Japanese-Americans, Hanako and her family are imprisoned in an American internment camp during World War II. After the war ends, they emigrate to Japan — but they struggle to make a home in a country that is unfamiliar to them.",https://cdn.vocabulary.com/units/7o7p5vkt/cover.jpeg?width=220&v=16da6ae709d,https://www.amazon.com/dp/1481446649?tag=vocabulary01-20,Cynthia Kadohata,"Grade 6,Grade 7,Grade 8,Grade 9,Grade 10,Grade 11,Grade 12,Literature",/lists/7o7p5vkt/place-to-belong
If You Come Softly,,"Two teenagers, both of whom feel like outsiders at their prep school, form a close bond.",https://cdn.vocabulary.com/units/7oj3dt3p/cover.jpeg?width=220&v=17c318a5706,https://www.amazon.com/dp/0142415227?tag=vocabulary01-20,Jacqueline Woodson,Literature,/lists/7oj3dt3p/if-you-come-softly
Zachary Ying and the Dragon Emperor,,"Possessed by the two-thousand-year-old spirit of the First Emperor Ying Zheng, twelve-year-old Zack must travel from Maine to China to save both his mom and the mortal realm.",https://cdn.vocabulary.com/units/7olar46b/cover.png?width=220&v=18dd2406553,https://www.amazon.com/dp/1665900717?tag=vocabulary01-20,Xiran Jay Zhao,Literature,/lists/7olar46b/zachary-ying-and-the-dragon-emperor
"Nine, Ten",A September 11 Story,"This novel traces the lives of four middle schoolers before, during, and after September 11, 2001.",https://cdn.vocabulary.com/units/7om2rkcf/cover.jpeg?width=220&v=16c256944c0,https://www.amazon.com/dp/1442485078?tag=vocabulary01-20,Nora Raleigh Baskin,Literature,/lists/7om2rkcf/nine-ten
The House of the Scorpion,,"This award-winning dystopian novel tells the story of Matt Alacrán, clone and captive of a powerful feudal lord. Follow Matt as he tries to escape the sinister forces at work in the country of Opium.",https://cdn.vocabulary.com/units/7p3xx6xs/cover.jpeg?width=220&v=188def7928e,https://www.amazon.com/dp/0689852231?tag=vocabulary01-20,Nancy Farmer,"Grade 9,Grade 10,Grade 11,Grade 12",/lists/7p3xx6xs/house-of-the-scorpion
"The Ear, the Eye and the Arm",,"In the year 2194, three daring children are on the run in Zimbabwe—but three detectives are hot on their trail.",https://cdn.vocabulary.com/units/7pbjhwvv/cover.jpeg?width=220&v=16c24db8381,https://www.amazon.com/dp/054535661X?tag=vocabulary01-20,Nancy Farmer,"Grade 6,Grade 7,Grade 8,Grade 9,Grade 10,Grade 11,Grade 12,Literature",/lists/7pbjhwvv/ear-the-eye-and-the-arm
