word,part_of_speech,meaning,example,example_meaning,definition
perturbation,noun,sự lo sợ,Perturbed Spirit.,Cảm xúc sôi trào.,(uncountable) Agitation; the state of being perturbed
abhorrent,adjective,ghê tởm,Practices formerly considered abhorrent have become acceptable.,Những thực hành mà trước đây người ta cho là ghê tởm nay đã được chấp nhận.,"Abhorring; detesting; having or showing abhorrence; loathing; hence, strongly opposed to; as, abhorrent thoughts."
combustible,adjective,dễ cháy,You do know that the formula's highly combustible ?,Mày có biết công thức đó rất dễ cháy không?,A material that is capable of burning.
hydrosphere,noun,thủy quyển,Its physical properties shape the hydrosphere and are an essential part of the water cycle and climate.,Tính chất vật lý của nó hình thành thủy quyển và là phần thiết yếu của vòng tuần hoàn nước và khí hậu.,"All the waters of the Earth, as distinguished from the land and the gases of the atmosphere."
polymer,noun,polyme,"The linking process is called polymerization, while the chains, or networks, are called polymers .","Quá trình liên kết được gọi là trùng hợp, trong khi các chuỗi, hoặc mạng, được gọi là polyme .","(chemistry) A long or larger molecule consisting of a chain or network of many repeating units, formed by chemically bonding together many identical or similar small molecules called monomers. A polymer is formed by polymerization, the joining of many monomer molecules."
organelle,noun,bào quan,Vesicles can also fuse with other organelles within the cell.,Túi cũng có thể dung hợp với những bào quan khác trong tế bào.,"(cytology) A specialized structure found inside cells that carries out a specific life process (e.g.ribosomes, vacuoles)."
eukaryote,noun,sinh vật nhân chuẩn,"However, these characteristics are also shared with other eukaryotes .","Tuy nhiên, các đặc trưng này cũng chia sẻ với các sinh vật nhân chuẩn khác.","Any of the single-celled or multicellular organisms, of the taxonomic domain Eukaryota, whose cells contain at least one distinct nucleus."
variability,noun,[tính,All we can be sure of is the variability will be different.,Những gì chúng ta có thể chắc chắn là tính biến đổi sẽ khác nhau.,the state or characteristic of being variable
convocation,noun,hội nghị,"On 20 April, the Convocation reconvened to consider the revision of the Bishops' Book.","Ngày 20 tháng 4, Hội nghị được triệu tập nhằm hiệu đính Sách của các Giám mục.",The act of calling or assembling by summons.
jamb,verb,rầm cửa,"Stone walling, flooring, lintels, and jambs had appeared sporadically during the Archaic Period, though it is true that a building of the size of the step pyramid made entirely out of stone had never before been constructed.","Tường, sàn, lintel và rầm cửa đá đã xuất hiện lác đác ở thời cổ, dù thực tế rằng việc xây dựng một công trình cỡ Kim tự tháp bậc và làm hoàn toàn bằng đá chưa bao giờ có.","(architecture, interior decorating, finish carpentry) The vertical components that form the sides of a door frame, window frame, or fireplace, or other opening in a wall."
denigration,noun,sự gièm pha,The denigration of one's art.,Khinh rẻ tài nghệ của một người.,The act of making black; a blackening or defamation
proctor,noun,giám thị,"Miss Proctor , it's been a delight.","Bà Giám Thị ạ, nó là niềm khoái cảm đấy.","(UK, law) A legal practitioner in ecclesiastical and some other courts"
procrastination,noun,sự chần chừ,That's procrastination .,Đó chính là sự chần chừ .,"The act of postponing, delaying or putting off, especially out of habitual carelessness or laziness."
shamrock,noun,cây lá chụm hoa,"Oh, it's your lucky day, Shamrock .","Oh, ngày may mắn của mày, Cỏ ba lá .","The trefoil leaf of any small clover, especially Trifolium repens, or such a leaf from a clover-like plant."
elf,noun,kẻ tinh nghịch,Papa Elf .,Ba gia-tinh .,"A mythical, supernatural being resembling but seen as distinct from humans."
martial art,noun,võ thuật,We have regular martial arts training.,Chúng ta có thường xuyên võ thuật đào tạo.,"Commonly, any of several fighting styles which contain systematized methods of training for combat, both armed and unarmed; often practised as a sport, e.g. boxing, karate, judo, Silat, wrestling, or Muay Thai."
pangolin,noun,tê tê,"In Vietnam, restaurants can charge as much as $150 per pound of pangolin meat.","Tại Việt Nam, các nhà hàng có thể tính phí tới 150 USD / pound thịt tê tê .","The scaly anteater; any of several long-tailed, scale-covered mammals of the order Pholidota of tropical Africa and Asia"
gladiator,noun,đấu sĩ,Why they chose gladiators worldwide and not only the Romans?,Sao họ lại chọn các đấu sĩ trên toàn thế giới mà không chọn từ Rome?,"(in ancient Rome) a person (professional or slave) who entertained the public by engaging in mortal combat with another, or with a wild animal"
mush,verb,chất đặc sệt,They're really a sort of cosmic mush .,Chúng thật sự là một loại chất đặc sệt thuộc về vũ trụ,"(uncountable) A mess, often of food; a soft or semisolid substance."
redefine,verb,Định nghĩa lại,"And so we said, right, we'd redefined charity.","Và vì vậy chúng tôi đã nói, đúng, chúng ta đã định nghĩa lại tổ chức từ thiện.","(computing) to define an area of storage, that has already been defined, in a different manner (e.g. both as character and numeric) - to allow multiple processing methods"
pollen,noun,phấn hoa,Pollen gets deposited on the feathers of the birds’ forehead and breast.,Phấn hoa sẽ dính vào lông trên đầu và trên ức của chúng.,A fine granular substance produced in flowers. Collective term for pollen grains or microspores produced in the anthers of flowering plants.
tournament,noun,cuộc đấu,This was Daigo's first trip to the U.S. and his first overseas tournament appearance.,Đây là lần đầu tiên Umehara đến Mỹ và là cuộc đấu đầu tiên ở nước ngoài.,"(historical) During the Middle Ages, a series of battles and other contests designed to prepare knights for war."
hostage,noun,con tin,"The bank's closed, so we've no hostages to worry about.","Ngân hàng đang đóng cửa, nên không cần lo về con tin .","A person given as a pledge or security for the performance of the conditions of a treaty or stipulations of any kind, on the performance of which the person is to be released."
dna,,DNA,The photograph provided key information that was essential for developing a model of DNA .,Bức ảnh cung cấp thông tin quan trọng cần thiết cho việc phát triển một mô hình DNA .,chemicals
retract,Verb,thụt vào,"Okay, that's not retracting .","Được rồi, nó không thụt vào .","(transitive) To pull back inside (for example, an airplane retracting its wheels while flying)."
unrest,noun,sự băn khoăn,"At Billboard, Jason Lipshutz evoked that the ""new album was the result of unrest , but as its title suggests, she has positively embraced her dissatisfaction and subsequently grown as an artist.""","Trên Billboard, Jason Lipshutz gọi ""album mới này là thành quả của sự băn khoăn , nhưng giống như tựa đề có nói, cô cho thấy mặt tích cực thông qua sự bất mãn và trưởng thành ở tư cách của một nghệ sĩ.""","A state of trouble, confusion and turbulence, especially in a political context; a time of riots, demonstrations and protests."
mercantilism,noun,chủ nghĩa trọng thương,"During his travels to Western Europe, Duke Jacob became an eager proponent of mercantilism .","Sau những chuyến du hành tới Tây Âu, Công tước Jacob đã trở thành người đề xướng hăng hái chủ nghĩa trọng thương .","An economic theory that holds that the prosperity of a nation depends upon its supply of capital, and that the global volume of trade is ""unchangeable""."
industrialization,noun,công nghiệp hoá,But my neighbor only knows two types of countries -- industrialized and developing.,Nhưng láng giềng của tôi chỉ biết hai nhóm quốc gia -- công nghiệp hoá và đang phát,a process of social and economic change whereby a human society is transformed from a pre-industrial to an industrial state
urbanization,noun,sự,"From an estimated 200 million people that currently live in low-lying coastal regions, the development of urban coastal centers is projected to increase the population by fivefold within 50 years.","Từ khoảng 200 triệu người hiện đang sống ở các vùng đất thấp ven biển, sự phát triển của các trung tâm đô thị ven biển dự kiến sẽ tăng dân số 5 lần trong vòng 50 năm.",the process of the formation and growth of cities
muckraker,noun,muckraker,"The muckraker of learned monopolies was François Rabelais, himself a man of vast and vagrant learning.","Người quấy rối giới độc quyền trí thức là Francois Rabelais, bản thân ông là một người thông thái và lang bạt khắp nơi.",(US) One who investigates and exposes issues of corruption that often violate widely held values; e.g. one who exposes political corruption or the poor conditions in prisons.
militarism,noun,chủ nghĩa quân phiệt,"Besides, I could see a growing militarism all around.","Ngoài ra, tôi cũng thấy chủ nghĩa quân phiệt ngày càng lan rộng khắp nơi.","an ideology which claims that the military is the foundation of a society's security, and thereby claims to be its most important aspect"
neutrality,noun,trung lập,We don't say children are neutral ; children are positive.,"Ta đừng nói chúng là trung lập , lạc quan.",The state or quality of being neutral; the condition of being unengaged in contests between others; state of taking no part on either side; indifference.
isolationism,noun,chủ nghĩa biệt lập,"I just think we're not seeing, at the moment, the huge opportunities open to us by the ability of people to cooperate in a world where either there was isolationism before or there was limited alliances based on convenience which never actually took you to deal with some of the central problems.",Tôi chỉ nghĩ là hiện tại chúng ta đang chưa thấy được những cơ hội lớn mở ra với chúng ta nhờ có khả năng hợp tác của mọi người trong một thế giới mà ở đó hoặc có chủ nghĩa biệt lập trước đó hoặc có các liên minh bị giới hạn dựa trên sự thuận tiện mà không bao giờ thực sự giúp bạn giải quyết một số các vấn đề trọng tâm.,A national (or group) policy of non-interaction with other nations (or groups).
treaty,noun,hiệp ước,Treaties mean nothing to the Inhumans.,Các hiệp ước không có nghĩa gì với các Inhuman.,"(international law) A binding agreement under international law concluded by subjects of international law, namely states and international organizations."
superpower,noun,siêu cường,I think it's already part of a Euro- Turkish superpower .,Tôi nghĩ nước ngày đã là một bộ phận của một siêu cường quốc Euro- Thổ Nhĩ Kỳ.,"(Obsolete usage) Electricity generated in a large plant that is tied into a regional network, on a larger scale than was common in the early years of commercial electricy production."
cold war,noun,chiến tranh lạnh,Then came the end of the Cold War .,Rồi Chiến Tranh Lạnh kết thúc.,A period of hostile relations between rivals where direct open warfare between them is largely undesired and avoided.
democracy,noun,Dân chủ,Representative democracy is one form of government.,Dân chủ đại diện là một hình thức của chính phủ.,"(uncountable) Rule by the people, especially as a form of government; either directly or through elected representatives (representative democracy)."
imperialism,noun,chủ nghĩa đế quốc,Our enemy is American imperialism .,Kẻ thù của chúng ta chính là Chủ nghĩa đế quốc Mỹ.,The policy of forcefully extending a nation's authority by territorial gain or by the establishment of economic and political dominance over other nations.
