word,part_of_speech,meaning,example,example_meaning,definition
propulsive,adjective,đẩy tới,The Propulsion System of the Jellyfish,Hệ thống đẩy tới của con sứa,Of or pertaining to propulsion
schwa,noun,,This problem is usually solved by insertion of the schwa .,Vấn đề này thường được giải quyết bằng cách chèn các nguyên âm trung tính ( schwa ).,"An indeterminate central vowel sound as the ""a"" in ""about"", represented as /ə/ in IPA and /@/ in SAMPA and X-SAMPA."
turnstile,noun,cửa xoay,The spacecraft was also equipped with one 136 MHz telemetry turnstile .,Tàu vũ trụ cũng được trang bị một cửa quay từ xa 136 MHz.,"A rotating mechanical device that controls and counts passage between public areas, especially one that only allows passage after a charge has been made."
volcanic,noun,núi lửa,Perhaps volcanic heat could generate enough to get life off the ground in Titan.,Nhiệt núi lửa có khả năng cung cấp đủ cho sự sống khởi đầu trên bề mặt.,"Of or pertaining to a volcano or volcanoes; as, volcanic heat."
cathedral,adjective,nhà thờ lớn,"Flying buttresses, just as in a cathedral , help strengthen the crown of the tree","Trụ chống, giống như trong một nhà thờ lớn giúp gia cố ngọn cây","A big church building, central place for some area."
drill,noun,khoan,"It's none of my business, but a power drill and some titanium bits will get you a lot further than that camera.","Không phải việc của tôi, nhưng một mũi khoan và một chút titan sẽ thuận tiện hơn là một chiếc máy ảnh.",(transitive) To create (a hole) by removing material with a drill [tool].
yoga,noun,yoga,Y'all need to be at a yoga class or something.,Cả hai nên vào lớp học yoga đi.,Any of several Hindu discipline aimed at training the consciousness for a state of perfect spiritual insight and tranquillity; especially a system of exercises practiced to promote control of the body and mind.
defector,noun,kẻ đào ngũ,Kohl's job was killing defectors .,Công việc của Kohl là thủ tiêu những kẻ đào ngũ .,one who defects.
tribe,noun,bộ lạc,"Near Mono Lake, they took refuge with the nearby Mono tribe of Paiute.","Gần hồ Mono, họ đã lánh nạn với bộ lạc Mono gần đó của Paiute.","A socially, ethnically, and politically cohesive group of people."
expiration,noun,sự mãn hạn,Omit this tag if your video does not expire .,Bỏ qua thẻ này nếu video của bạn không có ngày hết hạn.,"The act or process of breathing out, or forcing air from the lungs through the nose or mouth; as, respiration consists of inspiration and expiration; -- opposed to inspiration."
retriever,noun,người thu nhặt,It's a response algorithm for Fetch Retrieve .,Đây là một thuật toán đáp ứng của Fetch Retrieve .,a type of gun dog that retrieves game for a hunter
audio,adjective,âm thanh,Audio Player Settings,Thiết lập trình phát âm thanh,Of or relating to audible sound.
audiology,noun,thính học,During this time she earned bachelor’s and master’s degrees in speech pathology and audiology and an EdS (Education Specialist) degree from Brigham Young University.,"Trong thời gian này, chị nhận được bằng cử nhân và cao học về môn bệnh lý nói và nghe và EdS (Chuyên Gia về Giáo Dục) ở trường Brigham Young University.","The study of hearing, especially of hearing defects and their treatment"
audiometer,noun,cái đo sức nghe,,,An instrument which is used to determine the acuity of hearing.
audiovisual,adjective,nghe nhìn,"I wanted ""Upwake"" to have the same audiovisual qualities as a movie would.","Tôi muốn ""Upwake"" có chất lượng nghe nhìn giống như một bộ phim.",Containing both aural and visual elements.
audibility,noun,độ nghe rõ,Audible Bell,Chuông nghe được,The quality of being heard or understood; the degree to which a thing is audible.
audile,adjective,,,,Pertaining to hearing.
auditive,adjective,thính giác,What audition ?,Thử vai nào?,Of or relating to hearing; auditory.
homeopathy,noun,Vi lượng đồng căn,What is homeopathy ?,Homeopathy là gì?,"(medicine) a system of treating diseases with small amounts of substances which, in larger amounts, would produce the observed symptoms."
allopathy,noun,phép chữa đối chứng,,,(uncountable) traditional medicine
euphony,noun,luật hài âm,"This phrase, relying on a patriotic poem written by Max von Schenkendorf during the Napoleonic Wars, was popularized as the more euphonious Blut und Eisen (""Blood and Iron""), and became symbolic of Bismarckian Machtpolitik (""Power politics"").","Cụm từ này, dựa trên một bài thơ yêu nước Das eiserne Kreuz được viết bởi Max von Schenkendorf trong chiến tranh Napoleon, mà được phổ biến rộng rãi và trở nên biểu tượng của chính trị quyền lực Bismarck.",A pronunciation of letters and syllables which is pleasing to the ear.
symphony,noun,giao hưởng,"The symphonies of Mozart, Beethoven, and as late as Brahms, were still played on natural trumpets.","Những bản giao hưởng của Mozart, Beethoven, và muộn nhất, của Brahms, vẫn chơi trên kèn thường.","an extended piece of music of sophisticated structure, usually for orchestra"
antiphony,noun,bài hát đối,"Songs using antiphony , in which choirs and/ or soloists responded to one another, were also much appreciated.","Ngoài ra, những bài với thể loại hát đối đáp giữa hợp xướng với đơn ca cũng được yêu chuộng.","(music) alternate, or responsive singing by a choir split into two parts; a piece sung or chanted in this manner"
polyphony,noun,tính phức điệu,So the polyphony problem: I've only got one voice.,Vấn đề về tính phức điệu : Tôi chỉ có một giọng.,"(music) Musical texture consisting of several independent melodic voices, as opposed to music with just one voice (monophony) or music with one dominant melodic voice accompanied by chords (homophony)."
saxophone,noun,xắc xô,My brother did not ask what a saxophone was.,Em trai tôi không hỏi tiếp kèn xắc - xô là gì.,"(music) A single-reed instrument musical instrument of the woodwind family, usually made of brass and with a distinctive loop bringing the bell upwards"
xylophone,noun,mộc cầm,( Xylophone ),( Mộc cầm ),a musical instrument made of wooden slats graduated so as to make the sounds of the scale when struck with a small drumstick-like hammer.
dysphonia,noun,,,,defective use of the voice
phonics,noun,âm học,Every toothed whale except the sperm whale has two sets of phonic lips and is thus capable of making two sounds independently.,"Tất cả những loài cá heo có răng trừ cá nhà táng, đều có hai bộ môi phát âm và do đó đều có khả năng phát ra hai âm thanh độc lập với nhau.",The study of how the sounds of words are represented by spelling.
phonogram,noun,dấu ghi âm,The name PolyGram is a portmanteau of Polydor and PhonoGram .,Cái tên PolyGram là sự kết hợp giữa hai từ Polydor và PhonoGram .,"(linguistics) A group of letters which share the same letter combination associated with a sound, such as rhyming words."
phonology,noun,âm vị học,Major phonological changes are a characteristic of this period.,Các dãy thay đổi về độ lớn là một ví dụ điển hình của trường hợp này.,"(linguistics, uncountable) The study of the way sounds function in languages, including phonemes, syllable structure, stress, accent, intonation, and which sounds are distinctive units within a language."
stereophonic,adjective,âm thanh nổi,"You've begun to imagine it Cinemascope, with stereophonic sound.",Rõ ràng anh đang tưởng tượng bằng màn ảnh đại vĩ tuyến và âm thanh nổi .,of or pertaining to sound reproduction using two channels to give a more natural two-dimensional sound distribution
cyclops,noun,Cyclops,I liked you as a cyclops .,Tôi thích bạn như là một Cyclops .,"(Greek mythology, Roman mythology) A one-eyed giant from Greek and Roman mythology."
triceratops,noun,Triceratops,It's those two juvenile Triceratops .,Đó là hai con Triceratops chưa trưởng thành.,Common name of the extinct genus Triceratops; a herbivorous ceratopsid from the late Cretaceous.
optical,adjective,thị giác,Optical flats have uses in spectrophotometry as well.,Các chất lân quang cũng đã được dùng trong màn hình tia âm cực.,"Of, or relating to sight; visual"
panoptic,adjective,,,,"All-seeing; comprehensive, inclusive."
optician,noun,nhà quang học,An Optician Sows a Seed,Một bác sĩ chuyên khoa mắt gieo hạt giống,"A person who makes or sells lenses, spectacles etc."
amblyopia,noun,chứng giảm sức nhìn,"Now, at this point, a number of you are probably wondering well, what are you waiting for, to put on the market a game that would be good for the attention of my grandmother and that she would actually enjoy, or a game that would be great to rehabilitate the vision of my grandson who has amblyopia , for example?","Hiện, tại thời điểm này, một số trong các bạn chắc đang tự hỏi ừm, các vị còn đợi gì nữa. để đưa ra thị trường một game có thể tốt cho sự tập trung của bà tôi và cùng lúc bà ấy thực sự thích thú với nó, hay một game có thể tốt cho việc cải thiện thị lực của cháu trai mắc bệnh giảm thị lực của tôi, chẳng hạn?",dimness or blurring of the eyesight due to a fault in transmission of signals to the brain from an otherwise healthy eye.
diplopia,noun,chứng nhìn đôi,""" It causes fatigue , it can cause headaches , neck ache , back ache and it can cause things like diplopia or double vision and intermittent blur vision "" .",""" Hội chứng này gây ra tình trạng mệt mỏi , nhức đầu , đau cổ , đau lưng và nó có thể gây ra một vài biến chứng đại loại như nhìn một thành hai và mắt mờ không liên tục "" .",(pathology) An ophthalmologic condition where one perceives two images; double vision.
