word,part_of_speech,meaning,example,example_meaning,definition
genealogical,adjective,phả hệ,Josina supported the family by illustrating genealogical charts.,Josina ủng hộ gia đình bằng cách minh họa các bảng xếp hạng phả hệ .,of or relating to genealogy.
disposition,verb,khuynh hướng,3 Which of the two mental dispositions characterizes the world today?,"3 Trong hai khuynh hướng tâm thần, cái nào biểu thị đặc tính của thế gian ngày nay?",Tendency or inclination under given circumstances
detestable,adjective,đáng ghét,"ROMEO Thou detestable maw, thou womb of death,","ROMEO Chúa bụng đáng ghét , ngươi tử cung tử vong,",Stimulating disgust or detestation; offensive; shocking.
brooding,adjective,sinh nở,"King of a fine brood , sir.","Hoàng đế của lũ gà con , thưa ngài.",Present participle of brood.
throng,adjective,đám đông,21 Are you one of that growing throng of light bearers?,21 Chính bạn có phải là một trong số đám đông người mang sự sáng không?,A group of people crowded or gathered closely together; a multitude.
capitulation,noun,sự đầu hàng,Peithon easily defeated his opponents and accepted their capitulation .,Peithon dễ dàng đánh bại đối thủ của mình và chấp nhận sự đầu hàng của họ.,A reducing to heads or articles; a formal agreement.
vice,adjective,mỏ cặp,""" No, we can modify the workbench maybe to put a special stool, a special anvil, special vice , and maybe an electric screwdriver. """,""" Không, chúng ta có thể điều chỉnh lại cái ghế làm việc có thể đặt một chiếc ghế đặc biệt với cái đe đặc biệt, với cái mỏ cặp đặc biệt, và có thể một chiếc tuốc nơ vít bằng điện. """,A bad habit.
rampant,adjective,hung hăng,"And we've seen looting at sites so rampant , it looks like craters of the moon.","Và chúng tôi đã thấy sự bóc lột hung hăng , nó giống như miệng núi lửa mặt trăng vậy.",(originally) rearing on both hind legs with the forelegs extended
enamored,adjective,say mê,I am enamored by you.,Anh phải lòng em.,totally in love
ardor,noun,nhiệt tâm,"It might be asked, If ours is a “counterfeit of apostolic and missionary ardor ,” where is the real evangelizing zeal to be found?",Một câu hỏi được nêu lên là: Nếu lòng sốt sắng của chúng ta là “sự giả mạo của lòng nhiệt tâm của các tông đồ và giáo sĩ” thì người ta có thể tìm thấy lòng sốt sắng thật sự trong công việc rao giảng ở đâu?,(chiefly US) great warmth of feeling; fervor; passion
quicksilver,noun,thủy ngân,"When the quicksilver is here, the heat is precisely correct, and the oil will gradually rise.","Có thủy ngân ở đây, sức nóng sẽ đúng một cách chuẩn xác, và tinh dầu sẽ từ từ bốc lên.",The metal mercury.
shorthand,noun,tốc ký,we're using a kind of shorthand .,chúng tôi đang sử dụng một loại tốc ký .,"A compendious and rapid method of writing by substituting symbols, for letters, words, etc.; short writing; stenography; phonography"
brunt,noun,gánh năng chủ yếu,They suffered the full brunt of the attack.,Họ chủ yếu nhận hết đòn tấn công.,The full adverse effects of; the chief consequences or negative results of a thing or event.
heartrending,adjective,đau lòng,The poverty of those fellow Christians was heartrending .,Sự nghèo khổ của các anh em tín đồ Đấng Christ này thật não lòng .,"That causes great grief, anguish or distress"
indelicate,adjective,thiếu tế nhị,"However, the entries are not made with indelible ink.","Tuy nhiên, tên trong sách không được ghi bằng loại mực không thể tẩy xóa .",Improper or immodest.
refined,adjective,tao nhã,One of the refinements of every polished society.,Tôi cho khiêu vũ là cái thú tinh tế đầu tiên của xã hội tao nhã .,Showing or having good feelings or good taste.
superficial,adjective,nông cạn,"So it's a superficial job, then.",Vậy chắc phải là một công việc hời hợt .,"Shallow, lacking substance."
hypocrisy,noun,hành động đạo đức giả,And children often are the most alert and sensitive when it comes to recognizing hypocrisy .,Con cái thường cảnh giác và bén nhạy nhất khi chúng nhận ra hành động đạo đức giả .,"the claim or pretense of holding beliefs, feelings, standards, qualities, opinions, virtues or motivations that one does not actually possess. [from early 13th c.]"
impertinent,adjective,láo,He will consider it an impertinence .,Anh ta sẽ cho rằng đấy là một sự xấc láo .,irrelevant (opposite of pertinent)
gist,verb,lý do chính,Got the gist ?,Nắm được vấn đề chưa?,The most essential part; the main idea or substance (of a longer or more complicated matter).
pedantic,adjective,thông thái rởm,So pedantic .,Đúng là thông thái rởm !,"Like a pedant, overly concerned with formal rules and trivial points of learning."
bashful,adjective,rụt rè,"Being rather bashful , I said we would rather he would give us some.",Tôi rụt rè nói rằng chúng tôi thích để ông lấy cho chúng tôi một chút ít.,(Can we clean up(+)this sense?) inclined to avoid notice
unrequited,adjective,không được thưởng,Unrequited love affairs.,Yêu đương đơn phương .,Unanswered; not returned; not reciprocated; not repaid.
ruddy,adjective,hồng hào,"Blond, a bit younger than I am, ruddy -faced.","Tóc vàng, hơi trẻ hơn anh, hồng hào .","Reddish in color, especially of the face, fire, or sky."
ensemble,verb,bộ quần áo,That's an awfully aggressive ensemble .,Một bộ quần áo không thể tệ hơn.,"a group of musicians, dancers, actors, etc who perform together; the chorus of a ballet company"
pensive,adjective,trầm ngâm,"You're certainly a man comfortable with long, pensive silences.",Anh chắc chắn là kiểu người thoải mái với sự im lặng dài và trầm ngâm .,"Having the appearance of deep, often melancholic, thinking."
provoke,verb,khiêu khích,"I have learned to control my anger, even when I am provoked .","Tôi đã tập kiềm chế cơn nóng giận, ngay cả khi bị người khác khiêu khích .",(transitive) to cause (a person) to become annoyed or angry.
deftly,adverb,khéo léo,If you'd come earlier... you would have seen me deftly separate this Seljuk's head from his body.,Nếu ông tới sớm hơn... ông sẽ được chứng kiến tôi khéo léo chặt đầu tên Seljuk này.,"in a deft manner, i.e. quickly and neatly in action"
worldly,adjective,trần tục,Are we ridding ourselves of all our worldly possessions?,Có phải chúng ta đang tự giải thoát khỏi những của cải trần tục không?,"Of or relating to man and the planet earth, physical as opposed to spiritual."
drivel,verb,chảy dãi,"Stop talking drivel , pal.","Đừng đùa chứ , anh bạn.",senseless talk; nonsense
pseudonym,noun,biệt hiệu,Heisenberg is kind of a pseudonym .,Heisenberg là... kiểu như biệt hiệu ấy.,"A fictitious name, often used by writers and movie stars."
compote,noun,mứt quả,a quarter of the items were sold off for compote,một phần tư của các mặt hàng này được bán đi để làm mứt quả,A dessert made of fruit cooked in sugary syrup.
privation,noun,cảnh thiếu thốn,It was the reason they suffered privation and even death.,Đó là lý do mà họ đã chịu cảnh thiếu thốn và ngay cả cái chết.,(philosophy) The state of being deprived of or lacking an attribute formerly or properly possessed; the loss or absence of such an attribute.
epistle,verb,thư của sứ đồ,The epistle clearly shows that the sacrifice of Jesus Christ is the only one that provides the needed ransom for sinful humankind.,Thư của sứ đồ cho thấy rõ ràng rằng sự hy sinh của Giê-su Christ là của-lễ duy nhất để cung cấp giá chuộc cần thiết cho nhân loại tội lỗi.,"A letter, or a literary composition in the form of a letter."
measly,adjective,không ra gì,A measly ten?,Chỉ có mười đồng ?,"Small in amount, contemptibly so."
bourgeois,adjective,giai cấp tư sản,"In bourgeois terms, it was a war between the Allies and Germany.",Đối với giai cấp tư sản đó là cuộc chiến giữa Đồng Minh và Đức.,"Of or relating to the middle class, especially its attitudes and conventions."
temperance,noun,sự chừng mực,"No, I accidentally lost my temper .","Không, em vô tình mất kiểm soát .","Habitual moderation in regard to the indulgence of the natural appetites and passions; restrained or moderate indulgence; moderation; as, temperance in eating and drinking; temperance in the indulgence of joy or mirth; specifically, moderation, and sometimes abstinence, in respect to using intoxicating liquors."
attribute,Verb,cho là do,"It also causes slight cirrhosis, which Dr. Chase so eagerly attributed to alcohol.","Nó cũng dẫn tới bệnh xơ gan nhẹ, điều mà bác sĩ Chase đã rất nhanh chóng cho là do rượu.",A characteristic or quality of a thing.
deviant,adjective,bất thường,You're saying I'm a deviant ?,Ông đang bảo tôi bất thường ?,"A person who deviates, especially from norms of social behavior."
node,noun,nút,"Hybrid dependency/phrase structure grammar uses dependencies between words, but also includes dependencies between phrasal nodes – see for example the Quranic Arabic Dependency Treebank.",Văn phạm kết hợp phụ thuộc và thành phần dùng phụ thuộc giữa các từ nhưng cũng có phụ thuộc giữa các nút cụm từ - xem ví dụ Quranic Arabic Dependency Treebank.,"A knot, a knob; a protuberance; a swelling."
vindictiveness,noun,tính chất trả thù,He is a vindictive bastard.,Hắn là một tên khốn đầy thù hận .,The condition of being vindictive
haggard,adjective,hốc hác,But on that day a very haggard woman opened the door and stood before him.,"Nhưng vào ngày đó, một phụ nữ hốc hác đã mở cửa và đứng trước mặt ông.","Looking exhausted and unwell, in poor condition"
affinity,noun,ái lực,Roxithromycin has fewer interactions than erythromycin as it has a lower affinity for cytochrome P450.,Roxithromycin ít tương tác thuốc hơn so với erythromycin do nó có ít ái lực với cytochrome P450.,A natural attraction or feeling of kinship to a person or thing.
tractable,adjective,dễ bảo,"And another Bible scholar, Joseph Benson, wrote during the last century: “Men of fierce, cruel, and ungovernable dispositions shall be so transformed by the preaching of the gospel, and by the grace of Christ, that they shall become most humble, gentle, and tractable , and shall no more vex and persecute those meek and poor ones, mentioned [in] Isa 11 verse 4.”","Một chuyên-gia khác về Kinh-thánh là Joseph Benson, đã viết vào thế-kỷ 19 như sau: “Những con người cứng đầu, hung bạo và tàn ác sẽ biến đổi nhân-cách họ với sự rao truyền của phúc-âm và ân-sủng của đấng Christ tác-động trên con người họ khiến họ trở thành thật khiêm-tốn, hòa-nhã, dễ bảo ; họ sẽ không quấy nhiễu và hà hiếp kẻ yếu thế và kẻ nghèo được đề-cập đến ở câu 4”.","Capable of being easily led, taught, or managed; docile; manageable; governable."
alimony,noun,tiền cấp dưỡng,Did you know my wife pays me alimony ?,Cô có biết vợ tôi phải trả tiền cấp dưỡng cho tôi không?,(law) A court-enforced allowance made to a former spouse by a divorced or legally separated person.
sere,adjective,sear,"The Greek historian Strabo writes, ""they extended their empire even as far as the Seres (China) and the Phryni.""",Nhà sử học Hy Lạp Strabo viết rằng: Họ đã mở rộng đế chế của mình xa tới tận Seres (người Trung Quốc) và Phryni.,Without moisture.
environs,noun,vùng ven,Integration between land and water elements of the coastal zone: This is the realisation of the physical environment being a whole.,Đất và nước yếu tố của các vùng ven biển: Đây là việc thực hiện các môi trường vật lý là một tổng thể.,The surroundings; the environment.
allege,verb,cho là,This man is an alleged victim of consumption.,Người đàn ông này được cho là nạn nhân của bệnh lao phổi.,"(obsolete) To lighten, diminish."
supersede,verb,thay thế,In September 1997 it was superseded by Microsoft Internet Explorer 4.,Vào tháng 9 1997 nó đã bị thay thế bởi Internet Explorer 4.,(transitive) Set (something) aside.
libel,verb,lời phỉ báng,"In 1999, an article about the case in the Canadian newspaper The Globe and Mail resulted in a libel suit by Goh.","Năm 1999, một bài viết về sự kiện này trên tờ báo Globe and Mail của Canada kết dẫn tới một lời phỉ báng từ Lý.",A written (notably as handbill) or pictorial statement which unjustly seeks to damage someone's reputation.
dissent,verb,bất đồng quan điểm,"Your dissent on Godfrey v. Kent was brilliant, by the way.","Vụ bất đồng quan điểm với Godfrey v. Kent là rất thông minh, dù sao đi nữa.","(intransitive) To disagree; to withhold assent. Construed withfrom(or, formerly,to)."
tamp,noun,đầm,A 15-kilometre (9.3 mi) tamped -earth ramp was built to transport marble and materials to the construction site and teams of twenty or thirty oxen pulled the blocks on specially constructed wagons.,"15 km (9,3 mi) đường dốc bằng đất đầm nện được xây dựng để vận chuyển đá cẩm thạch và các vật liệu khác đến để xây dựng công trình và các đội gồm 20 hoặc 30 con bà được dùng để kéo các khối đá trên các toa xe có cấu tạo đặc biệt.","(blasting) to plug up with clay, earth, dry sand, sod, or other material, as a hole bored in a rock, in order to prevent the force of the explosion from being misdirected."
internment,noun,sự giam giữ,Constraints can be internal or external to the system.,Các ràng buộc có thể là nội bộ hoặc bên ngoài hệ thống.,"Confinement within narrow limits, as of foreign troops, to the interior of a country."
shamble,verb,chạy lóng ngóng,"Also, comp in shambles ?","Nói chung thì, kinh khủng thật.",To walk while shuffling or dragging the feet.
gilt,adjective,lợn cái con,Gilts at seven.,Giá vàng đang ở mức 7.,(slang) money
unequivocal,adjective,sòng,His words are unequivocal and bold.,Lời của ông thật dứt khoát và mạnh mẽ.,"Unambiguous; without equivocation or ambiguity; singularly clear, unmistakable, or unquestionable"
nominal,adjective,danh,This was despite the fact that he was a nominal Catholic.,Tất cả những điều này bất kể sự kiện ông là một người Công Giáo trên danh nghĩa.,"Of, resembling, relating to, or consisting of a name or names."
quaff,verb,nốc cạn một hơi,,,"To drink or imbibe, especially with vigour."
subjugate,verb,chinh phục,"In Cuba, it was subjugated by the Batista government.","Ở Cuba, nó được chinh phục bởi chính phủ Batista.",To forcibly impose obedience or servitude.
camaraderie,noun,tình bạn,I learned about sharing. I learned about camaraderie .,Tôi học cách chia sẻ.Tôi học về tình bạn .,Close friendship in a group of friends or teammates.
pathological,adjective,bệnh lý,You switched the samples and the pathology reports.,Anh đã đổi mẫu và bản báo cáo bệnh lý .,Pertaining to pathology.
dredge up,verb,,Can't dredge up the past now.,Giờ không được là lúc gợi lại quá khứ.,"Used other than as an idiom:seedredge,up."
cull,verb,hái,A cull is our only hope.,Sàng lọc là hy vọng duy nhất.,To pick someone or something.
amputate,verb,cắt cụt,"For example, we have a sister in our congregation who had her leg amputated .","Thí dụ, trong hội thánh chúng tôi có một chị bị cắt cụt chân.","To surgically remove a part of the body, especially a limb"
amiable,adjective,dễ thương,Is he amiable ?,Ông ta có tử tế không?,"Friendly; kind; sweet; gracious; as, an amiable temper or mood; amiable ideas."
ambitious,adjective,có nhiều hoài bão,"That's too ambitious .""","Điều đó quá tham vọng ?""","Possessing, or controlled by ambition; greatly or inordinately desirous of power, honor, office, superiority, or distinction."
overwhelm,verb,áp đảo,It's enough to make you feel very overwhelmed .,Nhiêu đó đủ để làm bạn thấy áp đảo .,"To engulf, surge-over and submerge"
antibiotic,adjective,thuốc kháng sinh,One of my big soapboxes right now is antibiotics .,Một trong những chủ đề lớn của tôi ngay bây giờ là thuốc kháng sinh .,(pharmacology) Any substance that can destroy or inhibit the growth of bacteria and similar microorganisms.
catastrophe,noun,tai họa,Why could this world not end in a nuclear catastrophe ?,Tại sao thế giới này không thể chấm dứt bằng một tai họa hạch tâm?,(now rare) Alternative spelling of catastrophe.
ravenous,adjective,cơ cực,"Raven , stop!","Raven , dừng lại!",Very hungry.
cunning,adjective,xảo quyệt,He has also employed more subtle means— cunning acts and sly devices.,Hắn cũng vận dụng những phương kế xảo quyệt hơn—những hành động dối trá và mưu kế gian hiểm.,Sly; crafty; clever in surreptitious behaviour.
apprehensive,adjective,sợ hãi,"Are we living with apprehension , fear, and worry?","Chúng ta có đang sống trong nỗi e ngại, sợ hãi và lo âu không?",Anticipating something with anxiety or fear.
lurk,verb,rình mò,♫ lurks the ghost of war.,♫ ẩn giấu bóng ma chiến tranh.,To remain concealed in order to ambush
phenomenal,adjective,phi thường,"Once hatched, a chick grows at a phenomenal pace.","Một khi đã nở, chim non lớn lên với một tốc độ phi thường .",(colloquial) Very remarkable; highly extraordinary; amazing.
confiscate,adjective,tịch thâu,I tried to think of something to say that would prevent this spiritual treasure from being confiscated .,Tôi cố nghĩ ra một điều gì đó để nói hầu cho kho tàng thiêng liêng này khỏi bị tịch thâu .,(transitive) To take possession of by force or authority; expropriate.
silhouette,verb,hình bóng,"Silhouette , Harry!","Hình bóng , Harry!","An illustrated outline filled in with a solid color(s), usually only black, and intended to represent the shape of an object without revealing any other visual details; a similar appearance produced when the object being viewed is situated in relative darkness with brighter lighting behind it; a profile portrait in black, such as a shadow appears to be."
rigmarole,noun,câu chuyện vô nghĩa,"And her sainted mother always dreamed of the whole mass rigmarole , but you're...","Và người... người mẹ thánh thiện của nó vẫn luôn mơ có đầy đủ một lễ Misa lê thê lết thết cho nó, nhưng...","complex, obsolete procedures; excess steps or activity; needless motion"
apprentice,noun,người học việc,"Being an apprentice , you know, you do that.",Bạn phải làm thế khi bạn là người học việc .,"A trainee, especially in a skilled trade."
eccentric,adjective,lập dị,he was eccentric .,Gã Gale Boetticher này lập dị lắm.,not at or in the centre.
piddling,adjective,dọn dẹp,What are you piddle -farting around for? I could do that in 10 minutes.,Sao mày ề à thế nhở. Nếu là tao thì cái đó 10 phút là xong rồi.,"Insignificant, negligible, paltry, trivial, useless."
glimmer,verb,le lói,"A short while later, a glimmer of light began to suffuse the dark vault of the sky.","Một lát sau, tia sáng le lói bắt đầu tràn ngập vòm trời đen tối.",A faint light; a dim glow.
misdeed,noun,hành động xấu,But what misdeed did they commit?,Nhưng hành động xấu xa nào họ đã phạm phải?,"That which was done that should not have been, ranging from any sin or moral offense to various degrees of crime."
connoisseur,noun,người sành sỏi,I'm a connoisseur of the... first printing.,Tôi là một người sành sỏi về những... bản in đầu tiên,"A specialist of a given field whose opinion is valued; especially in one of the fine arts, or in a matter of taste"
cinch,verb,nịt,"Wearing a ""fuller–figure"" "" cinched in corset"" designed by The Blonds, who also design outfits for Lady Gaga, Leah Simpson for the Daily Mail wrote that Aguilera put a ""sexy twist on patriotism with a star–spangled bodysuit and managed to get a few pulses racing in the over–the–top ensemble.""","Trình diễn trong ""trang phục kín đáo"" ""được thít chặt bằng áo nịt ngực"" thiết kế bởi The Blonds, người cũng thiết kế trag phục cho Lady Gaga, Leah Simpson của Daily Mail viết rằng Aguilera đem đến ""sự quyến rũ trong tình yêu nước với bộ quần áo lấp lánh những ngôi sao, và một chút rộn ràng trong bộ trang phục qua-hết-ngực.""",A simple saddle girth used in Mexico.
assumption,noun,giả định,And what assumption are we working on?,Thế chúng ta làm việc với giả định gì?,"The act of assuming, or taking to or upon one's self; the act of taking up or adopting."
mishap,verb,việc không may,"The only mishap was during the ceremony, when Charlotte was heard to giggle when the impoverished Leopold promised to endow her with all his worldly goods.",Việc không may duy nhất xảy ra trong buổi lễ là Charlotte cười khúc khích khi Leopold (rất nghèo so với Charlotte) hứa sẽ chăm lo cho bà với tất cả những thứ vật chất mà anh ta có.,"An accident, mistake, or problem."
swanky,adjective,choáng,Pretty swanky offices.,Văn phòng khoe khoang quá nhỉ.,"Rather posh, elegant, ritzy."
lingo,noun,tiếng lóng,"You gotta learn the lingo , hombrito.","Đi mà học thêm tiếng lóng đi, chàng trai.","Language, especially language peculiar to a particular group or region; jargon or a dialect."
segregate,adjective,tách riêng,You can segregate the data even further at the report level with tools like Segments.,"Thâm chí, bạn có thể tách riêng dữ liệu thêm nữa ở cấp báo cáo bằng các công cụ như Phân đoạn .",Separate; select.
aborigine,noun,thổ dân,Aboriginal and Torres Strait Islander people made up 18.1% of the population.,"Thổ dân và dân đảo Torres Strait chiếm 18,1% dân số.",An aboriginal inhabitant of a country.
foolproof,adjective,hết sức rõ ràng,We've watched the financial markets that we uniquely create -- these markets that were supposed to be foolproof -- we've watched them kind of collapse before our eyes.,Ta đã theo dõi thị trường tài chính do ta tạo ra lẽ ra phải hết sức rõ ràng nhưng lại sụp đổ ngay trước mắt chúng ta.,"For a device: protected, or designed to be proof against misuse or error; fail-safe."
leery,adjective,cẩn thận,"I-it's just, people have to be, and especially women, need to be leery about how much they put out into the world.","Mọi người, và đặc biệt là phụ nữ, cần cẩn thận về những gì mà họ tiết lộ ra thế giới bên ngoài.","Cautious, hesitant, or nervous about something; having reservations or concerns."
fortnight,noun,hai tuần lễ,"Every second fortnight , he rode.","Cứ vào hai tuần lễ cuối, ông ấy cưỡi ngựa đi.",A period of fourteen nights; two weeks.
aptitude,noun,khả năng,Let's see if you have the aptitude .,Chúng ta hãy xem là cô đủ khả năng không.,Natural ability to acquire knowledge or skill.
sharecropper,noun,người cấy rẽ,You're living like a sharecropper .,Con sống như một nông dân đi làm thuê vậy.,A person who enters an agreement with a land owner to farm the land and then pay a portion (share) of the produce as rent. One who sharecrops.
iota,noun,Iôta,Not an iota changed accept.,Sau đó là một thực tế.,"(uncountable) The ninth, and smallest, letter of the Greek alphabet."
stammer,verb,nói lắp,I thought I would stammer but did not.,Tôi nghĩ rằng tôi sẽ nói lắp nhưng tôi đã không làm thế.,To keep repeating a particular sound involuntarily.
sarcastic,adjective,chế nhạo,"While all sarcasm fits the definition of verbal irony, not all verbal irony is sarcastic .","Tất cả những lời chế nhạo là sự châm biếm, nhưng không phải tất cả lời châm biếm đều là sự chế nhạo .",Containing sarcasm.
grits,verb,bột yến mạch thô,They say he has grit .,Người ta nói ổng gan lì .,Plural form of grit. ('hulled oats')
affliction,noun,nỗi đau đớn,"These afflictions could have been physical, emotional, or mental.","Những nỗi đau đớn này có thể là về mặt thể chất, tình cảm, hay tinh thần.","A state of pain, suffering, distress or agony."
mull,verb,bắt trượt,"""Denmark, Poland mull pipeline link.(News)"".","Truy cập ngày 1 tháng 7 năm 2009 . “Denmark, Poland mull pipeline link.(News)”.",To work (over) mentally; to cogitate; to ruminate; usually with over.
