word,part_of_speech,meaning,example,example_meaning,definition
impute,verb,đổ,(b) What motives did Satan impute to Jehovah?,b) Sa-tan đổ lỗi cho Đức Giê-hô-va có những động cơ nào?,"(transitive) To reckon as pertaining or attributable; to charge; to ascribe; to attribute; to set to the account of; to charge to one as the author, responsible originator, or possessor; -- generally in a bad sense."
grammar,verb,sách ngữ pháp,"He produced the first grammar book on Swahili, as well as a dictionary of that language.",Ông đã cho ra đời sách ngữ pháp cũng như từ điển tiếng Swahili đầu tiên.,A system of rules and principles for speaking and writing a language.
usage,noun,tập quán,"There are various technical definitions of spring, but local usage of the term varies according to local climate, cultures and customs.","Về mùa xuân có rất nhiều định nghĩa, nhưng cách sử dụng khác nhau tùy vào khí hậu, văn hóa và tập quán của mỗi khu vực.","(lexicography) The ways and contexts in which spoken and written words are used, determined by a lexicographer's intuitition or from corpus analysis."
diction,noun,cách chọn lời,Do not speak so rapidly that your diction suffers.,Đừng nói nhanh quá khiến người khác không nghe rõ những gì anh chị nói .,"The effectiveness and degree of clarity of word choice, and presentation of said words."
syntax,noun,cú pháp,Syntax,Cú pháp,A set of rules that govern how words are combined to form phrases and sentences.
convention,noun,quy ước,In 1912 a Russo-French naval convention was signed.,"Năm 1912, một bản quy ước hải quân giữa Pháp với Nga được ký kết.",A meeting or gathering.
sentence structure,noun,cấu trúc câu,Avoid the use of involved sentence structure .,Hãy tránh dùng lối hành văn phức tạp .,the grammatical arrangement of words in sentences
complex sentence,noun,câu phức tạp,A heptapod can write a complex sentence in two seconds effortlessly.,Một heptapod có thể viết một câu phức tạp trong hai giây một cách dễ dàng.,"(grammar) a sentence that contains an independent clause as well as one or more dependent clauses, joined by a sub-ordinating conjunction such as 'however'."
compound sentence,noun,câu kép,"Compound words, when they exist freely in a sentence , are often written separately.","Các từ ghép , khi chúng tồn tại tự do trong một câu , thường được viết rời.","(grammar) a sentence that has two or more independent clauses, joined by a conjunction (such as 'but', 'and') and/or punctuation (such as ','). Compare simple sentence."
phrase,noun,cụm từ,The coin represents a Russian phrase .,Đồng xu thể hiện cho 1 thành ngữ của người Nga.,A short written or spoken expression.
clause,noun,điều khoản,Repentance is the escape clause in it all.,Sự hối cải là điều khoản khắc phục sự phạm giới và cái chết.,"(Can we clean up(+)this sense?) (grammar, informal) A group of two or more words which include a subject and any necessary predicate (the predicate also includes a verb, conjunction, or a preposition) to begin the clause; however, this clause is not considered a sentence for colloquial purposes."
active voice,noun,,It's voice activated .,Đó là còi báo hiệu .,(grammar) the form in which the subject of a verb carries out some action
passive voice,noun,,And the object is the passive no- voice .,Và đối phương thì không có tiếng nói một cách tiêu cực.,(grammar) The form of a transitive verb in which its subject receives the action.
transition,noun,chuyển tiếp,"It will take a lot longer than I think we all expect, especially that transition period.","Sẽ mất lâu hơn rất nhiều so với mọi người nghĩ, đặc biệt là quãng chuyển tiếp đó.","the process of change from one form, state, style or place to another"
modifier,noun,từ bổ nghĩa,Modify Task,Sửa đổi tác vụ,"One who, or that which, modifies."
adjective,noun,tính từ,We prefer to use a different adjective to describe Martinez's mouth.,Chúng tôi thích dùng tính từ khác để miêu tả miệng của Martinez's hơn.,(obsolete) Incapable of independent function.
noun,verb,Danh từ,What is the collective noun for a group of stuffy old Etonians?,Danh từ tập hợp nào dùng cho một nhóm học giả trường Eton đây?,"(grammar) A word that can be used to refer to a person, animal, place, thing, phenomenon, substance, quality, or idea; one of the basic parts of speech in many languages, including English."
pronoun,noun,đại từ,"It makes perfect sense, except for the pronouns .","Thật hoàn hảo, ngoại trừ những đại từ .","(grammar) A type of noun that refers anaphorically to another noun or noun phrase, but which cannot ordinarily be preceded by a determiner and rarely takes an attributive adjective. English examples includeI, you, him, who, me, my, each other."
gerund,noun,động danh từ,F word in gerund form.,Chêt tiệt .,"(grammar) A verbal form that functions as a verbal noun. (In English, a gerund has the same spelling as a present participle, but functions differently.)"
reference,verb,sự tham khảo,We're listing you as a reference .,Chúng tôi sẽ ghi ông lại như một sự tham khảo .,A measurement one can compare to.
research,verb,nghiên cứu,He's proposing a suggestion for altering the research method.,Nó đề xuất ý kiến cải cách phương pháp nghiên cứu .,(countable) A particular instance or piece of research.
documentation,noun,tư liệu,"In fact, on all these discs there were documents .","Thực tế, trong tất cả những cái đĩa này đều có những tư liệu .",Something transposed from a thought to a document; the written account of an idea.
source,noun,nguồn,That victory became a source of national pride.,Chiến thắng đó trở thành nguồn sức mạnh khơi dậy niềm tự hào dân tộc.,"The person, place or thing from which something (information, goods, etc.) comes or is acquired."
primary source,noun,,Energy is the primary source of emissions.,Ngành năng lượng là nguồn phát thải lớn nhất .,"(historiography) A historical document that was created at or near the time of the events studied, by a known person, for a known purpose"
secondary source,noun,,She must have relied on secondary sources —I hope not The Selfish Gene.,Bà hẳn đã phải dựa vào các nguồn thứ cấp khác - tôi hy vọng không phải là cuốn Gen vị kỷ.,(historiography) Any document that draws on one or more primary sources and interprets or analyses them; also sources such as newspapers whose accuracy is open to question.
data,noun,dữ liệu,So that's a very important piece of data .,Đó là một phần rất quan trọng của dữ liệu .,Plural form of datum: pieces of information.
multimedia,adjective,Multimedia,"like turning everything into a multimedia show,","như là biến mọi thứ thành show multimedia ,","(plurale tantum) the use of different media to convey information; text together with audio, graphics and animation, often packaged on CD-ROM with links to the Internet"
unreliable,adjective,không đáng tin,Memory's unreliable .,Trí nhớ mới không đáng tin .,Not reliable.
bibliography,noun,thư mục,Bibliography,Tài liệu tham khảo,"A section of a written work containing citations, not quotations, to all the books referenced in the work."
citation,noun,đoạn trích dẫn,One citation .,Một vé phạt .,An official summons or notice given to a person to appear; the paper containing such summons or notice.
plagiarism,noun,ý,We can't make a deal on a book that's been plagiarized .,Chúng tôi không thể thỏa thuận với một cuốn sách ăn cắp ý tưởng.,"(uncountable) The act of plagiarizing: the copying of another person's ideas, text, or other creative work, and presenting it as one's own,especiallywithout permission."
develop,verb,khai triển,All of these themes require development along completely different lines.,Tất cả những chủ đề này đòi hỏi phải khai triển hoàn toàn khác nhau.,"(intransitive) To change with a specific direction, progress."
elaboration,noun,sự thảo tỉ mỉ,That's elaborate .,Rất công phu .,The act or process of producing or refining with labor; improvement by successive operations; refinement.
evaluate,verb,đánh giá,Judgmental evaluations are the most commonly used with a large variety of evaluation methods.,Đánh giá phán đoán được sử dụng phổ biến nhất với nhiều phương pháp đánh giá lớn.,to draw conclusions from examining; to assess
contradict,verb,phủ nhận,Dead assassins can't contradict it.,Cái chết của các sát thủ không thể phủ nhận nó.,(obsolete) To speak against; to forbid.
synthesize,verb,tổng hợp,Epos TTS speech synthesizer,Trình tổng hợp Văn bản sang Tiếng nói EposName,"(transitive) To combine two or more things to produce a new, more complex product."
unity,noun,sự thống nhất,"With the resignation of Trotsky as War Commissar, the unity of the troika began to unravel.",Với sự từ chức Dân uỷ Chiến tranh của Trotsky sự thống nhất của troika dần giảm sút.,(uncountable) oneness; state of being one or undivided; united in mind or purpose
validity,noun,giá trị,Upon that unique and wonderful experience stands the validity of this Church.,Giá trị của Giáo Hội dựa vào kinh nghiêm độc nhất và kỳ diệu đó.,Having legal force.
variety,noun,nhiều thứ,Huge quantities of literature are made available in great variety and in many languages.,Một số lượng khổng lồ về sách báo đủ loại đã được in ra trong nhiều thứ tiếng.,Rare spelling of variety.
redundant,adjective,thừa,"In this instance, this knowledge allows us to design novel machine architectures or to design clever algorithms that gracefully handle damage, just like human athletes do, instead of building machines with redundancy .","Trong ví dụ này, với kiến thức đó đã cho phép chúng tôi thiết kê nên những thiết kế máy mới lạ hoặc thiết kế các thuật toán thông minh giúp xử lý các hỏng hóc một cách êm xuôi giống như các vận động viên thật thay vì tạo ra các máy bay thừa cánh",Superfluous; exceeding what is necessary.
summarize,verb,tóm tắt,To summarize those requirements:,Sau đây là tóm tắt những yêu cầu đó:,To prepare a summary of something
paraphrase,verb,diễn giải,To paraphrase a thought:,Để diễn giải một ý nghĩ:,"a restatement of a text in different words, often to clarify meaning"
layout,noun,bố cục,Your ad's layout automatically optimizes for the mobile experience.,Bố cục quảng cáo của bạn sẽ tự động tối ưu hóa cho trải nghiệm di động.,A structured arrangement of items within certain limits.
outline,verb,phác thảo,"In December 2012, Whedon stated that he had completed an outline for the film.","Tháng 12 năm 2012, Whedon chia sẻ rằng ông đã có một bản phác thảo hoàn thiện cho bộ phim.",A line marking the boundary of an object figure.
heading,noun,tiêu đề,Guys it's heading towards the bowling alley.,Kẻ đó là tiêu đề theo hướng hẻm bowling.,Present participle of head.
edit,verb,biên tập,It was there that the writings of the Talmud were edited in their most complete form.,Chính tại đây mà việc biên tập các bản văn thuộc bộ Talmud được hoàn tất.,A change to the text of a document.
formal,adjective,theo nghi thức,Later they really wanted to have the opportunity to welcome me formally .,Sau đó họ rất muốn có cơ hội chào đón tôi theo nghi thức .,(horticulture) Organized; well-structured and planned.
informal,adjective,không chính thức,The gospel should be taught both formally and informally .,Phúc âm cần phải được dạy một cách chính thức lẫn không chính thức .,Not formal or ceremonious; casual.
descriptive,adjective,diễn tả,Chapters 30–31 include a description of a virtuous woman.,Các chương 30–31 gồm có sự diễn tả về một người đàn bà đức hạnh.,"(sciences, philosophy) Describing and seeking to classify, as opposed to normative or prescriptive."
engaging,adjective,duyên dáng,"Anywho, I'm witty, engaging , smart, well-read.","Hơn ai hết, tớ dí dỏm, duyên dáng thông minh, có học thức.","Interesting; charming; attractive, especially of a manner or behaviour."
expressive,adjective,diễn cảm,Teach your children to express appreciation (See paragraph 15)*,Hãy dạy con tỏ lòng biết ơn (Xem đoạn 15)*,Effectively conveying thought or feeling.
objective,noun,khách quan,It just takes a picture of objective reality as it is.,Thị giác chỉ chụp lại hình ảnh của thực tại khách quan một cách nguyên bản.,A goal that is striven for.
coherence,noun,sự cố kết,Has a coherent movement.,Có một sự chuyển động mạch lạc.,Quality of cohering; of being coherent; internal consistency.
comparison,noun,sự so sánh,What insights do they gain from this comparison ?,Họ đạt được những sự hiểu biết nào từ sự so sánh này?,The act of comparing or the state or process of being compared
contrast,verb,làm tương phản,And so we can compare and contrast the big ideas.,Và vì thế mà chúng tôi có thể so sánh và làm tương phản các ý tưởng lớn.,"(countable) A difference in lightness, brightness and/or hue between two colours that makes them more or less distinguishable."
argument,Verb,lí lẽ,Would the defense care to make a closing argument ?,Bên biện hộ có muốn đưa ra lí lẽ cuối cùng không?,A fact or statement used to support a proposition; a reason.
counterargument,noun,,"That comment would be counterargued with, “No, no.","Lời yêu cầu đó bị bác bỏ: “Không, không.",An argument that is opposed to another argument.
assertion,noun,sự khẳng định,"Was it evidence of guilt, an assertion","Đó có phải là bằng chứng của tội lỗi, một sự khẳng định","The act of asserting, or that which is asserted; positive declaration or averment; affirmation; statement asserted; position advanced."
opinion,noun,ý kiến,I agree with the opinion that real estate is overpriced.,Tôi đồng ý với ý kiến rằng bất động sản bị định giá quá cao.,A belief that a person has formed about a topic or issue.
premise,noun,tiền đề,Nor do the Witnesses accept the premise upon which those statements are based —evolution.,Và họ cũng không chấp nhận tiền đề làm cơ sở cho lời nhận xét đó—sự tiến hóa.,A proposition antecedently supposed or proved; something previously stated or assumed as the basis of further argument; a condition; a supposition.
deductive,adjective,suy diễn,"A lot of science isn't deductive at all,","Rất nhiều khoa học không suy diễn gì cả,","Of, pertaining to, or based on deduction."
inductive,adjective,cảm ứng,Can you tell us how an induction motor starts?,Cậu có thể nói cho chúng tôi biết động cơ cảm ứng khởi động thế nào không?,"(logic) of, or relating to logical induction"
introductory,adjective,mở đầu,"In this promise, that introductory phrase, “come unto me,” is crucial.","Trong lời hứa này, câu mở đầu đó, “hãy đến cùng ta” là cốt yếu.",introducing; giving a preview or idea of
expository,adjective,để giải thích,Observes Vine’s Expository Dictionary of Old and New Testament Words: “Love can be known only from the actions it prompts.”,Sách Vine’s Expository Dictionary of Old and New Testament Words nhận xét: “Tình yêu thương chỉ có thể biết được qua các hành động xuất phát từ nó”.,"Serving to explain, explicate, or elucidate; expositive; of or relating to exposition."
explanatory,adjective,giả thích,It's fairly self- explanatory .,"Công bằng mà nói, nó như là một kiểu tự diễn giải.",Intended to serve as an explanation.
informational,adjective,có tin tức,I will continue to report the information if any.,Tôi sẽ báo ngay khi có tin tức mới.,Designed to or able to impart information.
aesthetic,noun,mỹ học,I occasionally write about the aesthetics of photography.,Tôi thỉng thoảng có viết về quan điểm mỹ học trong nhiếp ảnh.,"Concerned with beauty, artistic impact, or appearance."
analysis,noun,sự phân tích,"Now, in economic theory, cheating is a very simple cost-benefit analysis .","Xét trên lý thuyết kinh tế, gian lận là sự phân tích lợi nhuận rất đơn giản.","(countable, of a thing, concept, theory, or similar) A process of dismantling or separating into constituent elements in order to study the nature, function, or meaning."
commentary,noun,bài bình luận,The commentary edited by J.,Bài bình luận do J.,"A series of comments or annotations; especially, a book of explanations or expositions on the whole or a part of some other work."
interpretation,noun,sự giải thích,You have already studied and learned the interpretation of the first two symbols.,Các em đã nghiên cứu và học về sự giải thích hai biểu tượng đầu tiên.,(countable) An act of interpreting or explaining what is obscure; a translation; a version; a construction.
generalization,noun,sự khái quát,Intel 's Next Generation Platform to Support GPGPU,Nền tảng thế hệ Chip kế tiếp của Intel sẽ hỗ trợ GPGPU,(American) Alternative spelling of generalisation.
bias,adjective,khuynh hướng,"First of all, I'm going to show you the average amount of bias that we see.","Đầu tiên, tôi sẽ cho bạn thấy khuynh hướng trung bình mà chúng tôi nhìn thấy được.","In the game of crown green bowls: a weight added to one side of a bowl so that as it rolls, it will follow a curved rather than a straight path; the oblique line followed by such a bowl; the lopsided shape or structure of such a bowl."
implication,noun,ẩn ý,This of course has two very clear implications for life in general.,Điều này dĩ nhiên có 2 ẩn ý rất rõ về cuộc sống nói chung.,(uncountable) The act of implicating.
inference,noun,kết luận,The inference being she's selling secrets.,Kết luận đưa ra là cô ta bán thông tin tình báo.,(uncountable) The act or process of inferring by deduction or induction.
implicit,adjective,ẩn,"In the early 20th century, Borel and Arthur Eddington used the theorem to illustrate the timescales implicit in the foundations of statistical mechanics.","Trong những năm đầu thế kỷ 20, Émile Borel và Arthur Eddington sử dụng nguyên lý để minh họa cho thang thời gian ẩn giấu trong cơ sở của cơ học thống kê.","Implied indirectly, without being directly expressed"
formality,noun,nghi thức,Service to God Not a Burdensome Formality,Phụng sự Đức Chúa Trời không phải là nghi thức nặng nề,(uncountable) The state of being formal.
ambiguity,noun,sự mơ hồ,But the Paris Peace Accord was a masterpiece of ambiguity .,Hiệp định Paris là một tuyệt tác đầy sự mơ hồ .,"(countable) Something liable to more than one interpretation, explanation or meaning, if that meaning etc cannot be determined from its context."
fallacy,noun,nguỵ biện,"He states that the argument that ""Operation Vistula was the revenge for the slaughter of Poles by the Ukrainian Insurgent Army"" in 1943–1944, was "" fallacious and ethically inadmissible,"" as it invoked ""the principle of collective guilt.""","Ông lập luận rằng ""Chiến dịch Vistula là sự trả thù cho việc giết người Ba Lan của Quân đội nổi dậy Ukraina"" trong 1943-1944, là "" nguỵ biện và phi đạo đức không thể chấp nhận"", như nó gọi là ""nguyên tắc về tội lỗi tập thể.""",Deceptive or false appearance; deceitfulness; that which misleads the eye or the mind; deception.
topic,noun,chủ đề,This will help you to link together spiritual topics that you have investigated.,Suy ngẫm sẽ giúp bạn liên kết những chủ đề trong Kinh Thánh mà bạn đã nghiên cứu.,Subject; theme; a category or general area of interest.
topic sentence,noun,câu chủ đề,"* Notice the last sentence in the second paragraph of doctrinal topic 4, “The Restoration.”","* Hãy lưu ý đến câu cuối cùng trong đoạn thứ hai của đề tài giáo lý 4, “Sự Phục Hồi.”",A sentence at the beginning of a paragraph indicating the general matter to be discussed later in that paragraph.
theme,noun,chủ đề,Aceval revolves her writing around the theme of love.,Chủ đề viết của Aceval xoay quanh tình yêu.,a subject of a talk or an artistic piece; a topic.
subject,noun,chủ đề,PG: So groom was the subject of the piece.,PG: Vậy thư giản là chủ đề của bản nhạc.,Likely to be affected by or to experience something.
narration,noun,chuyện kể,Narrator – A speaker that tells all stories of detective Tom and Jerry.,Người dẫn truyện - Người nói chuyện kể về tất cả các câu chuyện thám tử Tom và Jerry.,"The act of recounting or relating in order the particulars of some action, occurrence, or affair; a narrating."
narrative,adjective,bài tường thuật,I quote from his narrative concerning this.,Tôi xin trích dẫn từ bài tường thuật của ông về điều này.,Telling a story.
narrator,noun,người kể chuyện,"If your narrator is alive, she's on this list.","Nếu người kể chuyện còn sống, thì sẽ có tên trên danh sách này.",One who narrates or tells stories.
perspective,adjective,phối cảnh,Sometimes the perspective is the illusion.,Đôi khi phối cảnh tạo nên ảo giác.,"A view, vista or outlook."
point of view,noun,quan điểm,"Hence, from a human point of view , their chances of being victorious would seem remote.","Vì thế, theo quan điểm loài người, dường như họ không thể chiến thắng.",A position from which something is seen; outlook; standpoint.
first person,noun,,You'll be the first person I call.,Anh sẽ là người đầu tiên tôi nhờ vả.,(grammar) Forms of pronouns or verbs used for the speaker or writer of the sentence in which they occur.
second person,noun,,“And you’re...my second person ?”,“Và ông là... người thứ hai của tôi ?”,"In grammar, the form of a verb used when the subject of a sentence is the audience. In English, the second person is used with the pronouns thou and you. In many languages the singular, applying to one person, and plural, applying to several people, are distinct."
third person,noun,,I think there's a third person .,Tôi nghĩ là có người thứ ba .,"(linguistics, withthe) The words, word-forms, and grammatical structures, taken collectively, that are normally used of people or things other than the speaker or the audience."
genre,noun,thể loại,I wanted to change genres and take a risk.,Tôi muốn thay đổi thể loại và làm liều...,"A kind; a stylistic category or sort, especially of literature or other artworks."
fiction,noun,tiểu thuyết,"I'll change the names if I have to, call it fiction .","Anh sẽ đổi tên nếu cần, gọi nó là tiểu thuyết .","Literary type using invented or imaginative writing, instead of real facts, usually written as prose."
science fiction,noun,khoa học viễn tưởng,"Though, by definition, science fiction is not science.","Theo định nghĩa, thì khoa học viễn tưởng không phải là khoa học .",Fiction in which advanced technology and/or science is a key element.
drama,noun,kịch,"And at Hannah, for making it all her drama .","Và với Hannah, vì đã khiến mọi bi kịch là của cô ấy.","A composition, normally in prose, telling a story and intended to be represented by actors impersonating the characters and speaking the dialogue"
comedy,noun,hài kịch,Here's how I see social justice comedy working.,Bản thân tôi nhìn hài kịch công bằng xã hội thế này,archaic Greece. a choric song of celebration or revel
romance,verb,bịa đặt,Romance problems?,Yêu rồi sao?,Woo; court.
mystery,noun,bí ẩn,"Yeah, and then saved by some mysterious vigilante.",Phải và rồi được cứu bởi một gã nổi loạn bí ẩn .,Something secret or unexplainable; unknown.
thriller,noun,Thriller,You're five zippers away from Thriller .,Anh chỉ là phần còn lại của Thriller thôi.,"Something that thrills, especially a suspenseful, sensational genre of story, book, play or film."
short story,noun,truyện ngắn,"Vibrant Depths (Zářivé hlubiny) 1916 – Collection of short stories , also illustrated by Josef.","Chấn động biển sâu (Zářivé hlubiny) 1916 – Tuyển tập truyện ngắn , cũng được minh họa bởi Josef.",A work of fiction that is shorter than a novel.
novel,adjective,mới,"I'm a magician, and it's a novel kind of an act.","Tôi là một ảo thuật gia, Và đây là một kiểu diễn mới lạ.",(obsolete) A novelty; something new. [15th-18th c.]
