word,part_of_speech,meaning,example,example_meaning,definition
haywire,adjective,rối loạn,The body's immune response goes haywire and starts attacking the peripheral nerves.,Phản ứng miễn dịch của cơ thể đột ngột rối loạn và tấn công các dây thần kinh ngoại biên.,Wire used to bind bales of hay.
malfunction,verb,trục trặc,But the Son'a report claims that they didn't fire until after he malfunctioned .,Nhưng người Son'a nói rằng họ không hề nổ súng trước khi anh ta bị trục trặc .,Faulty functioning.
battalion,verb,Tiểu đoàn,They had the battalion here under a very poor major.,Tiểu đoàn được đặt dưới quyền chỉ huy của một thiếu tá kém cỏi.,"(military) An army unit having two or more companies, etc. and a headquarters. Traditionally forming part of a regiment."
ruckus,noun,,What's this ruckus about?,Sao phải làm loạn lên thế?,A noisy disturbance and/or commotion.
flabbergasted,adjective,kinh ngạc,"When I leave a job interview, they're flabbergasted , can't believe what I say.",Khi tôi kết thúc phỏng vấn mọi người rất kinh ngạc và không tin những gì tôi nói.,"Appalled, annoyed, exhausted or disgusted."
unforeseen,adjective,bất ngờ,Illness or unforeseen occurrence may keep us away occasionally.,Thỉnh thoảng mình có thể vắng mặt vì bệnh hoạn hoặc trường hợp bất ngờ xảy ra.,not foreseen.
interrogation,noun,sự thẩm vấn,We need to interrogate one.,Chúng ta cần tới thẩm vấn một con.,The act of interrogating or questioning; examination by questions; inquiry.
expeditiously,adverb,,More expeditious than that.,Khẩn trương hơn đi.,In an expeditious manner
reserved,adjective,dành riêng,This process is not reserved for the prophets alone.,Tiến trình này không dành riêng cho các vị tiên tri.,Simple past tense and past participle of reserve.
privy,adjective,kín,The Privy Council is claiming... the remnants who escaped are behind this,Hội đồng kín đã tuyên bốNgười trốn thoát là kẻ đứng sau vụ này,"(now chiefly historical) Private, exclusive; that is one's own."
levity,noun,tính coi nhẹ,Your levity is good.,Tình yêu của con người thật tốt.,"lightness of manner or speech, frivolity"
scorn,verb,khinh,The scornful often accuse prophets of not living in the 21st century or of being bigoted.,Kẻ khinh miệt thường cáo buộc các vị tiên tri về việc không sống hợp thời trong thế kỷ 21 hoặc bị mù quáng.,(transitive) To feel or display contempt or disdain for something or somebody; to despise.
epigram,noun,cách nói dí dỏm,"Hence the epigram , ""Lex orandi, lex credendi"" - the law for prayer is the law for faith.","Lex orandi , lex credenda (""Luật của sự cầu nguyện chính là luật của đức tin"").",(obsolete) An inscription in stone.
turbulence,noun,Dòng chảy rối,"A turbulent flow can, however, be statistically stationary.","Một dòng chảy rối có thể, tuy nhiên, ổn định về mặt thống kê.","(uncountable) The state or fact of being turbulent or agitated; tempestuousness, disturbance."
supercilious,adjective,khinh khỉnh,The psalmist wrote: “The wicked one according to his superciliousness makes no search; all his ideas are: ‘There is no God.’” —Psalm 10:4.,"Người viết Thi-thiên nói: “Vì kiêu ngạo, nó không tìm kiếm Chúa, trong tư duy không dành chỗ cho Ngài”.—Thi-thiên 10:4, Bản Diễn Ý; chúng tôi viết nghiêng.",Arrogantly superior; showing contemptuous indifference; haughty.
oculist,noun,thầy thuốc khoa mắt,(Inaudible remark) (For bad eyesight you must go to a better oculist .),(Bình phẩm không nghe rõ) (Vì thị lực kém bạn phải đi đến một bác sĩ mắt tốt hơn.),An ophthalmologist
contiguous,adjective,bên cạnh,Staten Island is the only borough in New York City that does not share a land border with another borough (Marble Hill in Manhattan is contiguous with the Bronx).,Đảo Staten là quận duy nhất của Thành phố New York không có ranh giới trên bộ với quận khác (Marble Hill thuộc Manhattan nằm sát bên cạnh quận the Bronx).,connected; touching; abutting
sumptuous,adjective,xa hoa,"Through his agents Stephen and Theodotos, the emperor raised the funds to gratify his sumptuous tastes and his mania for erecting costly buildings.","Thông qua hai tên thuộc hạ là Stephen và Theodotos, hoàng đế cho nâng công quỹ để thỏa mãn thị hiếu xa hoa và niềm đam mê xây dựng những công trình tốn kém của mình.","Magnificent, luxurious, splendid."
anemic,adjective,thiếu máu,53% of women of reproductive age and 44% of children were found to be anemic .,53% phụ nữ ở tuổi sinh đẻ và 44% trẻ em bị thiếu máu .,Of or pertaining to anemia.
countenance,verb,cho phép,"The New York Times stated that ""no true patriot can countenance any such expenditures for bronze females in the present state of our finances.""","Nhật báo The New York Times lên tiếng rằng ""không có người yêu nước chân chính nào có thể cho phép bất cứ sự chi tiêu nào như thế cho những hình tượng nữ bằng đồng với tình trạng tài chính hiện tại của chúng ta.""","Appearance, especially the features and expression of the face."
rakish,adjective,ngang tàng,I think you look very rakish .,Tôi nghĩ rằng cậu trông rất ngang tàng .,Stylish; characterized by a devil-may-care unconventionality.
immoderate,adjective,quá độ,▪ What the Bible does condemn is the immoderate use of alcohol:,▪ Điều Kinh Thánh lên án là việc uống rượu quá độ :,"excessive or lacking, not consistent"
hauteur,noun,thái độ kiêu căng,""" Lord Pershore gone to bed, Jeeves? "" I asked, with reserved hauteur and what - not.",""" Chúa Pershore đi ngủ, Jeeves? "" Tôi hỏi, với hauteur dành riêng và những gì - không.",haughtiness or arrogance; loftiness
shiftless,adjective,nhác,I'm shiftless .,Tôi rất vụng về .,"lazy, unmotivated"
hospitality,noun,lòng hiếu khách,The Jews viewed showing hospitality as a sacred duty.,Người Do Thái xem việc thể hiện lòng hiếu khách là điều rất quan trọng.,"(business) The business of providing catering, lodging and entertainment service."
punctilious,adjective,câu nệ,"Some sites, including Wikimedia Commons, are punctilious about licenses and only accept pictures with clear information about permitted use.","Một số website, bao gồm Wikimedia Commons , có quy định chặt chẽ về bản quyền và chỉ chấp nhận ảnh chụp với thông tin giấy phép hợp lệ và rõ ràng.","Strictly attentive to detail; meticulous or fastidious, particularly to codes or conventions."
disconcerting,adjective,làm bối rối,"AllMusic called it a ""dizzying, disconcerting , schizophrenic tour through just about any rock style the group can think of, hopping from genre to genre without any apparent rhyme or reason, and sometimes doing so several times in the same song.""","AllMusic gọi album ""làm choáng váng, làm bối rối , một chuyến đi điên rồ qua tất cả những phong cách nhạc rock mà nhóm nhạc có thể nghĩ đến, chuyển từ thể loại này sang thể loại khác mà chẳng cần lý do nào, và đôi khi làm điều đó nhiều lần trong chỉ một bài hát.""","Tending to cause discomfort, uneasiness or alarm; unsettling; troubling; upsetting."
evasion,noun,sự tránh,Tax evasion .,Trốn thuế,"The act of eluding or avoiding, particularly the pressure of an argument, accusation, charge, or interrogation; artful means of eluding."
insidious,adjective,nham hiểm,"11 Satan can also undermine our spirituality in a subtle, insidious way.",11 Sa-tan cũng có thể dùng một cách xảo quyệt và nham hiểm để làm tổn hại tình trạng thiêng liêng của chúng ta.,"Producing harm in a stealthy, often gradual, manner."
meretricious,adjective,gái điếm,Meretricious .,Thật hào nhoáng .,"(obsolete) Of, or relating to prostitutes or prostitution."
ineffable,adjective,huý,An “ Ineffable Name”?,Một “danh cấm kỵ ” chăng?,Beyond expression in words; unspeakable.
ramification,noun,nhánh,to see the political ramifications of a system like this.,để đọc bảng phân nhánh của những hệ thống thế này.,"(botany, anatomy) A branching-out, the act or result of developing branches; specifically the divergence of the stem and limbs of a plant into smaller ones, or of similar developments in blood vessels, anatomical structures etc."
turgid,adjective,sưng,This is a positive remedy for weariness turgidity of the bowels and...,Đây là một phương thuốc nhiệm mầu cho mọi sự mệt mỏi sưng phình ruột và...,"Distended beyond the natural state by some internal agent, especially fluid, or expansive force."
dejection,noun,sự buồn nản,THE KING BECOMES “ DEJECTED ” IN A WAR,VỊ VUA TRỞ NÊN “ LO - BUỒN ” TRONG CUỘC CHIẾN,"a state of melancholy or depression; low spirits, the blues"
indiscernible,adjective,không phân biệt được,"For a fixed length n, the Hamming distance is a metric on the set of the words of length n (also known as a Hamming space), as it fulfills the conditions of non-negativity, identity of indiscernibles and symmetry, and it can be shown by complete induction that it satisfies the triangle inequality as well.","Đối với một chiều dài cố định ""n"", khoảng cách Hamming là độ đo trên không gian vectơ của các từ có chiều dài đó, vì nó thỏa mãn yêu cầu về tính chất số không âm (non-negativity) (số tuyệt đối), hiện thân của tính bất khả phân định (indiscernibles) và tính đối xứng (symmetry), và nó có thể được chứng minh một cách dễ dàng bằng phép quy nạp toàn phần (complete induction) rằng nó còn thỏa mãn bất đẳng thức tam giác (triangle inequality).","Not capable of being discerned, of being perceived."
stratum,noun,tầng,It consists of a partial anterior dentary 11.5 centimetres (4.53 in) in length from an early Albian stratum of the Chenini Formation of Tunisia.,"Nó bao gồm một mảnh của bề ngoài xương răng dài 11,5 cm khai quật từ tầng Albian đầu tiên của hệ tầng Chenini tại Tunisia.",One of several parallel horizontal layers of material arranged one on top of another.
redolent,adjective,gợi lại,It's redolent of James Bond movies and Kipling ballads.,Nó có hơi hướng như trong phim James Bond và những bản nhạc của Kipling.,fragrant or aromatic; having a sweet scent
vestibule,verb,tiền đình,Is it a vestibule ?,Đây có phải là phòng chờ không nhỉ?,"(architecture) A passage, hall or room, such as a lobby, between the outer door and the interior of a building."
garrulous,adjective,ba hoa,"Now take the same patient with chest pain, make them moist and garrulous and put a little bit of alcohol on their breath, and suddenly my history is laced with contempt.","Bây giờ cùng bệnh nhân bị đau ngực ấy, giả dụ anh ta ướt mồ hồi và nói lắm và thêm tí mùi cồn vào hơi thở của anh ta, và đột nhiên tiền sử bệnh của tôi bị ảnh hưởng xấu",Excessively or tiresomely talkative.
pneumatic,adjective,chạy bằng hơi,Supply more power than pneumatics .,Cung cấp nhiều năng lượng hơn khí nén .,(zoology) Having cavities filled with air
inextricably,adverb,,The very word will tell you how inextricably the two are one.,Cái từ chính xác sẽ nói cho em biết hai thứ gắn bó với nhau ra sao.,To an inextricable degree.
lamentation,noun,lời than van,Mama Beatrice’s laments remind me of how Job must have felt upon receiving all his terrible news.,Những lời than van của bác Beatrice làm chúng tôi nhớ đến cảm giác của ông Gióp khi nhận những tin khủng khiếp.,The act of lamenting.
conglomeration,noun,sự kết hợp,“Modern Western numerals may be a conglomeration from different sources.,“Các con số hiện đại phương Tây có lẽ là sự kết hợp từ nhiều nguồn khác nhau.,That which consists of many previously separate parts.
gesticulation,noun,khoa tay múa chân,"Now you pursue this guy, gesticulating .","Bây giờ bạn đuổi theo anh ta, khoa tay múa chân rối rít.","The act of gesticulating, or making gestures to express passion or enforce sentiments."
audacious,adjective,táo bạo,"So, together these two nations did something truly audacious .","Vậy, hai quốc gia đã cùng nhau làm một điều thực sự táo bạo .",Showing willingness to take bold risks; recklessly daring.
frivolous,adjective,nhẹ dạ,Déclassé consumption is the whole idea that spending money frivolously makes you look a little bit anti-fashion.,Giảm tiêu dùng là ý tưởng sử dụng tiền một cách nhẹ dạ làm bạn trở nên lỗi thời một chút.,"Silly, especially at an inappropriate time or in an inappropriate manner."
facetious,adjective,khôi hài,"You know, I thought it was rather facetious .","Bạn biết đấy, tôi đã nghĩ rằng nó khá là khôi hài .",Treating serious issues with deliberately inappropriate humor; flippant.
hortatory,adjective,cổ vũ,,,Giving exhortation or advice; encouraging; exhortatory; inciting.
arbitrary,adjective,độc đoán,A wise husband will not make arbitrary decisions.,Một người chồng khôn khéo thì không quyết định một cách độc đoán .,"(usually of a decision) Based on individual discretion or judgment; not based on any objective distinction, perhaps even made at random."
infirm,adjective,ốm yếu,Are arrangements complete to help older and infirm brothers and sisters?,Có sự sắp đặt trọn vẹn để giúp các anh chị lớn tuổi và ốm yếu không?,"Weak or ill, not in good health."
assiduously,adverb,cần mẫn,"The Koreans, very assiduously , did test both.","Người Hàn Quốc, một cách rất siêng năng , đã tiến hành kiểm tra cả hai phương pháp.",In an assiduous manner.
jowl,verb,hàm,"Pasta dishes based on the use of guanciale (unsmoked bacon prepared with pig's jowl or cheeks) are often found in Lazio, such as pasta alla carbonara and pasta all'amatriciana.","Bài chi tiết: Ẩm thực La mã Các món pasta dựa trên guanciale (giăm bông không xông khói nấu với hàm hoặc má lợn) thường được thấy ở Lazio, như là pasta alla carbonara, và pasta all'amatriciana.","the jaw, jawbone; especially one of the lateral parts of the mandible."
noxious,adjective,hại,"And then within plant protection, I came into the discipline of biological pest control, which we actually define as the use of living organisms to reduce populations of noxious plant pests.","Rồi trong ngành bảo vệ thực vật, tôi đi sâu vào chuyên ngành kiểm soát sâu bệnh bằng phương pháp sinh học mà chúng tôi định nghĩa là việc sử dụng các sinh vật để hạn chế số lượng các loài sâu hại trên cây trồng.",Harmful; injurious.
semblance,noun,sự làm ra vẻ,Avoid any semblance of pornography.,Hãy tránh xa bất cứ điều gì giống như hình ảnh sách báo khiêu dâm.,"likeness, similarity; the quality of being similar."
reprobation,noun,sự bài xích,Reprobate .,Tội lỗi quá .,(theology) The Calvinist term for damnation.
incorporeal,adjective,vô hình,"Sagan concludes by asking: ""Now what's the difference between an invisible, incorporeal , floating dragon who spits heatless fire and no dragon at all?","Sagan kết luận bằng cách hỏi ""Giờ thì có sự khác biệt nào giữa một con rộng vô hình , vô thể, trôi lơ lửng thở ra ngọn lửa vô nhiệt và không có con rồng nào?",Having no material form or physical substance.
avarice,noun,tính hám lợi,"They may be blinded by avarice , numbed by apathy, paralyzed by indecision, bogged down by routine, or gripped by fear of losing prestige.","Họ có thể mù quáng vì tính hám lợi , vô cảm vì tính thờ ơ, lưỡng lự vì thiếu quyết đoán, ngập đầu trong những công việc thường ngày, hoặc bị kiềm kẹp trong nỗi sợ mất uy tín.",Excessive or inordinate desire of gain; greediness after wealth; covetousness; cupidity.
prose,noun,văn xuôi,Urquhart's prose style is unique.,Phong cách viết văn xuôi của Urquhart là độc nhất vô nhị.,"Language, particularly written language, not intended as poetry."
drudge,verb,người lao dịch,It's going to be on Drudge within the hour.,Nó sẽ xuất hiện trên Drudge trong một giờ nữa.,A person who works in a low servile job.
misogynist,adjective,người ghét kết hôn,It's misogynistic .,Đó là tính ghét phụ nữ .,One who professes misogyny; a hater of women.
cursory,adjective,vội,Forgive me for the cursory nature of my greeting.,Xin thứ lỗi cho sự đón tiếp vội vàng của tôi.,"Brief or broad; not close, cautious, nor detailed."
pervade,verb,lan tràn khắp,"Our personal battles may include exertion to resist the pervading spirit of moral laxity, to fight our own weaknesses, or to protect our family from defiling influences.","Có thể chúng ta phải chiến đấu để kháng cự lối sống buông thả lan tràn khắp nơi, chống lại sự yếu kém của bản thân hoặc bảo vệ gia đình khỏi những ảnh hưởng xấu.",To be in every part of; to spread through
prosaic,adjective,tầm thường,"No, he would never do anything that prosaic .","Không, anh ấy sẽ không làm những việc tầm thường như vậy.",Pertaining to or having the characteristics of prose.
deplorable,adjective,tồi,"For example, in some parts of the world, imperfect human economic and political systems fail to provide children with adequate health care, suitable education, and sufficient food, as well as protection from the scourge of child labor and deplorable living conditions.","Thí dụ, ở một số nơi trên thế giới, hệ thống kinh tế và chính trị bất toàn của loài người không cung cấp cho trẻ em đủ sự chăm sóc y tế, sự giáo dục thích hợp và đầy đủ thức ăn, cũng như không bảo vệ chúng khỏi tệ nạn trẻ em lao động và điều kiện sống tồi tệ.",To be felt sorrow for; worthy of compassion.
escapade,noun,hành động hoang toàng,It's called Escapade .,Nó tên là Escapade .,A daring or adventurous act; an undertaking which goes against convention.
agog,adjective,nóng lòng,Your son starts the agoge next year.,Con trai người sẽ bắt đầu sống xa người vào năm tới.,"In eager desire, eager, astir."
omnibus,noun,xe buýt,"Robert, what's the latest on the omnibus ?","Robert, tình hình vụ xe buýt thế nào?",(obsolete) A vehicle set up to carry many people (now usually called a bus).
eschew,verb,kiêng cữ,"You know, Elsie Stark, she eschewed the pleasures of this earth.",Elsie Stark đã từ bỏ các niềm khoái lạc trên trần đời.,"(transitive, formal) To avoid; to shun, to shy away from."
faction,noun,bè phái,Many of them formerly belonged to factions that were at war with one another.,Nhiều người trong họ ngày trước thuộc vào các bè phái tranh chiến lẫn nhau.,"A group of people, especially within a political organization, who express a shared belief or opinion different from people who are not part of the group."
impediment,noun,sự ngăn trở,18. (a) What is often a major impediment to communication?,18. a) Cái gì thường là sự ngăn trở chính cho sự liên lạc?,A hindrance; that which impedes or hinders progress.
inimitable,adjective,,The Inimitable Caroline.,Caroline kinh hoàng.,"beyond imitation, surpassing all others, matchless"
toady,verb,liếm gót,I'm not your toady and I'm not your friend.,Ta không phải kẻ liếm gót ngươi và cũng không phải bạn của ngươi.,A sycophant who flatters others to gain personal advantage.
scruples,verb,,Scruples or beliefs?,Sự cứng nhắc hay lòng tin?,Plural form of scruple.
congeal,verb,đông,The surging waters congealed in the heart of the sea.,Sóng nước dâng trào đông cứng giữa lòng biển.,(transitive) To change from a liquid to solid state perhaps by cold
coarseness,noun,tính thô tục,"This stuff's a bit coarse , but it's good.","Chất liệu hơi thô , nhưng được.","The property of being coarse, roughness or primitiveness, unrefined or unpolished."
wench,adjective,gái điếm,Kitchen wench .,Con ả dọn bếp.,"(intransitive) To frequent prostitutes, to womanize"
plebeian,adjective,bình dân,"And you feasted 11,000 plebeians in the field of Mars.","Và ngươi mở yến tiệc cho 11,000 người dân ở cánh đồng thần Mars.","Of or pertaining to the Roman plebs, or common people."
frontispiece,noun,chính diện,IX: Frontispiece .,Thứ chín: Trước phục hầu.,"(publishing) An illustration that is on the page before the title page of a book, a section of one, or a magazine."
despotism,noun,chế độ chuyên quyền,The people who suffer under despots and prosper under just rule.,Những người khốn khổ vì bạo chúa và thịnh vượng nhờ anh quân.,"government by a singular authority, either a single person or tight-knit group, which rules with absolute power"
aesthetics,noun,mỹ học,I occasionally write about the aesthetics of photography.,Tôi thỉng thoảng có viết về quan điểm mỹ học trong nhiếp ảnh.,The study or philosophy of beauty.
anodyne,adjective,an ủi,"In another negative review, writing for Drowned in Sound, David Hillier gave ÷ a 3/10 rating, calling it ""the most anodyne and bland pop album possible.""","Trong một bài đánh giá tiêu cực, viết cho Drowned in Sound, David Hillier đã cho ÷ đánh giá 3/10, gọi nó là ""album nhạt nhẽo nhất có thể"".",Capable of soothing or eliminating pain. [from 16th c.]
terse,adjective,súc tích,The terseness of your email made it sound specific and time-related.,Tính chất súc tích của email anh làm cho nó có vẻ rành mạch và liên quan đến thời gian.,"(obsolete) Polished, burnished; smooth; fine, neat, spruce."
superfluity,noun,số thừa,Threat detection is superfluous .,Phát hiện mối đe dọa là không cần thiết .,The quality or state of being superfluous; in excess or overabundance.
confidante,noun,bạn gái tâm tình,She was a confidante and friend of Kamuzu Banda.,Bà là một người tri kỷ và bạn của Kamuzu Banda.,A female confidant.
depravity,noun,hành động sa đoạ,How depraved !,Thật là trụy lạc!,(uncountable) The state or condition of being depraved; moral debasement.
pernicious,adjective,nguy hiểm,to stop a new pernicious innovation which they called spooning.,để ngăn ngừa một sáng kiến nguy hiểm mà họ gọi là spooning (ôm ấp).,Causing much harm in a subtle way.
serpentine,adjective,quanh co,"Setting off again, we cross a spectacular rocky pass cut deep into the mountains and follow the serpentine road to a much smaller village.","Chúng tôi lại lên đường, băng qua một đèo đá ngoạn mục xuyên qua dãy núi, rồi đi tiếp theo con đường quanh co đến một ngôi làng nhỏ hơn nhiều.",Sinuous; curving in alternate directions.
astir,adjective,trở dậy,12 “My heart has become astir with a goodly matter.,12 “Lòng tôi đầy tràn những lời tốt.,In motion; characterized by motion.
nonchalance,noun,tính thờ ơ,Nonchalant .,Bình tĩnh thôi !,indifference; carelessness; coolness.
severance,noun,sự chia rẽ,Her support of the Contras caused divisions in her own family and resulted in La Prensa's offices being temporarily shut down on several occasions.,Sự ủng hộ của cô đối với Contras đã gây ra sự chia rẽ trong gia đình bà và kết quả là văn phòng của La Prensa bị tạm thời đóng cửa vài lần.,A separation.
repression,noun,sự kiềm chế,"It is not a repression of faults, so was not framed as a list of prohibitions.","Đây không phải là một sự kiềm chế lỗi lầm, vì vậy không được viết ra như một danh sách gồm những điều không nên làm.",The act of repressing; state of being repressed.
androgynous,adjective,ái nam ái nữ,"Ceviche (voiced by Elan Garfias): A young yellow (and somewhat androgynous ) goat apprentice to Paté and Panini's best friend, Ceviche was introduced in the episode ""The Apprentice Games"".","Ceviche (lồng tiếng bởi Elan Garfias):Một con dê con học việc màu vàng (và phần nào ái nam ái nữ ) cho Paté và người bạn thân nhất của Panini, Ceviche được giới thiệu trong tập phim ""The Apprentice Games"".",Possessing the sex organs of both genders. [from the earlier 17th c.]
virility,noun,khả năng có con,I'm so virile .,Ta thật là cường tráng .,Manly character
unmitigated,adjective,thậm,It hasn't been an unmitigated disaster.,Nó không phải là một thiên tai nhỏ.,Not mitigated
