word,part_of_speech,meaning,example,example_meaning,definition
mutton,adjective,thịt cừu,Pressed your face to the fire like you're a nice juicy mutton chop.,Nhấn mặt của ông vào ngọn lửa như thể ông là miếng thịt cừu mọng nước.,The flesh of sheep used as food.
extremity,noun,cùng,"The low nutrient level, extreme pressure and lack of sunlight create hostile living conditions in which few species are able to exist.","Mật độ dinh dưỡng thấp, áp lực nước cực mạnh cùng với việc không có ánh sáng chiếu tới đã tạo nên điều kiện sống bất lợi làm cho nơi đây có rất ít các loài sinh vật có khả năng tồn tại.",The most extreme or furthest point of something.
grandeur,noun,sự vĩ đại,Delusions of grandeur .,Ảo tưởng về sự vĩ đại .,The state of being grand or splendid; magnificence.
higgledy-piggledy,adjective,bát nháo,"But "" lexicographical "" is the same pattern as "" higgledy - piggledy . ""","Nhưng "" lexicographical "" có cùng mẫu hình với từ "" higgledy- piggledy. """,In utter disorder or confusion; mixed up.
malicious,adjective,ác,You yet have to show me one single example of maliciousness .,Cô vẫn chưa cho tôi xem một ví dụ của sự độc ác .,"Of, pertaining to, or as a result of malice or spite"
cheeky,adjective,hỗn xược,Cheeky sod.,Quỷ tha ma bắt.,(informal) Impudent; impertinent.
upstanding,adjective,cố định,All the upstanding citizens of society.,Toàn là thành phần thượng lưu của Xã hội.,honest; reputable
parlay,verb,đánh cuộc,Learn how Biff parlayed that lucky winning streak into the vast empire called Biffco.,Biết làm thế nào Biff đánh cuộc vào... đế quốc cờ bạc gọi là Biffco.,(transitive) To carry forward the stake and winnings from a bet onto a subsequent wager.
coiffure,verb,kiểu tóc,"“Yes, I suppose pumpkins can be allowed greater latitude in neatness of coiffure .”","“Vâng, tôi cho là bí ngô có thể được cho phép mức độ tóc tai gọn gàng hơn.”",hairstyle
attrition,noun,hao mòn,These elements now also impact losses from attrition .,Những yếu tố này bây giờ cũng ảnh hưởng đến tổn thất từ tiêu hao .,wearing or grinding down by friction
aplomb,noun,sự tự tin,"Milito clincially took both his chances with great aplomb , but also exposed FC Hollywood’s backs , a weakness that had been highlighted throughout the season in Europe’s top competition , even against Manchester United and Fiorentina , and an Achilles heel that Goal.com’s Ewan Macdonald pinpointed before the match .","Milito dễ dàng tận dụng cả hai cơ hội của mình với sự tự tin cao độ , nhưng còn cho thấy những vị trí hậu vệ trung tâm của Bayern Munich , điểm yếu mà đã bị bộc lộ suốt cả mùa bóng trong giải đấu cao nhất Châu Âu , thậm chí trước Manchester United và Fiorentina , và là gót chân A sin mà Ewan Macdonald của Goal.com từng chỉ ra trước trận đấu .",self-confidence; poise; composure.
wager,verb,sự cá cược,and his wager went like this:,và sự cá cược của ông ấy như sau:,"Something deposited, laid, or hazarded on the event of a contest or an unsettled question; a bet; a stake; a pledge."
racketeer,verb,găngxtơ,I'll go find a racket .,Anh sẽ đi tìm vợt .,"one who commits crimes (especially fraud, bribery, loansharking, extortion etc.) to aid in running a shady or illegal business."
encumbrance,noun,gánh nặng,"He told them that the body was a mere encumbrance , a prison for the soul.",Ông bảo họ rằng thể xác chỉ là một gánh nặng và là nơi giam hãm linh hồn.,Something that encumbers; a burden that must be carried.
beleaguer,verb,bao vây,This is Beleaguered Castle.,Đây là pháo đài kín .,To besiege; to surround with troops.
withers,noun,u vai,"The blossom withers ,+",Hoa nở cũng tàn +,"The part of the back of a draft animal or horse that is the highest, between the shoulder blades."
anthropomorphism,noun,thuyết hình người,Anthropomorphisms are not to be taken literally.,Thuyết hình người không được hiểu theo nghĩa đen.,"the attribution or ascription to inanimate objects, animals, forces of nature etc, of characteristics believed or assumed by some to belong exclusively to humans. [from the mid-18th c.]"
underscore,verb,gạch dưới,"This can be achieved by writing them in capital letters, underscoring the points, or marking them in color.","Có thể thực hiện điều này bằng cách viết bằng chữ hoa, gạch dưới , hay đánh dấu bằng viết màu.",An underline; a line drawn or printed beneath text; the character _.
sibilant,adjective,âm xuýt,"The father relentlessly pressed forward, pushing out sibilants , like a wild man.","Người cha không ngừng ép về phía trước, đẩy ra sibilants, giống như một người đàn ông hoang dã.","Characterized by a hissing sound such as the ""s"" or ""sh"" in sash or surge."
parochial,adjective,giáo khu,It reflected the rather parochial perspective.,Nó phản ánh phần nào viễn cảnh của giáo khu .,Pertaining to a parish.
credulity,noun,tính nhẹ dạ,Faith Versus Credulity,Đức tin trái ngược với tính nhẹ dạ,A willingness to believe in someone or something in the absence of reasonable proof; credulousness.
demean,verb,cư xử,This is demeaning .,Vậy là nhẫn nhịn rồi đấy.,To debase; to lower; to degrade.
quandary,noun,tình thế khó xử,"Well, I'm in a quandary , and I need your help.","Well, tao đang trong tình thế khó xử , tao cần mày giúp.","A state of not knowing what to decide; a state of difficulty or perplexity; a state of uncertainty, hesitation or puzzlement; a pickle; a predicament."
inertia,noun,quán tính,"Now, because the sea has a greater thermal inertia than the land,","Và bởi vì nước biển thì có mức quán tính nhiệt lớn hơn mặt đất,","(physics, uncountable or countable) The property of a body that resists any change to its uniform motion; equivalent to its mass."
skittishness,noun,tính hay lồng,"Skittish , Toombs.","Non tay quá , Toombs.",The property of being skittish.
inure,verb,có hiệu lực,"The world soon gets desensitized, inured to violence.","Do đó thế giới quen đi, không còn xúc động trước bạo lực.",(transitive) To cause (someone) to become accustomed (to something); to habituate. [from 16th c.]
curmudgeon,noun,người keo kiết,The spirit escorts Scrooge on a journey into the past to previous Christmases from the curmudgeon 's earlier years .,Con ma ấy hộ tống lão trên một chuyến hành trình về quá khứ về lại những mùa Giáng sinh xưa từ thời thơ ấu của lão keo kiệt này .,(archaic) A miser.
abut,verb,tiếp giáp với,"My small rectory abuts her estate,","Căn nhà nhỏ của tôi tiếp giáp với ruộng đấy của bà ấy,","(intransitive) To touch by means of a mutual border, edge or end; to border on; to lie adjacent; to project; to terminate; to be contiguous; to meet."
wily,adjective,lắm mưu,Kol the wily fox.,Kol là cáo ma mãnh.,"sly, cunning, full of tricks"
bucolic,adjective,mục đồng,"This one says, "" Bucolic meadow with split- rail fence.",""" Đồng cỏ thôn quê với rào phân cách đường sắt.","Rustic, pastoral, country-styled."
crooner,noun,,Crooners .,Crooners ạ .,"One who croons; a singer, usually male, especially of popular music."
inarticulate,adjective,không rõ ràng,She's a little inarticulate .,Cô ấy không nói được rõ ràng cho lắm.,speechless
magnanimity,noun,tính hào hiệp,You sound positively magnanimous .,Nghe rất khả quan .,The quality of being magnanimous; greatness of mind; elevation or dignity of soul.
farrier,verb,thợ đóng móng ngựa,"Farmers, farriers , stable boys.","Nông dân, tiều phu , người giữ ngựa.",A person who maintains the health and balance of the horse's feet through the trimming of the hoof and placement of horseshoes.
capitalization,noun,vốn hóa,"of market capitalization , showing that they'd actually mastered the art","vốn hóa thị trường, cho thấy họ đã kiểm soát thành công nghệ thuật",(North America) Alternative form of capitalisation.
punctuation,noun,chấm câu,"Consider, too, how the punctuation affects the meaning of the sentence.",Cũng hãy xét xem những dấu chấm câu ảnh hưởng thế nào đến ý nghĩa câu văn.,"A set of symbols and marks which are used to clarify meaning in text by separating strings of words into clauses, phrases and sentences."
sentence,verb,kết án,Chet was tried and convicted of murder and sentenced to life in prison.,Chet bị xét xử và bị kết án sát nhân và lãnh án tù chung thân.,To declare a sentence on a convicted person.
structure,verb,cấu trúc,"For example, molecular structure .","Ví dụ như, cấu trúc phân tử.",A cohesive whole built up of distinct parts.
