word,part_of_speech,meaning,example,example_meaning,definition
lintel,noun,lanh tô,Lintel 13 is above a doorway in Structure 20.,Vòm đá 13 ở trên một ô cửa trong Cấu trúc 20.,"(architecture) A horizontal structural beam spanning an opening, such as between the uprights of a door or a window, and which supports the wall above."
grackle,noun,grackle,,,Any of several American blackbirds of the genus Quiscalus having iridescent plumage
bemoan,verb,than khóc,""" Do not bemoan the sailor's life.",""" Đừng than khóc cho mạng tên thủy thủ",(transitive) to complain about; to dismay or worry about something
bedeck,verb,trang hoàng,A playground bedecked with flowers.,Một khoảng sân trang hoàng đầy hoa.,"To deck, ornament, or adorn; to grace."
piquant,adjective,cay cay,You know what else Dave finds particularly piquant ?,Anh có biết Dave còn tìm thấy thứ gì đặc biệt nữa không?,Engaging; charming.
elucidation,noun,sự giải thích,"Allow us to elucidate , Miss Bell.","Để bọn tớ giải thích cho bạn rõ nhé, Bell.","A making clear; the act of elucidating or that which elucidates, as an explanation, an exposition, an illustration; as, one example may serve for further elucidation of the subject."
imprudence,noun,hành động khinh suất,What an imprudent investment!,Thật là một sự đầu tư dại dột biết bao!,"(uncountable) The quality or state of being imprudent; want of prudence, caution, discretion or circumspection; indiscretion; inconsideration; rashness; heedlessness."
equivocal,adjective,nước đôi,"First they denied, and then they equivocated ...","Đầu tiên thì họ phủ nhận, rồi thì họ nói nước đôi ...",A word or expression capable of different meanings; an ambiguous term; an equivoque.
acquiescent,adjective,bằng lòng,"I asked for it back, they acquiesced .","Tôi muốn có lại nó, họ đã chấp nhận","willing to acquiesce, accept or agree to something without objection, protest or resistance"
pertinacity,noun,tính cố chấp,,,The state or characteristic of being pertinacious.
supposititious,adjective,giả định,"Some charged that the boy was "" supposititious "", having been secretly smuggled into the Queen's room in a bed-warming pan as a substitute for her stillborn baby.","Một số thông tin cho rằng cậu bé là ""giả mạo"", đã được bí mật đưa vào phòng của Vương hậu thay thế cho một đứa bé chết lưu từ trước.","Spurious; substituted for the genuine, counterfeit."
peroration,noun,,"Webster concluded his peroration with the famous words: ""It is, Sir, as I have said, a small college.","Kết luận bài diễn văn nổi tiếng của mình, Webster đã nói lên những câu từ nổi tiếng mà sau này được nhiều thế hệ trích dẫn lại: ""Nó, thưa ngài, như tôi đã nói, là một ngôi trường nhỏ.","The concluding section of a discourse, either written or oral, in which the orator or writer sums up and commends his topic to his audience, particularly as used in the technical sense of a component of ancient Roman oratorical delivery."
convivial,adjective,hoan lạc,"The Greeks are a convivial lot and when they celebrate, they want you to join in.","Người Hy Lạp là những con người hoan lạc và khi họ mở hội, họ muốn bạn tham gia cùng.","Of or relating to a feast or entertainment, or to eating and drinking, with accompanying festivity; festive; social; gay; jovial."
improvident,adjective,hoang toàng xa phí,,,failing to provide for the future; reckless
adjure,verb,bắt thề,"And now, as I adjure you in his name, begone from this woman and her unborn child... ( CONTINUES, INDISTINCT )","Và ngay bây giờ, ta sẽ thay mặt ông ấy trục xuất ngươi, khỏi người phụ nữ này và đứa con chưa ra đời của cô ấy,","To issue a formal command, especially in a legal context."
deserts,noun,giá trị,A beautiful desert bloom such as yourself should be on the arm of the most powerful man in the world.,Một sắc đẹp giá trị như nàng nên nằm trong người đàn ông mạnh nhất thế giới này.,Plural form of desert.
arraign,verb,buộc tội,"You want to sort this out, you sort it out after he's arraigned .","Cô muốn giải quyết việc này, thì hãy giải quyết nó sau khi anh ta bị buộc tội .",To officially charge someone in a court of law.
insensate,adjective,không cảm xúc,Paul spoke of “the insensibility of their hearts.”,Sứ đồ Phao-lô nói về “lòng họ cứng - cỏi ”.,Having no sensation or consciousness; unconscious; inanimate.
panache,noun,sự huênh hoang,Such... panache .,Cũng thật là phong cách .,"(uncountable) Flamboyant, energetic style or action; dash; verve."
falsehood,noun,sự nói dối,What is included in ‘putting away falsehood and speaking the truth’?,«Chừa sự nói dối và nói thật» bao gồm điều gì?,(uncountable) The property of being false.
sexist,adjective,phân biệt giới tính,"Oh, you don't want to call her "" sexist ""?",Cô không muốn gọi cô ta là kẻ phân biệt giới tính .,A person who discriminates on grounds of sex; someone who practises sexism.
feminist,adjective,Người hoạt động vì nữ quyền,I'm a feminist .,Tôi là một người ủng hộ nữ quyền.,Relating to or in accordance with feminism.
disallow,verb,không cho phép,Disallow :,Không cho phép :,To refuse to allow
incurable,adjective,bất trị,"Miller, you are an incurable showoff.","Miller, anh đúng là một tên ba hoa bất trị .","Of an illness, condition, etc, that cannot be cured."
foul,adjective,xấu,Yesterday you seemed certain it was foul play.,Hôm qua ông còn chắc chắn đó là chơi xấu mà.,(baseball) Outside of the base lines; in foul territory.
lair,verb,hang ổ,Your new lair is up and running.,Hang ổ mới của ngài đã hoàn thành và đang hoạt động.,"A place inhabited by a wild animal, often a cave or a hole in the ground."
fiend,noun,quỷ,The same fiend that brought down the arena in Capua?,Cũng chính là con quỷ đã đánh sụp đấu trườ ng của Capua?,A demon
consider,verb,suy xét,• What must be considered when counting the cost of pursuing higher education?,• Cần phải suy xét điều gì khi nói đến giá phải trả cho việc học lên cao?,(transitive) To think about seriously.
umbrage,verb,bóng cây,Naaman took umbrage at the treatment and counsel.,Na-a-man mếch lòng vì cách đối xử và lời khuyên đó.,(transitive) To shade.
label,noun,nhãn,Please stick this label to your baggage.,Vui lòng dán nhãn vào hành lý của bạn.,(transitive) To put a label (a ticket or sign) on (something).
natural selection,noun,Chọn lọc tự nhiên,It was natural selection .,Đó là chọn lọc tự nhiên .,"(evolutionary biology) A process by which heritable traits conferring survival and reproductive advantage to individuals, or related individuals, tend to be passed on to succeeding generations and become more frequent in a population, whereas other less favourable traits tend to become eliminated."
embryonic,adjective,phôi,"Carrel started an experiment on January 17, 1912, where he placed tissue cultured from an embryonic chicken heart in a stoppered Pyrex flask of his own design.",Ngày 17.1.1912 Carrel bắt đầu thí nghiệm việc đặt mô cấy từ phôi tim gà trong một chai Pyrex có đạy nút do chính ông thiết kế.,(embryology) Of or relating to an embryo.
protean,adjective,giống thần Prô-tê,But surely this was not the Protean man you'd envisioned.,Nhưng tất nhiên đấy không phải là Prote mà ngươi hình dung.,Exceedingly variable; readily assuming different shapes or forms.
analogical,adjective,giống nhau,"Now, the analogy here is, perhaps we need",Và sự giống nhau ở đây là,"Of, pertaining to, based on, or composed of an analogy."
gradation,verb,bậc,The up- gradation work is complete.,Công việc nâng cấp đã được hoàn thành.,"A sequence of gradual, successive stages; a systematic progression."
acclimatize,verb,di thực,Thought I was gonna acclimatize faster than this.,Cứ tưởng tôi thích nghi nhanh lắm chứ...,(intransitive) To get used to a new climate.
homologous,adjective,tương đồng,A nail is homologous to a claw but is flatter and has a curved edge instead of a point.,Móng tay là tương đồng với một móng vuốt nhưng nó phẳng hơn và có cả một cạnh cong thay vì một điểm.,Showing a degree of correspondence or similarity.
viscera,noun,nội tạng,"Believe it or not, even with internal viscera .","Thậm chí cả nội tạng , tin hay không tùy bạn.","Plural form of viscus. Collectively, the internal organs of the body, especially those contained within the abdominal and thoracic cavities, such as the liver, heart, or stomach."
