word,part_of_speech,meaning,example,example_meaning,definition
entice,verb,dụ dỗ,One of the most damaging things he can do is entice us to break the law of chastity.,Một trong những điều tai hại nhất mà nó có thể làm là dụ dỗ chúng ta vi phạm luật trinh khiết.,(transitive) To lure; to attract by arousing desire or hope.
astounding,adjective,làm kinh ngạc,"The riches of your banking may astound the world, but one day they will be your undoing!","Sự giàu có của các ngân hàng có thể làm kinh ngạc mọi người, và sẽ có ngày chúng sẽ hủy hoại các con!",Present participle of astound.
kaleidoscopic,adjective,kính vạn hoa,"It's called "" Kaleidoscope .""","Nó tên là "" Kaleidoscope "".","Of, relating to, or produced by a kaleidoscope."
sober,adjective,không say rượu,Alex has been clean and sober for four months.,Alex đã không nghiện và không say rượu trong suốt bốn tháng rồi.,(often with up) To overcome or lose a state of intoxication.
hypothesize,verb,cho rằng,"Diamond hypothesizes that resource scarcity may have led to brutal civil war, creating a drop in population.","Có giả thuyết cho rằng kim cương hiếm có thể đã dẫn đến cuộc nội chiến tàn bạo, tạo ra sự sụt giảm dân số.",(US) to hypothesise
rigor mortis,noun,co cứng tử thi,"Rigor mortis , signore.","Đã tê cứng , thưa ngài.",Temporary stiffness of a body's muscles and joints following death.
unsolicited,adjective,không yêu cầu,It was an unsolicited phone call.,Là cuộc gọi không yêu cầu .,"Not requested, welcome or invited."
disrespect,verb,sự thiếu tôn trọng,Escort me or I will tell the Khan of your disrespect .,Hộ tống ta không ta sẽ nói với Khả Hãn về sự thiếu tôn trọng của ngươi.,"A lack of respect, esteem or courteous behaviour."
cuff,verb,cổ tay áo,"And here, this cuff as well.","Đây nữa, cổ tay áo cũng thế.",(obsolete) glove; mitten.
crusade,verb,cuộc thập tự chinh,Young Machiavelli has convinced him to join our crusade .,Cậu Machiavelli đã thuyết phục ngài tham gia cuộc Thập tự chinh .,Any of the military expedition undertakens by the Christians of Europe in the 11th to 13th centuries to reconquest the Levant from the Muslims
interpersonal,adjective,,Interpersonal love refers to love between human beings.,Tình yêu thương liên quan đến tình yêu giữa con người.,Between two or more people.
forewarn,verb,báo trước,"But be forewarned , don't push Ho.","Nhưng tôi báo trước , đừng ép hắn.",To warn in advance.
sermon,verb,bài thuyết giáo,"With those sermons , it's a wonder you're still ordained.","Với những bài thuyết giáo như vậy, không hiểu sao ông vẫn còn được phong chức.",religious discourse; a written or spoken address on a religious or moral matter
throb,verb,sự đập mạnh,A throbbing pain?,Một cơn đau nhói ?,(intransitive) To pound or beat rapidly or violently
mortuary,noun,nhà xác,"Anybody up for going to the mortuary with me later, figure out what to do with Monica?","Lát nữa có ai đến nhà xác với chị, giái quyết vụ Monica không?","of, or relating to death or a funeral; funereal"
jab,verb,cái thọc mạnh,"Nice jab , buddy!",Cú đấm thẳng hay đấy.,"In American English, the word jab is also used when someone is bothering someone else, what is commonly known as verbal jabs. ""Don't throw jabs at me"" and ""Quit jabbing!"" are popular sayings. This may be because the verbal annoyances are not substantial attacks, and are similar to a boxing jab in that they are only annoying (not a knockout blow)."
jealous,adjective,ghen tị,A jealous person may not wish another harm.,Một người có tính ghen tị có lẽ không mong người khác bị tai họa.,Suspecting rivalry in love; troubled by worries that one might have been replaced in someone's affections; suspicious of a lover or spouse's fidelity. [from 13th c.]
common,adjective,thường,Don't treat me as common people.,"Đừng coi tôi như người ""bình thường ""!","Mutual good, shared by more than one."
arthritis,noun,chứng viêm khớp,"Great, my arthritis is back.","Tuyệt, chứng viêm khớp lại tái phát rồi.","Inflammation of a joint or joints causing pain and/or disability , swelling and stiffness, and due to various causes such as infection, trauma, degenerative changes or metabolic disorders."
wok,verb,cái xanh chảo,Wok must let her go.,Hanna buộc phải để chúng chạy thoát.,"A large, oriental, round-bottomed cooking pan."
zodiac,noun,hoàng đạo,But what is the origin of the zodiac ?,Tử vi hay hoàng đạo bắt nguồn từ đâu?,"(astrology) The belt-like region of the celestial sphere approximately eight degrees north and south of the ecliptic, which thousands of years ago included the apparent path of the sun, moon, and planets."
portal,adjective,cổng chính,"This is the Italian portal ,","Đây là cổng chính Ý,",A grandiose and often lavish entrance.
soar,verb,lượn,Far as an eagle will soar,Xa như tiếng đại bàng,"To fly aloft with little effort, as a bird."
vaguely,adverb,lờ mờ,"A guy I don't even remember, except for this... vague picture I have inside my head.","Người mà thậm chí tớ không nhớ nổi mặt, chỉ trừ... một vài nét lờ mờ trong đầu.",In a vague manner.
hasten,verb,vội,But the one hastening to get rich will not remain innocent.,Nhưng kẻ vội làm giàu khó giữ mình vô tội.,To move in a quick fashion.
beefy,adjective,lực lưỡng,"The large beefsteak tomato —called such because of its dense, beefy flesh— is ideal for stuffing or baking.",Loại cà chua “beefsteak”—gọi như thế là vì quả nặng và chắc như thịt bò—lý tưởng cho các món dồn hay đút lò.,"Similar to, or tasting like beef"
distribution,noun,sự phân phát,She answered a number of questions about Jehovah’s Witnesses and spoke about the wide distribution of the magazines that month.,Chị trả lời một số câu hỏi về Nhân-chứng Giê-hô-va và nói về sự phân phát rất nhiều báo này trong tháng đó.,An act of distributing or state of being distributed.
maize,noun,ngô,A single crop is responsible: maize .,Một loại cây trồng duy nhất chịu trách nhiệm: ngô .,Corn; a type of grain of the speciesZea mays.
semester,noun,học kỳ,But she is only here twice a semester .,Cô ấy chỉ ở đây hai lần trong một học kỳ .,Half of a school year (US) or academic year such as fall or spring semester.
resettle,verb,,Resettlement continued until the 1990s.,Tái định cư vẫn tiếp tục cho đến những năm 1990.,(intransitive) to settle in a different place
disability,noun,sự bất lực,"And, truthfully, the only real and consistent disability I've had to confront","Và thành thật mà nói, sự bất lực lâu dài, thực tế và duy nhất mà tôi phải đối mặt","State of being disabled; deprivation or want of ability; absence of competent physical, intellectual, or moral power, means, fitness, and the like."
photosynthesis,noun,quang hợp,"Where we wanted more photosynthesis , we would design more transparent channels.","Vị trí nào cần quang hợp , chúng tôi tạo thêm ống dẫn trong suốt.","(biology) The process by which plants and other photoautotrophs generate carbohydrates and oxygen from carbon dioxide, water, and light energy in chloroplasts."
interpreter,noun,người thông dịch,I'm gonna go try to dig up another interpreter .,Tôi sẽ cố tìm cho được người thông dịch khác.,One who listens to a speaker in one language and relates that utterance to the audience in a different language. Contrasted with translator.
self-righteous,adjective,tự cho là đúng đắn,How can teeth be self - righteous ?,Răng làm sao mà tự tin được?,piously self-assured and smugly moralistic
convene,verb,họp,"Media, we will convene immediately in the Briefing Room for our conference.","Các anh chị phóng viên, chúng ta sẽ tập trung ở phòng họp báo ngay bây giờ.",(intransitive): To come together; to meet; to unite.
doily,noun,khăn lót,"The wife consented, and he opened it to discover two doilies and $25,000.","Người vợ đồng ý, rồi người chồng mở cái hộp ra và khám phá ra hai cái khăn lót ren và 25,000 đô la.",A small ornamental piece of lace or linen or paper used to protect a surface from scratches by hard objects such as vases or bowls; or to decorate a plate of food.
err,verb,phạm lỗi,"Are we not wise to be like him, particularly when we err ?","Chẳng phải chúng ta cũng nên noi theo ông, đặc biệt là khi phạm lỗi ?",(intransitive) To make a mistake.
zany,adjective,người khờ dại,"This was one of a series called "" Zany Afternoons,"" which became a book.","Nó thuộc loạt tranh ""Buổi chiều kỳ khôi "", sau được xuất bản thành sách.","bizarre, clownish"
installment,noun,phần trả mỗi lần,Install New Theme,Cài đặt sắc thái mới,The act of installing; installation.
exorcism,noun,câu thần chú,An exorcism ?,1 buổi trừ tà .,"the ritual act of driving out supposed evil spirits from persons, places or things who are possessed by them."
pergola,noun,giàn dây leo,,,A framework in the form of a passageway of columns that supports a trelliswork roof; used to support and train climbing plants
mandible,noun,hàm dưới,"In some species, there is a notch or 'tooth' in the upper mandible .","Ở một số loài có một khía hình chữ V hay ""răng"" ở hàm trên.","The lower jaw, especially the lower jawbone."
unobtrusive,adjective,khiêm tốn,Useful and unobtrusive .,Rất hữu ích và kín đáo .,not noticeable or blatant; inconspicuous
agoraphobia,noun,chứng sợ khoảng rộng,Agoraphobia a symptom?,Sợ khoảng không rộng là một triệu chứng ?,"The fear of wide open spaces, crowds, or uncontrolled social conditions."
vendetta,noun,thù máu,I end this vendetta .,Tôi sẽ kết thúc mối thù truyền kiếp này.,"A bitter, destructive feud, normally between two families, clans or factions, in which each injury or slaying is revenged; a blood feud"
outlet,noun,lối ra,Released to seven outlets .,Được phát đi tại 7 cửa hàng .,a vent or similar passage to allow the escape of something
aft,adjective,ở đuôi tàu,"They're all still aft , sir.","Tất cả bọn họ còn ở đuôi tàu , thưa ngài.","(nautical) At, near, or towards the stern of a vessel (with the frame of reference within the vessel)."
nether,adjective,dưới,"As to the conditions prevailing there, an ancient Assyrian text states that “the nether world was filled with terror.”","Về tình trạng ngự trị tại đó, người A-si-ri cổ cho rằng “thế giới dưới thấp đó đầy sự rùng rợn”.",Lower; under.
diametrically,adverb,hoàn toàn,Is technology diametrically opposed to nature?,Có phải công nghệ đã hoàn toàn thay đổi tự nhiên?,"Separated by a diameter, on exactly the opposite side. Frequently used in the phrase diametrically opposed meaning absolutely in opposition."
profuse,adjective,dồi dào,He apologized profusely .,Anh ta rối rít xin lỗi.,In great quantity or abundance.
mountebank,verb,lăng băm,"S'il vous plaît indeed, you silly mountebank .","S'il vous plaît cái mốc xì, đồ bá láp .",One who sells dubious medicines
sophistry,noun,phép nguỵ biện,"To the sophistry of Satan, Jesus turned His back.",Chúa Giê Su đã không đếm xỉa đến những lời lẽ ngụy biện của Sa Tan.,"(countable) An argument that seems plausible, but is fallacious or misleading, especially one devised deliberately to be so."
virago,noun,tướng nam,"Saumarez, Verulam and Vigilant in one division and Venus and Virago in a second, were diverted to intercept.","Saumarez, Verulam và Vigilant thuộc một đội, và Venus cùng Virago thuộc một đội khác đã chia thành mũi gọng kìm để đánh chặn.",pertaining to a virago
homunculus,noun,hình nhân tí hon,He named it homunculus .,Nó được gọi là người lùn ( homunculus ).,A little man.
maudlin,adjective,sướt mướt,Talking about my wife has a tendency to make me a little bit maudlin .,Nói chuyện về vợ chú khiến chú hơi sướt mướt .,Extravagantly or excessively sentimental; self-pitying.
dinky,adjective,có duyên,The Dinky Link.,""" Dinky Link "" .","Double income, no kids yet. Said of a relationship."
backwater,verb,chỗ nước đọng ở bờ,What kind of backwater are you from?,Ngươi từ đâu đến thế?,"(idiomatic) A remote place; somewhere that remains unaffected by new events, progresses, ideas, etc."
hardy,adjective,dày dạn,"Of course, animals must still be hardy .","Tất nhiên, động vật vẫn phải dày dạn .","Having rugged physical strength; inured to fatigue or hardships. A hardy plant is one that can withstand the extremes of climate, such as frost."
treasonous,adjective,mưu phản,"1894 – The Dreyfus affair begins in France, when Alfred Dreyfus is wrongly convicted of treason .",1894 – Vụ Dreyfus bắt đầu tại Pháp khi Alfred Dreyfus bị kết án sai về tội mưu phản .,Like or in the way of treason.
subvert,verb,lật đổ,"That you plan to subvert the monarchy, perhaps.",Rằng anh định lật đổ nền quân chủ.,(transitive) To overturn from the foundation; to overthrow; to ruin utterly.
anserine,adjective,loài ngỗng,,,(zoology) Being from the subfamilyAnserinaeof the familyAnatidae.
caprine,adjective,giống con dê,"Among them are cattle, sheep, caprines , and antelopes.","Các loại bã bột, bã bia,bã hoa quả ép, rỉ mật.",of or relating to goats
cervine,adjective,hươu nai,,,belonging to or resembling a deer
corvine,adjective,con quạ,I believed it was Michael Corvin the only hybrid I knew existed at that time.,"Và tôi tin là Michael Corvin , người lai duy nhất mà tôi biết đang ở đó.","Of, pertaining to, or characteristic of crows or ravens."
elephantine,adjective,to kềnh,"This "" Elephantine Triad"" included Satis and Anuket.",Bộ ba Elephantine bao gồm cả Satis và Anuket.,"Of, pertaining to, or characteristic of elephants."
hircine,adjective,giống dê,,,"(not comparable) Of, pertaining to, or characteristic of goats."
leonine,adjective,giống sư t,"At each corner of the pedestal, a leonine atlas appears to support the weight of the structure above him.",Ở mỗi góc của bệ thờ có hình sư tử nâng đỡ cả khối kiến trúc nặng bên trên.,"Of, pertaining to, or characteristic of the lion."
limacine,adjective,limacine,,,Characteristic of slugs (of the family Limacidae)
murine,adjective,,A noted example is the garden of the villa Murin -an in Kyoto.,Một ví dụ đáng chú ý là vườn của biệt thự Murin-an ở Kyoto.,"Of, pertaining to, or characteristic of, the mouse, rat or (more generally) any mammal of the family Muridae."
oscine,adjective,,"Another name that is sometimes seen as a scientific or vernacular name is Oscines , from Latin oscen, ""a songbird"".","Nhánh này còn có một cái tên khác mà đôi khi được xem như là một tên khoa học hoặc tiếng địa phương là Oscines , từ tiếng Latin oscen, có nghĩa là ""một loài chim biết hót"".",Pertaining to songbirds
ovine,adjective,như cừu,"""Race ovine Bleu du Maine"" (in French).","""Race ovine Bleu du Maine"" (bằng tiếng Pháp).","Of, pertaining to, resembling, or being a sheep."
flutter,verb,dập dờn,"“The solution to this problem,” said a scientist, “may have been . . . fluttering right in front of our eyes.”",Một khoa học gia nói: “Giải pháp cho vấn đề này dường như... ‘ dập dờn ’ trước mắt chúng ta”.,(intransitive) To flap or wave quickly but irregularly.
gallop,verb,nước đại,"The father now gallops , with terror half wild,","Người cha giờ phi nước đại , với khủng bố nửa hoang dã,",The fastest gait of a horse.
slither,verb,trườn,From the sea come dragons marine iguanas slithering onto the land,"Từ dưới biển, rồng ngoi lên - những con kì đà biển trườn đi lên mặt đất.",(intransitive) To slide
steal,verb,ăn cắp,I would rather starve than steal .,Tôi thà nhịn đói còn hơn ăn cắp .,"(transitive) To illegally, or without the owner's permission, take possession of something by surreptitiously taking or carrying it away."
waddle,verb,lạch bạch,"I tried to convince Shapiro to pick him up last June, but he said he waddled like a duck.","Tôi đã cố thuyết phục Shapiro mua anh ta hồi tháng Sáu, Nhưng ông ấy nói anh ta đi lạch bạch như vịt.",A swaying gait.
aerie,noun,ổ trứng ấp,Aerys saw traitors everywhere.,Aerys thấy đâu cũng có kẻ phản bội.,Alternative form of eyrie.
flock,verb,Flock,I can definitely take Flock of Seagulls.,Tôi có thể đánh bại Flock of Seagulls.,(transitive) To congregate in or head towards a place in large numbers.
incubate,verb,ấp,"We like to think our breakthrough ideas, you know, are like that $40,000, brand new incubator , state-of-the-art technology, but more often than not, they're cobbled together from whatever parts that happen to be around nearby.","Chúng ta hay nghĩ những ý tưởng độc đáo giống như là cái lồng ấp 40.000usd này vậy, đỉnh cao của công nghệ, nhưng chúng thường được chế tạo nhanh chóng từ bất cứ những phụ tùng nào có sẵn.","(transitive) To brood, raise, or maintain eggs, organisms, or living tissue through the provision of ideal environmental conditions."
perch,verb,chết,"On 16 January 2013 and a month before his 76th birthday, Ûsoyan was shot in the head by a sniper perched on the sixth floor of an adjacent apartment building after leaving a restaurant which served as his 'office', and despite efforts of his bodyguards and ambulance workers he died en route to the hospital.","Ngày 16 tháng 1 năm 2013, Ûsoyan bị bắn vào đầu bởi một tay bắn tỉa ngồi trên tầng thứ sáu của một căn hộ trung cư liền kề sau khi rời khỏi một nhà hàng phục vụ, và bất chấp những nỗ lực của các vệ sĩ cùng xe cứu thương, ông ta đã chết trên đường đến bệnh viện.",Any of the three species of spiny-finned freshwater fish in the genus Perca.
ape,noun,khỉ,"Even if some similar areas are found in animals, the fact is that scientists cannot get apes to produce more than a few crude speech sounds.","Ngay cả khi tìm được những vùng tương tự nơi loài vật, thì sự thật là các nhà khoa học không thể dạy loài khỉ nói nhiều hơn được, ngoài vài tiếng đơn giản mà thôi.",Wild; crazy.
crane,verb,con hạc,"If you look close, it's this shape, called a crane .","Nếu nhìn kĩ, nó có hình dạng như một con hạc .","A mechanical lifting device, often used for lifting heavy loads for industrial or construction purposes."
ferret,verb,chồn sương,"Vaccinate your pets - dogs , cats , and ferrets .","Tiêm chủng cho thú nuôi như chó , mèo , và chồn sương .","A mammal rather like a weasel, but which was originally bred from the polecat and often trained to hunt rats or rabbits in England."
algae,noun,tảo,"Thus, corals are born from the marriage of algae and shells.","Theo cách đó, san hô được thoát thai từ cuộc hôn nhân giữa tảo và đá vôi.",Plural form of alga.
angler,noun,người câu cá,You know any anglers around here?,Có người câu cá quanh đây chứ?,A person who fishes with a hook and line.
barnacle,verb,con hàu,"""'Billions of bilious blue blistering barnacles in a thundering typhoon!","""'Hàng tỷ con hàu màu xanh bén nhọn gớm guốc trong một cơn giông bão!",A marine crustacean of the subclass Cirripedia that attaches itself to submerged surfaces such as tidal rocks or the bottoms of ships.
crustacean,adjective,giáp xác,By this means each whale can consume up to two tons of crustaceans a day.,"Bằng cách đó, mỗi con cá voi có thể nuốt đến hai tấn giáp xác mỗi ngày.","Any arthropod of the subphylum Crustacea, including lobsters, crabs, shrimp, barnacles and woodlice."
gill,verb,đánh,"Carreño Busta went on to win the title, defeating Gilles Müller in the final, 6–2, 7–6(7–5).","Carreño Busta đi đến để giành lấy danh hiệu, đánh bại Gilles Müller ở trận chung kết, 6–2, 7–6(7–5).",(animal anatomy) A breathing organ of fish and other aquatic animals.
hoof,noun,móng guốc,"They've been eating off the hoof for so long, they just naturally grew a set of extra long horns, that's all.","Chúng đã ăn hết móng guốc của mình từ lâu nay, chúng chỉ mọc thêm một cặp sừng dài, vậy thôi.","The foot of an animal such as a horse, ox or deer."
amenable,adjective,tuân theo,"+ (And all the people will say, ‘ Amen !’)",+ (Toàn thể dân chúng sẽ đáp rằng: ‘A- men !’).,Willing to respond to persuasion or suggestions.
companion,verb,bạn đồng hành,"For two weeks, she became my companion , slept with me.","Trong hai tuần, cô bé trở thành bạn đồng hành của tôi, ngủ với tôi.","A friend, acquaintance, or partner; someone with whom one spends time or keeps company"
domesticated,adjective,đã được thuần dưỡng,Are you suggesting this is domestic ?,Ý ông đang nói về cuộc chiến phe phái trong nội bộ chính phủ ?,"(of an animal, especially a pet) Tame, naturalized."
pedigree,adjective,nòi,And that kind of pedigree would cost far more than he could afford.,Và loại ngựa nòi đó sẽ tốn rất nhiều tiền hơn khả năng của ông để mua.,Having a pedigree.
kennel,verb,cũi chó,Like we're talking a whole kennel .,Nguyên một cũi chó luôn ấy,A house or shelter for a dog.
frisky,adjective,nghịch ngợm,So frisky .,Thật là vui tánh .,(informal) Sexually stimulated; horny
carnivore,noun,loài ăn thịt,Now they have 14 herbivores and six carnivores .,Giờ họ có 14 loài ăn cỏ và 6 loài ăn thịt .,Any animal that eats meat as the main part of its diet.
retractable,adjective,có thể chối,"Diego, retract the claws, please.","Diego, rút móng lại dùm đi.",Capable of being retracted; retractile.
lissome,adjective,mềm mại,,,lithe; quick and graceful in movement
aardvark,noun,lợn đất,Aardvark ?,Heo đất ?,"(zoology) The mammalOrycteropus afer, of the orderTubulidentata, somewhat resembling a pig, common in some parts of sub-Saharan Africa."
anchovy,noun,cá trống,""" Anchovy licorice sauce. """,""" Nước xốt cá trống nấu với cam thảo. ""","A small saltwater fish of the Engraulidae family, used as food, especially on pizzas and in Caesar salads."
aphid,noun,rệp cây,The aphids of Chapter 10 could be seen as paying out nectar to hire professional bodyguards.,Những con rệp cây ở Chương 10 có thể được xem như đang trả công bằng mật để thuê lính bảo vệ chuyên nghiệp.,Sapsucking pest insect of the superfamily Aphidoidea; an aphidian.
armadillo,noun,con tatu,"What am I gonna kill in this town, an armadillo ?","Tôi sẽ giết cái gì ở thị trấn này chứ, con Tatu à?","Any of a family of burrowing mammals covered with bony, jointed, protective plates."
barracuda,noun,cá nhồng,Rick fell somewhere between a barracuda and a great white.,Rick đã chết ở đâu đó trong giữa một con cá nhồng và một con cá mập,"Any large marine fish of the genus Sphyraenus that have elongated bodies, a projecting lower jaw and displaying prominent fang-shaped teeth."
caribou,noun,như cariboo,Moose and caribou can be found on the island.,Gỗ và açaí cũng được sản xuất tại đảo.,"Any of several North American subspecies of the reindeer, Rangifer tarandus."
caterpillar,noun,sâu bướm,"The Yank's an intruder, just like the caterpillar .","Tên Yankee là một vị khách không mời, cũng y như con sâu bướm .",The larva of a butterfly or moth.
chinook,noun,tiếng Si-núc,Two Chinooks and two Apaches.,2 Chinook và 2 Apache.,"(Canada, physics, meteorology) The name given to the descending, warm, dry wind on the eastern side of the Rocky Mountains. The chinook generally blows from the southwest, but its direction may be modified by topography. When it sets in after a spell of intense cold, the temperature may rise by 20°F to 40°F in 15 minutes due to replacement of a cold air mass with a much warmer air mass in minutes."
bald eagle,noun,Đại bàng đầu trắng,Let out ten bald eagles that had been raised in the Detroit Zoo into the wild.,Thả 10 chú đại bàng đầu trắng từng được nuôi dưỡng ở vườn Detroilt về với thiên nhiên.,A species of eagle native to North America and notable for the white plumage on its head.
chicken,adjective,gà con,"If he was a healthy weasel, the chicken didn't get a chance to say anything.","Nếu là một con chồn mạnh khỏe, con gà con sẽ không có cơ hội nói gì đâu.","(countable) A domestic fowl,Gallus gallus, especially when young"
dove,noun,bồ câu,"No difference to you, my dove of Canaan.","Không khác với nàng, con bồ câu Canaan của ta.","A pigeon, especially one smaller in size; a bird (often arbitrarily called either a pigeon or a dove or both) of more than 300 species of the family Columbidae."
