word,part_of_speech,meaning,example,example_meaning,definition
image,noun,ảnh,"For example, with images from a digital camera, the Exif information can be viewed, both in the Properties pages for the photo itself, as well as via optional additional Details View columns.","Ví dụ: với hình ảnh từ máy ảnh kỹ thuật số, thông tin Exif có thể được xem, cả trong các trang thuộc tính cho ảnh , cũng như thông qua các cột Chi tiết xem bổ sung.",An optical or other representation of a real object; a graphic; a picture.
narcissistic,adjective,tự yêu mình,Narcissists tend to be Extremely preferential.,Người tự yêu mình thường cực kỳ ưu tiên.,Having an inflated idea of one's own importance.
pompous,adjective,hoa mỹ,"In his autobiography, Chaplin wrote, ""Simplicity is best ... pompous effects slow up action, are boring and unpleasant ...","Trong tự truyện của mình, Chaplin cũng viết, ""Tính đơn giản là tuyệt vời nhất... các hiệu ứng hoa mỹ kéo chậm hành động, chúng gây chán ngán và chẳng có gì thú vị...","Affectedly grand, solemn or self-important."
portrait,adjective,điển hình,In the Bible Job offers the classic portrait of patience.,"Trong Kinh Thánh, Gióp tiêu biểu cho tính kiên nhẫn điển hình thời xưa đó.","A painting or other picture of a person, especially the head and shoulders."
pose,verb,đặt,"I do not pose question as master, but as a man.","Ta không đặt câu hỏi với tư cách ông chủ, mà là một người đàn ông.","(transitive) set in place, arrange"
shallow,adjective,nông,Perhaps it will be easier in the shallows .,Có lẽ sẽ dễ hơn ở những chỗ nông .,Having little depth; significantly less deep than wide.
confrontational,adjective,,What difficult tests confront Christian youngsters today?,Những tín đồ đấng Christ trẻ tuổi phải đương đầu với những thử thách khó khăn nào ngày nay?,"Pertaining to a confrontation; characterized by, or given to initiating hostile encounter; in-your-face."
impulsively,adverb,,I'm impulsive .,Em rất bồng bột .,In an impulsive manner; with force; by impulse.
abrasion,noun,sự mài mòn,They are usually both a scrape ( abrasion ) and a heat burn .,Chúng thường là cả phỏng do trầy xước ( sự mài mòn ) và phỏng do sức nóng .,"The act of abrading, wearing, or rubbing off; the wearing away by friction."
contusion,noun,vết đụng giập,"20 to 30 contusions on all sides, including defensive wounds on the hands and the forearms.","20 đến 30 vết đụng giập từ mọi phía, bao gồm vết thương do phản kháng trên bàn tay và cánh tay.","A wound, such as a bruise, in which the skin is not broken; often having broken blood vessels and discolouration"
arraignment,noun,sự buộc tội,"Hey, when's the arraignment ?","Hey, khi nào có quyết định của tòa ?",(law) The formal charging of a defendant with an offense
manslaughter,noun,tội ngộ sát,"Well, we'll try and get it in as manslaughter , sir.","Vâng, chúng tôi sẽ cố gắng đưa vào tội ngộ sát , thưa ngài.","An act of killing a human being unlawfully, but not wilfully (as opposed to murder)."
premeditated,adjective,có chủ tâm,Premeditated murder is the most serious charge tried in our criminal courts.,Giết người có chủ tâm là tội nguy hiểm nhất trong tòa án hình sự.,Simple past tense and past participle of premeditate.
vilification,noun,sự gièm pha,"IN RECENT years, Jehovah’s Witnesses in France have been the target of an intense campaign of vilification .","TRONG những năm gần đây, Nhân Chứng Giê-hô-va ở Pháp là mục tiêu của một chiến dịch vu khống dữ dội .",slanderous or malicious defamation; character assassination
seamy,adjective,có đường may nối,,,"Sordid, squalid or corrupt."
sophistication,noun,sự làm giả,Except it's much more sophisticated .,"Cho dù là cái quái gì đi nữa, có điều tinh vi hơn nhiều.",Enlightenment or education.
pilgrim,verb,người du hành,"Thorn was a pilgrim , affectionately known as Pappy because of his fatherly, Christlike disposition","Thorn, một người du hành được gọi là “Pappy” (bố) vì anh trìu mến như một người cha","One who travels, especially on a journey to visit sites of religious significance."
thanksgiving,noun,lễ tạ ơn,Hope you know you're invited for Thanksgiving tomorrow.,Hy vọng em biết mình được mời tới lễ Tạ ơn vào ngày mai.,an expression of gratitude.
blockbuster,adjective,Bom tấn,now dominated by a culture of the Hollywood blockbuster .,giờ bị thống trị bởi văn hóa phim bom tấn Hollywood.,"A high-explosive bomb used for the purposes of demolishing extensive areas, such as a city block."
citrus,adjective,giống cam quít,Citrus trees grow in the wild; coconut trees and banana plants are abundant.,"Cây thuộc giống cam quít mọc hoang, dừa và chuối cũng đầy dẫy.",Any of several shrubs or trees of the family Rutaceae.
divorce,verb,ly dị,I've heard that Mary wants a divorce .,Tôi nghe nói rằng Mary muốn ly dị .,The legal dissolution of a marriage.
imagine,verb,tưởng tượng,I imagine Tom will be a finalist.,Tôi tưởng tượng Tom sẽ bào chung kết.,(transitive) To form a mental image of something; to envision or create something in one's mind.
rubble,noun,đá vụn bỏ đi,I hate rubble .,Tôi ghét bị đè lắm,"The broken remains of an object, usually rock or masonry."
deduction,noun,khấu trừ,"However, most other deductions are allowed.","Tuy nhiên, hầu hết các khoản khấu trừ khác được cho phép.","(logic) A process of reasoning that moves from the general to the specific, in which a conclusion follows necessarily from the premises presented, so that the conclusion cannot be false if the premises are true."
expression,noun,biểu thức,Click to remove a word or regular expression from the list,Nhấn vào để bỏ một từ hay một biểu thức chính quy khỏi danh sách,A particular way of phrasing an idea.
neuroscientist,noun,,But neuroscientists go further.,Nhưng các nhà nơ -ron học đi xa hơn.,A scientist whose speciality is neuroscience
nonexistent,adjective,,I never said he was nonexistent .,Ta không bao giờ nói ông ta không tồn tại .,Not existent; not real.
deployment,noun,sự triển khai,"Kaviza provides built-in high availability , does not require shared storage and is a turnkey deployment .","Kaviza cung cấp tính sẵn sàng hoạt động cao , không đòi hỏi lưu trữ chia sẻ và là sự triển khai trọn gói .",An arrangement or classification of things.
dormant,adjective,đang ngủ,"I don't know, sweetheart, but whatever parts of you are dormant are gonna stay that way.","Tôi không biết, nhưng dù là phần nào của cô đang ngủ đông thì sẽ vẫn cứ như thế thôi.","Inactive, asleep, suspended."
fragrant,adjective,thơm,"As the wood decays, it secretes fragrant oil and resin.",Khi gỗ bị mục thì dầu và nhựa thơm chảy ra.,Sweet-smelling; having a pleasant (usually strong) scent or fragrance.
software,noun,phần mềm,"Nobody would buy software , certainly not from a woman.","Không ai mua phần mềm cả, càng không thể mua phần mềm do phụ nữ viết.","(computing) Encoded computer instructions, usually modifiable (unless stored in some form of unalterable memory such as ROM). Compare hardware."
mare,noun,ngựa cái,"Yeah, and he was riding a little buckskin mare .","Phải, và ảnh cỡi một con ngựa cái .",An adult female horse.
steady,adjective,vững,"To be consistent is to be steady , constant, and dependable.","Kiên định có nghĩa là vững chắc, kiên trì, và đáng tin cậy.",To stabilize something; to prevent from shaking.
mane,noun,bờm,And he's got a long mane of hair and his fingers are twice the length of ours.,Và hắn có bờm tóc dài và ngón tay dài gấp đôi ngón tay chúng tôi.,Long or thick hair of a person's head.
empathic,adjective,đồng cảm,And I... empathize .,Và con... đồng cảm với bố.,Showing or expressing empathy.
ewe,noun,cừu cái,"The rams of this breed are horned, and the ewes are not.",Cừu đực thuộc giống này có sừng còn cừu cái thì không.,"A female sheep, as opposed to a ram."
disgorge,verb,phun ra,"In some versions, Metis gave Cronus an emetic to force him to disgorge the babies, or Zeus cut Cronus's stomach open.","Theo một số dị bản khác, Metis đã cho Cronus uống một thứ thuốc gây nôn để bắt hắn ta nôn ra những đứa trẻ hoặc là chính Zeus đã mổ dạ dày của Cronus để giải thoát cho anh em mình.","To vomit or spew, to discharge."
masticate,verb,nhai,"(Hebrews 5:11, 14) Solid food must be masticated before being swallowed and digested.","(Hê-bơ-rơ 5:11, 14) Phải nhai đồ ăn đặc trước khi nuốt và tiêu hóa.",(transitive) To chew (food).
lute,noun,đàn luýt,"The lute was similar to the harp, but it usually differed in shape.",Đàn luýt tương tự như đàn hạc nhưng thường có hình dạng khác.,"A fretted stringed instrument, similar to a guitar, having a bowl shaped body or soundbox."
troubadour,noun,Hát rong,"Like many of his contemporary troubadours , Peire merely composed contrafacta.","Giống như nhiều người hát rong đương thời, Cardenal chỉ đơn thuần sáng tác các contrafacta.",An itinerant composer and performer of songs in medieval Europe; a jongleur or travelling minstrel.
quizzical,adjective,buồn cười,"And they would look quizzically , and then be like, "" High five! ""","Mặt chúng biểu hiện rất buồn cười rồi "" high five! "" ( hai người giơ cao và vỗ tay nhau - thể hiện sự tán thành và phấn khích )",Questioning or suggesting puzzlement.
mature,adjective,trưởng thành,You can tell it's mature bone.,Bạn có thể thấy rằng đó là một cái xương trưởng thành .,"Fully developed; grown up in terms of physical appearance, behaviour or thinking; ripe."
corporate,adjective,đoàn thể,I just love requisitions and corporate record reports.,Tôi yêu các đơn yêu cầu và báo cáo đoàn thể lắm ý.,(finance) A bond issued by a corporation
psychologist,noun,nhà tâm lý học,The psychologists asked other people a slightly different question.,Các nhà tâm lý học hỏi những người khác với một câu hỏi khác đi một chút.,An expert in the field of psychology.
evolve,verb,tiến hoá,Maybe we evolved as a hunting pack animal.,Có thể chúng ta tiến hoá như một bầy động vật đi săn.,To move in regular procession through a system.
inclusion,noun,bao gồm,"but inclusive , sustainable growth","mà bao gồm , sự phát triển bền vững","(countable) An addition or annex to a group, set, or total."
trickle,verb,chảy nhỏ giọt,"The thing is, it doesn't trickle up.",Vấn đề ở đây là chúng ta không thể thay đổi được nó.,A very thin river.
slum,verb,khu ổ chuột,This whole area used to be slums when I was a boy.,Cả khu vực này từng là khu ổ chuột khi tôi còn nhỏ.,A dilapidated neighborhood where many people live in a state of poverty.
desalination,noun,Khử muối,and that's going to require us to build desalination plants.,và điều đó đòi hỏi chúng ta phải xây các nhà máy khử muối .,The process of removing salt from sea water in order to make drinking water.
wrestle,verb,đánh vật,It's wonderful to watch you wrestle with these dilemmas.,Thật tuyệt khi thấy cô phải đánh vật với sự khổ sở.,A wrestling bout.
naan,noun,Naan,"""How To Make Naan Bread"". videojug.",Truy cập ngày 6 tháng 9 năm 2015. ^ “How To Make Naan Bread”. videojug.,"A type of round, flat bread baked in a tandoor popular in South and Central Asian cuisine."
wilt,verb,hao mòn,Why do I want to watch money wilt ?,Sao em lại muộn tiền dần hao mòn đi?,(intransitive) To droop or become limp and flaccid (as a dying leaf or flower).
teetotaler,noun,,""" He is a vegetarian and a teetotaller and is devoted to reading.",""" Ông ấy là một người ăn chay và người không uống rượu và được dành để đọc.",(US) A person who completely abstains from alcoholic beverages.
contrary,adjective,nghịch,• Why was the grafting process “ contrary to nature”?,• Tại sao quá trình tháp cây là “ nghịch tánh”?,strongly dissimilar
grouch,verb,càu nhàu,I can grouch .,I can grouch .,One who is grumpy or irritable.
ingrate,adjective,vô ơn bạc nghĩa,Ingrate !,Kẻ phản bội !,Ungrateful.
ashamed,adjective,ngượng,There is no reason to feel awkward or ashamed because you believe in creation.,Không có lý do nào để cảm thấy ngượng ngùng vì bạn tin nơi sự sáng tạo.,Feeling shame or guilt.
guilty,adjective,có tội,We are not the only ones to believe that he is not guilty .,Chúng tôi không phải là những người duy nhất tin rằng cậu ta không có tội .,Responsible for a dishonest act.
regretful,adjective,cảm thấy hối tiếc,Do I regret having left the “silent service”?,Tôi có cảm thấy hối tiếc vì đã từ bỏ “hoạt động ngầm” không?,"Full of feelings of regret, indulging in regrets."
embarrassment,noun,sự lúng túng,This is beyond embarrassing .,Cái này vượt quá sự lúng túng luôn rồi.,A state of discomfort arising from bashfulness or consciousness of having violated a social rule; humiliation.
enraged,adjective,,Never Become Enraged Against Jehovah!,Đừng bao giờ tức giận Đức Giê-hô-va!,"Angered, made furious, made full of rage."
enthusiasm,noun,sự nhiệt tình,You don't say that with much enthusiasm .,Cậu không nói với sự nhiệt tình nào cả.,(obsolete or historical) Possession by a god; divine inspiration or frenzy.
tureen,noun,liễn,"'Beautiful Soup, so rich and green, Waiting in a hot tureen !",""" Beautiful Soup, phong phú và màu xanh lá cây, chờ đợi trong một tìm để đựng súp nóng!","A broad, deep serving dish used for serving soup or stew."
delectable,adjective,ngon lành,"Each year, Johann Strauss Ball brings an evening of ballroom dancing, delectable food and fine music.","Mỗi năm, Johann Strauss Ball mang đến một buổi tối khiêu vũ, đồ ăn ngon lành và âm nhạc tuyệt hảo.",Pleasing to the taste; delicious.
liquidate,verb,thanh toán,It is the debt that has priority for repayment in a liquidation .,Nó là khoản nợ có độ ưu tiên thanh toán trong thanh lý.,To settle a debt by paying the outstanding amount.
prophet,noun,tiên tri,Let your voice help fulfill Moroni’s prophetic words to speak good of the Prophet .,Hãy để tiếng nói của các em giúp làm ứng nghiệm lời tiên tri của Mô Rô Ni để nói tốt về Vị Tiên Tri .,Someone who speaks by divine inspiration.
voluntary,adjective,tự nguyện,There individuals can deposit voluntary donations if they so desire.,Mỗi người có thể bỏ vào hộp phần đóng góp tự nguyện của mình .,"Done, given, or acting of one's own free will."
commandant,noun,sĩ quan chỉ huy,Goldwater was his commanding officer.,Goldwater từng là sĩ quan chỉ huy của cậu ta.,"A commanding officer, usually of a specific force or division."
lukewarm,adjective,ấm,a lukewarm temperature of three million degrees C.,"tại nhiệt độ ấm , khoảng 3 triệu độ C.",Temperature between warm and cool.
tepid,adjective,ấm,"The next day, I was baptized in the tepid waters of a nearby public bathhouse.","Ngày hôm sau, tôi làm báp têm trong nước âm ấm của nhà tắm công cộng gần đó.",Lukewarm; neither warm nor cool.
execution,noun,sự thực hiện,"Her life, influence and execution made her a key figure of the religion.","Cuộc sống, ảnh hưởng và sự thực hiện của cô làm cho cô trở thành một nhân vật quan trọng của tôn giáo đó.","The act of putting to death or being put to death as a penalty, or actions so associated."
baton,noun,dùi cui,Not even a police baton is needed to keep order.,Cũng không cần đến cây dùi cui của lính cảnh sát để giữ gìn trật tự.,"A staff or truncheon, used for various purposes; as, the baton of a field marshal"
wherefore,noun,do gì,"* They are gods, even the sons of God— wherefore , all things are theirs, D&C 76:58–59.","* Họ là những thượng đế, là các con trai của Thượng Đế— vậy nên , vạn vật là của họ, GLGƯ 76:58–59.","(conjunctive, archaic) Why, for what reason, because of what."
tyrannous,adjective,bạo ngược,"He's a tyrannical martinet who will never, ever allow me to go on away missions!","Một kẻ độc tài bạo ngược quá nguyên tắc, kẻ mà không bao giờ cho phép tôi đi đâu và làm nhiệm vụ gì.","tyrannical, despotic or oppressive"
withered,adjective,héo,Nice way of saying that everything he touches seems to wither and die.,"Một cách nói bóng bẩy là, cái gì bị anh ta chạm phải, đều sẽ héo và chết.","Shrivelled, shrunken or faded, especially due to lack of water."
recur,verb,tái diễn,There seems to be a recurring issue here.,Có vẻ như có một vấn đề luôn tái diễn ở đây.,"(now rare) To have recourse (to) someone or something for assistance, support etc."
maniacal,adjective,điên,How many murders is it going to take before you start believing that this maniac's out there?,Phải thêm bao nhiêu vụ giết người nữa trước khi anh bắt đầu tin rằng có một lũ điên ở ngoài đó?,In the manner of a maniac; insane; frenzied.
obstacle,noun,sự trở ngại,One Catholic chronicler contends that this question is “a serious obstacle to faith” for many.,Một người chép sử Công Giáo cho rằng đối với nhiều người câu hỏi này là “một sự trở ngại nghiêm trọng cho đức tin”.,"Something that impedes, stands in the way of, or holds up progress"
thither,adverb,tới đó,Kindly convey us thither with the utmost discretion.,Vui lòng đưa chúng ta tới đó một cách vô cùng kín đáo.,(dated) To that place (rare except for literary or legal use).
tremendous,adjective,to lớn,That gave us a tremendous amount of hope.,Điều đó đã đưa chúng tôi một hi vọng to lớn,awe-inspiring; terrific.
conflicting,adjective,mâu thuẫn,"There's no infighting, there's no conflict over territory.","Sẽ không có tranh chấp nội bộ, không có mâu thuẫn tranh giành địa bàn.","Striking, or dashing together; fighting; contending; struggling to resist and overcome."
depleted,adjective,,Then the depleted region is formed.,Thế trận bao vây tiêu diệt đã hình thành.,"Used up, expended; of which nothing is left."
blissful,adjective,sung sướng,"Some think of such trust merely as a feeling, a kind of blissful emotion that should well up naturally in the heart.","Một số người nghĩ lòng tin cậy như thế chỉ là một cảm xúc, một cảm giác sung sướng tự nhiên dâng lên trong lòng.","Extremely happy; full of joy; experiencing, indicating, causing, or characterized by bliss."
philosophy,verb,triết lý,philosophy,Đó là triết lý sống,(countable) A comprehensive system of belief.
strife,noun,sự xung đột,"Clever manipulation might gain you a little freedom, but in the long run, it only prolongs family strife .","Mánh khóe này có thể giúp bạn được toại nguyện lúc đó, nhưng sẽ kéo dài sự xung đột trong gia đình.","Violent conflict, usually brief or limited in nature."
decay,verb,mục nát,That body probably decayed and returned to the ground.,Có lẽ thân thể đó đã bị mục nát và trở về cát bụi rồi.,The process or result of being gradually decomposed.
status,noun,thân thế,They were not distracted by his status or position.,Họ không phải bận tâm nghĩ đến thân thế hay địa vị của ngài.,A person’s position or standing relative to that of others.
tenor,adjective,nam cao,"sing their parts — soprano, alto, tenor and bass —","hát phần của họ — nữ cao , nữ trầm, nam cao và nam trầm —","(archaic, music) Musical part or section thatholdsor performs the main melody, as opposed to thecontratenor bassusandcontratenor altus, who perform countermelodies."
ultimately,adverb,cuối cùng,"And ultimately , it seems to me, that always works better than propaganda.","Và cuối cùng , đối với tôi, điều đó tốt hơn nhiều so với tuyên truyền.",Indicating the last item.
tradition,verb,phong tục,They invented that tradition for their arrival here.,Họ đã tạo ra phong tục đó cho những người di cư đến đây.,"A part of culture that is passed from person to person or generation to generation, possibly differing in detail from family to family, such as the way to celebrate holidays."
exhale,verb,thốt ra,[ exhales ],[ thở dài ],(intransitive) To expel air from the lungs through the nose or mouth by action of the diaphragm.
protuberance,noun,u lồi,"Notice these other, smaller protuberances .","chú ý đến những cái khác, những u lồi nhỏ hơn","A bulge, knob, swelling, spine or anything that protrudes."
alchemy,noun,thuật giả kim,"It's the ancient elixir of life, the basis of alchemy .",Đó là phương thuốc kéo dài sự sống cơ sở của thuật giả kim .,"(obsolete, uncountable) The ancient search for a universal panacea, and of the philosopher's stone, that eventually developed into chemistry"
yurt,noun,,Inside a yurt,Bên trong một lều yurt,"A large, round semi-permanent tent with vertical walls and conical roof usually associated with Central Asia and Mongolia."
seersucker,noun,vải sọc,,,"A thin, all-cotton fabric, commonly striped, used to make clothing for summer wear."
endocrine,adjective,nội tiết,In animals endocrine tissues release hormones into the bloodstream.,"Ở động vật, mô nội tiết giải phóng hormone vào dòng máu.",Producing internal secretions that are transported around the body by the bloodstream.
patella,noun,xương bánh chè,And your patellas aren't so bad either.,Và đầu gối cô cũng không quá củ lạc đâu.,(anatomy) The sesamoid bone of the knee; the kneecap.
archival,adjective,,"""Sally Jane Priesand | Jewish Women's Archive "".",Truy cập ngày 3 tháng 5 năm 2012. ^ “Sally Jane Priesand | Jewish Women's Archive ”.,Of or pertaining to an archive or archiving.
effects,verb,hiệu ứng,The new medicine demonstrated an immediate effect .,Loại thuốc mới phô bày hiệu ứng tức thời.,Plural form of effect.
precognition,noun,sự biết trước,"Your precognitive dream as expected, was wrong?",Vậy là ngài lại mơ sảng nữa rồi.,(parapsychology) The ability to foresee the future.
proselytize,verb,cho nhập đạo,Proselytes and God-Fearers,Những người cải đạo và những người kính sợ Đức Chúa Trời,"(intransitive) To encourage or induce people to join a religious movement, political party, or other cause or organization."
anticipatory,adjective,dùng trước,"""Rupesh surprised by Sherlyn's complaint; seeks anticipatory bail"".",Truy cập ngày 10 tháng 2 năm 2014. ^ “Rupesh surprised by Sherlyn's complaint ; seeks anticipatory bail”.,Characterized by anticipation.
inebriate,adjective,say,An inebriated college girl deserves to make it home safe at night.,Cô sinh viên say rượu xứng đáng được về nhà an toàn trong đêm.,"A person who is intoxicated, especially one who is habitually drunk."
expand,verb,mở rộng,Unionism strengthened and education coverage expanded .,Liên minh tăng cường và bảo hiểm giáo dục mở rộng .,(transitive) To change (something) from a smaller form and/or size to a larger one.
route,noun,đường,Lymphatic vessels also provide routes for disease organisms.,Các mạch bạch huyết cũng là những đường xâm nhập của sinh vật gây bệnh.,A course or way which is traveled or passed.
sardine,verb,Cá mòi,He's gonna squash us in this sardine can.,Hắn muốn bóp chết mình trong cái hộp cá mòi này.,"Any one of several small species of herring which are commonly preserved in olive oil or in tins for food, especially the pilchard, or European sardine (Clupea pichardus). The California sardine (Clupea sagax) is similar. The American sardines of the Atlantic coast are mostly the young of the common herring and of the menhaden."
exist,verb,tồn tại,The user you to want to send this message to does not exist . Please try with another username.,Người dùng bạn muốn gởi tin này đến không tồn tại . Vui lòng thử tên khác.,to be; have existence; have being or reality
neigh,verb,hí,"We gotta neigh it out loud and proud, girlfriend.","Chúng tôi hí vang và tự hào, bạn gái ạ.",The cry of a horse.
bulky,adjective,kềnh càng,"The bag full of tracts was quite bulky , making me look pregnant.",Túi xách đầy ắp giấy nhỏ thật kềnh càng khiến tôi trông như đang mang thai.,"Being large in size, mass, or volume."
tutor,verb,gia sư,The tutor was not usually a schoolteacher.,Gia sư thường không phải là giáo viên ở trường.,"One who teaches another (usually called a student, learner, or tutee) in a one-on-one or small-group interaction."
