word,part_of_speech,meaning,example,example_meaning,definition
replace,verb,thay thế,Nobody can replace Tom.,Không một ai có thể thay thế Tom.,"(transitive) To restore to a former place, position, condition, or the like."
supposed,adjective,cho là nó có,Do you suppose ?,Vậy sao ?,Simple past tense and past participle of suppose.
lariat,verb,bắt,Lariat .,Lariat .,a lasso
strenuous,adjective,căng thẳng,Strenuous recovery efforts helped raise production to 10% of the uranium-235 feed by January 1945.,Các nỗ lực thu hồi căng thẳng đã làm tăng sản lượng nên 10% urani đầu vào tháng 1 năm 1945.,"Urgent, ardent, zealous."
lintel,noun,lanh tô,Lintel 13 is above a doorway in Structure 20.,Vòm đá 13 ở trên một ô cửa trong Cấu trúc 20.,"(architecture) A horizontal structural beam spanning an opening, such as between the uprights of a door or a window, and which supports the wall above."
grackle,noun,grackle,,,Any of several American blackbirds of the genus Quiscalus having iridescent plumage
bemoan,verb,than khóc,""" Do not bemoan the sailor's life.",""" Đừng than khóc cho mạng tên thủy thủ",(transitive) to complain about; to dismay or worry about something
bedeck,verb,trang hoàng,A playground bedecked with flowers.,Một khoảng sân trang hoàng đầy hoa.,"To deck, ornament, or adorn; to grace."
piquant,adjective,cay cay,You know what else Dave finds particularly piquant ?,Anh có biết Dave còn tìm thấy thứ gì đặc biệt nữa không?,Engaging; charming.
elucidation,noun,sự giải thích,"Allow us to elucidate , Miss Bell.","Để bọn tớ giải thích cho bạn rõ nhé, Bell.","A making clear; the act of elucidating or that which elucidates, as an explanation, an exposition, an illustration; as, one example may serve for further elucidation of the subject."
imprudence,noun,hành động khinh suất,What an imprudent investment!,Thật là một sự đầu tư dại dột biết bao!,"(uncountable) The quality or state of being imprudent; want of prudence, caution, discretion or circumspection; indiscretion; inconsideration; rashness; heedlessness."
equivocal,adjective,nước đôi,"First they denied, and then they equivocated ...","Đầu tiên thì họ phủ nhận, rồi thì họ nói nước đôi ...",A word or expression capable of different meanings; an ambiguous term; an equivoque.
acquiescent,adjective,bằng lòng,"I asked for it back, they acquiesced .","Tôi muốn có lại nó, họ đã chấp nhận","willing to acquiesce, accept or agree to something without objection, protest or resistance"
pertinacity,noun,tính cố chấp,,,The state or characteristic of being pertinacious.
supposititious,adjective,giả định,"Some charged that the boy was "" supposititious "", having been secretly smuggled into the Queen's room in a bed-warming pan as a substitute for her stillborn baby.","Một số thông tin cho rằng cậu bé là ""giả mạo"", đã được bí mật đưa vào phòng của Vương hậu thay thế cho một đứa bé chết lưu từ trước.","Spurious; substituted for the genuine, counterfeit."
peroration,noun,,"Webster concluded his peroration with the famous words: ""It is, Sir, as I have said, a small college.","Kết luận bài diễn văn nổi tiếng của mình, Webster đã nói lên những câu từ nổi tiếng mà sau này được nhiều thế hệ trích dẫn lại: ""Nó, thưa ngài, như tôi đã nói, là một ngôi trường nhỏ.","The concluding section of a discourse, either written or oral, in which the orator or writer sums up and commends his topic to his audience, particularly as used in the technical sense of a component of ancient Roman oratorical delivery."
convivial,adjective,hoan lạc,"The Greeks are a convivial lot and when they celebrate, they want you to join in.","Người Hy Lạp là những con người hoan lạc và khi họ mở hội, họ muốn bạn tham gia cùng.","Of or relating to a feast or entertainment, or to eating and drinking, with accompanying festivity; festive; social; gay; jovial."
improvident,adjective,hoang toàng xa phí,,,failing to provide for the future; reckless
adjure,verb,bắt thề,"And now, as I adjure you in his name, begone from this woman and her unborn child... ( CONTINUES, INDISTINCT )","Và ngay bây giờ, ta sẽ thay mặt ông ấy trục xuất ngươi, khỏi người phụ nữ này và đứa con chưa ra đời của cô ấy,","To issue a formal command, especially in a legal context."
deserts,noun,giá trị,A beautiful desert bloom such as yourself should be on the arm of the most powerful man in the world.,Một sắc đẹp giá trị như nàng nên nằm trong người đàn ông mạnh nhất thế giới này.,Plural form of desert.
arraign,verb,buộc tội,"You want to sort this out, you sort it out after he's arraigned .","Cô muốn giải quyết việc này, thì hãy giải quyết nó sau khi anh ta bị buộc tội .",To officially charge someone in a court of law.
insensate,adjective,không cảm xúc,Paul spoke of “the insensibility of their hearts.”,Sứ đồ Phao-lô nói về “lòng họ cứng - cỏi ”.,Having no sensation or consciousness; unconscious; inanimate.
panache,noun,sự huênh hoang,Such... panache .,Cũng thật là phong cách .,"(uncountable) Flamboyant, energetic style or action; dash; verve."
falsehood,noun,sự nói dối,What is included in ‘putting away falsehood and speaking the truth’?,«Chừa sự nói dối và nói thật» bao gồm điều gì?,(uncountable) The property of being false.
sexist,adjective,phân biệt giới tính,"Oh, you don't want to call her "" sexist ""?",Cô không muốn gọi cô ta là kẻ phân biệt giới tính .,A person who discriminates on grounds of sex; someone who practises sexism.
feminist,adjective,Người hoạt động vì nữ quyền,I'm a feminist .,Tôi là một người ủng hộ nữ quyền.,Relating to or in accordance with feminism.
disallow,verb,không cho phép,Disallow :,Không cho phép :,To refuse to allow
incurable,adjective,bất trị,"Miller, you are an incurable showoff.","Miller, anh đúng là một tên ba hoa bất trị .","Of an illness, condition, etc, that cannot be cured."
foul,adjective,xấu,Yesterday you seemed certain it was foul play.,Hôm qua ông còn chắc chắn đó là chơi xấu mà.,(baseball) Outside of the base lines; in foul territory.
lair,verb,hang ổ,Your new lair is up and running.,Hang ổ mới của ngài đã hoàn thành và đang hoạt động.,"A place inhabited by a wild animal, often a cave or a hole in the ground."
fiend,noun,quỷ,The same fiend that brought down the arena in Capua?,Cũng chính là con quỷ đã đánh sụp đấu trườ ng của Capua?,A demon
consider,verb,suy xét,• What must be considered when counting the cost of pursuing higher education?,• Cần phải suy xét điều gì khi nói đến giá phải trả cho việc học lên cao?,(transitive) To think about seriously.
umbrage,verb,bóng cây,Naaman took umbrage at the treatment and counsel.,Na-a-man mếch lòng vì cách đối xử và lời khuyên đó.,(transitive) To shade.
label,noun,nhãn,Please stick this label to your baggage.,Vui lòng dán nhãn vào hành lý của bạn.,(transitive) To put a label (a ticket or sign) on (something).
natural selection,noun,Chọn lọc tự nhiên,It was natural selection .,Đó là chọn lọc tự nhiên .,"(evolutionary biology) A process by which heritable traits conferring survival and reproductive advantage to individuals, or related individuals, tend to be passed on to succeeding generations and become more frequent in a population, whereas other less favourable traits tend to become eliminated."
embryonic,adjective,phôi,"Carrel started an experiment on January 17, 1912, where he placed tissue cultured from an embryonic chicken heart in a stoppered Pyrex flask of his own design.",Ngày 17.1.1912 Carrel bắt đầu thí nghiệm việc đặt mô cấy từ phôi tim gà trong một chai Pyrex có đạy nút do chính ông thiết kế.,(embryology) Of or relating to an embryo.
protean,adjective,giống thần Prô-tê,But surely this was not the Protean man you'd envisioned.,Nhưng tất nhiên đấy không phải là Prote mà ngươi hình dung.,Exceedingly variable; readily assuming different shapes or forms.
analogical,adjective,giống nhau,"Now, the analogy here is, perhaps we need",Và sự giống nhau ở đây là,"Of, pertaining to, based on, or composed of an analogy."
gradation,verb,bậc,The up- gradation work is complete.,Công việc nâng cấp đã được hoàn thành.,"A sequence of gradual, successive stages; a systematic progression."
acclimatize,verb,di thực,Thought I was gonna acclimatize faster than this.,Cứ tưởng tôi thích nghi nhanh lắm chứ...,(intransitive) To get used to a new climate.
homologous,adjective,tương đồng,A nail is homologous to a claw but is flatter and has a curved edge instead of a point.,Móng tay là tương đồng với một móng vuốt nhưng nó phẳng hơn và có cả một cạnh cong thay vì một điểm.,Showing a degree of correspondence or similarity.
viscera,noun,nội tạng,"Believe it or not, even with internal viscera .","Thậm chí cả nội tạng , tin hay không tùy bạn.","Plural form of viscus. Collectively, the internal organs of the body, especially those contained within the abdominal and thoracic cavities, such as the liver, heart, or stomach."
rote,adjective,làm việc một cách máy móc,"By committing to memory, learning by rote .","Dựa vào trí nhớ, học vẹt hoặc viết mọi thứ ra giấy",(rare) The roar of the surf; the sound of waves breaking on the shore.
viscid,adjective,dính,,,Viscous; having a high viscosity.
basal,adjective,cơ bản,But you said your basal temp spiked last night.,Nhưng em nói đo được nhiệt độ cực đại vào đêm qua mà.,"Relating to, or forming, the base, or point of origin."
ductile,adjective,dẻo,"In 1934, Egon Orowan, Michael Polanyi and Geoffrey Ingram Taylor, roughly simultaneously, realized that the plastic deformation of ductile materials could be explained in terms of the theory of dislocations.","Năm 1934, Egon Orowan, Michael Polanyi và Geoffrey Ingram Taylor gần như cùng một lúc nhận thấy rằng biến dạng dẻo của vật liệu dẻo có thể được giải thích theo thuyết sai lệch mạng.",Capable of being pulled or stretched into thin wire by mechanical force without breaking.
deciduous,adjective,phù du,"In contrast with western Georgia, nearly 85 percent of the forests of the region are deciduous .","Trái ngược với tây Gruzia, gần 85% rừng tại vùng này là phù du .","(biology) Describing a part that falls off, or is shed, at a particular time or stage of development."
pachyderm,noun,con voi,This has come 'round to be that all those naked pachyderms have aquatic ancestors.,Mọi động vật da dày được kết luận là đều có thủy tổ.,Someone (or something) with thick skin. It is used for animals such as an elephant or a hippopotamus.
differential,noun,vi phân,It's a partial differential equation.,Đó là phương trình vi phân riêng phần.,"of, or relating to a difference"
procreate,verb,sinh,"First, it was ordained for the procreation of children.","Một là, hôn nhân nhằm đảm bảo sự sinh sản, duy trì nòi gống.",(transitive) To beget or conceive (offspring).
cautionary,adjective,để báo trước,This is a cautionary tale.,Đây là một câu chuyện cảnh báo .,Serving to caution or warn; admonitory
physique,noun,cơ thể vóc người,"Your physique helps, I'm sure, too. Ah.",Vóc dáng của anh làm em chắc chắn đấy!,"The natural constitution, or physical structure, of a person."
ajar,adjective,khép hờ,"Then one night , finding the hutch door ajar , he escaped .","Thế là một đêm nọ , chú thấy cửa chuồng thỏ khép hờ liền thoát ra ngoài .","Slightly turned or opened; as, the door was standing ajar."
nuzzle,verb,ngửi,Nuzzling into someone's neck.,Ngoạm vào cổ ai đó.,"(of animals, lovers, etc) To touch someone or something with the nose."
octave,adjective,quãng tám,"Incidentally, we see just one octave .","Nhân tiện, chúng ta đang thấy một quãng tám","(music) An interval of twelve semitones spanning eight degrees of the diatonic scale, representing a doubling or halving in pitch."
riveting,adjective,,Riveting .,Thừa ấy chứ .,Present participle of rivet.
vehemently,adverb,dữ dội,The record states that “they vehemently tried to pick a quarrel with him.”,Lời tường thuật ghi lại: “Chúng cãi cùng người cách dữ - dội ”.,In a vehement manner; expressing with a strong or forceful attitude.
savior,noun,saviour,He came to earth as our Savior and Redeemer.,Ngài đã đến thế gian với tư cách là Đấng Cứu Rỗi và Đấng Cứu Chuộc của chúng ta.,A person who rescues another from harm.
complimentary,adjective,biếu,"Some complimentary pink champagne, Mr. Rams-Jones.","Một ít sâm-banh hồng làm quà biếu , ông Rams-Jones.",In the nature of a compliment.
exhilaration,noun,niềm vui vẻ,It sounds exhilarating .,Nghe có vẻ hồ hởi quá.,The act of enlivening the spirits; the act of making glad or cheerful; a gladdening.
abrasive,adjective,để mài mòn,"Greenblatt said that he initially found difficulty in working on any story with Truffles since the character could be ""so abrasive "" that the Chowder staff had to be ""a little more sensitive about finding her softer side.""","Greenblatt nói rằng ban đầu ông thấy khó khăn trong việc làm việc trên bất kỳ câu chuyện với Truffles kể từ khi nhân vật có thể là "" để mài mòn "" mà các nhân viên Chowder phải ""một chút nhạy cảm hơn về việc tìm kiếm mặt mềm mại của cô. """,Producing abrasion; rough enough to wear away the outer surface.
honcho,noun,,Go to the head honcho .,Chúng ta đi thẳng tới .,"boss, leader"
rant,verb,nói huênh hoang,I'm told he was ranting .,Tôi đã bảo anh ta đang nói huênh hoang .,A criticism done by ranting.
permanence,noun,sự lâu dài,(b) What attitude is revealed by those who ignore the Bible’s advice on the permanency of marriage?,b) Những người bỏ qua lời khuyên của Kinh-thánh về sự lâu dài trong hôn nhân có thái độ nào?,The state of being permanent.
coward,noun,nhát gan,"If I weren't such a coward , where would you be?",Nếu mình không phải là một đứa nhát gan thì cậu đang ở đâu chứ?,A person who lacks courage.
glory,noun,vinh quang,“Great shall be their reward and eternal shall be their glory .,“Phần thưởng của họ sẽ vĩ đại và vinh quang của họ sẽ vĩnh cửu.,"Worship or praise, as in glory to God."
steadily,adverb,vững,We become worthy by steadily and steadfastly obeying the commandments.,Chúng ta trở nên xứng đáng bằng cách tuân theo các lệnh truyền một cách kiên định và vững vàng.,In a steady manner.
irredeemable,adjective,không thể cứu vãn,And what I am... is irredeemable .,Và con người em... là không thể cứu vãn .,"Not redeemable; unredeemable; not able to be restored, recovered, revoked, or escaped."
perish,verb,diệt vong,"How is it that ye will perish , because of the hardness of your hearts?",Sao các anh lại muốn cho mình phải bị diệt vong vì lòng dạ chai đá?,To pass away; to come to naught; to waste away; to decay and disappear.
visualize,verb,hình dung,Do you visualize yourself attaining the prize when you read Bible accounts?,"Khi đọc Kinh Thánh, bạn có hình dung mình đạt được giải thưởng không?",(American) Alternative spelling of visualise.
betray,verb,phản bội,I didn't betray you.,Tôi không phản bội cậu.,"To violate the confidence of, by disclosing a secret, or that which one is bound in honor not to make known."
hardscrabble,adjective,,"And if Hardscrabble can't see that, then she can just...",Và nếu cô Hardscrabble không thấy rằng cô chỉ có thể...,Of or pertaining to land that takes a lot of work in order to farm and even then is not very productive.
aimless,adjective,không mục đích,"And it reminds us of the aimless nature of cloudspotting, what an aimless activity it is.","Và nó nhắc nhở chúng ta về bản chất không mục đích của việc ngắm mây, một hành động mới vu vơ làm sao.","Without aim, purpose, or direction."
jambalaya,noun,Jambalaya,"Jambalaya , gumbo.","Jambalya , gumbo... đều có hết!","Any of various of rice-based dishes common in Louisiana Cajun or Creole cooking; most often with shrimp, oysters, chicken or ham"
quench,verb,nén,Quenching our thirst!,Làm dịu đi cơn khát!,"(transitive) To satisfy, especially an actual or figurative thirst."
agitation,noun,sự bối rối,I will bring agitation and terror upon them suddenly.,"Bất thình lình, ta sẽ giáng sự bối rối và kinh khiếp trên chúng.","The act of agitating, or the state of being agitated; the state of being moved with violence, or with irregular action; commotion."
equivalence,verb,sự tương đương,(b) In what way does a ransom involve equivalency ?,(b) Giá chuộc đòi hỏi sự tương đương theo cách nào?,(uncountable) The condition of being equivalent or essentially equal.
talon,noun,vuốt,I think he might be missing a few talons .,Tớ nghĩ ông ấy đã bị mất vài cái vuốt .,"A sharp, hooked claw of a bird of prey or other predatory animal."
klutz,noun,hậu môm,I'm such a klutz .,Tôi lóng ngóng quá .,"(US, pejorative) A clumsy or stupid person; an oaf."
lactose,noun,đường sữa,Arabs. even lactose intolerance.,"Gây mất khoái cảm, co giật, suy thận và cả việc không hấp thụ được đường sữa .","(biochemistry) The disaccharide sugar of milk and dairy products, C12H22O11, (a product of glucose and galactose) used as a food and in medicinal compounds."
pastel,noun,bức tranh màu phấn,Oil Pastels !,Tranh sơn dầu sao ?,"Any of several subdued tints of colors, usually associated with pink, peach, yellow, green, blue and lavender"
resurrect,verb,khai quật,What about after Jesus’ resurrection to heaven?,Sau khi Chúa Giê-su được sống lại và lên trời thì sao?,"(transitive) To raise from the dead, to bring life back to."
offensive,adjective,khó chịu,This gas has an offensive smell like hydrogen sulfide (rotten eggs).,Loại khí này có mùi khó chịu như hydro sunfua (trứng thối).,"Causing offense; arousing a visceral reaction of disgust, anger, or hatred"
manipulative,adjective,sự thao tác,but manipulation robotics is really just in the dark ages.,nhưng sự thao tác của robot thực sự mới chỉ ở giai đoạn đầu.,Describing a person who manipulates others.
keepsake,noun,vật lưu niệm,I went through the house to make sure there were no keepsakes that still belonged to you.,Tôi đã coi khắp nhà để đảm bảo không còn vật lưu niệm nào của cô nữa.,Some object given by a person and retained in memory of something or someone; something kept for sentimental or nostalgic reasons.
hue,noun,sắc,Set here the hue adjustment of the image,Ở đây hãy đặt cách điều chỉnh sắc màu của ảnh,"A color, or shade of color, blee; tint; dye."
arsenal,noun,binh xưởng,It's an arsenal .,Kho vũ khí .,"A military establishment for the storing, development, manufacturing, testing, or repairing of arms, ammunition, and other war materiel; an armoury."
telekinesis,noun,,Telekinesis .,Khả năng dịch chuyển vật .,(uncountable) The ability to move an object with the power of one's thoughts.
marinara,adjective,,I got nothing but marinara now.,Tôi chỉ còn Marinara thôi .,"Prepared with tomatoes, or in a tomato sauce."
swig,verb,tợp,You want a swig ?,Muốn uống không?,To drink (usually by gulping or in a greedy or unrefined manner); to quaff.
afterthought,verb,,An afterthought .,Phần không cần thiết .,"A reflection after an act; a later or subsequent thought, action, or expedient."
floodgate,noun,cửa ngập nước,"For the floodgates above will be opened,","Vì các cửa ngăn nước trên trời sẽ mở ra,",An adjustable gate or valve used to control the flow of water through a sluice.
scoliosis,noun,chứng vẹo xương sống,Scoliosis .,Vẹo cột sống .,(pathology) A condition where there is abnormal lateral curvature of the spine.
single-handed,adjective,đơn thương độc mã,Ten years ago I watched you walk single - handed into a saloon in Oklahoma City and knock out three of the fastest guns in the territory.,Mười năm trước tôi đã chứng kiến ông đơn thương độc mã bước vô một quán rượu... ở Oklahoma City và hạ gục ba tay súng nhanh nhất vùng đó.,without help from others; unassisted
concerto,noun,côngxectô,"Other well-known pieces of his are the incidental music for Adam Oehlenschläger's drama Aladdin (Nielsen), the operas Saul og David and Maskarade, the concertos for flute, violin, and clarinet, the Wind Quintet, and the Helios Overture, which depicts the passage of the sun in the sky from dawn to nightfall.","Các bản nhạc nổi tiếng khác của ông ấy là âm nhạc cho vở kịch Aladdin (Nielsen) của Adam Oehlenschläger, các bản opera Saul og David và Maskarade, các bản côngxectô cho sáo, vĩ cầm, và clarinet, Wind Quintet, và Helios Overture, thứ mô tả sự di chuyển của Mặt Trời trên trời từ ban ngày đến ban đêm.",A piece of music for one or more solo instruments and orchestra.
chew the fat,verb,,You said you wanted to catch up and chew the fat .,Cậu đã nói cậu muốn bắt kịp và ngấu nghiến chất béo .,(idiomatic) To chat idly or generally waste time talking.
glaucoma,noun,bệnh glôcôm,EARLY GLAUCOMA,GLAUCOMA GIAI ĐOẠN ĐẦU,"(pathology) An eye disease or disorder that is defined as a characteristic optic neuropathy, or disease of the optic nerve, possibly, if untreated, leading to damage of the optic disc of the eye and resultant visual field loss due to lack of communication between the retina and the brain, which can lead to blindness."
skew,noun,xiên,"If they're slightly skewed , we'll see a different image.","Nếu chúng xiên một chút, chúng ta sẽ thấy một hình ảnh khác.",(mathematics) Neither perpendicular nor parallel (usually said of two lines).
exponentially,adverb,,Information technology grows in an exponential manner.,Công nghệ thông tin phát triển theo cấp số lũy thừa .,Growing or decaying in an exponential manner.
take the bull by the horns,verb,,,,"(idiomatic) to confront a difficulty, rather than avoiding it"
suffragette,noun,,Do we have a suffragette on our hands?,"Ồ, phải chăng chúng ta đang có một nữ Đại biểu Quốc hội tương lai?","A female supporter, often militant, of women's right to vote in the early 20th century"
barbaric,adjective,dã man,You think they'd allow you to continue your barbaric practice?,Mày nghĩ rằng họ sẽ cho phép mày tiếp tục những thí nghiệm dã man đó?,"Of or relating to a barbarian; uncivilised, uncultured or uncouth."
suitor,verb,người cầu hôn,This man's an incompetent suitor seeking intimacy with a woman unavailable to him.,Tên này là 1 người cầu hôn bất tài đang tìm sự thân mật với một người phụ nữ không có dành cho hắn.,(law) A party to a suit or litigation.
pirouette,verb,múa xoay tròn,Pirouette .,Xoay một chân .,"A whirling or turning on the toes in dancing, primarily in ballet."
resounding,adjective,vang dội,The evidence in the media gives a resounding yes to that question.,Bằng chứng trong các phương tiện truyền thông đại chúng vang dội trả lời: có.,The action of the verb to resound
grail,noun,,A grail ?,Cái Chén ?,The Holy Grail.
propulsion,noun,sự đẩy đi,The Propulsion System of the Jellyfish,Hệ thống đẩy tới của con sứa,(physics) A force causing movement.
unsettle,verb,làm lung lay,It's unsettling .,Không khí căng thẳng thế.,To make upset or uncomfortable
obliging,adjective,ân cần,You're not obliged to go back to Daisy Town.,Cậu không cần phải tới đó.,Happy and ready to do favours for others.
repertory,noun,repertoire,The Biblical Repertory and Princeton Review.,Tạp chí PC và Princeton Review.,a repertoire
laborious,adjective,chăm chỉ,"Once upon a time, people invested in their memories, in laboriously furnishing their minds.","Vào thời xa xưa, con người đầu tư cho trí nhớ bằng cách chăm chỉ trang hoàng cho tâm trí của họ .",Requiring much physical effort; toilsome.
tardy,adjective,muộn,"Chloe, there's a zero-tolerance policy on tardiness , young lady.","Chloe, đi muộn thì không được tha thứ gì đâu đấy, quý cô trẻ tuổi.",Late; overdue or delayed.
ultimate,adjective,cuối cùng,"And ultimately , it seems to me, that always works better than propaganda.","Và cuối cùng , đối với tôi, điều đó tốt hơn nhiều so với tuyên truyền.",Concerning the last or final thing in a series.
commendation,noun,sự khen ngợi,"What effect does commendation , or the lack of it, have on others?",Lời khen ngợi hoặc thiếu sự khen ngợi có ảnh hưởng nào đối với người khác?,The act of commending; praise; favorable representation in words; recommendation.
