word,part_of_speech,meaning,example,example_meaning,definition
calamity,noun,tai hoạ,Why bring calamity upon yourself?,Tại sao phải tự mình gánh chịu hết mọi tai hoạ chứ?,An event resulting in great loss
saga,noun,Xaga,"In the Scandinavian Hervarar saga , which relates ancient Germanic legends about battles between Goths and Huns, the name Karpates appears in the predictable Germanic form as Harvaða fjöllum (see Grimm's law).","Trong xaga vùng Scandinavia là Hervarar saga, trong đó người ta miêu tả các truyền thuyết Đức cổ đại về các trận chiến giữa người Goth và người Hung, tên gọi Karpates xuất hiện trong dạng Đức có thể đoán trước như là Harvaða fjöllum (xem quy luật Grimm).","An Old Norse (Icelandic) prose narrative, especially one dealing with family or social histories and legends"
adjudicate,verb,phân xử,The leader is an arbiter who presides and adjudicates over all inequities and disputes.,Người lãnh đạo cũng là người phân xử có nhiệm vụ chủ trì và phân xử những bất công và tranh chấp.,To act as a judge.
knack,verb,sở trường,Maybe you've got a knack for breaking the law.,Có lẽ cô có một sở trường vi phạm luật pháp.,A readiness in performance; aptness at doing something; skill; facility; dexterity.
spangled,adjective,đốm,The star- spangled man with a plan,Chính là người đàn ông gắn ngôi sao với kế hoạch,Simple past tense and past participle of spangle.
evolutionary,adjective,sự tiến hoá,or the evolutionary order of any particular species.,hay sự tiến hoá của bất kỳ loại cụ thể nào.,Of or relating to evolution.
equitable,adjective,công bằng,And this expansion in urbanization is going to be neither even nor equitable .,Và sự mở rộng đô thị hóa sẽ không đồng đều và cũng không công bằng .,Marked by or having equity.
multiform,adjective,biến hoá,And that's that the company and the building was multiform .,Và đó là công ti và tòa nhà đa dạng hình thức.,Having more than one shape or appearance.
lackadaisical,adjective,uỷ mị,You cannot be indifferent or lackadaisical in attitude.,Bạn không thể có thái độ lãnh đạm hoặc thờ ơ.,Showing no interest or enthusiasm.
prelude,noun,khúc dạo,"The final act lacks the elegance of the prelude , but at least it's quick.","Hành động cuối cùng thiếu sự tao nhã của khúc dạo đầu, nhưng ít nhất thì nó cũng nhanh.",an introductory or preliminary performance or event; a preface
bylaw,noun,,We often use a term called bylaws .,Mà chúng tôi thường gọi là Luật lệ.,A local custom or law of a settlement or district.
trestle,noun,trụ,"All right, that's the trestle .","Tới rồi, đây là chỗ trụ càu.","A horizontal member supported near each end by a pair of divergent legs, such as sawhorses."
cupola,noun,vòm,"All right, your target is up on top of that building, that cupola .","Mục tiêu của các anh là nóc tòa nhà đó, phần mái vòm .",(architecture) A dome-shaped ornamental structure located on top of a larger roof or dome.
considerate,adjective,chu đáo,Such a considerate maid.,Cô nữ tỳ này cũng thật chu đáo .,consciously thoughtful and observant (often of other people); caring
eleemosynary,adjective,bố thí,,,(rare) Diæretic spelling of eleemosynary.
pleasant,adjective,dễ chịu,And that is one of the pleasant aspects of life here.,Và đó là một khía cạnh dễ chịu về cuộc sống ở đây.,Giving pleasure; pleasing in manner.
blithesome,adjective,sung sướng,,,"happy or spriteful, carefree"
charitable,adjective,nhân đức,"Its roots are Latin, and it means “to wish someone well.” 2 To be benevolent is to be kind, well meaning, and charitable .","Bác ái là nhân từ, có chủ ý tốt và nhân đức .2 Nhiều em đã biết về ý nghĩa của lòng bác ái khi các em ở trong Hội Thiếu Nhi và thuộc lòng bài hát này:",Pertaining to charity.
empathetic,adjective,,19 Jehovah is empathetic .,19 Đức Giê-hô-va có lòng thấu cảm .,"Showing empathy for others, and recognizing their feelings etc; empathic"
exquisite,adjective,tuyệt,Your body is more precious than the most exquisite temple on earth.,Thân thể của các em còn quý báu hơn ngôi đền thờ tuyệt mỹ nhất trên thế gian.,Especially fine or pleasing; exceptional.
faithful,adjective,trung thành,"My parents and my two brothers were faithful until their death, and my two sisters continue faithfully in the way of the truth.","Cha mẹ và hai em tôi đã trung thành đến lúc chết, hai em gái tôi tiếp tục trung thành trong đường lối lẽ thật.",engaging in sexual relations only with one's spouse or long-term sexual partner
amicable,adjective,thân mật,And therefore it has to have amicable relations with them.,Và vì thế Kurdistan phải có mối quan hệ thân mật với các nước đó.,Showing friendliness or goodwill.
buoyant,adjective,nổi trên mặt,I became extremely buoyant .,Tôi trở nên vô cùng sôi động.,having buoyancy; able to float
cherubic,adjective,có mắt tròn trĩnh,25 The second cherub was also ten cubits.,25 Từ đầu cánh này đến đầu cánh kia của chê-rúp thứ hai cũng là mười cu-bít.,"of, or relating to a cherub; angelic"
cordial,adjective,thân mật,Lincoln was always cordial ; I was always a little rude.,Lincoln luôn luôn tỏ vẻ thân mật ; tôi thì luôn luôn tỏ ra hơi khiếm nhã.,Hearty; sincere; warm; affectionate.
humorous,adjective,hài hước,He seems to be bankrupt of humor .,Hình như anh ấy chẳng có tí khiếu hài hước nào.,Full of humor or arousing laughter; funny.
inspirational,adjective,gây cảm hứng,It was mutual inspiration I had in mind.,Anh nghĩ mình có thể gây cảm hứng cho nhau.,Having the quality to inspire.
jocund,adjective,vui tính,"Night's candles are burnt out, and jocund day","Đêm của những ngọn nến được đốt cháy, và ngày vui tươi","jovial, exuberant, lighthearted; merry and in high spirits : exhibiting happiness"
mettlesome,adjective,dũng cảm,,,Of great mettle; courageous.
pulchritudinous,adjective,,,,(literary) Having physical beauty.
breathtaking,adjective,ngoạn mục,"If you visit the terraces, you can personally experience their breathtaking beauty.","Nếu thăm viếng ruộng bậc thang, bạn có thể đích thân thưởng thức cảnh đẹp ngoạn mục .",stunningly beautiful; amazing
dazzling,adjective,chói lọi,"The ice of Antarctica glows with a light so dazzling , it blinds the unprotected eye.",Băng ở Nam Cực phát ra một ánh sáng chói lọi tới mức có thể làm mù mắt ai không đeo kính bảo hộ.,Present participle of dazzle.
elegant,adjective,thanh lịch,We figure out an elegant way to lift and interrogate him.,Chúng tôi tìm ra một cách thanh lịch để giữ và thẩm vấn ông ta.,Characterised by or exhibiting elegance.
gorgeous,adjective,lộng lẫy,And that's the most gorgeous thing I ever saw.,Và đó là thứ lộng lẫy nhất mà tôi từng thấy.,(of a person or place) very beautiful.
handsome,adjective,đẹp,You can focus on seducing with girls as you are so handsome .,"Cậu rất đẹp trai, cậu hãy tập trung để quyến rũ các cô gái đẹp đi.",(obsolete) Dexterous; skillful; handy; ready; convenient; -- applied to things as persons.
lovely,adjective,dễ thương,We'll find you a lovely bit of tail.,Chúng tôi sẽ tìm cho anh một cô nàng dễ thương .,(obsolete) Inspiring actual love
radiant,adjective,hớn hở,"Her smile was even bigger than before, and her countenance was radiant .","Nụ cười của chị rạng rỡ hơn trước, và sắc mặt của chị đầy hớn hở .",Radiating light and/or heat.
ravishing,adjective,làm say đắm,"Miss Todd, you are a woman of ravishing resourcefulness.","Cô Todd, cô là một người phụ nữ biết cách làm say đắm người ta đấy.",Present participle of ravish.
